[{
	"index": 0,
	"title": "ports",
	"id": 6,
	"parentId": "1",
	"dateAddedLocal": "7/19/2021, 8:56:35 AM",
	"dateAddedUTC": "2021-07-19T12:56:35.529Z"
},{
	"index": 0,
	"title": "rails routes",
	"url": "http://localhost:3000/routes",
	"id": 3029,
	"parentId": "6",
	"dateAddedLocal": "10/16/2024, 9:05:35 AM",
	"dateAddedUTC": "2024-10-16T13:05:35.259Z"
},{
	"index": 1,
	"title": "localhost:3000",
	"url": "http://localhost:3000/",
	"id": 3008,
	"parentId": "6",
	"dateAddedLocal": "10/11/2024, 4:15:14 PM",
	"dateAddedUTC": "2024-10-11T20:15:14.169Z"
},{
	"index": 2,
	"title": "VITE localhost:5173",
	"url": "http://localhost:5173/",
	"id": 2595,
	"parentId": "6",
	"dateAddedLocal": "10/28/2023, 10:46:22 AM",
	"dateAddedUTC": "2023-10-28T14:46:22.552Z"
},{
	"index": 3,
	"title": "localhost:3001",
	"url": "http://localhost:3001/",
	"id": 3014,
	"parentId": "6",
	"dateAddedLocal": "10/12/2024, 10:59:13 AM",
	"dateAddedUTC": "2024-10-12T14:59:13.467Z"
},{
	"index": 4,
	"title": "localhost:3035",
	"url": "http://localhost:3035/",
	"id": 3025,
	"parentId": "6",
	"dateAddedLocal": "10/14/2024, 6:02:10 PM",
	"dateAddedUTC": "2024-10-14T22:02:10.369Z"
},{
	"index": 5,
	"title": "brad zoom mtg",
	"url": "https://us04web.zoom.us/j/5818282569?pwd=WEJVYjM3WmR0WHdOa0ZoT0U3UXJBZz09#success",
	"id": 31,
	"parentId": "6",
	"dateAddedLocal": "3/30/2022, 11:40:41 AM",
	"dateAddedUTC": "2022-03-30T15:40:41.691Z"
},{
	"index": 6,
	"title": "Cloud: MongoDB Cloud",
	"url": "https://cloud.mongodb.com/v2/621adb3a970bb327c4c3e7fa#clusters",
	"id": 30,
	"parentId": "6",
	"dateAddedLocal": "2/27/2022, 9:04:58 AM",
	"dateAddedUTC": "2022-02-27T14:04:58.752Z"
},{
	"index": 7,
	"title": "GraphiQL",
	"url": "http://localhost:3000/graphiql",
	"id": 26,
	"parentId": "6",
	"dateAddedLocal": "6/21/2021, 2:12:25 PM",
	"dateAddedUTC": "2021-06-21T18:12:25.000Z"
},{
	"index": 8,
	"title": "GRAPHQL Explorer | Sandbox | Studio",
	"url": "https://studio.apollographql.com/sandbox/explorer",
	"id": 2629,
	"parentId": "6",
	"dateAddedLocal": "12/25/2023, 11:43:14 AM",
	"dateAddedUTC": "2023-12-25T16:43:14.761Z"
},{
	"index": 9,
	"title": "localhost:4000",
	"url": "http://localhost:4000/",
	"id": 2627,
	"parentId": "6",
	"dateAddedLocal": "12/7/2023, 7:43:55 AM",
	"dateAddedUTC": "2023-12-07T12:43:55.410Z"
},{
	"index": 10,
	"title": "localhost:8080",
	"url": "http://localhost:8080/",
	"id": 2369,
	"parentId": "6",
	"dateAddedLocal": "4/21/2023, 3:29:30 PM",
	"dateAddedUTC": "2023-04-21T19:29:30.814Z"
},{
	"index": 11,
	"title": "localhost:8480",
	"url": "http://localhost:8480/?custom_correlation_id=local",
	"id": 2418,
	"parentId": "6",
	"dateAddedLocal": "5/10/2023, 7:51:34 AM",
	"dateAddedUTC": "2023-05-10T11:51:34.905Z"
},{
	"index": 12,
	"title": "GitGuardian",
	"url": "https://dashboard.gitguardian.com/workspace/61629/incidents/14136062?date=true",
	"id": 3016,
	"parentId": "6",
	"dateAddedLocal": "10/13/2024, 5:07:54 AM",
	"dateAddedUTC": "2024-10-13T09:07:54.143Z"
},{
	"index": 13,
	"title": "Squarespace Domains",
	"url": "https://account.squarespace.com/domains",
	"id": 3017,
	"parentId": "6",
	"dateAddedLocal": "10/13/2024, 6:47:03 AM",
	"dateAddedUTC": "2024-10-13T10:47:03.503Z"
},{
	"index": 1,
	"title": "acct",
	"id": 2974,
	"parentId": "1",
	"dateAddedLocal": "10/2/2024, 11:20:04 PM",
	"dateAddedUTC": "2024-10-03T03:20:04.812Z"
},{
	"index": 0,
	"title": "Academind",
	"url": "https://pro.academind.com/courses/enrolled/761608?",
	"id": 2976,
	"parentId": "2974",
	"dateAddedLocal": "10/2/2024, 11:20:27 PM",
	"dateAddedUTC": "2024-10-03T03:20:27.055Z"
},{
	"index": 1,
	"title": "CleanMyMac X â€“ Plan For 1 Mac",
	"url": "https://my.macpaw.com/products/cleanmymac/plans/830245c0-2663-41eb-aa92-fb13e5df9e67",
	"id": 2984,
	"parentId": "2974",
	"dateAddedLocal": "10/3/2024, 3:49:10 PM",
	"dateAddedUTC": "2024-10-03T19:49:10.487Z"
},{
	"index": 2,
	"title": "CodeGPT",
	"url": "https://app.codegpt.co/en/login",
	"id": 2981,
	"parentId": "2974",
	"dateAddedLocal": "10/3/2024, 3:47:11 PM",
	"dateAddedUTC": "2024-10-03T19:47:11.141Z"
},{
	"index": 3,
	"title": "CodeGPT",
	"url": "https://app.codegpt.co/en",
	"id": 2982,
	"parentId": "2974",
	"dateAddedLocal": "10/3/2024, 3:47:45 PM",
	"dateAddedUTC": "2024-10-03T19:47:45.552Z"
},{
	"index": 4,
	"title": "CodeSignal",
	"url": "https://learn.codesignal.com/onboarding/recommended",
	"id": 2988,
	"parentId": "2974",
	"dateAddedLocal": "10/4/2024, 9:08:48 PM",
	"dateAddedUTC": "2024-10-05T01:08:48.533Z"
},{
	"index": 5,
	"title": "Coursera",
	"url": "https://www.coursera.org/",
	"id": 598,
	"parentId": "2974",
	"dateAddedLocal": "6/21/2021, 2:12:25 PM",
	"dateAddedUTC": "2021-06-21T18:12:25.000Z"
},{
	"index": 6,
	"title": "edX",
	"url": "https://home.edx.org/",
	"id": 2991,
	"parentId": "2974",
	"dateAddedLocal": "10/4/2024, 9:21:45 PM",
	"dateAddedUTC": "2024-10-05T01:21:45.419Z"
},{
	"index": 7,
	"title": "Epic React by Kent C. Dodds",
	"url": "https://www.epicreact.dev/products?s=purchased",
	"id": 2975,
	"parentId": "2974",
	"dateAddedLocal": "10/2/2024, 11:20:10 PM",
	"dateAddedUTC": "2024-10-03T03:20:10.152Z"
},{
	"index": 8,
	"title": "From Zero to Full Stack: Master JavaScript and Create Dynamic Web Apps - YouTube",
	"url": "https://www.youtube.com/watch?v=H3XIJYEPdus",
	"id": 2979,
	"parentId": "2974",
	"dateAddedLocal": "10/2/2024, 11:28:54 PM",
	"dateAddedUTC": "2024-10-03T03:28:54.570Z"
},{
	"index": 9,
	"title": "Learn Enough to Be Dangerous",
	"url": "https://www.learnenough.com/your-courses",
	"id": 2980,
	"parentId": "2974",
	"dateAddedLocal": "10/2/2024, 11:38:14 PM",
	"dateAddedUTC": "2024-10-03T03:38:14.138Z"
},{
	"index": 10,
	"title": "Learn to Code With Me",
	"url": "https://learntocodewith.me/",
	"id": 2990,
	"parentId": "2974",
	"dateAddedLocal": "10/4/2024, 9:12:42 PM",
	"dateAddedUTC": "2024-10-05T01:12:42.847Z"
},{
	"index": 11,
	"title": "Library | Nebula",
	"url": "https://nebula.tv/library",
	"id": 2985,
	"parentId": "2974",
	"dateAddedLocal": "10/3/2024, 7:23:16 PM",
	"dateAddedUTC": "2024-10-03T23:23:16.131Z"
},{
	"index": 12,
	"title": "Newline - Fullstack React with TypeScript",
	"url": "https://www.newline.co/books/fullstack-react-with-typescript/introduction",
	"id": 2954,
	"parentId": "2974",
	"dateAddedLocal": "9/22/2024, 4:53:21 AM",
	"dateAddedUTC": "2024-09-22T08:53:21.979Z"
},{
	"index": 13,
	"title": "Peterson Academy",
	"url": "https://petersonacademy.com/",
	"id": 2992,
	"parentId": "2974",
	"dateAddedLocal": "10/4/2024, 9:24:13 PM",
	"dateAddedUTC": "2024-10-05T01:24:13.112Z"
},{
	"index": 14,
	"title": "SitePoint",
	"url": "https://www.sitepoint.com/",
	"id": 618,
	"parentId": "2974",
	"dateAddedLocal": "6/21/2021, 2:12:25 PM",
	"dateAddedUTC": "2021-06-21T18:12:25.000Z"
},{
	"index": 15,
	"title": "SkillSprints: Closing the Digital Skills Gap",
	"url": "https://skillsprints.co/",
	"id": 2987,
	"parentId": "2974",
	"dateAddedLocal": "10/4/2024, 8:55:15 PM",
	"dateAddedUTC": "2024-10-05T00:55:15.460Z"
},{
	"index": 16,
	"title": "Teachable Accounts",
	"url": "https://sso.teachable.com/secure/teachable_accounts/sign_in",
	"id": 2978,
	"parentId": "2974",
	"dateAddedLocal": "10/2/2024, 11:22:08 PM",
	"dateAddedUTC": "2024-10-03T03:22:08.577Z"
},{
	"index": 17,
	"title": "Tuts+",
	"url": "https://tutsplus.com/",
	"id": 675,
	"parentId": "2974",
	"dateAddedLocal": "6/21/2021, 2:12:25 PM",
	"dateAddedUTC": "2021-06-21T18:12:25.000Z"
},{
	"index": 18,
	"title": "Udacity",
	"url": "https://www.udacity.com/dashboard",
	"id": 2989,
	"parentId": "2974",
	"dateAddedLocal": "10/4/2024, 9:11:33 PM",
	"dateAddedUTC": "2024-10-05T01:11:33.067Z"
},{
	"index": 19,
	"title": "Udemy",
	"url": "https://www.udemy.com/home/my-courses/learning/",
	"id": 2977,
	"parentId": "2974",
	"dateAddedLocal": "10/2/2024, 11:20:42 PM",
	"dateAddedUTC": "2024-10-03T03:20:42.937Z"
},{
	"index": 20,
	"title": "Obsidian Forum",
	"url": "https://forum.obsidian.md/",
	"id": 3005,
	"parentId": "2974",
	"dateAddedLocal": "10/11/2024, 11:19:22 AM",
	"dateAddedUTC": "2024-10-11T15:19:22.234Z"
},{
	"index": 21,
	"title": "Kaleidoscope",
	"url": "https://cloud.kaleidoscope.app/store/thank-you?transaction_id=txn_01j9xyws95dm2n7h3wa9qagjjs",
	"id": 3006,
	"parentId": "2974",
	"dateAddedLocal": "10/11/2024, 11:19:48 AM",
	"dateAddedUTC": "2024-10-11T15:19:48.110Z"
},{
	"index": 2,
	"title": "ai",
	"id": 3012,
	"parentId": "1",
	"dateAddedLocal": "10/12/2024, 8:27:57 AM",
	"dateAddedUTC": "2024-10-12T12:27:57.434Z"
},{
	"index": 0,
	"title": "(13) Discord | #ðŸ™‹ask_codegpt | CodeGPT",
	"url": "https://discord.com/channels/1060370286593192098/1090767356369846292",
	"id": 3011,
	"parentId": "3012",
	"dateAddedLocal": "10/12/2024, 8:27:16 AM",
	"dateAddedUTC": "2024-10-12T12:27:16.876Z"
},{
	"index": 1,
	"title": "Account settings | CodeGPT",
	"url": "https://app.codegpt.co/en/account",
	"id": 3013,
	"parentId": "3012",
	"dateAddedLocal": "10/12/2024, 8:28:20 AM",
	"dateAddedUTC": "2024-10-12T12:28:20.473Z"
},{
	"index": 3,
	"title": "gl",
	"id": 2633,
	"parentId": "1",
	"dateAddedLocal": "1/7/2024, 8:30:06 AM",
	"dateAddedUTC": "2024-01-07T13:30:06.151Z"
},{
	"index": 0,
	"title": "Dashboard - Great Learning",
	"url": "https://olympus.mygreatlearning.com/dashboard",
	"id": 2644,
	"parentId": "2633",
	"dateAddedLocal": "1/10/2024, 1:27:04 PM",
	"dateAddedUTC": "2024-01-10T18:27:04.771Z"
},{
	"index": 1,
	"title": "SCHEDULE",
	"url": "file:///Users/brad/Library/Mobile%20Documents/iCloud~md~obsidian/Documents/bjs/04-projects/aiml/_misc/Schedule.pdf",
	"id": 3038,
	"parentId": "2633",
	"dateAddedLocal": "10/20/2024, 9:38:03 AM",
	"dateAddedUTC": "2024-10-20T13:38:03.401Z"
},{
	"index": 2,
	"title": "ai",
	"id": 2701,
	"parentId": "2633",
	"dateAddedLocal": "2/21/2024, 2:03:27 PM",
	"dateAddedUTC": "2024-02-21T19:03:27.409Z"
},{
	"index": 0,
	"title": "CIA Spy On WW3, Jeffrey Epstein, Israel-Hamas, AI & Social Media Brainwashing | Andrew Bustamante - YouTube",
	"url": "https://www.youtube.com/watch?v=l46oWMu3b9M",
	"id": 2685,
	"parentId": "2701",
	"dateAddedLocal": "2/4/2024, 4:31:36 PM",
	"dateAddedUTC": "2024-02-04T21:31:36.184Z"
},{
	"index": 1,
	"title": "Poe",
	"url": "https://poe.com/",
	"id": 2696,
	"parentId": "2701",
	"dateAddedLocal": "2/20/2024, 6:46:53 PM",
	"dateAddedUTC": "2024-02-20T23:46:53.346Z"
},{
	"index": 2,
	"title": "Hugging Face â€“ The AI community building the future.",
	"url": "https://huggingface.co/",
	"id": 2655,
	"parentId": "2701",
	"dateAddedLocal": "1/21/2024, 5:55:21 PM",
	"dateAddedUTC": "2024-01-21T22:55:21.408Z"
},{
	"index": 3,
	"title": "Kaggle: Your Machine Learning and Data Science Community",
	"url": "https://www.kaggle.com/",
	"id": 2694,
	"parentId": "2701",
	"dateAddedLocal": "2/18/2024, 5:17:56 PM",
	"dateAddedUTC": "2024-02-18T22:17:56.137Z"
},{
	"index": 4,
	"title": "Keras: Deep Learning for humans",
	"url": "https://keras.io/",
	"id": 2683,
	"parentId": "2701",
	"dateAddedLocal": "2/4/2024, 11:32:27 AM",
	"dateAddedUTC": "2024-02-04T16:32:27.271Z"
},{
	"index": 5,
	"title": "Querri - Use AI and LLMs to clean, move and transform your data.",
	"url": "https://querri.com/",
	"id": 2695,
	"parentId": "2701",
	"dateAddedLocal": "2/18/2024, 5:23:38 PM",
	"dateAddedUTC": "2024-02-18T22:23:38.913Z"
},{
	"index": 6,
	"title": "scikit-learn: machine learning in Python â€” scikit-learn 1.4.0 documentation",
	"url": "https://scikit-learn.org/stable/",
	"id": 2682,
	"parentId": "2701",
	"dateAddedLocal": "2/4/2024, 11:31:57 AM",
	"dateAddedUTC": "2024-02-04T16:31:57.770Z"
},{
	"index": 7,
	"title": "Gradio",
	"url": "https://www.gradio.app/",
	"id": 2654,
	"parentId": "2701",
	"dateAddedLocal": "1/20/2024, 4:37:38 PM",
	"dateAddedUTC": "2024-01-20T21:37:38.083Z"
},{
	"index": 8,
	"title": "MLlib | Apache Spark",
	"url": "https://spark.apache.org/mllib/",
	"id": 2684,
	"parentId": "2701",
	"dateAddedLocal": "2/4/2024, 11:34:50 AM",
	"dateAddedUTC": "2024-02-04T16:34:50.219Z"
},{
	"index": 9,
	"title": "Replit",
	"url": "https://replit.com/",
	"id": 2640,
	"parentId": "2701",
	"dateAddedLocal": "1/7/2024, 9:47:26 AM",
	"dateAddedUTC": "2024-01-07T14:47:26.282Z"
},{
	"index": 3,
	"title": "anaconda",
	"id": 2700,
	"parentId": "2633",
	"dateAddedLocal": "2/21/2024, 2:00:59 PM",
	"dateAddedUTC": "2024-02-21T19:00:59.376Z"
},{
	"index": 0,
	"title": "Anaconda docs",
	"url": "https://docs.anaconda.com/",
	"id": 2636,
	"parentId": "2700",
	"dateAddedLocal": "1/7/2024, 8:54:58 AM",
	"dateAddedUTC": "2024-01-07T13:54:58.671Z"
},{
	"index": 1,
	"title": "nb.anaconda.cloud- JupyterLab",
	"url": "https://nb.anaconda.cloud/jupyterhub/user/76293bd2-7949-4b9a-8251-faacad1653eb/lab/tree/Untitled.ipynb?",
	"id": 2635,
	"parentId": "2700",
	"dateAddedLocal": "1/7/2024, 8:40:45 AM",
	"dateAddedUTC": "2024-01-07T13:40:45.729Z"
},{
	"index": 2,
	"title": "Project Jupyter | Try Jupyter",
	"url": "https://jupyter.org/try",
	"id": 2637,
	"parentId": "2700",
	"dateAddedLocal": "1/7/2024, 9:43:46 AM",
	"dateAddedUTC": "2024-01-07T14:43:46.257Z"
},{
	"index": 3,
	"title": "Installation Success | Anaconda",
	"url": "https://www.anaconda.com/installation-success?source=installer",
	"id": 2648,
	"parentId": "2700",
	"dateAddedLocal": "1/10/2024, 7:46:34 PM",
	"dateAddedUTC": "2024-01-11T00:46:34.976Z"
},{
	"index": 4,
	"title": "PyTorch",
	"url": "https://pytorch.org/",
	"id": 2656,
	"parentId": "2700",
	"dateAddedLocal": "1/21/2024, 8:16:40 PM",
	"dateAddedUTC": "2024-01-22T01:16:40.177Z"
},{
	"index": 5,
	"title": "Home | Cloud: Data Science and Python Tools from Anaconda",
	"url": "https://anaconda.cloud/",
	"id": 2649,
	"parentId": "2700",
	"dateAddedLocal": "1/10/2024, 7:48:43 PM",
	"dateAddedUTC": "2024-01-11T00:48:43.240Z"
},{
	"index": 6,
	"title": "Definitive Guide to AI Platforms | Anaconda",
	"url": "https://www.anaconda.com/definitive-guide-to-ai-platforms",
	"id": 2647,
	"parentId": "2700",
	"dateAddedLocal": "1/10/2024, 7:37:10 PM",
	"dateAddedUTC": "2024-01-11T00:37:10.279Z"
},{
	"index": 4,
	"title": "data",
	"id": 2704,
	"parentId": "2633",
	"dateAddedLocal": "2/21/2024, 2:05:13 PM",
	"dateAddedUTC": "2024-02-21T19:05:13.743Z"
},{
	"index": 0,
	"title": "Index of /datasets/movielens",
	"url": "https://files.grouplens.org/datasets/movielens/",
	"id": 2680,
	"parentId": "2704",
	"dateAddedLocal": "2/3/2024, 2:02:07 PM",
	"dateAddedUTC": "2024-02-03T19:02:07.006Z"
},{
	"index": 5,
	"title": "google-colab",
	"id": 2703,
	"parentId": "2633",
	"dateAddedLocal": "2/21/2024, 2:04:41 PM",
	"dateAddedUTC": "2024-02-21T19:04:41.416Z"
},{
	"index": 0,
	"title": "colab.google",
	"url": "https://colab.google/",
	"id": 2638,
	"parentId": "2703",
	"dateAddedLocal": "1/7/2024, 9:44:24 AM",
	"dateAddedUTC": "2024-01-07T14:44:24.727Z"
},{
	"index": 1,
	"title": "Google Colab features",
	"url": "https://www.youtube.com/watch?v=rNgswRZ2C1Y",
	"id": 2645,
	"parentId": "2703",
	"dateAddedLocal": "1/10/2024, 4:53:23 PM",
	"dateAddedUTC": "2024-01-10T21:53:23.903Z"
},{
	"index": 2,
	"title": "External data: Local Files, Drive, Sheets, and Cloud Storage - Colaboratory",
	"url": "https://colab.research.google.com/notebooks/io.ipynb",
	"id": 2676,
	"parentId": "2703",
	"dateAddedLocal": "1/31/2024, 5:43:12 PM",
	"dateAddedUTC": "2024-01-31T22:43:12.851Z"
},{
	"index": 3,
	"title": "Welcome To Colaboratory - Colaboratory",
	"url": "https://colab.research.google.com/#scrollTo=gJr_9dXGpJ05",
	"id": 2646,
	"parentId": "2703",
	"dateAddedLocal": "1/10/2024, 6:54:13 PM",
	"dateAddedUTC": "2024-01-10T23:54:13.766Z"
},{
	"index": 4,
	"title": "Teacher Access to Math 180 Student SoftwareÂ®",
	"url": "http://localhost:8480/math180/tvss/app/#/learnzone/lessonMap",
	"id": 2719,
	"parentId": "2703",
	"dateAddedLocal": "3/6/2024, 3:26:35 PM",
	"dateAddedUTC": "2024-03-06T20:26:35.426Z"
},{
	"index": 6,
	"title": "math-statistics-formulas",
	"id": 2702,
	"parentId": "2633",
	"dateAddedLocal": "2/21/2024, 2:03:55 PM",
	"dateAddedUTC": "2024-02-21T19:03:55.429Z"
},{
	"index": 0,
	"title": "Bayes theorem, the geometry of changing beliefs - YouTube",
	"url": "https://www.youtube.com/watch?v=HZGCoVF3YvM",
	"id": 2677,
	"parentId": "2702",
	"dateAddedLocal": "1/31/2024, 9:03:48 PM",
	"dateAddedUTC": "2024-02-01T02:03:48.037Z"
},{
	"index": 1,
	"title": "How does Netflix recommend movies? Matrix Factorization - YouTube",
	"url": "https://www.youtube.com/watch?v=ZspR5PZemcs",
	"id": 2681,
	"parentId": "2702",
	"dateAddedLocal": "2/3/2024, 2:02:30 PM",
	"dateAddedUTC": "2024-02-03T19:02:30.644Z"
},{
	"index": 2,
	"title": "Standard deviation (simply explained) - YouTube",
	"url": "https://www.youtube.com/watch?v=esskJJF8pCc",
	"id": 2722,
	"parentId": "2702",
	"dateAddedLocal": "3/16/2024, 9:28:25 AM",
	"dateAddedUTC": "2024-03-16T13:28:25.763Z"
},{
	"index": 7,
	"title": "python",
	"id": 2699,
	"parentId": "2633",
	"dateAddedLocal": "2/21/2024, 1:59:54 PM",
	"dateAddedUTC": "2024-02-21T18:59:54.285Z"
},{
	"index": 0,
	"title": "Pythonâ€™s List Comprehensions: Uses and Advantages | by Luciano Strika | Towards Data Science",
	"url": "https://towardsdatascience.com/how-list-comprehensions-can-help-your-code-look-better-and-run-smoother-3cf8f87172ae",
	"id": 2675,
	"parentId": "2699",
	"dateAddedLocal": "1/31/2024, 5:43:00 PM",
	"dateAddedUTC": "2024-01-31T22:43:00.181Z"
},{
	"index": 1,
	"title": "The Python Standard Library â€” Python 3.12.1 documentation",
	"url": "https://docs.python.org/3/library/index.html#library-index",
	"id": 2641,
	"parentId": "2699",
	"dateAddedLocal": "1/7/2024, 2:33:31 PM",
	"dateAddedUTC": "2024-01-07T19:33:31.905Z"
},{
	"index": 2,
	"title": "Glossary â€” Python 3.12.1 documentation",
	"url": "https://docs.python.org/3/glossary.html#glossary",
	"id": 2642,
	"parentId": "2699",
	"dateAddedLocal": "1/7/2024, 2:37:42 PM",
	"dateAddedUTC": "2024-01-07T19:37:42.688Z"
},{
	"index": 3,
	"title": "Python Standard Library",
	"url": "https://docs.python.org/3.10/library/index.html",
	"id": 2698,
	"parentId": "2699",
	"dateAddedLocal": "2/21/2024, 1:58:37 PM",
	"dateAddedUTC": "2024-02-21T18:58:37.447Z"
},{
	"index": 4,
	"title": "Powerful Python: The Most Impactful Patterns, Features and Development Strategies Modern Python Provides",
	"url": "https://cf.powerfulpython.com/book1702329261527?utm_source=meta&utm_campaign=C51+book+Purchase+CBO+HV+7C1V&utm_content=C51+7+broad+WINNERS+v3_1+webviews_cs-h&fbc_id=120202998695040678&h_ad_id=120202998695000678&fbclid=IwAR07XuybUkwYtQx-cOvtV3NAx4Ao5wAC7WryU7MPObxVLOfZ8okSACCsuHk",
	"id": 2652,
	"parentId": "2699",
	"dateAddedLocal": "1/18/2024, 7:26:46 PM",
	"dateAddedUTC": "2024-01-19T00:26:46.277Z"
},{
	"index": 5,
	"title": "PEP 8 â€“ Style Guide for Python Code | peps.python.org",
	"url": "https://peps.python.org/pep-0008/",
	"id": 2667,
	"parentId": "2699",
	"dateAddedLocal": "1/27/2024, 2:06:34 PM",
	"dateAddedUTC": "2024-01-27T19:06:34.906Z"
},{
	"index": 6,
	"title": "1.6 Test Your Understanding: Python Foundations - Great Learning",
	"url": "https://olympus.mygreatlearning.com/courses/106496/modules/items/5145215",
	"id": 2650,
	"parentId": "2699",
	"dateAddedLocal": "1/13/2024, 9:03:09 AM",
	"dateAddedUTC": "2024-01-13T14:03:09.859Z"
},{
	"index": 7,
	"title": "MITx: Introduction to Computer Science and Programming Using Python | edX",
	"url": "https://www.edx.org/learn/computer-science/massachusetts-institute-of-technology-introduction-to-computer-science-and-programming-using-python?index=product&objectID=course-956319ec-8665-4039-8bc6-32c9a9aea5e9&webview=false&campaign=Introduction+to+Computer+Science+and+Programming+Using+Python&source=edX&product_category=course&placement_url=https%3A%2F%2Fwww.edx.org%2Flearn%2Fpython",
	"id": 2662,
	"parentId": "2699",
	"dateAddedLocal": "1/26/2024, 4:10:54 PM",
	"dateAddedUTC": "2024-01-26T21:10:54.248Z"
},{
	"index": 8,
	"title": "List Comprehension, Conditional, and Looping Statements (Quick Code-Python) | by Shreedhar Vellayaraj | Geek Culture | Medium",
	"url": "https://medium.com/geekculture/list-comprehension-conditional-and-looping-statements-in-python-16db4ea9e58b",
	"id": 2674,
	"parentId": "2699",
	"dateAddedLocal": "1/31/2024, 5:42:37 PM",
	"dateAddedUTC": "2024-01-31T22:42:37.926Z"
},{
	"index": 8,
	"title": "recordings",
	"id": 2664,
	"parentId": "2633",
	"dateAddedLocal": "1/27/2024, 8:38:28 AM",
	"dateAddedUTC": "2024-01-27T13:38:28.493Z"
},{
	"index": 0,
	"title": "Python Beginner",
	"url": "https://olympus1.mygreatlearning.com/online_session/recordings?access_token=eyJ0eXAiOiJKV1QiLCJhbGciOiJIUzI1NiJ9.eyJtZW50b3JlZF9zZXNzaW9uX2lkIjoxMTUzNjA3fQ.6iurAGc-X5SMZZXKOM1MsO_v3CWX1055IMiTjEGUTXA",
	"id": 2663,
	"parentId": "2664",
	"dateAddedLocal": "1/27/2024, 8:38:03 AM",
	"dateAddedUTC": "2024-01-27T13:38:03.102Z"
},{
	"index": 1,
	"title": "AI Primer : Intro to AI",
	"url": "https://olympus1.mygreatlearning.com/online_session/recordings?access_token=eyJ0eXAiOiJKV1QiLCJhbGciOiJIUzI1NiJ9.eyJtZW50b3JlZF9zZXNzaW9uX2lkIjoxMTU2ODUxfQ.mO0fZfhA3_l-3MzRSm4WjKv3rzT5_ICtsm5Ia_YEqVo",
	"id": 2665,
	"parentId": "2664",
	"dateAddedLocal": "1/27/2024, 8:38:38 AM",
	"dateAddedUTC": "2024-01-27T13:38:38.091Z"
},{
	"index": 2,
	"title": "Must-Know Math & Stats",
	"url": "https://olympus1.mygreatlearning.com/online_session/recordings?access_token=eyJ0eXAiOiJKV1QiLCJhbGciOiJIUzI1NiJ9.eyJtZW50b3JlZF9zZXNzaW9uX2lkIjoxMTYxMzk2fQ.vieWNe3Z0XtBEDWtFklro-7wie8dXshMhs09SuPXO5E",
	"id": 2666,
	"parentId": "2664",
	"dateAddedLocal": "1/27/2024, 8:39:11 AM",
	"dateAddedUTC": "2024-01-27T13:39:11.083Z"
},{
	"index": 9,
	"title": "videos-about-ai",
	"id": 2706,
	"parentId": "2633",
	"dateAddedLocal": "2/21/2024, 2:08:04 PM",
	"dateAddedUTC": "2024-02-21T19:08:04.431Z"
},{
	"index": 0,
	"title": "THE BIG RESET: Use AI To Build Wealth & GET AHEAD Of 99% Of People | Peter Diamandis & Salim Ismail - YouTube",
	"url": "https://www.youtube.com/watch?v=zm0QVutAkYg&t=137s",
	"id": 2686,
	"parentId": "2706",
	"dateAddedLocal": "2/4/2024, 4:34:32 PM",
	"dateAddedUTC": "2024-02-04T21:34:32.485Z"
},{
	"index": 10,
	"title": "visualization",
	"id": 2705,
	"parentId": "2633",
	"dateAddedLocal": "2/21/2024, 2:07:07 PM",
	"dateAddedUTC": "2024-02-21T19:07:07.181Z"
},{
	"index": 0,
	"title": "Dash Documentation & User Guide | Plotly",
	"url": "https://dash.plotly.com/",
	"id": 2632,
	"parentId": "2705",
	"dateAddedLocal": "1/7/2024, 8:29:41 AM",
	"dateAddedUTC": "2024-01-07T13:29:41.886Z"
},{
	"index": 11,
	"title": "deploy",
	"id": 2708,
	"parentId": "2633",
	"dateAddedLocal": "2/21/2024, 3:02:30 PM",
	"dateAddedUTC": "2024-02-21T20:02:30.770Z"
},{
	"index": 0,
	"title": "pre-work - a Hugging Face Space by smithwebtek",
	"url": "https://huggingface.co/spaces/smithwebtek/pre-work",
	"id": 2707,
	"parentId": "2708",
	"dateAddedLocal": "2/21/2024, 3:02:08 PM",
	"dateAddedUTC": "2024-02-21T20:02:08.389Z"
},{
	"index": 12,
	"title": "databricks",
	"id": 2714,
	"parentId": "2633",
	"dateAddedLocal": "3/1/2024, 6:43:28 PM",
	"dateAddedUTC": "2024-03-01T23:43:28.410Z"
},{
	"index": 0,
	"title": "Databricks: Large Language Models: Application through Production | edX",
	"url": "https://www.edx.org/learn/computer-science/databricks-large-language-models-application-through-production",
	"id": 2713,
	"parentId": "2714",
	"dateAddedLocal": "3/1/2024, 6:43:13 PM",
	"dateAddedUTC": "2024-03-01T23:43:13.372Z"
},{
	"index": 1,
	"title": "Getting started with NLP using Hugging Face transformers pipelines | Databricks Blog",
	"url": "https://www.databricks.com/blog/2023/02/06/getting-started-nlp-using-hugging-face-transformers-pipelines.html",
	"id": 2715,
	"parentId": "2714",
	"dateAddedLocal": "3/1/2024, 6:43:33 PM",
	"dateAddedUTC": "2024-03-01T23:43:33.592Z"
},{
	"index": 2,
	"title": "Introducing AI Functions: Integrating Large Language Models with Databricks SQL | Databricks Blog",
	"url": "https://www.databricks.com/blog/2023/04/18/introducing-ai-functions-integrating-large-language-models-databricks-sql.html",
	"id": 2716,
	"parentId": "2714",
	"dateAddedLocal": "3/1/2024, 6:43:42 PM",
	"dateAddedUTC": "2024-03-01T23:43:42.069Z"
},{
	"index": 3,
	"title": "Build Your Own Large Language Model Like Dolly | Databricks",
	"url": "https://www.databricks.com/resources/webinar/build-your-own-large-language-model-dolly",
	"id": 2717,
	"parentId": "2714",
	"dateAddedLocal": "3/1/2024, 6:43:49 PM",
	"dateAddedUTC": "2024-03-01T23:43:49.387Z"
},{
	"index": 13,
	"title": "excel",
	"id": 2731,
	"parentId": "2633",
	"dateAddedLocal": "3/25/2024, 10:47:23 AM",
	"dateAddedUTC": "2024-03-25T14:47:23.935Z"
},{
	"index": 0,
	"title": "Import and analyze data - Microsoft Support",
	"url": "https://support.microsoft.com/en-us/office/Import-and-analyze-data-ccd3c4a6-272f-4c97-afbb-d3f27407fcde#ID0EAABAAA=Charts&ID0EBBD=Import_data",
	"id": 2730,
	"parentId": "2731",
	"dateAddedLocal": "3/25/2024, 10:46:57 AM",
	"dateAddedUTC": "2024-03-25T14:46:57.671Z"
},{
	"index": 14,
	"title": "data-science-resources",
	"id": 2908,
	"parentId": "2633",
	"dateAddedLocal": "8/11/2024, 1:58:48 PM",
	"dateAddedUTC": "2024-08-11T17:58:48.168Z"
},{
	"index": 0,
	"title": "Data-Science-Resources/machine-learning/Practical Statistics for Data Scientists.pdf at master Â· Chandra0505/Data-Science-Resources",
	"url": "https://github.com/Chandra0505/Data-Science-Resources/blob/master/machine-learning/Practical%20Statistics%20for%20Data%20Scientists.pdf",
	"id": 2907,
	"parentId": "2908",
	"dateAddedLocal": "8/11/2024, 1:58:24 PM",
	"dateAddedUTC": "2024-08-11T17:58:24.258Z"
},{
	"index": 1,
	"title": "Chandra0505/Data-Science-Resources",
	"url": "https://github.com/Chandra0505/Data-Science-Resources",
	"id": 2909,
	"parentId": "2908",
	"dateAddedLocal": "8/11/2024, 1:58:53 PM",
	"dateAddedUTC": "2024-08-11T17:58:53.266Z"
},{
	"index": 15,
	"title": "GL_Newsletter-GLIMPSES-Aug24",
	"url": "https://d1vwxdpzbgdqj.cloudfront.net/s3-public-files/newsletter/gl_newsletter-glimpses-aug24_intl.pdf",
	"id": 2993,
	"parentId": "2633",
	"dateAddedLocal": "10/6/2024, 6:25:04 AM",
	"dateAddedUTC": "2024-10-06T10:25:04.240Z"
},{
	"index": 16,
	"title": "Jupyter Notebooks(ipynb) Viewer and Converter",
	"url": "https://htmtopdf.herokuapp.com/ipynbviewer/",
	"id": 3020,
	"parentId": "2633",
	"dateAddedLocal": "10/13/2024, 10:57:21 AM",
	"dateAddedUTC": "2024-10-13T14:57:21.366Z"
},{
	"index": 4,
	"title": "job",
	"id": 2996,
	"parentId": "1",
	"dateAddedLocal": "10/10/2024, 3:24:26 PM",
	"dateAddedUTC": "2024-10-10T19:24:26.065Z"
},{
	"index": 0,
	"title": "Teal: Track Manage Job Search Applications",
	"url": "https://www.tealhq.com/?sscid=a1k8_ebuwk&",
	"id": 2995,
	"parentId": "2996",
	"dateAddedLocal": "10/10/2024, 3:23:49 PM",
	"dateAddedUTC": "2024-10-10T19:23:49.859Z"
},{
	"index": 1,
	"title": "Teal - Home",
	"url": "https://app.tealhq.com/home",
	"id": 2997,
	"parentId": "2996",
	"dateAddedLocal": "10/10/2024, 3:33:19 PM",
	"dateAddedUTC": "2024-10-10T19:33:19.999Z"
},{
	"index": 2,
	"title": "AI Headshot Generator: Stunning Headshots for Successful Professionals",
	"url": "https://instaheadshots.com/?via=bryan",
	"id": 2998,
	"parentId": "2996",
	"dateAddedLocal": "10/10/2024, 3:55:57 PM",
	"dateAddedUTC": "2024-10-10T19:55:57.003Z"
},{
	"index": 3,
	"title": "Massive | Hyper-relevant roles at the most exciting companies",
	"url": "https://usemassive.com/?via=bryan",
	"id": 2999,
	"parentId": "2996",
	"dateAddedLocal": "10/10/2024, 3:56:51 PM",
	"dateAddedUTC": "2024-10-10T19:56:51.456Z"
},{
	"index": 4,
	"title": "Notion",
	"url": "https://www.notion.so/product?utm_source=affl&utm_medium=bryancreely7471&pscd=affiliate.notion.so&ps_partner_key=YnJ5YW5jcmVlbHk3NDcx&ps_xid=mPpBTSptV6ESJk&gsxid=mPpBTSptV6ESJk&gspk=YnJ5YW5jcmVlbHk3NDcx&cookie_sync_completed=true",
	"id": 3000,
	"parentId": "2996",
	"dateAddedLocal": "10/10/2024, 3:57:08 PM",
	"dateAddedUTC": "2024-10-10T19:57:08.801Z"
},{
	"index": 5,
	"title": "Massive | Hyper-relevant roles at the most exciting companies",
	"url": "https://usemassive.com/auto-apply-new",
	"id": 3001,
	"parentId": "2996",
	"dateAddedLocal": "10/10/2024, 4:11:44 PM",
	"dateAddedUTC": "2024-10-10T20:11:44.057Z"
},{
	"index": 6,
	"title": "Copy.ai",
	"url": "https://app.copy.ai/teamspace/27373511/dashboard?tool=chat",
	"id": 3002,
	"parentId": "2996",
	"dateAddedLocal": "10/10/2024, 5:22:34 PM",
	"dateAddedUTC": "2024-10-10T21:22:34.997Z"
},{
	"index": 7,
	"title": "Front-End Software Engineer Position | Tidepool",
	"url": "https://www.tidepool.org/jobs/front-end-software-engineer",
	"id": 3023,
	"parentId": "2996",
	"dateAddedLocal": "10/14/2024, 11:01:04 AM",
	"dateAddedUTC": "2024-10-14T15:01:04.646Z"
},{
	"index": 5,
	"title": "swt",
	"id": 333,
	"parentId": "1",
	"dateAddedLocal": "7/19/2021, 8:56:35 AM",
	"dateAddedUTC": "2021-07-19T12:56:35.531Z"
},{
	"index": 0,
	"title": "diabetes",
	"id": 2814,
	"parentId": "333",
	"dateAddedLocal": "5/5/2024, 9:04:18 AM",
	"dateAddedUTC": "2024-05-05T13:04:18.323Z"
},{
	"index": 0,
	"title": "How far did I run? - Create running maps with On The Go Map",
	"url": "https://onthegomap.com/#/create",
	"id": 2821,
	"parentId": "2814",
	"dateAddedLocal": "5/6/2024, 3:23:42 PM",
	"dateAddedUTC": "2024-05-06T19:23:42.381Z"
},{
	"index": 1,
	"title": "How To Sprout Anything - YouTube",
	"url": "https://www.youtube.com/watch?v=1mbR5xcO8aI",
	"id": 2813,
	"parentId": "2814",
	"dateAddedLocal": "5/5/2024, 9:03:53 AM",
	"dateAddedUTC": "2024-05-05T13:03:53.436Z"
},{
	"index": 2,
	"title": "How To Grow Sprouts at Home | 4 Super Healthy Sprouts - YouTube",
	"url": "https://www.youtube.com/watch?v=XYbBiHoTaWc",
	"id": 2815,
	"parentId": "2814",
	"dateAddedLocal": "5/5/2024, 9:12:06 AM",
	"dateAddedUTC": "2024-05-05T13:12:06.727Z"
},{
	"index": 3,
	"title": "Delicious Bread For Breakfast, I've been doing it for 20 years, it has never misled me! - YouTube",
	"url": "https://www.youtube.com/watch?v=4-wAckalSCc",
	"id": 2816,
	"parentId": "2814",
	"dateAddedLocal": "5/5/2024, 9:40:06 AM",
	"dateAddedUTC": "2024-05-05T13:40:06.343Z"
},{
	"index": 4,
	"title": "Sprouting for Diabetes Control | Benefits & How-To Guide 2023",
	"url": "https://diabetesfreelife.org/diet/sprouting/",
	"id": 2817,
	"parentId": "2814",
	"dateAddedLocal": "5/5/2024, 9:55:42 AM",
	"dateAddedUTC": "2024-05-05T13:55:42.311Z"
},{
	"index": 5,
	"title": "chat.openai.com/domain_migration?next=https%3A%2F%2Fchatgpt.com%2F",
	"url": "https://chat.openai.com/domain_migration?next=https%3A%2F%2Fchatgpt.com%2F",
	"id": 2824,
	"parentId": "2814",
	"dateAddedLocal": "5/14/2024, 6:02:41 PM",
	"dateAddedUTC": "2024-05-14T22:02:41.586Z"
},{
	"index": 6,
	"title": "Are Corporations Re-Defining Illness and Health? The Diabetes Epidemic, Goal Numbers, and Blockbuster Drugs - PMC",
	"url": "https://www.ncbi.nlm.nih.gov/pmc/articles/PMC8568684/",
	"id": 2829,
	"parentId": "2814",
	"dateAddedLocal": "5/18/2024, 10:14:38 PM",
	"dateAddedUTC": "2024-05-19T02:14:38.768Z"
},{
	"index": 7,
	"title": "Why Doesn't My Average Blood Glucose Match My A1C?",
	"url": "https://onedrop.today/blogs/blog/average-blood-glucose-and-a1c#:~:text=For%20some%20people%2C%20glucose%20attaches,to%20be%20lower%20than%20expected.",
	"id": 2830,
	"parentId": "2814",
	"dateAddedLocal": "5/19/2024, 12:45:01 AM",
	"dateAddedUTC": "2024-05-19T04:45:01.577Z"
},{
	"index": 8,
	"title": "LibreView",
	"url": "https://www.libreview.com/",
	"id": 2835,
	"parentId": "2814",
	"dateAddedLocal": "5/21/2024, 10:28:02 AM",
	"dateAddedUTC": "2024-05-21T14:28:02.999Z"
},{
	"index": 9,
	"title": "5 Exercises Without Equipment To Transform Your Body -Fast Results - YouTube",
	"url": "https://www.youtube.com/watch?v=_83lEnXz0Lw",
	"id": 2837,
	"parentId": "2814",
	"dateAddedLocal": "5/24/2024, 7:20:11 PM",
	"dateAddedUTC": "2024-05-24T23:20:11.692Z"
},{
	"index": 10,
	"title": "13 Minutes of Body Activation / Loosening Exercises for the Morning with Shi Heng Yi - YouTube",
	"url": "https://www.youtube.com/watch?v=8sJ5N9nsEmM",
	"id": 2838,
	"parentId": "2814",
	"dateAddedLocal": "5/24/2024, 7:33:51 PM",
	"dateAddedUTC": "2024-05-24T23:33:51.734Z"
},{
	"index": 11,
	"title": "Yoga Flow For Beginners | Intro To Flow - YouTube",
	"url": "https://www.youtube.com/watch?v=4TLHLNX65-4",
	"id": 2839,
	"parentId": "2814",
	"dateAddedLocal": "5/24/2024, 8:02:27 PM",
	"dateAddedUTC": "2024-05-25T00:02:27.884Z"
},{
	"index": 12,
	"title": "Water-only Fasting | TrueNorth Health Center",
	"url": "https://www.healthpromoting.com/water-only-fasting",
	"id": 2859,
	"parentId": "2814",
	"dateAddedLocal": "6/23/2024, 4:20:40 PM",
	"dateAddedUTC": "2024-06-23T20:20:40.391Z"
},{
	"index": 13,
	"title": "The Pleasure Trap: Mastering the Hidden Force that Undermines Health & Happiness: Douglas J. Lisle, Alan Goldhamer: 9781570671975: Amazon.com: Books",
	"url": "https://www.amazon.com/Pleasure-Trap-Mastering-Undermines-Happiness/dp/1570671974",
	"id": 2860,
	"parentId": "2814",
	"dateAddedLocal": "6/23/2024, 4:31:29 PM",
	"dateAddedUTC": "2024-06-23T20:31:29.877Z"
},{
	"index": 14,
	"title": "The war on â€˜prediabetes' could be a boon for pharmaâ€”but is it good medicine? | Science | AAAS",
	"url": "https://www.science.org/content/article/war-prediabetes-could-be-boon-pharma-it-good-medicine",
	"id": 2888,
	"parentId": "2814",
	"dateAddedLocal": "7/28/2024, 11:02:57 AM",
	"dateAddedUTC": "2024-07-28T15:02:57.287Z"
},{
	"index": 15,
	"title": "Alexia Strzalka | OpenPayments",
	"url": "https://openpaymentsdata.cms.gov/physician/2124782",
	"id": 2889,
	"parentId": "2814",
	"dateAddedLocal": "7/28/2024, 11:05:46 AM",
	"dateAddedUTC": "2024-07-28T15:05:46.794Z"
},{
	"index": 16,
	"title": "Explore the Open Payments Data | CMS",
	"url": "https://www.cms.gov/priorities/key-initiatives/open-payments/data/explore",
	"id": 2890,
	"parentId": "2814",
	"dateAddedLocal": "7/28/2024, 11:06:08 AM",
	"dateAddedUTC": "2024-07-28T15:06:08.379Z"
},{
	"index": 17,
	"title": "Big Pharma Is Fooling You & Making Americans Sick! - Corrupt Companies & Toxic Food | Calley Means - YouTube",
	"url": "https://www.youtube.com/watch?v=sTS2fd3kE9I",
	"id": 2891,
	"parentId": "2814",
	"dateAddedLocal": "7/28/2024, 11:09:17 AM",
	"dateAddedUTC": "2024-07-28T15:09:17.312Z"
},{
	"index": 18,
	"title": "Edgepark | Continuous Glucose Monitor (CGM) | Thank You",
	"url": "https://www.edgeparkcgm.com/success",
	"id": 2921,
	"parentId": "2814",
	"dateAddedLocal": "9/9/2024, 12:15:35 PM",
	"dateAddedUTC": "2024-09-09T16:15:35.225Z"
},{
	"index": 19,
	"title": "Fitaos PRO 3 High-end ECG/EKG blood sugar health sports smart watch",
	"url": "https://fitaos.com/products/fitaos-pro-3-high-end-ecg-ekg-blood-sugar-health-sports-smart-watch?variant=44176204693745&currency=USD&utm_medium=product_sync&utm_source=google&utm_content=sag_organic&utm_campaign=sag_organic&utm_source=google&utm_medium=medium&utm_campaign=482&utm_content=18&gad_source=1&gclid=EAIaIQobChMIiJaWsYHMiAMVQ1dHAR3NCw4tEAQYBSABEgImB_D_BwE",
	"id": 2945,
	"parentId": "2814",
	"dateAddedLocal": "9/18/2024, 3:54:46 AM",
	"dateAddedUTC": "2024-09-18T07:54:46.077Z"
},{
	"index": 20,
	"title": "Levels - Unlock Your Metabolic Health",
	"url": "https://www.levels.com/",
	"id": 2958,
	"parentId": "2814",
	"dateAddedLocal": "9/23/2024, 10:13:06 AM",
	"dateAddedUTC": "2024-09-23T14:13:06.815Z"
},{
	"index": 21,
	"title": "Get Graph | LibreView Unofficial",
	"url": "https://libreview-unofficial.stoplight.io/docs/libreview-unofficial/abe5cfff1f3b9-get-graph",
	"id": 2965,
	"parentId": "2814",
	"dateAddedLocal": "9/28/2024, 5:52:48 PM",
	"dateAddedUTC": "2024-09-28T21:52:48.612Z"
},{
	"index": 22,
	"title": "JSON Web Tokens - jwt.io",
	"url": "https://jwt.io/",
	"id": 2966,
	"parentId": "2814",
	"dateAddedLocal": "9/28/2024, 5:53:02 PM",
	"dateAddedUTC": "2024-09-28T21:53:02.536Z"
},{
	"index": 23,
	"title": "FokkeZB/libreview-proxy: Proxy for the unofficial API docs for LibreView.",
	"url": "https://github.com/FokkeZB/libreview-proxy",
	"id": 2967,
	"parentId": "2814",
	"dateAddedLocal": "9/28/2024, 5:53:10 PM",
	"dateAddedUTC": "2024-09-28T21:53:10.199Z"
},{
	"index": 24,
	"title": "libreview-proxy.onrender.com",
	"url": "https://libreview-proxy.onrender.com/",
	"id": 2968,
	"parentId": "2814",
	"dateAddedLocal": "9/28/2024, 5:53:14 PM",
	"dateAddedUTC": "2024-09-28T21:53:14.150Z"
},{
	"index": 25,
	"title": "FokkeZB/libreview-unofficial: LibreView Unofficial API Documentation.",
	"url": "https://github.com/FokkeZB/libreview-unofficial?tab=readme-ov-file",
	"id": 2969,
	"parentId": "2814",
	"dateAddedLocal": "9/28/2024, 5:53:18 PM",
	"dateAddedUTC": "2024-09-28T21:53:18.183Z"
},{
	"index": 26,
	"title": "FokkeZB/libreview-unofficial: LibreView Unofficial API Documentation.",
	"url": "https://github.com/FokkeZB/libreview-unofficial",
	"id": 2970,
	"parentId": "2814",
	"dateAddedLocal": "9/28/2024, 5:53:40 PM",
	"dateAddedUTC": "2024-09-28T21:53:40.774Z"
},{
	"index": 1,
	"title": "hearYourStory",
	"id": 2853,
	"parentId": "333",
	"dateAddedLocal": "6/20/2024, 10:46:47 AM",
	"dateAddedUTC": "2024-06-20T14:46:47.264Z"
},{
	"index": 0,
	"title": "hearyourstory.com/books/mybooks/",
	"url": "https://hearyourstory.com/books/mybooks/",
	"id": 2852,
	"parentId": "2853",
	"dateAddedLocal": "6/20/2024, 10:46:19 AM",
	"dateAddedUTC": "2024-06-20T14:46:19.895Z"
},{
	"index": 2,
	"title": "listen",
	"id": 334,
	"parentId": "333",
	"dateAddedLocal": "7/19/2021, 8:56:35 AM",
	"dateAddedUTC": "2021-07-19T12:56:35.531Z"
},{
	"index": 0,
	"title": "Binaural Beats Focus Music for ADHD Relief, Background Study Music - YouTube",
	"url": "https://www.youtube.com/watch?v=jQJOuoT2gbQ",
	"id": 2758,
	"parentId": "334",
	"dateAddedLocal": "3/29/2024, 1:31:18 PM",
	"dateAddedUTC": "2024-03-29T17:31:18.770Z"
},{
	"index": 1,
	"title": "Deep Focus Music",
	"url": "https://www.youtube.com/watch?v=8OPcb5x6YM8",
	"id": 335,
	"parentId": "334",
	"dateAddedLocal": "10/6/2021, 7:53:20 AM",
	"dateAddedUTC": "2021-10-06T11:53:20.812Z"
},{
	"index": 2,
	"title": "Deep Focus -Study",
	"url": "https://www.youtube.com/watch?v=3rmWJAQ0Na4",
	"id": 2622,
	"parentId": "334",
	"dateAddedLocal": "11/28/2023, 5:21:02 PM",
	"dateAddedUTC": "2023-11-28T22:21:02.080Z"
},{
	"index": 3,
	"title": "Music for Deep Focus and Concentration with Binaural Beats, Brainwave Music for Studying - YouTube",
	"url": "https://www.youtube.com/watch?v=EFi-pxsKWzE",
	"id": 2354,
	"parentId": "334",
	"dateAddedLocal": "4/7/2023, 8:39:08 AM",
	"dateAddedUTC": "2023-04-07T12:39:08.242Z"
},{
	"index": 4,
	"title": "I BELIEVE IN ME | 528Hz Healing",
	"url": "https://www.youtube.com/watch?v=Wd3--fDBaQg",
	"id": 336,
	"parentId": "334",
	"dateAddedLocal": "5/10/2022, 9:44:28 AM",
	"dateAddedUTC": "2022-05-10T13:44:28.111Z"
},{
	"index": 5,
	"title": "AutoBahn",
	"url": "https://www.youtube.com/watch?v=k9ts6p63ns0&list=PLIFpjuNsfKnm1g4yhcDneYHw_XcSqLr-w&index=6&ab_channel=GreenredProductions-RelaxingMusic",
	"id": 337,
	"parentId": "334",
	"dateAddedLocal": "6/21/2021, 2:12:25 PM",
	"dateAddedUTC": "2021-06-21T18:12:25.000Z"
},{
	"index": 6,
	"title": "SleepBreathe",
	"url": "https://www.youtube.com/watch?v=AXKipiBYlRI&t=3379s",
	"id": 338,
	"parentId": "334",
	"dateAddedLocal": "6/21/2021, 2:12:25 PM",
	"dateAddedUTC": "2021-06-21T18:12:25.000Z"
},{
	"index": 7,
	"title": "SusChord",
	"url": "https://www.youtube.com/watch?v=nby5jgjb0Dk&t=2509s",
	"id": 339,
	"parentId": "334",
	"dateAddedLocal": "6/21/2021, 2:12:25 PM",
	"dateAddedUTC": "2021-06-21T18:12:25.000Z"
},{
	"index": 8,
	"title": "DeepBass",
	"url": "https://www.youtube.com/watch?v=Qd3N_r0VUWQ&index=2&t=41706s&list=PL9w_rZsxQQNYNUCE8CX5SNNxWWw-YDquE",
	"id": 340,
	"parentId": "334",
	"dateAddedLocal": "6/21/2021, 2:12:25 PM",
	"dateAddedUTC": "2021-06-21T18:12:25.000Z"
},{
	"index": 9,
	"title": "Bass w/Choir",
	"url": "https://www.youtube.com/watch?v=SjOXz5LUy9M&list=PLIFpjuNsfKnm1g4yhcDneYHw_XcSqLr-w&index=1&t=18729s&ab_channel=MeditativeMind",
	"id": 341,
	"parentId": "334",
	"dateAddedLocal": "6/21/2021, 2:12:25 PM",
	"dateAddedUTC": "2021-06-21T18:12:25.000Z"
},{
	"index": 10,
	"title": "Mixolydian",
	"url": "https://www.youtube.com/watch?v=lecITZkWqzg&list=PLIFpjuNsfKnm1g4yhcDneYHw_XcSqLr-w&index=5&ab_channel=BodyMindZone",
	"id": 342,
	"parentId": "334",
	"dateAddedLocal": "6/21/2021, 2:12:25 PM",
	"dateAddedUTC": "2021-06-21T18:12:25.000Z"
},{
	"index": 11,
	"title": "Calm Space Ambient Music. Cosmic Harmony. - YouTube",
	"url": "https://www.youtube.com/watch?v=MvtWljsraTs",
	"id": 343,
	"parentId": "334",
	"dateAddedLocal": "9/29/2021, 4:44:47 PM",
	"dateAddedUTC": "2021-09-29T20:44:47.544Z"
},{
	"index": 12,
	"title": "Hypnotize - Ultra Relaxing Low Hum",
	"url": "https://www.youtube.com/watch?v=xxAghv0Nqa8",
	"id": 344,
	"parentId": "334",
	"dateAddedLocal": "3/9/2022, 10:50:02 AM",
	"dateAddedUTC": "2022-03-09T15:50:02.907Z"
},{
	"index": 13,
	"title": "âœ¨ Space Ambient Music",
	"url": "https://www.youtube.com/watch?v=Kgbnt-UxgKw",
	"id": 345,
	"parentId": "334",
	"dateAddedLocal": "10/18/2021, 12:48:23 PM",
	"dateAddedUTC": "2021-10-18T16:48:23.809Z"
},{
	"index": 14,
	"title": "Glenn Gould  1955 Goldberg Variations",
	"url": "https://www.youtube.com/watch?v=Ah392lnFHxM",
	"id": 346,
	"parentId": "334",
	"dateAddedLocal": "6/21/2021, 2:12:25 PM",
	"dateAddedUTC": "2021-06-21T18:12:25.000Z"
},{
	"index": 15,
	"title": "Deep Sleep Music",
	"url": "https://www.youtube.com/watch?v=zk1vvtd6Hfo",
	"id": 347,
	"parentId": "334",
	"dateAddedLocal": "3/1/2022, 3:09:08 PM",
	"dateAddedUTC": "2022-03-01T20:09:08.325Z"
},{
	"index": 16,
	"title": "Brainwaves",
	"url": "https://www.youtube.com/watch?v=Q8JIO106JlM",
	"id": 348,
	"parentId": "334",
	"dateAddedLocal": "2/10/2022, 10:16:24 AM",
	"dateAddedUTC": "2022-02-10T15:16:24.619Z"
},{
	"index": 17,
	"title": "Bill Evans - Village Vanguard",
	"url": "https://www.youtube.com/watch?v=Nh4nXEiHpBw&list=PLhq_uu2458_xwfeisa6KZE7dyAAMdhYmk",
	"id": 349,
	"parentId": "334",
	"dateAddedLocal": "6/21/2021, 2:12:25 PM",
	"dateAddedUTC": "2021-06-21T18:12:25.000Z"
},{
	"index": 18,
	"title": "Chopin -Nocturnes : Claudio Arrau",
	"url": "https://www.youtube.com/watch?v=uUdoxvigIl8&t=4735s",
	"id": 350,
	"parentId": "334",
	"dateAddedLocal": "6/21/2021, 2:12:25 PM",
	"dateAddedUTC": "2021-06-21T18:12:25.000Z"
},{
	"index": 19,
	"title": "Debussy",
	"url": "https://www.youtube.com/watch?v=qRZmdzCGLYw",
	"id": 351,
	"parentId": "334",
	"dateAddedLocal": "6/21/2021, 2:12:25 PM",
	"dateAddedUTC": "2021-06-21T18:12:25.000Z"
},{
	"index": 20,
	"title": "WGIR",
	"url": "https://www.iheart.com/live/news-radio-610-2752/?sc=inferno&campid=a&pname=WGIR-AM",
	"id": 352,
	"parentId": "334",
	"dateAddedLocal": "8/23/2021, 12:18:13 PM",
	"dateAddedUTC": "2021-08-23T16:18:13.905Z"
},{
	"index": 21,
	"title": "396 Hz Solfeggio | Let Go FEAR & GUILT | Remove Negative Blocks | Balance Root Chakra - YouTube",
	"url": "https://www.youtube.com/watch?v=LU_lEl-n5Ec",
	"id": 353,
	"parentId": "334",
	"dateAddedLocal": "3/19/2022, 7:42:42 AM",
	"dateAddedUTC": "2022-03-19T11:42:42.638Z"
},{
	"index": 22,
	"title": "FAN sleep",
	"url": "https://www.youtube.com/watch?v=JxaBrIOIIp0",
	"id": 354,
	"parentId": "334",
	"dateAddedLocal": "4/12/2022, 9:47:23 AM",
	"dateAddedUTC": "2022-04-12T13:47:23.568Z"
},{
	"index": 23,
	"title": "Loreishi",
	"id": 355,
	"parentId": "334",
	"dateAddedLocal": "10/1/2022, 1:21:08 PM",
	"dateAddedUTC": "2022-10-01T17:21:08.156Z"
},{
	"index": 0,
	"title": "Spotify â€“ Lotus",
	"url": "https://open.spotify.com/album/4Ay7CcibnfSaaIrpJAyELn?si=tP_jDFCKSzKt4VTrevBXCg&fbclid=IwAR0OSkczYyi2SF16Eyb9TcoNbyXI6Hu1JqwRyJrcLskGrpk9j_dhKmZPBSI&nd=1",
	"id": 356,
	"parentId": "355",
	"dateAddedLocal": "10/1/2022, 1:20:41 PM",
	"dateAddedUTC": "2022-10-01T17:20:41.795Z"
},{
	"index": 24,
	"title": "ðŸ”´ Space Ambient Music",
	"url": "https://www.youtube.com/watch?v=E5WpblyBR38",
	"id": 2242,
	"parentId": "334",
	"dateAddedLocal": "11/28/2022, 9:20:52 AM",
	"dateAddedUTC": "2022-11-28T14:20:52.894Z"
},{
	"index": 25,
	"title": "Bass Pulse",
	"url": "https://www.youtube.com/watch?v=jAhaAPSXnnk",
	"id": 2245,
	"parentId": "334",
	"dateAddedLocal": "12/2/2022, 3:59:18 PM",
	"dateAddedUTC": "2022-12-02T20:59:18.968Z"
},{
	"index": 26,
	"title": "Binaural Bass : Deep Sub Bass",
	"url": "https://www.youtube.com/watch?v=CI4tvhzsYeo",
	"id": 2252,
	"parentId": "334",
	"dateAddedLocal": "12/20/2022, 10:48:46 AM",
	"dateAddedUTC": "2022-12-20T15:48:46.443Z"
},{
	"index": 27,
	"title": "Binaural Bass : 432Hz Tuned Sleep Inducing Bass | ASMR - YouTube",
	"url": "https://www.youtube.com/watch?v=rmtHVZwgJyw",
	"id": 2253,
	"parentId": "334",
	"dateAddedLocal": "12/20/2022, 11:10:09 AM",
	"dateAddedUTC": "2022-12-20T16:10:09.561Z"
},{
	"index": 28,
	"title": "Sub Bass Healing Music",
	"url": "https://www.youtube.com/watch?v=AXKipiBYlRI&t=13s",
	"id": 2258,
	"parentId": "334",
	"dateAddedLocal": "12/21/2022, 11:27:43 AM",
	"dateAddedUTC": "2022-12-21T16:27:43.579Z"
},{
	"index": 29,
	"title": "Okta SSO",
	"url": "https://pubazusok01.pubedu.hegn.us/IWA/",
	"id": 2356,
	"parentId": "334",
	"dateAddedLocal": "4/10/2023, 8:11:32 AM",
	"dateAddedUTC": "2023-04-10T12:11:32.673Z"
},{
	"index": 30,
	"title": "Houghton Mifflin Harcourt Company - Sign In",
	"url": "https://hmhco.okta.com/login/default?fromURI=%2fapp%2fhoughtonmifflinharcourtcompany_confluence_1%2fexk8k9n0mahJwwZx81t7%2fsso%2fsaml%3fRelayState%3d-HRUG2-TRACKER%26SAMLRequest%3dPHNhbWxwOkF1dGhuUmVxdWVzdCB4bWxuczpzYW1scD0idXJuOm9hc2lzOm5hbWVzOnRjOlNBTUw6Mi4wOnByb3RvY29sIiB4bWxuczpzYW1sPSJ1cm46b2FzaXM6bmFtZXM6dGM6U0FNTDoyLjA6YXNzZXJ0aW9uIiBJRD0iUkVTT0xVVElPTl80Mjc1NDVjNC1lYTI4LTRmOTktYjMwYy05N2Y0NjE0MTEwZDYiIFZlcnNpb249IjIuMCIgSXNzdWVJbnN0YW50PSIyMDIzLTA0LTEwVDEyOjExOjMxWiIgRGVzdGluYXRpb249Imh0dHBzOi8vaG1oY28ub2t0YS5jb20vYXBwL2hvdWdodG9ubWlmZmxpbmhhcmNvdXJ0Y29tcGFueV9jb25mbHVlbmNlXzEvZXhrOGs5bjBtYWhKd3daeDgxdDcvc3NvL3NhbWwiIFByb3RvY29sQmluZGluZz0idXJuOm9hc2lzOm5hbWVzOnRjOlNBTUw6Mi4wOmJpbmRpbmdzOkhUVFAtUE9TVCIgQXNzZXJ0aW9uQ29uc3VtZXJTZXJ2aWNlVVJMPSJodHRwczovL2NvbmZsdWVuY2UuaG1oY28uY29tL3BsdWdpbnMvc2VydmxldC9zYW1sc3NvIj48c2FtbDpJc3N1ZXI%252BY29uZmx1ZW5jZS5obWhjby5jb208L3NhbWw6SXNzdWVyPjwvc2FtbHA6QXV0aG5SZXF1ZXN0Pg%253D%253D%26OKTA_INVALID_SESSION_REPOST%3dtrue",
	"id": 2357,
	"parentId": "334",
	"dateAddedLocal": "4/10/2023, 8:11:34 AM",
	"dateAddedUTC": "2023-04-10T12:11:34.482Z"
},{
	"index": 31,
	"title": "study",
	"url": "https://www.youtube.com/watch?v=sXC6AUbY69A&t=3s",
	"id": 2621,
	"parentId": "334",
	"dateAddedLocal": "11/28/2023, 5:20:16 PM",
	"dateAddedUTC": "2023-11-28T22:20:16.680Z"
},{
	"index": 32,
	"title": "Drifting Off with Joe Pera on Apple Podcasts",
	"url": "https://podcasts.apple.com/us/podcast/drifting-off-with-joe-pera/id1669125364",
	"id": 2660,
	"parentId": "334",
	"dateAddedLocal": "1/23/2024, 7:32:07 PM",
	"dateAddedUTC": "2024-01-24T00:32:07.663Z"
},{
	"index": 33,
	"title": "Binaural Beats Study",
	"url": "https://www.youtube.com/watch?v=KHbJi8qai50",
	"id": 2951,
	"parentId": "334",
	"dateAddedLocal": "9/22/2024, 4:39:45 AM",
	"dateAddedUTC": "2024-09-22T08:39:45.023Z"
},{
	"index": 34,
	"title": "Deep Sub Bass Healing",
	"url": "https://www.youtube.com/watch?v=CI4tvhzsYeo&t=327s",
	"id": 2955,
	"parentId": "334",
	"dateAddedLocal": "9/22/2024, 5:11:58 AM",
	"dateAddedUTC": "2024-09-22T09:11:58.469Z"
},{
	"index": 3,
	"title": "news",
	"id": 578,
	"parentId": "333",
	"dateAddedLocal": "7/19/2021, 8:56:35 AM",
	"dateAddedUTC": "2021-07-19T12:56:35.546Z"
},{
	"index": 0,
	"title": "A List Apart: For People Who Make Websites",
	"url": "http://alistapart.com/",
	"id": 579,
	"parentId": "578",
	"dateAddedLocal": "6/21/2021, 2:12:25 PM",
	"dateAddedUTC": "2021-06-21T18:12:25.000Z"
},{
	"index": 1,
	"title": "Alley Coworking Community - Workspace and Services",
	"url": "https://youralley.com/",
	"id": 580,
	"parentId": "578",
	"dateAddedLocal": "6/21/2021, 2:12:25 PM",
	"dateAddedUTC": "2021-06-21T18:12:25.000Z"
},{
	"index": 2,
	"title": "CodeNewbie",
	"url": "https://www.codenewbie.org/podcast",
	"id": 581,
	"parentId": "578",
	"dateAddedLocal": "6/21/2021, 2:12:25 PM",
	"dateAddedUTC": "2021-06-21T18:12:25.000Z"
},{
	"index": 3,
	"title": "Crunch Daily | TechCrunch",
	"url": "https://techcrunch.com/crunch-daily/",
	"id": 582,
	"parentId": "578",
	"dateAddedLocal": "6/21/2021, 2:12:25 PM",
	"dateAddedUTC": "2021-06-21T18:12:25.000Z"
},{
	"index": 4,
	"title": "CS50 Video",
	"url": "https://video.cs50.net/2017/fall/lectures/3?t=1h8m56s",
	"id": 583,
	"parentId": "578",
	"dateAddedLocal": "6/21/2021, 2:12:25 PM",
	"dateAddedUTC": "2021-06-21T18:12:25.000Z"
},{
	"index": 5,
	"title": "Hacker Newsletter - The Hacker News Newsletter",
	"url": "http://www.hackernewsletter.com/",
	"id": 584,
	"parentId": "578",
	"dateAddedLocal": "6/21/2021, 2:12:25 PM",
	"dateAddedUTC": "2021-06-21T18:12:25.000Z"
},{
	"index": 6,
	"title": "HANSEL MINUTES",
	"url": "https://hanselminutes.com/",
	"id": 585,
	"parentId": "578",
	"dateAddedLocal": "6/21/2021, 2:12:25 PM",
	"dateAddedUTC": "2021-06-21T18:12:25.000Z"
},{
	"index": 7,
	"title": "Joel on Software",
	"url": "https://www.joelonsoftware.com/",
	"id": 586,
	"parentId": "578",
	"dateAddedLocal": "6/21/2021, 2:12:25 PM",
	"dateAddedUTC": "2021-06-21T18:12:25.000Z"
},{
	"index": 8,
	"title": "Mislav's blog",
	"url": "https://mislav.net/blog/",
	"id": 587,
	"parentId": "578",
	"dateAddedLocal": "6/21/2021, 2:12:25 PM",
	"dateAddedUTC": "2021-06-21T18:12:25.000Z"
},{
	"index": 9,
	"title": "NSScreencast: Bite-sized Screencasts for iOS Development",
	"url": "http://nsscreencast.com/episodes",
	"id": 588,
	"parentId": "578",
	"dateAddedLocal": "6/21/2021, 2:12:25 PM",
	"dateAddedUTC": "2021-06-21T18:12:25.000Z"
},{
	"index": 10,
	"title": "Podcasts To Help You Learn About Technology",
	"url": "http://skillcrush.com/2014/01/07/best-podcasts-that-help-you-keep-up-technology/",
	"id": 589,
	"parentId": "578",
	"dateAddedLocal": "6/21/2021, 2:12:25 PM",
	"dateAddedUTC": "2021-06-21T18:12:25.000Z"
},{
	"index": 11,
	"title": "Second Career Devs | Home",
	"url": "https://secondcareerdevs.com/",
	"id": 590,
	"parentId": "578",
	"dateAddedLocal": "6/21/2021, 2:12:25 PM",
	"dateAddedUTC": "2021-06-21T18:12:25.000Z"
},{
	"index": 12,
	"title": "Startup Digest | The personalized insider newsletter for all things startup in your area.",
	"url": "https://www.startupdigest.com/",
	"id": 591,
	"parentId": "578",
	"dateAddedLocal": "6/21/2021, 2:12:25 PM",
	"dateAddedUTC": "2021-06-21T18:12:25.000Z"
},{
	"index": 13,
	"title": "VentureBeat Newsletters | VentureBeat",
	"url": "https://venturebeat.com/newsletters/",
	"id": 592,
	"parentId": "578",
	"dateAddedLocal": "6/21/2021, 2:12:25 PM",
	"dateAddedUTC": "2021-06-21T18:12:25.000Z"
},{
	"index": 14,
	"title": "You are seconds away from signing up for the hottest list in NYC Tech - AlleyWatch",
	"url": "http://www.alleywatch.com/email/",
	"id": 593,
	"parentId": "578",
	"dateAddedLocal": "6/21/2021, 2:12:25 PM",
	"dateAddedUTC": "2021-06-21T18:12:25.000Z"
},{
	"index": 4,
	"title": "node-pg",
	"id": 864,
	"parentId": "333",
	"dateAddedLocal": "10/26/2022, 7:54:20 PM",
	"dateAddedUTC": "2022-10-26T23:54:20.679Z"
},{
	"index": 0,
	"title": "How To Use PostgreSQL With Node.js on Ubuntu 20.04 | DigitalOcean",
	"url": "https://www.digitalocean.com/community/tutorials/how-to-use-postgresql-with-node-js-on-ubuntu-20-04",
	"id": 865,
	"parentId": "864",
	"dateAddedLocal": "10/26/2022, 7:54:02 PM",
	"dateAddedUTC": "2022-10-26T23:54:02.244Z"
},{
	"index": 1,
	"title": "How To Install and Use PostgreSQL on Ubuntu 20.04 | DigitalOcean",
	"url": "https://www.digitalocean.com/community/tutorials/how-to-install-and-use-postgresql-on-ubuntu-20-04",
	"id": 866,
	"parentId": "864",
	"dateAddedLocal": "10/26/2022, 8:36:13 PM",
	"dateAddedUTC": "2022-10-27T00:36:13.477Z"
},{
	"index": 2,
	"title": "Google Domains - Website",
	"url": "https://domains.google.com/registrar/smithwebtek.com/webhost?_ga=2.77673812.1375999627.1590523816-1776639291.1580922133",
	"id": 867,
	"parentId": "864",
	"dateAddedLocal": "10/26/2022, 9:33:30 PM",
	"dateAddedUTC": "2022-10-27T01:33:30.494Z"
},{
	"index": 3,
	"title": "Cert bot",
	"url": "https://www.digitalocean.com/community/tutorials/how-to-secure-nginx-with-let-s-encrypt-on-ubuntu-20-04",
	"id": 868,
	"parentId": "864",
	"dateAddedLocal": "10/26/2022, 11:34:16 PM",
	"dateAddedUTC": "2022-10-27T03:34:16.808Z"
},{
	"index": 4,
	"title": "What is PERN Stack? - GeeksforGeeks",
	"url": "https://www.geeksforgeeks.org/what-is-pern-stack/",
	"id": 869,
	"parentId": "864",
	"dateAddedLocal": "10/27/2022, 1:11:45 PM",
	"dateAddedUTC": "2022-10-27T17:11:45.931Z"
},{
	"index": 5,
	"title": "How To Install Nginx on Ubuntu 20.04 | DigitalOcean",
	"url": "https://www.digitalocean.com/community/tutorials/how-to-install-nginx-on-ubuntu-20-04",
	"id": 870,
	"parentId": "864",
	"dateAddedLocal": "10/27/2022, 1:12:16 PM",
	"dateAddedUTC": "2022-10-27T17:12:16.041Z"
},{
	"index": 5,
	"title": "study",
	"id": 594,
	"parentId": "333",
	"dateAddedLocal": "7/19/2021, 8:56:35 AM",
	"dateAddedUTC": "2021-07-19T12:56:35.537Z"
},{
	"index": 0,
	"title": "career",
	"id": 623,
	"parentId": "594",
	"dateAddedLocal": "6/21/2021, 2:28:37 PM",
	"dateAddedUTC": "2021-06-21T18:28:37.014Z"
},{
	"index": 0,
	"title": "junior",
	"id": 624,
	"parentId": "623",
	"dateAddedLocal": "6/21/2021, 2:28:37 PM",
	"dateAddedUTC": "2021-06-21T18:28:37.014Z"
},{
	"index": 0,
	"title": "12 Things Web Developers Must Include in Their Portfolios | Codementor",
	"url": "https://www.codementor.io/learn-programming/12-important-things-to-include-in-web-dev-portfolios",
	"id": 625,
	"parentId": "624",
	"dateAddedLocal": "6/21/2021, 2:12:25 PM",
	"dateAddedUTC": "2021-06-21T18:12:25.000Z"
},{
	"index": 1,
	"title": "12 Things You Must Do to Land a Junior Web Developer Job",
	"url": "http://skillcrush.com/2015/04/09/land-junior-web-developer-job/",
	"id": 626,
	"parentId": "624",
	"dateAddedLocal": "6/21/2021, 2:12:25 PM",
	"dateAddedUTC": "2021-06-21T18:12:25.000Z"
},{
	"index": 2,
	"title": "Becoming a Ruby on Rails developer | Infinum",
	"url": "https://infinum.co/the-capsized-eight/becoming-a-ruby-on-rails-developer",
	"id": 627,
	"parentId": "624",
	"dateAddedLocal": "6/21/2021, 2:12:25 PM",
	"dateAddedUTC": "2021-06-21T18:12:25.000Z"
},{
	"index": 3,
	"title": "Getting Your First Job As A Software Developer",
	"url": "https://dev.to/jennifer/getting-your-first-job-as-a-software-developer",
	"id": 628,
	"parentId": "624",
	"dateAddedLocal": "6/21/2021, 2:12:25 PM",
	"dateAddedUTC": "2021-06-21T18:12:25.000Z"
},{
	"index": 4,
	"title": "How to Build an Impressive Portfolio When You're New to Tech",
	"url": "https://skillcrush.com/2015/03/12/impressive-tech-portfolio/",
	"id": 629,
	"parentId": "624",
	"dateAddedLocal": "6/21/2021, 2:12:25 PM",
	"dateAddedUTC": "2021-06-21T18:12:25.000Z"
},{
	"index": 5,
	"title": "Landing Your First Job as a Junior Web Developer",
	"url": "http://blog.thefirehoseproject.com/posts/getting-your-first-junior-web-developer-job/",
	"id": 630,
	"parentId": "624",
	"dateAddedLocal": "6/21/2021, 2:12:25 PM",
	"dateAddedUTC": "2021-06-21T18:12:25.000Z"
},{
	"index": 6,
	"title": "So You Just Finished a Bootcamp, Now What?",
	"url": "http://frontside.io/blog/2016/05/17/so-you-just-finished-a-bootcamp-now-what.html",
	"id": 631,
	"parentId": "624",
	"dateAddedLocal": "6/21/2021, 2:12:25 PM",
	"dateAddedUTC": "2021-06-21T18:12:25.000Z"
},{
	"index": 7,
	"title": "What Employers are looking for in a junior rails developer",
	"url": "http://blog.teamtreehouse.com/employers-looking-junior-rails-developer",
	"id": 632,
	"parentId": "624",
	"dateAddedLocal": "6/21/2021, 2:12:25 PM",
	"dateAddedUTC": "2021-06-21T18:12:25.000Z"
},{
	"index": 8,
	"title": "What Every Junior Rails Developer Should Know | Rails Mama",
	"url": "https://railsmama.wordpress.com/2015/06/13/what-every-junior-rails-developer-should-know/",
	"id": 633,
	"parentId": "624",
	"dateAddedLocal": "6/21/2021, 2:12:25 PM",
	"dateAddedUTC": "2021-06-21T18:12:25.000Z"
},{
	"index": 1,
	"title": "interview-prep",
	"id": 634,
	"parentId": "623",
	"dateAddedLocal": "6/21/2021, 2:28:37 PM",
	"dateAddedUTC": "2021-06-21T18:28:37.015Z"
},{
	"index": 0,
	"title": "3 Steps to a Perfect Informational Interview",
	"url": "https://www.themuse.com/advice/3-steps-to-a-perfect-informational-interview?utm_medium=email&utm_campaign=weekly_20170407&utm_source=blueshift&bsft_eid=c7fee705-de41-4462-9dc0-d7d3c78ba382&bsft_pid=ffb458c9-9c5d-4e94-930f-15d30646ca5a&bsft_clkid=ab86f205-daf9-4881-ab93-2f71af299a16&bsft_uid=11a0bd8b-d47a-4d56-94dd-efdffc5e1484&bsft_mid=006df803-f84a-4b5d-81ff-28cefc7af911&bsft_pp=2&p=2",
	"id": 635,
	"parentId": "634",
	"dateAddedLocal": "6/21/2021, 2:12:25 PM",
	"dateAddedUTC": "2021-06-21T18:12:25.000Z"
},{
	"index": 1,
	"title": "4 Ways to Handle Interview Questions You Don't Know How to Answer",
	"url": "https://www.themuse.com/advice/4-ways-to-handle-interview-questions-you-dont-know-how-to-answer?utm_medium=email&utm_campaign=weekly_20170407&utm_source=blueshift&bsft_eid=c7fee705-de41-4462-9dc0-d7d3c78ba382&bsft_pid=3ccf07d5-00fa-4342-b6ca-c2f59a7fd019&bsft_clkid=df6f283e-972d-418c-b3b5-88370b41424f&bsft_uid=11a0bd8b-d47a-4d56-94dd-efdffc5e1484&bsft_mid=006df803-f84a-4b5d-81ff-28cefc7af911&bsft_pp=1&p=1",
	"id": 636,
	"parentId": "634",
	"dateAddedLocal": "6/21/2021, 2:12:25 PM",
	"dateAddedUTC": "2021-06-21T18:12:25.000Z"
},{
	"index": 2,
	"title": "Coding Interview Advice | Interview Cake",
	"url": "https://www.interviewcake.com/coding-interview-tips",
	"id": 637,
	"parentId": "634",
	"dateAddedLocal": "6/21/2021, 2:12:25 PM",
	"dateAddedUTC": "2021-06-21T18:12:25.000Z"
},{
	"index": 3,
	"title": "Four Semesters of Computer Science in Six Hours v2 Workshop",
	"url": "https://frontendmasters.com/workshops/computer-science-v2/",
	"id": 638,
	"parentId": "634",
	"dateAddedLocal": "6/21/2021, 2:12:25 PM",
	"dateAddedUTC": "2021-06-21T18:12:25.000Z"
},{
	"index": 4,
	"title": "free anonymous technical interview practice | free anonymous technical interview practice | interviewing.io",
	"url": "https://interviewing.io/",
	"id": 639,
	"parentId": "634",
	"dateAddedLocal": "6/21/2021, 2:12:25 PM",
	"dateAddedUTC": "2021-06-21T18:12:25.000Z"
},{
	"index": 5,
	"title": "Gainlo - Mock Interview With Professionals",
	"url": "http://www.gainlo.co/#!/",
	"id": 640,
	"parentId": "634",
	"dateAddedLocal": "6/21/2021, 2:12:25 PM",
	"dateAddedUTC": "2021-06-21T18:12:25.000Z"
},{
	"index": 6,
	"title": "How to Make the Most Out of Your Next Technical Interview, Even if You Bomb it - Flatiron School Flatiron School",
	"url": "http://blog.flatironschool.com/how-to-make-the-most-out-of-your-next-technical/",
	"id": 641,
	"parentId": "634",
	"dateAddedLocal": "6/21/2021, 2:12:25 PM",
	"dateAddedUTC": "2021-06-21T18:12:25.000Z"
},{
	"index": 7,
	"title": "How to pass a programming interview - Triplebyte Blog",
	"url": "https://triplebyte.com/blog/how-to-pass-a-programming-interview",
	"id": 642,
	"parentId": "634",
	"dateAddedLocal": "6/21/2021, 2:12:25 PM",
	"dateAddedUTC": "2021-06-21T18:12:25.000Z"
},{
	"index": 8,
	"title": "How to Prepare for a Video Interview the Right Way | The Muse",
	"url": "https://www.themuse.com/advice/how-to-prepare-for-video-interview",
	"id": 643,
	"parentId": "634",
	"dateAddedLocal": "6/21/2021, 2:12:25 PM",
	"dateAddedUTC": "2021-06-21T18:12:25.000Z"
},{
	"index": 9,
	"title": "Interview Cake",
	"url": "https://www.interviewcake.com/",
	"id": 644,
	"parentId": "634",
	"dateAddedLocal": "6/21/2021, 2:12:25 PM",
	"dateAddedUTC": "2021-06-21T18:12:25.000Z"
},{
	"index": 10,
	"title": "Programmer Mock Interviews | CareerCup",
	"url": "https://www.careercup.com/interview",
	"id": 645,
	"parentId": "634",
	"dateAddedLocal": "6/21/2021, 2:12:25 PM",
	"dateAddedUTC": "2021-06-21T18:12:25.000Z"
},{
	"index": 11,
	"title": "software interview coaching",
	"url": "http://www.impactinterview.com/software-engineering-interview-coaching/",
	"id": 646,
	"parentId": "634",
	"dateAddedLocal": "6/21/2021, 2:12:25 PM",
	"dateAddedUTC": "2021-06-21T18:12:25.000Z"
},{
	"index": 12,
	"title": "Stack Overflow Trends",
	"url": "https://insights.stackoverflow.com/trends?tags=",
	"id": 647,
	"parentId": "634",
	"dateAddedLocal": "6/21/2021, 2:12:25 PM",
	"dateAddedUTC": "2021-06-21T18:12:25.000Z"
},{
	"index": 13,
	"title": "The 30 Best Tips to Prepare for an Interview | The Muse",
	"url": "https://www.themuse.com/advice/the-ultimate-interview-guide-30-prep-tips-for-job-interview-success",
	"id": 648,
	"parentId": "634",
	"dateAddedLocal": "6/21/2021, 2:12:25 PM",
	"dateAddedUTC": "2021-06-21T18:12:25.000Z"
},{
	"index": 14,
	"title": "The Best-Ever Response to \"Why Did You Leave Your Last Job?\"",
	"url": "https://www.themuse.com/advice/the-bestever-response-to-why-did-you-leave-your-last-job?utm_medium=email&utm_campaign=weekly_20170407&utm_source=blueshift&bsft_eid=c7fee705-de41-4462-9dc0-d7d3c78ba382&bsft_pid=76c53af0-c381-499b-a28c-3e564ea22aea&bsft_clkid=f4314a00-8d71-4ee0-83e8-ff14df33ba1e&bsft_uid=11a0bd8b-d47a-4d56-94dd-efdffc5e1484&bsft_mid=006df803-f84a-4b5d-81ff-28cefc7af911&bsft_pp=3&p=3",
	"id": 649,
	"parentId": "634",
	"dateAddedLocal": "6/21/2021, 2:12:25 PM",
	"dateAddedUTC": "2021-06-21T18:12:25.000Z"
},{
	"index": 15,
	"title": "Top 50 React Interview Questions and Answers | Edureka",
	"url": "https://www.edureka.co/blog/interview-questions/react-interview-questions/?utm_source=facebook&utm_medium=crosspost&utm_campaign=social-media-edureka-sep-sc",
	"id": 650,
	"parentId": "634",
	"dateAddedLocal": "6/21/2021, 2:12:25 PM",
	"dateAddedUTC": "2021-06-21T18:12:25.000Z"
},{
	"index": 16,
	"title": "Video Interview Guide: Tips for a Successful Interview | Indeed.com",
	"url": "https://www.indeed.com/career-advice/interviewing/video-interview-guide",
	"id": 651,
	"parentId": "634",
	"dateAddedLocal": "6/21/2021, 2:12:25 PM",
	"dateAddedUTC": "2021-06-21T18:12:25.000Z"
},{
	"index": 17,
	"title": "What is a Full Stack developer? | Laurence Gellert's Blog",
	"url": "http://www.laurencegellert.com/2012/08/what-is-a-full-stack-developer/",
	"id": 652,
	"parentId": "634",
	"dateAddedLocal": "6/21/2021, 2:12:25 PM",
	"dateAddedUTC": "2021-06-21T18:12:25.000Z"
},{
	"index": 18,
	"title": "10 Interview Questions Every JavaScript Developer Should Know",
	"url": "https://medium.com/javascript-scene/10-interview-questions-every-javascript-developer-should-know-6fa6bdf5ad95",
	"id": 653,
	"parentId": "634",
	"dateAddedLocal": "6/21/2021, 2:12:25 PM",
	"dateAddedUTC": "2021-06-21T18:12:25.000Z"
},{
	"index": 19,
	"title": "37 Essential JavaScript Interview Questions and Answers",
	"url": "https://www.toptal.com/javascript/interview-questions",
	"id": 654,
	"parentId": "634",
	"dateAddedLocal": "6/21/2021, 2:12:25 PM",
	"dateAddedUTC": "2021-06-21T18:12:25.000Z"
},{
	"index": 20,
	"title": "How to Build an Impressive Portfolio When You're New to Tech",
	"url": "https://skillcrush.com/2015/03/12/impressive-tech-portfolio/",
	"id": 655,
	"parentId": "634",
	"dateAddedLocal": "6/21/2021, 2:12:25 PM",
	"dateAddedUTC": "2021-06-21T18:12:25.000Z"
},{
	"index": 21,
	"title": "9 Things Interviewers Never Tell Job Candidates, But Should | LinkedIn",
	"url": "https://www.linkedin.com/pulse/20140916123750-20017018-9-things-interviewers-never-tell-job-candidates-but-should/",
	"id": 656,
	"parentId": "634",
	"dateAddedLocal": "6/21/2021, 2:12:25 PM",
	"dateAddedUTC": "2021-06-21T18:12:25.000Z"
},{
	"index": 22,
	"title": "15 Steps for Updating Your ResumÃ©",
	"url": "http://skillcrush.com/2014/07/30/15-steps-updating-resume/",
	"id": 657,
	"parentId": "634",
	"dateAddedLocal": "6/21/2021, 2:12:25 PM",
	"dateAddedUTC": "2021-06-21T18:12:25.000Z"
},{
	"index": 23,
	"title": "Killer Cover Letters: Startup Edition - Levo",
	"url": "https://www.levo.com/posts/killer-cover-letters-startup-edition",
	"id": 658,
	"parentId": "634",
	"dateAddedLocal": "6/21/2021, 2:12:25 PM",
	"dateAddedUTC": "2021-06-21T18:12:25.000Z"
},{
	"index": 24,
	"title": "Tips From a Recruiter: Optimize Your Resume - Levo",
	"url": "http://www.levo.com/articles/career-advice/how-to-fit-your-resume-onto-just-one-page",
	"id": 659,
	"parentId": "634",
	"dateAddedLocal": "6/21/2021, 2:12:25 PM",
	"dateAddedUTC": "2021-06-21T18:12:25.000Z"
},{
	"index": 2,
	"title": "networking",
	"id": 660,
	"parentId": "623",
	"dateAddedLocal": "6/21/2021, 2:28:37 PM",
	"dateAddedUTC": "2021-06-21T18:28:37.017Z"
},{
	"index": 0,
	"title": "13 Meetup Groups You Should Join If You're New To Code",
	"url": "http://skillcrush.com/2015/02/17/13-tech-meetup-groups-for-beginners/",
	"id": 661,
	"parentId": "660",
	"dateAddedLocal": "6/21/2021, 2:12:25 PM",
	"dateAddedUTC": "2021-06-21T18:12:25.000Z"
},{
	"index": 1,
	"title": "How to Find Email Addresses | Scott Britton | Pulse | LinkedIn",
	"url": "https://www.linkedin.com/pulse/20140915184621-60525567-how-to-find-email-addresses?trk=hb_ntf_MEGAPHONE_ARTICLE_POST&trk=hb_ntf_MEGAPHONE_ARTICLE_POST",
	"id": 662,
	"parentId": "660",
	"dateAddedLocal": "6/21/2021, 2:12:25 PM",
	"dateAddedUTC": "2021-06-21T18:12:25.000Z"
},{
	"index": 2,
	"title": "Namechk | Username, Domain & Trademark Search",
	"url": "https://namechk.com/",
	"id": 663,
	"parentId": "660",
	"dateAddedLocal": "6/21/2021, 2:12:25 PM",
	"dateAddedUTC": "2021-06-21T18:12:25.000Z"
},{
	"index": 3,
	"title": "Rapportive-email finder",
	"url": "http://rapportive.com/",
	"id": 664,
	"parentId": "660",
	"dateAddedLocal": "6/21/2021, 2:12:25 PM",
	"dateAddedUTC": "2021-06-21T18:12:25.000Z"
},{
	"index": 4,
	"title": "Shapr - Meet Inspiring People, Shape Your Life",
	"url": "http://www.shapr.co/",
	"id": 665,
	"parentId": "660",
	"dateAddedLocal": "6/21/2021, 2:12:25 PM",
	"dateAddedUTC": "2021-06-21T18:12:25.000Z"
},{
	"index": 1,
	"title": "Cube.js Docs",
	"url": "https://cube.dev/docs/getting-started",
	"id": 679,
	"parentId": "594",
	"dateAddedLocal": "6/21/2021, 2:12:25 PM",
	"dateAddedUTC": "2021-06-21T18:12:25.000Z"
},{
	"index": 2,
	"title": "365 Data Science",
	"url": "https://365datascience.teachable.com/?flash=checkout.already_purchased_error",
	"id": 680,
	"parentId": "594",
	"dateAddedLocal": "6/21/2021, 2:12:25 PM",
	"dateAddedUTC": "2021-06-21T18:12:25.000Z"
},{
	"index": 3,
	"title": "Adobe XD Tutorial",
	"url": "https://www.youtube.com/watch?v=68w2VwalD5w",
	"id": 681,
	"parentId": "594",
	"dateAddedLocal": "6/21/2021, 2:12:25 PM",
	"dateAddedUTC": "2021-06-21T18:12:25.000Z"
},{
	"index": 4,
	"title": "Framework Television - HTML Authoring",
	"url": "https://www.frameworktv.com/products/html5-specialist",
	"id": 682,
	"parentId": "594",
	"dateAddedLocal": "6/21/2021, 2:12:25 PM",
	"dateAddedUTC": "2021-06-21T18:12:25.000Z"
},{
	"index": 5,
	"title": "GraphQL Tutorials | Learn GraphQL | Apollo Odyssey",
	"url": "https://odyssey.apollographql.com/?utm_source=apollo_docs&utm_medium=referral",
	"id": 683,
	"parentId": "594",
	"dateAddedLocal": "6/21/2021, 2:12:25 PM",
	"dateAddedUTC": "2021-06-21T18:12:25.000Z"
},{
	"index": 6,
	"title": "Guides - Rails Girls",
	"url": "https://guides.railsgirls.com/",
	"id": 684,
	"parentId": "594",
	"dateAddedLocal": "6/21/2021, 2:12:25 PM",
	"dateAddedUTC": "2021-06-21T18:12:25.000Z"
},{
	"index": 7,
	"title": "Introduction - Apollo Basics - Apollo GraphQL Docs",
	"url": "https://www.apollographql.com/docs/tutorial/introduction/",
	"id": 685,
	"parentId": "594",
	"dateAddedLocal": "6/21/2021, 2:12:25 PM",
	"dateAddedUTC": "2021-06-21T18:12:25.000Z"
},{
	"index": 8,
	"title": "LANDING | Barry Kibrick",
	"url": "https://www.barrykibrick.com/",
	"id": 686,
	"parentId": "594",
	"dateAddedLocal": "6/21/2021, 2:12:25 PM",
	"dateAddedUTC": "2021-06-21T18:12:25.000Z"
},{
	"index": 9,
	"title": "Leanpub | Bookstore",
	"url": "https://leanpub.com/bookstore?type=book&category=react",
	"id": 687,
	"parentId": "594",
	"dateAddedLocal": "6/21/2021, 2:12:25 PM",
	"dateAddedUTC": "2021-06-21T18:12:25.000Z"
},{
	"index": 10,
	"title": "Learn",
	"url": "https://learn.co/tracks/full-stack-web-dev-with-react",
	"id": 688,
	"parentId": "594",
	"dateAddedLocal": "6/21/2021, 2:12:25 PM",
	"dateAddedUTC": "2021-06-21T18:12:25.000Z"
},{
	"index": 11,
	"title": "Learn Code the Hard Way",
	"url": "https://learncodethehardway.org/",
	"id": 689,
	"parentId": "594",
	"dateAddedLocal": "6/21/2021, 2:12:25 PM",
	"dateAddedUTC": "2021-06-21T18:12:25.000Z"
},{
	"index": 12,
	"title": "Learn Enough to Be Dangerous",
	"url": "https://www.learnenough.com/",
	"id": 690,
	"parentId": "594",
	"dateAddedLocal": "6/21/2021, 2:12:25 PM",
	"dateAddedUTC": "2021-06-21T18:12:25.000Z"
},{
	"index": 13,
	"title": "Learn to Code With Me",
	"url": "https://go.learntocodewith.me/p/tech-toolbox-2020",
	"id": 691,
	"parentId": "594",
	"dateAddedLocal": "6/21/2021, 2:12:25 PM",
	"dateAddedUTC": "2021-06-21T18:12:25.000Z"
},{
	"index": 14,
	"title": "Learn to Code With Me",
	"url": "https://go.learntocodewith.me/courses/enrolled/952788",
	"id": 692,
	"parentId": "594",
	"dateAddedLocal": "6/21/2021, 2:12:25 PM",
	"dateAddedUTC": "2021-06-21T18:12:25.000Z"
},{
	"index": 15,
	"title": "Learn to Code With Me",
	"url": "https://go.learntocodewith.me/",
	"id": 693,
	"parentId": "594",
	"dateAddedLocal": "6/21/2021, 2:12:25 PM",
	"dateAddedUTC": "2021-06-21T18:12:25.000Z"
},{
	"index": 16,
	"title": "Learn Vidos",
	"url": "https://instruction.learn.co/student/video_lectures#/",
	"id": 694,
	"parentId": "594",
	"dateAddedLocal": "6/21/2021, 2:12:25 PM",
	"dateAddedUTC": "2021-06-21T18:12:25.000Z"
},{
	"index": 17,
	"title": "LinkedIN Learning",
	"url": "https://www.linkedin.com/learning/me?u=2114857",
	"id": 695,
	"parentId": "594",
	"dateAddedLocal": "6/21/2021, 2:12:25 PM",
	"dateAddedUTC": "2021-06-21T18:12:25.000Z"
},{
	"index": 18,
	"title": "Making a Progressive Web App | Create React App",
	"url": "https://create-react-app.dev/docs/making-a-progressive-web-app/#:~:text=The%20production%20build%20has%20all,a%20src%2Fservice-worker.",
	"id": 696,
	"parentId": "594",
	"dateAddedLocal": "6/21/2021, 2:12:25 PM",
	"dateAddedUTC": "2021-06-21T18:12:25.000Z"
},{
	"index": 19,
	"title": "myTeachable",
	"url": "https://sso.teachable.com/secure/teachable_accounts/profile",
	"id": 697,
	"parentId": "594",
	"dateAddedLocal": "6/21/2021, 2:12:25 PM",
	"dateAddedUTC": "2021-06-21T18:12:25.000Z"
},{
	"index": 20,
	"title": "Rails 6.0 with RSpec, FactoryBot, and Devise",
	"url": "https://matthewhoelter.com/2019/09/12/setting-up-and-testing-rails-6.0-with-rspec-factorybot-and-devise.html",
	"id": 698,
	"parentId": "594",
	"dateAddedLocal": "6/21/2021, 2:12:25 PM",
	"dateAddedUTC": "2021-06-21T18:12:25.000Z"
},{
	"index": 21,
	"title": "React on Rails Tutorial: Integrating React and Ruby on Rails 5.2 - Cognitive Class",
	"url": "https://cognitiveclass.ai/blog/react-on-rails-tutorial-integrating-react-and-ruby-on-rails",
	"id": 699,
	"parentId": "594",
	"dateAddedLocal": "6/21/2021, 2:12:25 PM",
	"dateAddedUTC": "2021-06-21T18:12:25.000Z"
},{
	"index": 22,
	"title": "Simple Steps Javascript",
	"url": "https://courses.simplestepscode.com/thanks-for-joining/",
	"id": 700,
	"parentId": "594",
	"dateAddedLocal": "6/21/2021, 2:12:25 PM",
	"dateAddedUTC": "2021-06-21T18:12:25.000Z"
},{
	"index": 23,
	"title": "Udemy",
	"url": "https://www.udemy.com/",
	"id": 701,
	"parentId": "594",
	"dateAddedLocal": "6/21/2021, 2:12:25 PM",
	"dateAddedUTC": "2021-06-21T18:12:25.000Z"
},{
	"index": 24,
	"title": "Odin",
	"url": "https://www.theodinproject.com/dashboard",
	"id": 702,
	"parentId": "594",
	"dateAddedLocal": "6/21/2021, 2:12:25 PM",
	"dateAddedUTC": "2021-06-21T18:12:25.000Z"
},{
	"index": 25,
	"title": "About - Project Euler",
	"url": "https://projecteuler.net/",
	"id": 703,
	"parentId": "594",
	"dateAddedLocal": "6/21/2021, 2:12:25 PM",
	"dateAddedUTC": "2021-06-21T18:12:25.000Z"
},{
	"index": 26,
	"title": "web.dev",
	"url": "https://web.dev/",
	"id": 2559,
	"parentId": "594",
	"dateAddedLocal": "9/15/2023, 8:38:52 AM",
	"dateAddedUTC": "2023-09-15T12:38:52.918Z"
},{
	"index": 27,
	"title": "typescript",
	"id": 2598,
	"parentId": "594",
	"dateAddedLocal": "11/4/2023, 9:07:26 AM",
	"dateAddedUTC": "2023-11-04T13:07:26.386Z"
},{
	"index": 0,
	"title": "What is TypeScript and why should you use it? | Contentful",
	"url": "https://www.contentful.com/blog/what-is-typescript-and-why-should-you-use-it/#:~:text=TypeScript%20extends%20JavaScript%2C%20providing%20a,TypeScript%20based%20on%20its%20value.",
	"id": 2597,
	"parentId": "2598",
	"dateAddedLocal": "11/4/2023, 9:06:47 AM",
	"dateAddedUTC": "2023-11-04T13:06:47.146Z"
},{
	"index": 28,
	"title": "javascript",
	"id": 2600,
	"parentId": "594",
	"dateAddedLocal": "11/4/2023, 9:10:23 AM",
	"dateAddedUTC": "2023-11-04T13:10:23.453Z"
},{
	"index": 0,
	"title": "You-Dont-Know-JS/get-started/ch1.md at 2nd-ed Â· getify/You-Dont-Know-JS",
	"url": "https://github.com/getify/You-Dont-Know-JS/blob/2nd-ed/get-started/ch1.md",
	"id": 2800,
	"parentId": "2600",
	"dateAddedLocal": "4/13/2024, 8:39:12 PM",
	"dateAddedUTC": "2024-04-14T00:39:12.556Z"
},{
	"index": 29,
	"title": "react native",
	"id": 2931,
	"parentId": "594",
	"dateAddedLocal": "9/15/2024, 6:19:40 AM",
	"dateAddedUTC": "2024-09-15T10:19:40.933Z"
},{
	"index": 0,
	"title": "How To Set Up And Use React Native In Visual Studio Code - Groove Technology - Software Outsourcing Simplified",
	"url": "https://groovetechnology.com/blog/how-to-set-up-and-use-react-native-in-visual-studio-code/",
	"id": 2930,
	"parentId": "2931",
	"dateAddedLocal": "9/15/2024, 6:19:27 AM",
	"dateAddedUTC": "2024-09-15T10:19:27.538Z"
},{
	"index": 1,
	"title": "Get Started with React Native Â· React Native",
	"url": "https://reactnative.dev/docs/environment-setup",
	"id": 2932,
	"parentId": "2931",
	"dateAddedLocal": "9/15/2024, 7:33:09 AM",
	"dateAddedUTC": "2024-09-15T11:33:09.940Z"
},{
	"index": 2,
	"title": "microsoft/vscode-react-native: VSCode extension for React Native - supports debugging and editor integration",
	"url": "https://github.com/microsoft/vscode-react-native#expo-applications",
	"id": 2933,
	"parentId": "2931",
	"dateAddedLocal": "9/15/2024, 7:33:16 AM",
	"dateAddedUTC": "2024-09-15T11:33:16.190Z"
},{
	"index": 3,
	"title": "Create your first app - Expo Documentation",
	"url": "https://docs.expo.dev/tutorial/create-your-first-app/",
	"id": 2934,
	"parentId": "2931",
	"dateAddedLocal": "9/15/2024, 8:06:17 AM",
	"dateAddedUTC": "2024-09-15T12:06:17.413Z"
},{
	"index": 4,
	"title": "Projects â€” Expo",
	"url": "https://expo.dev/accounts/smithwebtek/projects",
	"id": 2935,
	"parentId": "2931",
	"dateAddedLocal": "9/15/2024, 8:06:30 AM",
	"dateAddedUTC": "2024-09-15T12:06:30.532Z"
},{
	"index": 5,
	"title": "Download Android Studio & App Tools - Android Developers",
	"url": "https://developer.android.com/studio",
	"id": 2936,
	"parentId": "2931",
	"dateAddedLocal": "9/15/2024, 8:39:04 AM",
	"dateAddedUTC": "2024-09-15T12:39:04.658Z"
},{
	"index": 6,
	"title": "Java Downloads | Oracle",
	"url": "https://www.oracle.com/java/technologies/downloads/#jdk17-mac",
	"id": 2937,
	"parentId": "2931",
	"dateAddedLocal": "9/15/2024, 8:39:10 AM",
	"dateAddedUTC": "2024-09-15T12:39:10.620Z"
},{
	"index": 7,
	"title": "Running On Device Â· React Native",
	"url": "https://reactnative.dev/docs/running-on-device?os=macos&platform=android&guide=native#method-1-using-adb-reverse-recommended",
	"id": 2938,
	"parentId": "2931",
	"dateAddedLocal": "9/15/2024, 1:23:43 PM",
	"dateAddedUTC": "2024-09-15T17:23:43.294Z"
},{
	"index": 30,
	"title": "fullstack-react",
	"id": 2953,
	"parentId": "594",
	"dateAddedLocal": "9/22/2024, 4:50:02 AM",
	"dateAddedUTC": "2024-09-22T08:50:02.566Z"
},{
	"index": 0,
	"title": "TypeScript: TS Playground - An online editor for exploring TypeScript and JavaScript",
	"url": "https://www.typescriptlang.org/play/?#code/GYVwdgxgLglg9mABAWwKYGd0FUAOAVAC1QEEAnUgQwE8AKC8gLkTMqoB50pSYwBzRAD6IwIZACNUpAHwBKJgDc4MACaIA3gChE2xPVIA6HCHQEaAJhkBuDQF8NGiAk6JO3PuiYtqHLj15TEAF5EAG0AcmA4ODCAGkQwsXowgF1rNExcQhJyahpXP3Qre0cwZw8XXz4girdedBCARlSHJzgAG1R9NrhePP0oOAAZOAB3SQBhCnRUGhkZRA0gA",
	"id": 2952,
	"parentId": "2953",
	"dateAddedLocal": "9/22/2024, 4:49:43 AM",
	"dateAddedUTC": "2024-09-22T08:49:43.419Z"
},{
	"index": 1,
	"title": "Add images to a React project with Typescript - DEV Community",
	"url": "https://dev.to/minompi/add-images-to-a-react-project-with-typescript-4gbm#:~:text=import%20React%20from%20%22react%22%3B,built%20using%20CRA%20or%20Vite.",
	"id": 2957,
	"parentId": "2953",
	"dateAddedLocal": "9/22/2024, 12:39:03 PM",
	"dateAddedUTC": "2024-09-22T16:39:03.146Z"
},{
	"index": 31,
	"title": "java-spring",
	"id": 2441,
	"parentId": "594",
	"dateAddedLocal": "6/2/2023, 9:16:31 PM",
	"dateAddedUTC": "2023-06-03T01:16:31.500Z"
},{
	"index": 0,
	"title": "Spring | Learn",
	"url": "https://spring.io/learn",
	"id": 2440,
	"parentId": "2441",
	"dateAddedLocal": "6/2/2023, 9:15:14 PM",
	"dateAddedUTC": "2023-06-03T01:15:14.453Z"
},{
	"index": 1,
	"title": "Full Stack: React and Java Spring Boot - The Developer Guide | Udemy",
	"url": "https://www.udemy.com/course/full-stack-react-and-java-spring-boot-the-developer-guide/?utm_source=adwords&utm_medium=udemyads&utm_campaign=WebDevelopment_Search_la.EN_cc.US_PP_Control&utm_content=deal4584&utm_term=_._ag_141124571212_._ad_622358214946_._kw__._de_c_._dm__._pl__._ti_dsa-1652654191345_._li_9002291_._pd__._&matchtype=&gclid=EAIaIQobChMIsJrYwPWl_wIV0FZyCh1TwQ2sEAAYAiAAEgKJMPD_BwE",
	"id": 2442,
	"parentId": "2441",
	"dateAddedLocal": "6/2/2023, 9:16:35 PM",
	"dateAddedUTC": "2023-06-03T01:16:35.483Z"
},{
	"index": 2,
	"title": "Spring | Tools",
	"url": "https://spring.io/tools",
	"id": 2443,
	"parentId": "2441",
	"dateAddedLocal": "6/2/2023, 9:16:39 PM",
	"dateAddedUTC": "2023-06-03T01:16:39.728Z"
},{
	"index": 3,
	"title": "JDK 20 Documentation - Home",
	"url": "https://docs.oracle.com/en/java/javase/20/index.html",
	"id": 2444,
	"parentId": "2441",
	"dateAddedLocal": "6/3/2023, 5:57:30 AM",
	"dateAddedUTC": "2023-06-03T09:57:30.955Z"
},{
	"index": 4,
	"title": "Spring-Boot Maven project structure explained. | Medium",
	"url": "https://tabrezshaikh13.medium.com/spring-boot-maven-project-structure-explained-a45448dcbd4f",
	"id": 2445,
	"parentId": "2441",
	"dateAddedLocal": "6/3/2023, 11:27:41 AM",
	"dateAddedUTC": "2023-06-03T15:27:41.136Z"
},{
	"index": 5,
	"title": "Hello Web! First web-app using Spring-Boot | Medium | Medium",
	"url": "https://tabrezshaikh13.medium.com/hello-web-your-first-web-application-using-spring-boot-74afb16f4101",
	"id": 2446,
	"parentId": "2441",
	"dateAddedLocal": "6/3/2023, 11:27:46 AM",
	"dateAddedUTC": "2023-06-03T15:27:46.394Z"
},{
	"index": 6,
	"title": "Java Downloads | Oracle",
	"url": "https://www.oracle.com/java/technologies/downloads/#jdk20-mac",
	"id": 2447,
	"parentId": "2441",
	"dateAddedLocal": "6/3/2023, 11:29:48 AM",
	"dateAddedUTC": "2023-06-03T15:29:48.741Z"
},{
	"index": 7,
	"title": "Spring Boot Extension Pack - Visual Studio Marketplace",
	"url": "https://marketplace.visualstudio.com/items?itemName=vmware.vscode-boot-dev-pack",
	"id": 2448,
	"parentId": "2441",
	"dateAddedLocal": "6/3/2023, 11:33:14 AM",
	"dateAddedUTC": "2023-06-03T15:33:14.773Z"
},{
	"index": 8,
	"title": "Maven â€“ Installing Apache Maven",
	"url": "https://maven.apache.org/install.html",
	"id": 2449,
	"parentId": "2441",
	"dateAddedLocal": "6/3/2023, 11:42:28 AM",
	"dateAddedUTC": "2023-06-03T15:42:28.170Z"
},{
	"index": 9,
	"title": "macos - Command not found - Oh-My-Zsh - Stack Overflow",
	"url": "https://stackoverflow.com/questions/33935281/command-not-found-oh-my-zsh/70105882#70105882",
	"id": 2450,
	"parentId": "2441",
	"dateAddedLocal": "6/3/2023, 12:02:17 PM",
	"dateAddedUTC": "2023-06-03T16:02:17.438Z"
},{
	"index": 10,
	"title": "How to Install Maven on Mac OS | DigitalOcean",
	"url": "https://www.digitalocean.com/community/tutorials/install-maven-mac-os",
	"id": 2451,
	"parentId": "2441",
	"dateAddedLocal": "6/3/2023, 12:03:08 PM",
	"dateAddedUTC": "2023-06-03T16:03:08.284Z"
},{
	"index": 6,
	"title": "van",
	"id": 704,
	"parentId": "333",
	"dateAddedLocal": "7/19/2021, 8:56:35 AM",
	"dateAddedUTC": "2021-07-19T12:56:35.541Z"
},{
	"index": 0,
	"title": "80-20",
	"id": 705,
	"parentId": "704",
	"dateAddedLocal": "6/21/2021, 2:28:37 PM",
	"dateAddedUTC": "2021-06-21T18:28:37.020Z"
},{
	"index": 0,
	"title": "Amazon.com",
	"url": "https://www.amazon.com/s?me=A1H481IPHNMK5K&marketplaceID=ATVPDKIKX0DER",
	"id": 706,
	"parentId": "705",
	"dateAddedLocal": "6/21/2021, 2:12:25 PM",
	"dateAddedUTC": "2021-06-21T18:12:25.000Z"
},{
	"index": 1,
	"title": "ac",
	"id": 707,
	"parentId": "704",
	"dateAddedLocal": "6/21/2021, 2:28:37 PM",
	"dateAddedUTC": "2021-06-21T18:28:37.020Z"
},{
	"index": 0,
	"title": "Cooper & Hunter 9,000 BTU, 115V, 19 SEER Ductless Mini Split AC/Heating System MIA Series Pre-Charged Inverter Heat Pump with 16ft Installation Kit: Appliances",
	"url": "https://www.amazon.com/COOPER-HUNTER-Ductless-Pre-Charged-Installation/dp/B0862F1FPQ/ref=asc_df_B0862F1FPQ/?tag=hyprod-20&linkCode=df0&hvadid=416671577205&hvpos=&hvnetw=g&hvrand=6862378042186532801&hvpone=&hvptwo=&hvqmt=&hvdev=c&hvdvcmdl=&hvlocint=&hvlocphy=9002297&hvtargid=pla-899482683518&psc=1&tag=&ref=&adgrpid=96944448914&hvpone=&hvptwo=&hvadid=416671577205&hvpos=&hvnetw=g&hvrand=6862378042186532801&hvqmt=&hvdev=c&hvdvcmdl=&hvlocint=&hvlocphy=9002297&hvtargid=pla-899482683518",
	"id": 708,
	"parentId": "707",
	"dateAddedLocal": "6/21/2021, 2:12:25 PM",
	"dateAddedUTC": "2021-06-21T18:12:25.000Z"
},{
	"index": 1,
	"title": "Ductless Split Air Conditioning | Heating System | DC Inverter",
	"url": "https://www.pioneerminisplit.com/products/9-000-btu-ductless-dc-inverter-mini-split-air-conditioner-heat-pump-115-vac?variant=14703000485930&currency=USD&utm_medium=product_sync&utm_source=google&utm_content=sag_organic&utm_campaign=sag_organic&gclid=EAIaIQobChMI_dTAksCq8AIVFAaICR2PQAitEAQYASABEgLptfD_BwE",
	"id": 709,
	"parentId": "707",
	"dateAddedLocal": "6/21/2021, 2:12:25 PM",
	"dateAddedUTC": "2021-06-21T18:12:25.000Z"
},{
	"index": 2,
	"title": "WYS-IM-2017",
	"url": "https://www.pdhvac.com/site/downloads/WAS_WYS_IM_19S.pdf",
	"id": 710,
	"parentId": "707",
	"dateAddedLocal": "6/21/2021, 2:12:25 PM",
	"dateAddedUTC": "2021-06-21T18:12:25.000Z"
},{
	"index": 3,
	"title": "hOmeLabs Mini Split AC Heating System - 9,000 BTU 115V - Low Noise Inverter Air Conditioner with Washable Filter: Appliances",
	"url": "https://www.amazon.com/dp/B08Y5C7J7Q/ref=sspa_dk_detail_0?psc=1&pd_rd_i=B08Y5C7J7Q&pd_rd_w=DBsWJ&pf_rd_p=7771f1a2-d77a-4098-a19e-6d9a1e65f44d&pd_rd_wg=nxLzK&pf_rd_r=J00VV0AYZCTY6YPS7RXY&pd_rd_r=df3a1c44-3837-47d1-8bef-54b3fac939b3&smid=A19LAAJSDK1TMK&spLa=ZW5jcnlwdGVkUXVhbGlmaWVyPUEyMUlQOUlONzlXSFo3JmVuY3J5cHRlZElkPUEwMTQ1NTkzM0FVVlBRV0tLWUVQRyZlbmNyeXB0ZWRBZElkPUEwMTk0MzY0M0dJVkxJUzFYODBaRyZ3aWRnZXROYW1lPXNwX2RldGFpbCZhY3Rpb249Y2xpY2tSZWRpcmVjdCZkb05vdExvZ0NsaWNrPXRydWU=",
	"id": 711,
	"parentId": "707",
	"dateAddedLocal": "6/21/2021, 2:12:25 PM",
	"dateAddedUTC": "2021-06-21T18:12:25.000Z"
},{
	"index": 4,
	"title": "Mini Split AC Setup**Concealed**",
	"url": "https://www.youtube.com/watch?v=xE099gEf4f4&ab_channel=HowieRoll:445",
	"id": 712,
	"parentId": "707",
	"dateAddedLocal": "6/21/2021, 2:12:25 PM",
	"dateAddedUTC": "2021-06-21T18:12:25.000Z"
},{
	"index": 5,
	"title": "Mini Split Air Condition Setup In Custom RV Build **Concealed** - YouTube",
	"url": "https://www.youtube.com/watch?v=xE099gEf4f4&ab_channel=HowieRoll",
	"id": 713,
	"parentId": "707",
	"dateAddedLocal": "6/21/2021, 2:12:25 PM",
	"dateAddedUTC": "2021-06-21T18:12:25.000Z"
},{
	"index": 6,
	"title": "Getting Started",
	"url": "http://localhost/tutorial/",
	"id": 714,
	"parentId": "707",
	"dateAddedLocal": "6/21/2021, 2:12:25 PM",
	"dateAddedUTC": "2021-06-21T18:12:25.000Z"
},{
	"index": 7,
	"title": "Mitsubishi MZ-FH06NAH Heat Pump Mini Split System w/ Base Pan Heater",
	"url": "https://younits.com/mitsubishi-mz-fh06nah-heat-pump-mini-split-system-w-base-pan-heater.html",
	"id": 715,
	"parentId": "707",
	"dateAddedLocal": "6/21/2021, 2:12:25 PM",
	"dateAddedUTC": "2021-06-21T18:12:25.000Z"
},{
	"index": 2,
	"title": "bathroom",
	"id": 716,
	"parentId": "704",
	"dateAddedLocal": "6/21/2021, 2:28:37 PM",
	"dateAddedUTC": "2021-06-21T18:28:37.021Z"
},{
	"index": 0,
	"title": "quick dry Nylon Shower Curtains",
	"url": "https://www.vermontcountrystore.com/nylon-hotel-shower-curtain/product/54194",
	"id": 717,
	"parentId": "716",
	"dateAddedLocal": "6/21/2021, 2:12:25 PM",
	"dateAddedUTC": "2021-06-21T18:12:25.000Z"
},{
	"index": 1,
	"title": "Shower Pan  36\" x 24\" x 5\"",
	"url": "https://www.amazon.com/RecPro-Shower-Drain-White-Camper/dp/B086Q2MQB3/ref=pd_sbs_3?pd_rd_w=XctoZ&pf_rd_p=651d64d1-3c73-45b6-ae09-e545600e3a22&pf_rd_r=2ND8RSG802P3YS944SD0&pd_rd_r=90def994-3fe7-4066-a5b1-2d7728fa9333&pd_rd_wg=XZfQr&pd_rd_i=B086Q2MQB3&psc=1",
	"id": 718,
	"parentId": "716",
	"dateAddedLocal": "6/21/2021, 2:12:25 PM",
	"dateAddedUTC": "2021-06-21T18:12:25.000Z"
},{
	"index": 2,
	"title": "Visa 248 $120.28",
	"url": "https://www.amazon.com/dp/B0007L9J40?tag=sackscash-20&linkCode=ogi&th=1&psc=1",
	"id": 719,
	"parentId": "716",
	"dateAddedLocal": "6/21/2021, 2:12:25 PM",
	"dateAddedUTC": "2021-06-21T18:12:25.000Z"
},{
	"index": 3,
	"title": "Organic RV Holding Tank Treatment - 64 Treatments: Automotive",
	"url": "https://www.amazon.com/Happy-Campers-Organic-Holding-Treatment/dp/B007S0LDME/ref=asc_df_B007S0LDME/?tag=hyprod-20&linkCode=df0&hvadid=312094794632&hvpos=&hvnetw=g&hvrand=10213101567037573799&hvpone=&hvptwo=&hvqmt=&hvdev=c&hvdvcmdl=&hvlocint=&hvlocphy=9002297&hvtargid=pla-493704281005&psc=1&tag=&ref=&adgrpid=60223452937&hvpone=&hvptwo=&hvadid=312094794632&hvpos=&hvnetw=g&hvrand=10213101567037573799&hvqmt=&hvdev=c&hvdvcmdl=&hvlocint=&hvlocphy=9002297&hvtargid=pla-493704281005",
	"id": 720,
	"parentId": "716",
	"dateAddedLocal": "6/21/2021, 2:12:25 PM",
	"dateAddedUTC": "2021-06-21T18:12:25.000Z"
},{
	"index": 4,
	"title": "24 Gallon RV Fresh Water Tank | Ronco RVB446",
	"url": "https://www.ntotank.com/24gallon-ronco-rv-water-tank-x9022372",
	"id": 721,
	"parentId": "716",
	"dateAddedLocal": "6/21/2021, 2:12:25 PM",
	"dateAddedUTC": "2021-06-21T18:12:25.000Z"
},{
	"index": 5,
	"title": "20 GAL wheel well tank",
	"url": "https://titandiykits.com/shop/20-gallon-water-system/",
	"id": 722,
	"parentId": "716",
	"dateAddedLocal": "6/21/2021, 2:12:25 PM",
	"dateAddedUTC": "2021-06-21T18:12:25.000Z"
},{
	"index": 6,
	"title": "10 Gal  Water Tank 32\" x 19 1/2\" x 4 3/4\"",
	"url": "https://www.ntotank.com/10gallon-ronco-rv-water-tank-x8898393",
	"id": 723,
	"parentId": "716",
	"dateAddedLocal": "6/21/2021, 2:12:25 PM",
	"dateAddedUTC": "2021-06-21T18:12:25.000Z"
},{
	"index": 7,
	"title": "Hassock Toilet | Bass Pro Shops",
	"url": "https://www.basspro.com/shop/en/hassock-toilet",
	"id": 2299,
	"parentId": "716",
	"dateAddedLocal": "2/20/2023, 12:19:02 PM",
	"dateAddedUTC": "2023-02-20T17:19:02.128Z"
},{
	"index": 3,
	"title": "bed",
	"id": 724,
	"parentId": "704",
	"dateAddedLocal": "6/21/2021, 2:28:37 PM",
	"dateAddedUTC": "2021-06-21T18:28:37.022Z"
},{
	"index": 0,
	"title": "71\"Convertible Sofa | Wayfair",
	"url": "https://www.wayfair.com/Hashtag-Home--Brookland-Full-71-Velvet-Convertible-Sofa-X116111776-L978-K~W005000665.html?refid=GX103455958963-W005000665_1180388004&device=c&ptid=1223733917919&network=g&targetid=pla-1223733917919&channel=GooglePLA&ireid=118560514&fdid=1817&PiID%5B%5D=1180388004&campaignid=398251723&gclid=EAIaIQobChMIqJucqKaO8AIV1NrICh206gPjEAQYAyABEgK3WvD_BwE",
	"id": 725,
	"parentId": "724",
	"dateAddedLocal": "6/21/2021, 2:12:25 PM",
	"dateAddedUTC": "2021-06-21T18:12:25.000Z"
},{
	"index": 1,
	"title": "Hashtag Home Brookland Full 71\" Velvet Convertible Sofa & Reviews | Wayfair",
	"url": "https://www.wayfair.com/furniture/pdp/hashtag-home-brookland-full-71-velvet-convertible-sofa-w005000665.html?piid=1180388004",
	"id": 726,
	"parentId": "724",
	"dateAddedLocal": "6/21/2021, 2:12:25 PM",
	"dateAddedUTC": "2021-06-21T18:12:25.000Z"
},{
	"index": 2,
	"title": "RV Furniture Parts",
	"url": "https://www.recpro.com/rv-furniture-parts/",
	"id": 727,
	"parentId": "724",
	"dateAddedLocal": "6/21/2021, 2:12:25 PM",
	"dateAddedUTC": "2021-06-21T18:12:25.000Z"
},{
	"index": 3,
	"title": "Ultrawall 24 inch Black Sturdy Folding Shelf Brackets, Heavy Duty Adjustable Steel Wall Mounted Collapsible Shelf Bracket, Max Load 550lb (Pack of 2) - - Amazon.com",
	"url": "https://www.amazon.com/gp/product/B071F4K3GB/ref=ox_sc_act_title_2?smid=ATSUHE5486TFT&psc=1",
	"id": 728,
	"parentId": "724",
	"dateAddedLocal": "6/21/2021, 2:12:25 PM",
	"dateAddedUTC": "2021-06-21T18:12:25.000Z"
},{
	"index": 4,
	"title": "Milliard Tri-fold 6\" Mattress | Mattress Firm",
	"url": "https://www.mattressfirm.com/6-tri-fold-mattress/5637146923.p?variantid=5637152658&utm_source=google&utm_content=_PLA_&utm_kxconfid=t6c7xqs93&gclid=EAIaIQobChMIgrezje2i_QIV8zizAB19PwEXEAQYASABEgLCn_D_BwE&gclsrc=aw.ds",
	"id": 2300,
	"parentId": "724",
	"dateAddedLocal": "2/20/2023, 12:19:21 PM",
	"dateAddedUTC": "2023-02-20T17:19:21.618Z"
},{
	"index": 5,
	"title": "SINWEEK Tri Folding Mattress with Storage Bag Foldable Mattress Foam Topper Floor Cot Mattress, Guset Bed with Machine Washable Cover and Waterproof Lining, CertiPUR-US Certified 25 x 75 x3 Inch",
	"url": "https://www.amazon.com/SINWEEK-Thickness-Removable-CertiPUR-US-Certified/dp/B09V2JZ8ZB/ref=sr_1_1_sspa?gclid=EAIaIQobChMIgrezje2i_QIV8zizAB19PwEXEAMYASAAEgK1nvD_BwE&hvadid=631556535964&hvdev=c&hvlocphy=9002297&hvnetw=g&hvqmt=b&hvrand=10114047646207320770&hvtargid=kwd-297540772773&hydadcr=7473_13294095&keywords=folding%2Bvan%2Bseat%2Bbed&qid=1676853342&sr=8-1-spons&ufe=app_do%3Aamzn1.fos.e3dc0fa2-4ee8-4881-a97d-5992ecbdb227&spLa=ZW5jcnlwdGVkUXVhbGlmaWVyPUExRDBDWEYzUTNPU1FBJmVuY3J5cHRlZElkPUEwNDgwMDI1Mlc2UDNTQVlJRlNRQiZlbmNyeXB0ZWRBZElkPUEwNTU1NTcxMlBBNzRCTVRDRkVKVSZ3aWRnZXROYW1lPXNwX2F0ZiZhY3Rpb249Y2xpY2tSZWRpcmVjdCZkb05vdExvZ0NsaWNrPXRydWU&th=1",
	"id": 2301,
	"parentId": "724",
	"dateAddedLocal": "2/20/2023, 12:19:35 PM",
	"dateAddedUTC": "2023-02-20T17:19:35.000Z"
},{
	"index": 4,
	"title": "deck",
	"id": 729,
	"parentId": "704",
	"dateAddedLocal": "6/21/2021, 2:28:37 PM",
	"dateAddedUTC": "2021-06-21T18:28:37.022Z"
},{
	"index": 0,
	"title": "Clam - Traveler Screen Tent",
	"url": "https://shop.quicksetshelters.com/traveler-screen-tent.html",
	"id": 730,
	"parentId": "729",
	"dateAddedLocal": "6/21/2021, 2:12:25 PM",
	"dateAddedUTC": "2021-06-21T18:12:25.000Z"
},{
	"index": 5,
	"title": "dimensions",
	"id": 731,
	"parentId": "704",
	"dateAddedLocal": "6/21/2021, 2:28:37 PM",
	"dateAddedUTC": "2021-06-21T18:28:37.022Z"
},{
	"index": 6,
	"title": "heater",
	"id": 732,
	"parentId": "704",
	"dateAddedLocal": "6/21/2021, 2:28:37 PM",
	"dateAddedUTC": "2021-06-21T18:28:37.023Z"
},{
	"index": 0,
	"title": "HS2000 Furnace â€¢ Economical Propane fired furnace â€¢ Propex",
	"url": "https://www.propexheatsource.com/heaters/hs2000-furnace/",
	"id": 733,
	"parentId": "732",
	"dateAddedLocal": "6/21/2021, 2:12:25 PM",
	"dateAddedUTC": "2021-06-21T18:12:25.000Z"
},{
	"index": 7,
	"title": "influencers",
	"id": 734,
	"parentId": "704",
	"dateAddedLocal": "6/21/2021, 2:28:37 PM",
	"dateAddedUTC": "2021-06-21T18:28:37.023Z"
},{
	"index": 0,
	"title": "DIYvan",
	"url": "https://diyvan.com/",
	"id": 735,
	"parentId": "734",
	"dateAddedLocal": "6/21/2021, 2:12:25 PM",
	"dateAddedUTC": "2021-06-21T18:12:25.000Z"
},{
	"index": 8,
	"title": "insulate",
	"id": 736,
	"parentId": "704",
	"dateAddedLocal": "6/21/2021, 2:28:37 PM",
	"dateAddedUTC": "2021-06-21T18:28:37.023Z"
},{
	"index": 0,
	"title": "Insulating Your Van: Everything You Need to Know for Your DIY Van Build",
	"url": "https://gnomadhome.com/van-build-insulation/",
	"id": 737,
	"parentId": "736",
	"dateAddedLocal": "6/21/2021, 2:12:25 PM",
	"dateAddedUTC": "2021-06-21T18:12:25.000Z"
},{
	"index": 9,
	"title": "kitchen",
	"id": 738,
	"parentId": "704",
	"dateAddedLocal": "6/21/2021, 2:28:37 PM",
	"dateAddedUTC": "2021-06-21T18:28:37.023Z"
},{
	"index": 0,
	"title": "Camp Chef Outdoor 2-Burner Range with Oven - Walmart.com - Walmart.com",
	"url": "https://www.walmart.com/ip/Camp-Chef-Outdoor-2-Burner-Range-with-Oven/7857646?wmlspartner=wlpa&selectedSellerId=0&&adid=22222222227017743395&wl0=&wl1=g&wl2=c&wl3=43385291912&wl4=pla-82952028512&wl5=9002297&wl6=&wl7=&wl8=&wl9=pla&wl10=8175035&wl11=online&wl12=7857646&veh=sem&gclid=EAIaIQobChMIxYv25POy7wIVA6GzCh33NQFDEAQYAyABEgI42_D_BwE&gclsrc=aw.ds",
	"id": 739,
	"parentId": "738",
	"dateAddedLocal": "6/21/2021, 2:12:25 PM",
	"dateAddedUTC": "2021-06-21T18:12:25.000Z"
},{
	"index": 1,
	"title": "Pelican Elite 20 Quart Cooler (Canyon Red/Coyote) : Sports & Outdoors",
	"url": "https://www.amazon.com/dp/B07NTTR85Z/ref=sspa_dk_detail_4?psc=1&spLa=ZW5jcnlwdGVkUXVhbGlmaWVyPUEySUxGVE1WQzg4STVHJmVuY3J5cHRlZElkPUEwMDE3MDI5M0xJS1MxSlM4RVVWNyZlbmNyeXB0ZWRBZElkPUEwMjg0NDYxM0pIUlZUVkpMQUdIMCZ3aWRnZXROYW1lPXNwX2RldGFpbDImYWN0aW9uPWNsaWNrUmVkaXJlY3QmZG9Ob3RMb2dDbGljaz10cnVl",
	"id": 740,
	"parentId": "738",
	"dateAddedLocal": "6/21/2021, 2:12:25 PM",
	"dateAddedUTC": "2021-06-21T18:12:25.000Z"
},{
	"index": 10,
	"title": "misc",
	"id": 741,
	"parentId": "704",
	"dateAddedLocal": "6/21/2021, 2:28:37 PM",
	"dateAddedUTC": "2021-06-21T18:28:37.023Z"
},{
	"index": 0,
	"title": "Layout Considerations for a Camper Van Build - YouTube",
	"url": "https://www.youtube.com/watch?v=KQs29VFwn1M&ab_channel=MoserMakes",
	"id": 742,
	"parentId": "741",
	"dateAddedLocal": "6/21/2021, 2:12:25 PM",
	"dateAddedUTC": "2021-06-21T18:12:25.000Z"
},{
	"index": 1,
	"title": "Creativity RV's Amazon Page",
	"url": "https://www.amazon.com/shop/creativityrv",
	"id": 743,
	"parentId": "741",
	"dateAddedLocal": "6/21/2021, 2:12:25 PM",
	"dateAddedUTC": "2021-06-21T18:12:25.000Z"
},{
	"index": 11,
	"title": "power",
	"id": 744,
	"parentId": "704",
	"dateAddedLocal": "6/21/2021, 2:28:37 PM",
	"dateAddedUTC": "2021-06-21T18:28:37.023Z"
},{
	"index": 0,
	"title": "1000 watts Tilting Solar, See the Power - Van Build Tech Talk Series - Ep. 1 - YouTube",
	"url": "https://www.youtube.com/watch?v=wRHdZ2CregM&ab_channel=Snow%26Curt",
	"id": 745,
	"parentId": "744",
	"dateAddedLocal": "6/21/2021, 2:12:25 PM",
	"dateAddedUTC": "2021-06-21T18:12:25.000Z"
},{
	"index": 1,
	"title": "Flame King 1 lb. Refillable Propane Cylinder with Refill Kit-YSN1LBKT - The Home Depot",
	"url": "https://www.homedepot.com/p/Flame-King-1-lb-Refillable-Propane-Cylinder-with-Refill-Kit-YSN1LBKT/305539519?mtc=Shopping-B-F_D28I-G-D28I-28_22_BBQ_GRILL-MULTI-NA-Feed-PLA-NA-NA-SHP_General&cm_mmc=Shopping-B-F_D28I-G-D28I-28_22_BBQ_GRILL-MULTI-NA-Feed-PLA-NA-NA-SHP_General-71700000041074675-58700005364751339-92700048746792085&gclid=CjwKCAjw_uDsBRAMEiwAaFiHa0ScmqmHquL6j1DY0jvqlKLp4Vt7vUDS44CzQgSqsLA6YC_QeRvv_BoCkrYQAvD_BwE&gclsrc=aw.ds",
	"id": 746,
	"parentId": "744",
	"dateAddedLocal": "6/21/2021, 2:12:25 PM",
	"dateAddedUTC": "2021-06-21T18:12:25.000Z"
},{
	"index": 2,
	"title": "Power Inverter - Inverters R Us Corp - Your DC to AC Superstore",
	"url": "https://invertersrus.com/",
	"id": 747,
	"parentId": "744",
	"dateAddedLocal": "6/21/2021, 2:12:25 PM",
	"dateAddedUTC": "2021-06-21T18:12:25.000Z"
},{
	"index": 3,
	"title": "propane heater: Camco Wave 3 Propane Heater Review - YouTube",
	"url": "https://www.youtube.com/watch?v=jvYw-4kIL2w",
	"id": 748,
	"parentId": "744",
	"dateAddedLocal": "6/21/2021, 2:12:25 PM",
	"dateAddedUTC": "2021-06-21T18:12:25.000Z"
},{
	"index": 12,
	"title": "propane",
	"id": 749,
	"parentId": "704",
	"dateAddedLocal": "6/21/2021, 2:28:37 PM",
	"dateAddedUTC": "2021-06-21T18:28:37.024Z"
},{
	"index": 0,
	"title": "11 lb. Propane Cylinder with Type 1 Overfill Protection Device Valve (Ships Empty) - Walmart.com",
	"url": "https://www.walmart.com/ip/11-lb-Propane-Cylinder-with-Type-1-Overfill-Protection-Device-Valve-Ships-Empty/41488619?wmlspartner=wlpa&selectedSellerId=0&adid=22222222227063024440&wl0=&wl1=g&wl2=c&wl3=169582247270&wl4=pla-275963858288&wl5=&wl6=&wl7=&wl8=&wl9=pla&wl10=8175035&wl11=online&wl12=41488619&veh=sem&gclid=Cj0KCQjw84XtBRDWARIsAAU1aM164naGBasDTYyG3fR_GcD-lh2jYv2qvj12EV7Z9NetU56A6FxDBU8aAiXnEALw_wcB",
	"id": 750,
	"parentId": "749",
	"dateAddedLocal": "6/21/2021, 2:12:25 PM",
	"dateAddedUTC": "2021-06-21T18:12:25.000Z"
},{
	"index": 1,
	"title": "Double-Stage Auto-Changeover Regulator- For RVs with Dual Propane Tank Hookups, Maintains a Constant Gas Pressure With Auto Change From Empty to Full Tanks (59005): Automotive",
	"url": "https://www.amazon.com/Camco-Double-Stage-Auto-Changeover-Regulator-59005/dp/B0024ECBCA",
	"id": 751,
	"parentId": "749",
	"dateAddedLocal": "6/21/2021, 2:12:25 PM",
	"dateAddedUTC": "2021-06-21T18:12:25.000Z"
},{
	"index": 2,
	"title": "Install a Horizontal RV Propane Tank Underneath RAM Promaster Van",
	"url": "https://www.vanlifeoutfitters.com/installing-a-propane-tank-underneath-a-promaster-van-with-remote-fill-kit/",
	"id": 752,
	"parentId": "749",
	"dateAddedLocal": "6/21/2021, 2:12:25 PM",
	"dateAddedUTC": "2021-06-21T18:12:25.000Z"
},{
	"index": 3,
	"title": "Mount Propane Tank Under Van | Ram Promaster - YouTube",
	"url": "https://www.youtube.com/watch?v=2zdwrn4fAkI&ab_channel=LindseyandDannyVanlife",
	"id": 753,
	"parentId": "749",
	"dateAddedLocal": "6/21/2021, 2:12:25 PM",
	"dateAddedUTC": "2021-06-21T18:12:25.000Z"
},{
	"index": 4,
	"title": "propane tank - Google Search",
	"url": "https://www.google.com/search?q=propane+tank&rlz=1C5CHFA_enUS839US839&sxsrf=ACYBGNSywQM6PEd6HUhJfcxEUzo8i5A9oA:1570922630116&source=lnms&tbm=isch&sa=X&ved=0ahUKEwj2rtnq7pflAhVjmuAKHbrkD_gQ_AUIEygC&biw=1309&bih=662#imgrc=JbOSdDkISvTFOM:",
	"id": 754,
	"parentId": "749",
	"dateAddedLocal": "6/21/2021, 2:12:25 PM",
	"dateAddedUTC": "2021-06-21T18:12:25.000Z"
},{
	"index": 5,
	"title": "Remote Fill Kit with Mounting Bracket: Industrial Hardware: Amazon.com: Home Improvement",
	"url": "https://www.amazon.com/Nashfuel-Propane-Remote-Mounting-Bracket/dp/B00EP1T4J8/ref=as_li_ss_tl?keywords=remote+fill+kit+propane&qid=1549997095&s=hi&sr=1-1-catcorr&linkCode=sl1&tag=vanlifeoutf0f-20&linkId=d3f915068dc99f22486adf26cf7f9593&language=en_US",
	"id": 755,
	"parentId": "749",
	"dateAddedLocal": "6/21/2021, 2:12:25 PM",
	"dateAddedUTC": "2021-06-21T18:12:25.000Z"
},{
	"index": 6,
	"title": "RV Propane Tank - 6.7 Gallon, Manchester Model 6811 â€“ Campervan HQ",
	"url": "https://www.campervan-hq.com/products/rv-propane-tank-6-7-gallon-manchester-model-6811?variant=41138329363&network=g&device=c&keyword=&campaign=10753893734&adgroup=pla-934951516783&gclid=EAIaIQobChMI-Lffm_S87wIVBq-GCh3HhQNoEAQYBiABEgIZqPD_BwE",
	"id": 756,
	"parentId": "749",
	"dateAddedLocal": "6/21/2021, 2:12:25 PM",
	"dateAddedUTC": "2021-06-21T18:12:25.000Z"
},{
	"index": 13,
	"title": "sites",
	"id": 757,
	"parentId": "704",
	"dateAddedLocal": "6/21/2021, 2:28:37 PM",
	"dateAddedUTC": "2021-06-21T18:28:37.024Z"
},{
	"index": 0,
	"title": "Category: Water Tank & Water Systems | Titan DIY Kits",
	"url": "https://titandiykits.com/product-category/water-tank-water-systems/",
	"id": 758,
	"parentId": "757",
	"dateAddedLocal": "6/21/2021, 2:12:25 PM",
	"dateAddedUTC": "2021-06-21T18:12:25.000Z"
},{
	"index": 14,
	"title": "solar",
	"id": 759,
	"parentId": "704",
	"dateAddedLocal": "6/21/2021, 2:28:37 PM",
	"dateAddedUTC": "2021-06-21T18:28:37.025Z"
},{
	"index": 0,
	"title": "Roof Mount Adapter - Ram Promaster: Automotive",
	"url": "https://www.amazon.com/DEMOUNTABLE-CONCEPTS-Roof-Mount-Adapter/dp/B08QZVFYPS/ref=asc_df_B08QZVFYPS/?tag=hyprod-20&linkCode=df0&hvadid=475771883881&hvpos=&hvnetw=g&hvrand=2930661030782758122&hvpone=&hvptwo=&hvqmt=&hvdev=c&hvdvcmdl=&hvlocint=&hvlocphy=9002297&hvtargid=pla-1144984587820&psc=1",
	"id": 760,
	"parentId": "759",
	"dateAddedLocal": "6/21/2021, 2:12:25 PM",
	"dateAddedUTC": "2021-06-21T18:12:25.000Z"
},{
	"index": 1,
	"title": "4 Set Solar Panel Mounting Z Brackets Kit with Nuts and Bolts for Roof Panels,Roof Rack Mounting Brackets, Rv Camper,Boat,Wall and Other Off Gird Roof Installation, A Set of 4 Units: Garden & Outdoor",
	"url": "https://www.amazon.com/dp/B08L7HZTMM/ref=sspa_dk_detail_0?psc=1&pd_rd_i=B08L7HZTMM&pd_rd_w=zL9qw&pf_rd_p=4269e1a0-a218-4fbd-9748-1cd337d2f2a5&pd_rd_wg=yuWRO&pf_rd_r=Y4TSB7Y0TRR5DV3NE31H&pd_rd_r=74a67242-db54-488a-8194-b0ba48c52e69&spLa=ZW5jcnlwdGVkUXVhbGlmaWVyPUFKQVcxTEoxN1lLMDEmZW5jcnlwdGVkSWQ9QTAyNTUyMDcyWjlLQ1Y5SjRUVE4zJmVuY3J5cHRlZEFkSWQ9QTA5MTE4NjRHRkMxNkpQMTBCMkMmd2lkZ2V0TmFtZT1zcF9kZXRhaWwmYWN0aW9uPWNsaWNrUmVkaXJlY3QmZG9Ob3RMb2dDbGljaz10cnVl",
	"id": 761,
	"parentId": "759",
	"dateAddedLocal": "6/21/2021, 2:12:25 PM",
	"dateAddedUTC": "2021-06-21T18:12:25.000Z"
},{
	"index": 2,
	"title": "clear cover acrylic sheet",
	"url": "https://www.tapplastics.com/index.php?route=checkout/cart",
	"id": 762,
	"parentId": "759",
	"dateAddedLocal": "6/21/2021, 2:12:25 PM",
	"dateAddedUTC": "2021-06-21T18:12:25.000Z"
},{
	"index": 3,
	"title": "Promaster Roof Rail Attachment and L Bracket â€“ DIYvan",
	"url": "https://diyvan.com/collections/promaster/products/promaster-roof-rail-attachment-and-l-bracket?variant=37511116161181",
	"id": 763,
	"parentId": "759",
	"dateAddedLocal": "6/21/2021, 2:12:25 PM",
	"dateAddedUTC": "2021-06-21T18:12:25.000Z"
},{
	"index": 4,
	"title": "Royal Building Products 0.312-in x 5.812-in x 8-ft PVC Trim Board in the PVC Trim Boards department at Lowes.com",
	"url": "https://www.lowes.com/pd/Royal-Building-Products-Actual-0-312-in-x-5-812-in-x-8-ft-Common-Board-PVC-Board/1000445479",
	"id": 764,
	"parentId": "759",
	"dateAddedLocal": "6/21/2021, 2:12:25 PM",
	"dateAddedUTC": "2021-06-21T18:12:25.000Z"
},{
	"index": 5,
	"title": "Amazon.com: BougeRV 30 Feet 10AWG Solar Extension Cable with Female and Male Connector with Extra Free Pair of Connectors Solar Panel Adaptor Kit Tool (30FT Red + 30FT Black): Garden & Outdoor",
	"url": "https://www.amazon.com/dp/B07BRFPD6R?psc=1&linkCode=sl1&tag=wanderlibrevlog-20&linkId=5055e80534b87f3a7d385edd5841b215&language=en_US&ref_=as_li_ss_tl",
	"id": 765,
	"parentId": "759",
	"dateAddedLocal": "6/21/2021, 2:12:25 PM",
	"dateAddedUTC": "2021-06-21T18:12:25.000Z"
},{
	"index": 6,
	"title": "Amazon.com: Alex Tech 25ft â€“ 1/2 inch Split Wire Loom Tubing Wire Conduit â€“ Black: Home Improvement",
	"url": "https://www.amazon.com/gp/product/B07TCDTFL2?ie=UTF8&psc=1&linkCode=sl1&tag=wanderlibrevlog-20&linkId=293042abba2717f1ad5691161921d6c8&language=en_US&ref_=as_li_ss_tl",
	"id": 766,
	"parentId": "759",
	"dateAddedLocal": "6/21/2021, 2:12:25 PM",
	"dateAddedUTC": "2021-06-21T18:12:25.000Z"
},{
	"index": 7,
	"title": "Blue Sea Systems CableClam - 0.83: Electronics",
	"url": "https://www.amazon.com/gp/product/B000MMC7HK?ie=UTF8&psc=1&linkCode=sl1&tag=wanderlibrevlog-20&linkId=6b70446c41b3c61ff8d65652b6af4370&language=en_US&ref_=as_li_ss_tl",
	"id": 767,
	"parentId": "759",
	"dateAddedLocal": "6/21/2021, 2:12:25 PM",
	"dateAddedUTC": "2021-06-21T18:12:25.000Z"
},{
	"index": 8,
	"title": "Renogy 175 Watt 12 Volt Monocrystalline Grid Large System Residential Commercial House Cabin Sheds Rooftop, 175W, Marine Boat, Caravan, RV, Multi-Panel Solar Arrays : Garden & Outdoor",
	"url": "https://www.amazon.com/Renogy-175-Watt-Volt-Monocrystalline/dp/B08CMCZV9J?crid=26E0XKDIZN8MQ&dchild=1&keywords=renogy+175+watt+solar+panel&qid=1613085160&sprefix=renogy+175+,aps,544&sr=8-3&linkCode=sl1&tag=wanderlibrevlog-20&linkId=bc13d90fbb74a1d175b265c6830087b9&language=en_US&ref_=as_li_ss_tl",
	"id": 768,
	"parentId": "759",
	"dateAddedLocal": "6/21/2021, 2:12:25 PM",
	"dateAddedUTC": "2021-06-21T18:12:25.000Z"
},{
	"index": 9,
	"title": "Wire 12v",
	"url": "https://www.explorist.life/how-to-wire-12v-plugs-fans-and-accessories-in-a-diy-camper/",
	"id": 769,
	"parentId": "759",
	"dateAddedLocal": "6/21/2021, 2:12:25 PM",
	"dateAddedUTC": "2021-06-21T18:12:25.000Z"
},{
	"index": 10,
	"title": "(2) Bluetti AC200P Solar Panel Set Up Guide | How To: Setup Solar Panels For AC200P Solar Generator - YouTube",
	"url": "https://www.youtube.com/watch?v=pTXZ-TOLH0Q&ab_channel=ShopSolarKits",
	"id": 770,
	"parentId": "759",
	"dateAddedLocal": "6/21/2021, 2:12:25 PM",
	"dateAddedUTC": "2021-06-21T18:12:25.000Z"
},{
	"index": 11,
	"title": "Modified Sine Wave Power Inverter | Inverters R Us",
	"url": "https://invertersrus.com/product-category/power-inverters/modified-sine-wave/",
	"id": 771,
	"parentId": "759",
	"dateAddedLocal": "6/21/2021, 2:12:25 PM",
	"dateAddedUTC": "2021-06-21T18:12:25.000Z"
},{
	"index": 15,
	"title": "storage",
	"id": 772,
	"parentId": "704",
	"dateAddedLocal": "6/21/2021, 2:28:37 PM",
	"dateAddedUTC": "2021-06-21T18:28:37.026Z"
},{
	"index": 0,
	"title": "Storex Plastic Drawer, Letter/Legal Size, Gray (61101U01C) | Staples",
	"url": "https://www.staples.com/Storex-Stackable-Plastic-Storage-File-Drawer-Granite/product_487021?cid=PS:GooglePLAs:487021&ci_src=17588969&ci_sku=487021&KPID=487021&gclid=Cj0KCQiAr8bwBRD4ARIsAHa4YyLRDjlizvhLwv4xi9w77f3oRYSdYgdGAeZFLK-nuDUq5dkElBF1X-gaAg9OEALw_wcB",
	"id": 773,
	"parentId": "772",
	"dateAddedLocal": "12/20/2021, 9:57:25 AM",
	"dateAddedUTC": "2021-12-20T14:57:25.262Z"
},{
	"index": 16,
	"title": "swivel-seats",
	"id": 774,
	"parentId": "704",
	"dateAddedLocal": "6/21/2021, 2:28:37 PM",
	"dateAddedUTC": "2021-06-21T18:28:37.026Z"
},{
	"index": 0,
	"title": "Dodge Promaster Scopema Seat Swivels",
	"url": "https://theswivelshop.com/products/promaster-scopema-seat-swivels-1",
	"id": 775,
	"parentId": "774",
	"dateAddedLocal": "6/21/2021, 2:12:25 PM",
	"dateAddedUTC": "2021-06-21T18:12:25.000Z"
},{
	"index": 17,
	"title": "table",
	"id": 776,
	"parentId": "704",
	"dateAddedLocal": "6/21/2021, 2:28:37 PM",
	"dateAddedUTC": "2021-06-21T18:28:37.026Z"
},{
	"index": 0,
	"title": "Standard Lagun Table System &#40;With Hardware&#41; | Lagun USA",
	"url": "https://www.lagunusa.com/product/lagun-table-system#",
	"id": 777,
	"parentId": "776",
	"dateAddedLocal": "6/21/2021, 2:12:25 PM",
	"dateAddedUTC": "2021-06-21T18:12:25.000Z"
},{
	"index": 1,
	"title": "Amazon.com: Wall Foldable Dining Table Legs, Telescopic Feet, RV Lift Legs, Bar Support Foot, 40-130cm: Home & Kitchen",
	"url": "https://www.amazon.com/Foldable-Dining-Telescopic-Support-40-130cm/dp/B07Y22P5CN/ref=asc_df_B07Y22P5CN/?tag=hyprod-20&linkCode=df0&hvadid=459460440603&hvpos=&hvnetw=g&hvrand=17056774671646311760&hvpone=&hvptwo=&hvqmt=&hvdev=c&hvdvcmdl=&hvlocint=&hvlocphy=9002297&hvtargid=pla-943431500362&psc=1",
	"id": 778,
	"parentId": "776",
	"dateAddedLocal": "6/21/2021, 2:12:25 PM",
	"dateAddedUTC": "2021-06-21T18:12:25.000Z"
},{
	"index": 18,
	"title": "tent-deck",
	"id": 779,
	"parentId": "704",
	"dateAddedLocal": "6/21/2021, 2:28:37 PM",
	"dateAddedUTC": "2021-06-21T18:28:37.026Z"
},{
	"index": 0,
	"title": "CLAM Quick-Set Screen Hub Brown Fabric Wind & Sun Panels Accessory Only (3 Pack) : Garden & Outdoor",
	"url": "https://www.amazon.com/Quick-Set-9898-Tear-Resistant-Fire-Retardant-Screened/dp/B00YSPL12E/ref=as_li_ss_tl?_encoding=UTF8&pd_rd_i=B00YSPL12E&pd_rd_r=48e27758-ab4e-11e8-bcdb-932140fb8169&pd_rd_w=9gSeh&pd_rd_wg=LtRRR&pf_rd_i=desktop-dp-sims&pf_rd_m=ATVPDKIKX0DER&pf_rd_p=7ca3846a-7fcf-4568-9727-1bc2d7b4d5e0&pf_rd_r=Q6EZCPJRKTEENZXGAGH0&pf_rd_s=desktop-dp-sims&pf_rd_t=40701&psc=1&refRID=Q6EZCPJRKTEENZXGAGH0&linkCode=sl1&tag=cheaprvliving-20&linkId=26df60644993a77eb9e68815cdb3bc9a&language=en_US",
	"id": 780,
	"parentId": "779",
	"dateAddedLocal": "6/21/2021, 2:12:25 PM",
	"dateAddedUTC": "2021-06-21T18:12:25.000Z"
},{
	"index": 1,
	"title": "Amazon.com : CLAM Quick-Set Traveler 6 x 6 Foot Portable Pop Up Outdoor Camping Gazebo Screen Tent 4 Sided Canopy Shelter with Ground Stakes and Carry Bag, Green : Garden & Outdoor",
	"url": "https://www.amazon.com/Quick-Set-9870-Traveler-Portable-Protection/dp/B00TMBENB0/ref=as_li_ss_tl?ie=UTF8&qid=1535520891&sr=8-4&keywords=clam+pop+up+screen+room&dpID=4150yMz518L&preST=_SY300_QL70_&dpSrc=srch&linkCode=sl1&tag=cheaprvliving-20&linkId=29145d94ed0b0ad5fad27aa616405b47&language=en_US",
	"id": 781,
	"parentId": "779",
	"dateAddedLocal": "6/21/2021, 2:12:25 PM",
	"dateAddedUTC": "2021-06-21T18:12:25.000Z"
},{
	"index": 2,
	"title": "Amazon.com : Clam Quick-Set Traveler 6' x 6' Portable Pop-Up Outdoor Camping Gazebo Screen Tent Canopy Shelter and Carry Bag with 3 Wind and Sun Panels Accessory : Sports & Outdoors",
	"url": "https://www.amazon.com/QUICK-SET-Traveler-Portable-Outdoor-Gazebo/dp/B07DDTRPRF/ref=sr_1_1?dchild=1&keywords=clam+traveler&qid=1596976280&s=sporting-goods&sr=1-1",
	"id": 782,
	"parentId": "779",
	"dateAddedLocal": "12/20/2021, 9:46:40 AM",
	"dateAddedUTC": "2021-12-20T14:46:40.871Z"
},{
	"index": 19,
	"title": "tutorials",
	"id": 783,
	"parentId": "704",
	"dateAddedLocal": "6/21/2021, 2:28:37 PM",
	"dateAddedUTC": "2021-06-21T18:28:37.026Z"
},{
	"index": 0,
	"title": "BugOutMoto - YouTube",
	"url": "https://www.youtube.com/channel/UCKrdCz7sPkHv9huZzHoxx4w",
	"id": 784,
	"parentId": "783",
	"dateAddedLocal": "6/21/2021, 2:12:25 PM",
	"dateAddedUTC": "2021-06-21T18:12:25.000Z"
},{
	"index": 20,
	"title": "vehicle",
	"id": 785,
	"parentId": "704",
	"dateAddedLocal": "6/21/2021, 2:28:37 PM",
	"dateAddedUTC": "2021-06-21T18:28:37.027Z"
},{
	"index": 0,
	"title": "PrestigeÂ® APS787E - 1-Way Remote Start/Keyless Entry and Security System with Up to 2,500' Operating Range",
	"url": "https://www.carid.com/prestige/1-way-remote-start-keyless-entry-and-security-system-mpn-aps787e.html?singleid=1400514344",
	"id": 786,
	"parentId": "785",
	"dateAddedLocal": "6/21/2021, 2:12:25 PM",
	"dateAddedUTC": "2021-06-21T18:12:25.000Z"
},{
	"index": 1,
	"title": "Remote Start Systems | Automatic Starters & Kits - 50+ products at CARiD.com",
	"url": "https://www.carid.com/universal-remote-start/?vehicle=123510",
	"id": 787,
	"parentId": "785",
	"dateAddedLocal": "6/21/2021, 2:12:25 PM",
	"dateAddedUTC": "2021-06-21T18:12:25.000Z"
},{
	"index": 2,
	"title": "Window Visor Vent Sun Shade Rain Guard 2pcs Fits RAM Promaster 2014-20 â€“ Omac Shop Usa - Auto Accessories",
	"url": "https://omacshop.com/products/dodge-ram-promaster-2014-front-doors-window-air-rain-wind-deflector-guard-2-pcs?variant=24541726048356&currency=USD&utm_medium=product_sync&utm_source=google&utm_content=sag_organic&utm_campaign=sag_organic&utm_campaign=gs-2019-08-06&utm_source=google&utm_medium=smart_campaign&gclid=EAIaIQobChMIiumN99z97gIVFjeGCh0j6A25EAYYAyABEgL3-vD_BwE",
	"id": 788,
	"parentId": "785",
	"dateAddedLocal": "6/21/2021, 2:12:25 PM",
	"dateAddedUTC": "2021-06-21T18:12:25.000Z"
},{
	"index": 3,
	"title": "Windshield Sunshade",
	"url": "https://www.amazon.com/YelloPro-Reflective-Windshield-Accessories-ProMaster/dp/B086RT5TXV/ref=sr_1_5?dchild=1&gclid=EAIaIQobChMIiumN99z97gIVFjeGCh0j6A25EAAYBCAAEgKLfPD_BwE&hvadid=177594203470&hvdev=c&hvlocphy=9002291&hvnetw=g&hvqmt=b&hvrand=10461247815992035242&hvtargid=kwd-56027526131&hydadcr=7059_9585698&keywords=ram+promaster+accessories&qid=1614007881&sr=8-5&tag=googhydr-20",
	"id": 789,
	"parentId": "785",
	"dateAddedLocal": "6/21/2021, 2:12:25 PM",
	"dateAddedUTC": "2021-06-21T18:12:25.000Z"
},{
	"index": 4,
	"title": "Window Tint Kit",
	"url": "https://www.rvinyl.com/Ram-Promaster-2014-2021-Window-Tint-Kits.html",
	"id": 790,
	"parentId": "785",
	"dateAddedLocal": "6/21/2021, 2:12:25 PM",
	"dateAddedUTC": "2021-06-21T18:12:25.000Z"
},{
	"index": 21,
	"title": "ventilation",
	"id": 791,
	"parentId": "704",
	"dateAddedLocal": "6/21/2021, 2:28:37 PM",
	"dateAddedUTC": "2021-06-21T18:28:37.027Z"
},{
	"index": 0,
	"title": "Amazon.com: AC Infinity CLOUDLINE S4, Quiet 4â€ Inline Duct Fan with Speed Controller - Ventilation Exhaust Fan for Heating Cooling Booster, Grow Tents, Hydroponics: Kitchen & Dining",
	"url": "https://www.amazon.com/gp/product/B07JB292JC/ref=as_li_ss_tl?ie=UTF8&psc=1&linkCode=sl1&tag=mosermakes-20&linkId=10b866a48215e59a30cae685a9b48df0&language=en_US",
	"id": 792,
	"parentId": "791",
	"dateAddedLocal": "6/21/2021, 2:12:25 PM",
	"dateAddedUTC": "2021-06-21T18:12:25.000Z"
},{
	"index": 22,
	"title": "vlogs",
	"id": 793,
	"parentId": "704",
	"dateAddedLocal": "6/21/2021, 2:28:37 PM",
	"dateAddedUTC": "2021-06-21T18:28:37.027Z"
},{
	"index": 0,
	"title": "Urban Van Life: Time for Some Changes - YouTube",
	"url": "https://www.youtube.com/watch?v=CJOmyIFxMOc",
	"id": 794,
	"parentId": "793",
	"dateAddedLocal": "6/21/2021, 2:12:25 PM",
	"dateAddedUTC": "2021-06-21T18:12:25.000Z"
},{
	"index": 1,
	"title": "vent review",
	"url": "https://www.youtube.com/watch?v=AJ26sN53Js0",
	"id": 795,
	"parentId": "793",
	"dateAddedLocal": "6/21/2021, 2:12:25 PM",
	"dateAddedUTC": "2021-06-21T18:12:25.000Z"
},{
	"index": 23,
	"title": "water",
	"id": 796,
	"parentId": "704",
	"dateAddedLocal": "6/21/2021, 2:28:37 PM",
	"dateAddedUTC": "2021-06-21T18:28:37.027Z"
},{
	"index": 0,
	"title": "20 Gallon Water System in a conversion van using a Wheel Well Water Tank - YouTube",
	"url": "https://www.youtube.com/watch?v=oNVzyzYHDHw&ab_channel=TitanVans",
	"id": 797,
	"parentId": "796",
	"dateAddedLocal": "6/21/2021, 2:12:25 PM",
	"dateAddedUTC": "2021-06-21T18:12:25.000Z"
},{
	"index": 1,
	"title": "(1) Dodge Promaster Campervan Grey Water Tanks - YouTube",
	"url": "https://www.youtube.com/watch?v=L9MewrgxDQA&ab_channel=OffOurRockers",
	"id": 798,
	"parentId": "796",
	"dateAddedLocal": "6/21/2021, 2:12:25 PM",
	"dateAddedUTC": "2021-06-21T18:12:25.000Z"
},{
	"index": 2,
	"title": "(1) Grey tanks are hung with care under this Promaster van - YouTube",
	"url": "https://www.youtube.com/watch?v=YEdZLbHnmUA&ab_channel=HumbleRoad",
	"id": 799,
	"parentId": "796",
	"dateAddedLocal": "6/21/2021, 2:12:25 PM",
	"dateAddedUTC": "2021-06-21T18:12:25.000Z"
},{
	"index": 3,
	"title": "20 Gallon White Vertical Storage Tank | Norwesco 44846",
	"url": "https://www.ntotank.com/20gallon-norwesco-white-vertical-storage-tank-x6168415",
	"id": 800,
	"parentId": "796",
	"dateAddedLocal": "6/21/2021, 2:12:25 PM",
	"dateAddedUTC": "2021-06-21T18:12:25.000Z"
},{
	"index": 4,
	"title": "AMAZING DIY WATER SYSTEM For Van Life In A Sprinter Conversion Camper Van - YouTube",
	"url": "https://www.youtube.com/watch?v=HjkVxWWxa7Y",
	"id": 801,
	"parentId": "796",
	"dateAddedLocal": "6/21/2021, 2:12:25 PM",
	"dateAddedUTC": "2021-06-21T18:12:25.000Z"
},{
	"index": 5,
	"title": "DIY ~ GREY WATER TANK ~ Empty Your Grey Water Tank Without Removing Your Tank - YouTube",
	"url": "https://www.youtube.com/watch?v=wwmC8zJ8ns0&ab_channel=oneadVANtureatatime",
	"id": 802,
	"parentId": "796",
	"dateAddedLocal": "6/21/2021, 2:12:25 PM",
	"dateAddedUTC": "2021-06-21T18:12:25.000Z"
},{
	"index": 6,
	"title": "Hot Box | Aphcarios Hot water within minutes, using the heat from your car",
	"url": "http://aphcarios.com/products/hot-box/",
	"id": 803,
	"parentId": "796",
	"dateAddedLocal": "6/21/2021, 2:12:25 PM",
	"dateAddedUTC": "2021-06-21T18:12:25.000Z"
},{
	"index": 7,
	"title": "How to find water for free - A vanlife guide | FarOutRide",
	"url": "https://faroutride.com/vanlife/find-water-vanlife/",
	"id": 804,
	"parentId": "796",
	"dateAddedLocal": "6/21/2021, 2:12:25 PM",
	"dateAddedUTC": "2021-06-21T18:12:25.000Z"
},{
	"index": 8,
	"title": "How To Get Rid Of All Gray Water Tank Smells in a Camper van or RV | Hepvo valve - YouTube",
	"url": "https://www.youtube.com/watch?v=wd2TsFhACes&ab_channel=NomadicMillennials",
	"id": 805,
	"parentId": "796",
	"dateAddedLocal": "6/21/2021, 2:12:25 PM",
	"dateAddedUTC": "2021-06-21T18:12:25.000Z"
},{
	"index": 9,
	"title": "INSTALL SHOWER DRAIN AND TANK | 4 SEASON VAN LIFE | EP.38 - YouTube",
	"url": "https://www.youtube.com/watch?v=Foowx20YqHA&ab_channel=DaresDrives",
	"id": 806,
	"parentId": "796",
	"dateAddedLocal": "6/21/2021, 2:12:25 PM",
	"dateAddedUTC": "2021-06-21T18:12:25.000Z"
},{
	"index": 10,
	"title": "Installing A Portable 12v Water Heater In A Camper Van",
	"url": "https://www.parkedinparadise.com/electric-propane-water-heater/",
	"id": 807,
	"parentId": "796",
	"dateAddedLocal": "6/21/2021, 2:12:25 PM",
	"dateAddedUTC": "2021-06-21T18:12:25.000Z"
},{
	"index": 11,
	"title": "Need Hot water in your sprinter van? â€“ Van Living 101",
	"url": "https://vanliving101.com/2019/10/03/hot-water-in-your-sprinter-conversion-van/",
	"id": 808,
	"parentId": "796",
	"dateAddedLocal": "6/21/2021, 2:12:25 PM",
	"dateAddedUTC": "2021-06-21T18:12:25.000Z"
},{
	"index": 12,
	"title": "Prevent Water System Freezing â€“ Build A Green RV",
	"url": "https://www.buildagreenrv.com/prevent-water-system-freezing/",
	"id": 809,
	"parentId": "796",
	"dateAddedLocal": "6/21/2021, 2:12:25 PM",
	"dateAddedUTC": "2021-06-21T18:12:25.000Z"
},{
	"index": 13,
	"title": "Scepter Water Cans | Scepter Military Water Cans for sale | Scepter Watre Cans for sale | Scepter Military Fuel Cans | Military Water Cans | MWC | (MWC) | Scepter 2.5 gallon water cans | Scepter 5 gallon water cans | Scepter 10 liter water cans | Scepter",
	"url": "https://www.lexingtoncontainercompany.com/Military-Water-Cans.html",
	"id": 810,
	"parentId": "796",
	"dateAddedLocal": "6/21/2021, 2:12:25 PM",
	"dateAddedUTC": "2021-06-21T18:12:25.000Z"
},{
	"index": 14,
	"title": "Amazon.com: SHURflo 182-200 Pre-Pressurized Accumulator Tank,Black: Automotive",
	"url": "https://www.amazon.com/gp/product/B000N9VF6Q/ref=as_li_ss_tl?ie=UTF8&psc=1&linkCode=sl1&tag=mosermakes-20&linkId=0fd308988f217c706d4cd9a1118d4489&language=en_US",
	"id": 811,
	"parentId": "796",
	"dateAddedLocal": "6/21/2021, 2:12:25 PM",
	"dateAddedUTC": "2021-06-21T18:12:25.000Z"
},{
	"index": 24,
	"title": "Links to get my Bug Out Camper Van Stuff! | CycleCruza's WorldCycleCruza's World",
	"url": "https://cyclecruza.com/links-to-get-my-bug-out-camper-van-stuff",
	"id": 812,
	"parentId": "704",
	"dateAddedLocal": "6/21/2021, 2:12:25 PM",
	"dateAddedUTC": "2021-06-21T18:12:25.000Z"
},{
	"index": 25,
	"title": "promaster-city",
	"id": 2275,
	"parentId": "704",
	"dateAddedLocal": "2/1/2023, 9:06:25 PM",
	"dateAddedUTC": "2023-02-02T02:06:25.215Z"
},{
	"index": 0,
	"title": "For Ram Promaster City 2015-2021 Bumper Cover | Rear | Primed | CH1100A13 | eBay",
	"url": "https://www.ebay.com/itm/225373062048?fits=Model%3AProMaster+City%7CMake%3ARam&hash=item34794803a0:g:BekAAOSwBrtjz1rZ:sc:ShippingMethodStandard!95125!US!-1&amdata=enc%3AAQAHAAAA4LNZmHrFhBVtVi6bzQeZRrvZl9SGhN%2FBz%2FqmVi9%2BPooboaqd9qxKqfegb52uowouU5ujm%2Bvu0vkCGBqa3lVjBO2Xa4J01ulolglwNupqkfh%2FdmX6mIbCYRCTh50pQF%2FX4hk47yh52PSxOow7HzkospNqX%2FXiJefkmhwlwZ7swGchj8oozzUFxfXbisdLYE6XDdm%2BBXkeMehsV9AET902FRew6WWk%2BRWG9lXlEB8ORyvRxMHMt69t%2BtsKlYiiicdimx%2FmLTYmKP9be6owzDd2%2BL%2BFWQHpVFbJo%2FULA4z19X20%7Ctkp%3ABFBM4u7X_cFh",
	"id": 2274,
	"parentId": "2275",
	"dateAddedLocal": "2/1/2023, 9:05:54 PM",
	"dateAddedUTC": "2023-02-02T02:05:54.982Z"
},{
	"index": 1,
	"title": "CARiD.com - Your Shopping Cart",
	"url": "https://www.carid.com/cart.php",
	"id": 2276,
	"parentId": "2275",
	"dateAddedLocal": "2/1/2023, 9:08:44 PM",
	"dateAddedUTC": "2023-02-02T02:08:44.945Z"
},{
	"index": 26,
	"title": "lap desk",
	"id": 2288,
	"parentId": "704",
	"dateAddedLocal": "2/8/2023, 1:02:18 PM",
	"dateAddedUTC": "2023-02-08T18:02:18.150Z"
},{
	"index": 0,
	"title": "Large Bed Tray Foldable Portable Multifunction Laptop Desk Lazy Laptop Table - Walmart.com",
	"url": "https://www.walmart.com/ip/Large-Bed-Tray-Foldable-Portable-Multifunction-Laptop-Desk-Lazy-Laptop-Table/933507262?wmlspartner=wlpa&selectedSellerId=101038442",
	"id": 2287,
	"parentId": "2288",
	"dateAddedLocal": "2/8/2023, 1:01:36 PM",
	"dateAddedUTC": "2023-02-08T18:01:36.903Z"
},{
	"index": 1,
	"title": "Large Bed Tray Foldable Portable Multifunction Laptop Desk Lazy Laptop Table - 24\" x 16\" x 11\"(LxWxH) - Overstock - 34553522",
	"url": "https://www.overstock.com/Home-Garden/Large-Bed-Tray-Foldable-Portable-Multifunction-Laptop-Desk-Lazy-Laptop-Table-N-A/34553522/product.html?option=65626405",
	"id": 2289,
	"parentId": "2288",
	"dateAddedLocal": "2/8/2023, 1:02:25 PM",
	"dateAddedUTC": "2023-02-08T18:02:25.854Z"
},{
	"index": 2,
	"title": "Laptop Desk Black : Target",
	"url": "https://www.target.com/p/laptop-desk-black/-/A-52045780?ref=tgt_adv_XS000000&AFID=google_pla_df&fndsrc=tgtao&DFA=71700000012735310&CPNG=PLA_Furniture%2BShopping_Local%7CFurniture_Ecomm_Home&adgroup=SC_Folding+Furniture&LID=700000001170770pgs&LNM=PRODUCT_GROUP&network=g&device=c&location=9002297&targetid=pla-1679050911755&ds_rl=1246978&ds_rl=1247068&gclid=EAIaIQobChMI1s22ybqG_QIVCnyGCh3H5wtyEAwYAiABEgIAovD_BwE&gclsrc=aw.ds",
	"id": 2290,
	"parentId": "2288",
	"dateAddedLocal": "2/8/2023, 1:02:32 PM",
	"dateAddedUTC": "2023-02-08T18:02:32.882Z"
},{
	"index": 3,
	"title": "Mind Reader 23.5\" x 15.75\" Aluminum/Iron/MDF Laptop Tray, Gray (TAFOLAP-GRY) | Quill.com",
	"url": "https://www.quill.com/mind-reader-235-x-1575-aluminum-iron-mdf-laptop-tray-gray-tafolap-gry/cbs/55401444.html?effort_code=550&sfcp=1&gclsrc=aw.ds&&cm_mmc=SEM_PLA_SHOP_N_7p_55401444_N_N_ZOM&mcode=SEM_PLA_ZOM_7p_55401444_N_N&gclid=EAIaIQobChMI1s22ybqG_QIVCnyGCh3H5wtyEAkYCiABEgJ5PPD_BwE",
	"id": 2291,
	"parentId": "2288",
	"dateAddedLocal": "2/8/2023, 1:03:51 PM",
	"dateAddedUTC": "2023-02-08T18:03:51.114Z"
},{
	"index": 27,
	"title": "sienna",
	"id": 2296,
	"parentId": "704",
	"dateAddedLocal": "2/11/2023, 12:43:14 PM",
	"dateAddedUTC": "2023-02-11T17:43:14.589Z"
},{
	"index": 0,
	"title": "Minivan converted in RV (Grand Caravan 2019) - YouTube",
	"url": "https://www.youtube.com/watch?v=4DdvOBBhl5M",
	"id": 2295,
	"parentId": "2296",
	"dateAddedLocal": "2/11/2023, 12:42:57 PM",
	"dateAddedUTC": "2023-02-11T17:42:57.637Z"
},{
	"index": 1,
	"title": "MiniVan Camper Build | Dodge Grand Caravan RT | Van Life - YouTube",
	"url": "https://www.youtube.com/watch?v=nib4fhnbQUg",
	"id": 2297,
	"parentId": "2296",
	"dateAddedLocal": "2/11/2023, 12:50:03 PM",
	"dateAddedUTC": "2023-02-11T17:50:03.308Z"
},{
	"index": 28,
	"title": "sketchup alt",
	"id": 2304,
	"parentId": "704",
	"dateAddedLocal": "2/22/2023, 9:30:52 PM",
	"dateAddedUTC": "2023-02-23T02:30:52.582Z"
},{
	"index": 0,
	"title": "The Best SketchUp Alternatives of 2023 | All3DP",
	"url": "https://all3dp.com/2/best-sketchup-alternative/",
	"id": 2303,
	"parentId": "2304",
	"dateAddedLocal": "2/22/2023, 9:30:29 PM",
	"dateAddedUTC": "2023-02-23T02:30:29.870Z"
},{
	"index": 29,
	"title": "seats",
	"id": 2421,
	"parentId": "704",
	"dateAddedLocal": "5/17/2023, 6:51:47 AM",
	"dateAddedUTC": "2023-05-17T10:51:47.589Z"
},{
	"index": 0,
	"title": "Jump Seat 07 - Shield Step Van Seat in Black Vinyl with Morgan Olson Mounting Pattern | SuburbanSeats.com",
	"url": "https://www.suburbanseats.com/products/jump-seat-7-shield-step-van-seat-with-morgan-olson-mounting-pattern-in-black-vinyl?variant=42083968844007&absrc=Google&abid=&abcampid=18495036220&gclid=EAIaIQobChMIuLCjlZf8_gIVrfHjBx2YwgctEAQYAyABEgLe7vD_BwE&utm_source=Google&utm_medium=CPC",
	"id": 2422,
	"parentId": "2421",
	"dateAddedLocal": "5/17/2023, 6:51:24 AM",
	"dateAddedUTC": "2023-05-17T10:51:24.404Z"
},{
	"index": 7,
	"title": "volunteer",
	"id": 2870,
	"parentId": "333",
	"dateAddedLocal": "7/8/2024, 10:43:32 AM",
	"dateAddedUTC": "2024-07-08T14:43:32.742Z"
},{
	"index": 0,
	"title": "VolunteerMatch.org",
	"url": "https://www.volunteermatch.org/s/auth/personalProfile",
	"id": 2869,
	"parentId": "2870",
	"dateAddedLocal": "7/8/2024, 10:42:59 AM",
	"dateAddedUTC": "2024-07-08T14:42:59.619Z"
},{
	"index": 1,
	"title": "Points of Light Engage",
	"url": "https://engage.pointsoflight.org/",
	"id": 2871,
	"parentId": "2870",
	"dateAddedLocal": "7/8/2024, 10:43:44 AM",
	"dateAddedUTC": "2024-07-08T14:43:44.239Z"
},{
	"index": 2,
	"title": "Develop for Good",
	"url": "https://www.developforgood.org/",
	"id": 2872,
	"parentId": "2870",
	"dateAddedLocal": "7/8/2024, 10:46:11 AM",
	"dateAddedUTC": "2024-07-08T14:46:11.432Z"
},{
	"index": 3,
	"title": "opptys",
	"id": 3019,
	"parentId": "2870",
	"dateAddedLocal": "10/13/2024, 7:32:09 AM",
	"dateAddedUTC": "2024-10-13T11:32:09.427Z"
},{
	"index": 0,
	"title": "Web Developer Volunteer - Points of Light Engage",
	"url": "https://engage.pointsoflight.org/opportunities/68-b21e5012-783c-c729-6f27-48ad8320ce29",
	"id": 3018,
	"parentId": "3019",
	"dateAddedLocal": "10/13/2024, 7:31:35 AM",
	"dateAddedUTC": "2024-10-13T11:31:35.901Z"
},{
	"index": 8,
	"title": "yoga",
	"id": 2624,
	"parentId": "333",
	"dateAddedLocal": "11/30/2023, 10:36:37 AM",
	"dateAddedUTC": "2023-11-30T15:36:37.761Z"
},{
	"index": 0,
	"title": "Basic YOGA ASANAS for GOOD HEALTH - for Beginners and all Age Groups | Beginners Yoga at Home - YouTube",
	"url": "https://www.youtube.com/watch?v=149Iac5fmoE",
	"id": 2623,
	"parentId": "2624",
	"dateAddedLocal": "11/30/2023, 10:36:18 AM",
	"dateAddedUTC": "2023-11-30T15:36:18.151Z"
},{
	"index": 1,
	"title": "Eddie Stern: Courses, Apps, Books at Broome Street Yoga",
	"url": "https://classes.eddiestern.com/pages/courses-apps-books",
	"id": 2961,
	"parentId": "2624",
	"dateAddedLocal": "9/24/2024, 10:09:17 AM",
	"dateAddedUTC": "2024-09-24T14:09:17.733Z"
},{
	"index": 2,
	"title": "Yoga Primary Series: Ashtanga Yoga Practices",
	"url": "https://core.live/shows/yoga-primary-series",
	"id": 2960,
	"parentId": "2624",
	"dateAddedLocal": "9/24/2024, 10:47:13 AM",
	"dateAddedUTC": "2024-09-24T14:47:13.541Z"
},{
	"index": 3,
	"title": "Eddie Sternâ€™s One Simple Thing | Ashtanga Dispatch",
	"url": "https://ashtangadispatch.com/eddie-stern-one-simple-thing/",
	"id": 2959,
	"parentId": "2624",
	"dateAddedLocal": "9/24/2024, 10:57:34 AM",
	"dateAddedUTC": "2024-09-24T14:57:34.572Z"
},{
	"index": 9,
	"title": "cal",
	"url": "https://calendar.google.com/calendar/u/0/r?tab=rc",
	"id": 813,
	"parentId": "333",
	"dateAddedLocal": "6/21/2021, 2:12:25 PM",
	"dateAddedUTC": "2021-06-21T18:12:25.000Z"
},{
	"index": 10,
	"title": "smithWEBtek/blog",
	"url": "https://github.com/smithWEBtek/blog",
	"id": 816,
	"parentId": "333",
	"dateAddedLocal": "6/21/2021, 2:12:25 PM",
	"dateAddedUTC": "2021-06-21T18:12:25.000Z"
},{
	"index": 11,
	"title": "Family Contact Info - Google Sheets",
	"url": "https://docs.google.com/spreadsheets/d/1tE-4Tc07ZAtXP0dN4Rdx9AICPkTeNobz4wCDsxHnKgY/edit?usp=sharing&urp=gmail_link",
	"id": 500,
	"parentId": "333",
	"dateAddedLocal": "6/21/2021, 2:12:25 PM",
	"dateAddedUTC": "2021-06-21T18:12:25.000Z"
},{
	"index": 12,
	"title": "Mama Bear Legal Forms: Young Adult Power of Attorâ€¦",
	"url": "https://www.mamabearlegalforms.com/?gclid=EAIaIQobChMInNf_0vzv-gIVhbLICh3AbgH4EAAYASAAEgJQ8PD_BwE",
	"id": 5,
	"parentId": "333",
	"dateAddedLocal": "10/20/2022, 7:36:36 PM",
	"dateAddedUTC": "2022-10-20T23:36:36.104Z"
},{
	"index": 13,
	"title": "codespace",
	"id": 3031,
	"parentId": "333",
	"dateAddedLocal": "10/16/2024, 10:12:18 AM",
	"dateAddedUTC": "2024-10-16T14:12:18.334Z"
},{
	"index": 0,
	"title": "swt9-codespace",
	"url": "https://urban-space-pancake-g46w9qgjrrw3p79v.github.dev/",
	"id": 3030,
	"parentId": "3031",
	"dateAddedLocal": "10/16/2024, 10:11:45 AM",
	"dateAddedUTC": "2024-10-16T14:11:45.681Z"
},{
	"index": 1,
	"title": "Introduction to dev containers - GitHub Docs",
	"url": "https://docs.github.com/en/codespaces/setting-up-your-project-for-codespaces/adding-a-dev-container-configuration/introduction-to-dev-containers",
	"id": 3032,
	"parentId": "3031",
	"dateAddedLocal": "10/16/2024, 10:13:15 AM",
	"dateAddedUTC": "2024-10-16T14:13:15.297Z"
},{
	"index": 6,
	"title": "tek",
	"id": 871,
	"parentId": "1",
	"dateAddedLocal": "7/19/2021, 8:56:35 AM",
	"dateAddedUTC": "2021-07-19T12:56:35.547Z"
},{
	"index": 0,
	"title": "accessibility",
	"id": 876,
	"parentId": "871",
	"dateAddedLocal": "6/21/2021, 2:28:37 PM",
	"dateAddedUTC": "2021-06-21T18:28:37.057Z"
},{
	"index": 0,
	"title": "The A11Y Project",
	"url": "http://a11yproject.com/",
	"id": 877,
	"parentId": "876",
	"dateAddedLocal": "6/21/2021, 2:12:25 PM",
	"dateAddedUTC": "2021-06-21T18:12:25.000Z"
},{
	"index": 1,
	"title": "Welcome to A11y.me! | Accessibility & Me",
	"url": "http://a11y.me/",
	"id": 878,
	"parentId": "876",
	"dateAddedLocal": "6/21/2021, 2:12:25 PM",
	"dateAddedUTC": "2021-06-21T18:12:25.000Z"
},{
	"index": 1,
	"title": "administration",
	"id": 879,
	"parentId": "871",
	"dateAddedLocal": "6/21/2021, 2:28:37 PM",
	"dateAddedUTC": "2021-06-21T18:28:37.057Z"
},{
	"index": 0,
	"title": "Active Admin",
	"url": "https://github.com/activeadmin/activeadmin",
	"id": 880,
	"parentId": "879",
	"dateAddedLocal": "6/21/2021, 2:12:25 PM",
	"dateAddedUTC": "2021-06-21T18:12:25.000Z"
},{
	"index": 1,
	"title": "justinfrench/formtastic: A Rails form builder plugin with semantically rich and accessible markup.",
	"url": "https://github.com/justinfrench/formtastic",
	"id": 881,
	"parentId": "879",
	"dateAddedLocal": "6/21/2021, 2:12:25 PM",
	"dateAddedUTC": "2021-06-21T18:12:25.000Z"
},{
	"index": 2,
	"title": "adobe xd",
	"id": 2136,
	"parentId": "871",
	"dateAddedLocal": "6/21/2021, 2:28:37 PM",
	"dateAddedUTC": "2021-06-21T18:28:37.163Z"
},{
	"index": 3,
	"title": "algos",
	"id": 2137,
	"parentId": "871",
	"dateAddedLocal": "6/21/2021, 2:28:37 PM",
	"dateAddedUTC": "2021-06-21T18:28:37.163Z"
},{
	"index": 0,
	"title": "A Gentle Introduction to Algorithms and Data Structures â€• Scotch.io",
	"url": "https://scotch.io/courses/the-ultimate-guide-to-javascript-algorithms/a-gentle-introduction-to-algorithms-and-data-structures",
	"id": 2138,
	"parentId": "2137",
	"dateAddedLocal": "6/21/2021, 2:12:25 PM",
	"dateAddedUTC": "2021-06-21T18:12:25.000Z"
},{
	"index": 1,
	"title": "AlgoExpert | Ace the Coding Interviews",
	"url": "https://www.algoexpert.io/product?r=ads&gclid=EAIaIQobChMIw_eGq8bd7wIV7giICR32mwVpEAAYASAAEgJEEvD_BwE",
	"id": 2139,
	"parentId": "2137",
	"dateAddedLocal": "6/21/2021, 2:12:25 PM",
	"dateAddedUTC": "2021-06-21T18:12:25.000Z"
},{
	"index": 2,
	"title": "Algorithms-Javascript |",
	"url": "https://js-algorithms.tutorialhorizon.com/",
	"id": 2140,
	"parentId": "2137",
	"dateAddedLocal": "6/21/2021, 2:12:25 PM",
	"dateAddedUTC": "2021-06-21T18:12:25.000Z"
},{
	"index": 3,
	"title": "Big O Notation | Interview Cake",
	"url": "https://www.interviewcake.com/article/java/big-o-notation-time-and-space-complexity",
	"id": 2141,
	"parentId": "2137",
	"dateAddedLocal": "6/21/2021, 2:12:25 PM",
	"dateAddedUTC": "2021-06-21T18:12:25.000Z"
},{
	"index": 4,
	"title": "Big O Notation | Interview Cake",
	"url": "https://www.interviewcake.com/article/ruby/big-o-notation-time-and-space-complexity",
	"id": 2142,
	"parentId": "2137",
	"dateAddedLocal": "6/21/2021, 2:12:25 PM",
	"dateAddedUTC": "2021-06-21T18:12:25.000Z"
},{
	"index": 5,
	"title": "Big-O Algorithm Complexity Cheat Sheet (Know Thy Complexities!) @ericdrowell",
	"url": "http://bigocheatsheet.com/",
	"id": 2143,
	"parentId": "2137",
	"dateAddedLocal": "6/21/2021, 2:12:25 PM",
	"dateAddedUTC": "2021-06-21T18:12:25.000Z"
},{
	"index": 6,
	"title": "Code Interview Prep & Programming Questions | Pramp",
	"url": "https://www.pramp.com/#/",
	"id": 2144,
	"parentId": "2137",
	"dateAddedLocal": "6/21/2021, 2:12:25 PM",
	"dateAddedUTC": "2021-06-21T18:12:25.000Z"
},{
	"index": 7,
	"title": "CodingBat Java",
	"url": "http://codingbat.com/java",
	"id": 2145,
	"parentId": "2137",
	"dateAddedLocal": "6/21/2021, 2:12:25 PM",
	"dateAddedUTC": "2021-06-21T18:12:25.000Z"
},{
	"index": 8,
	"title": "computer-science-in-javascript/sorting-algorithms-in-javascript at master Â· benoitvallon/computer-science-in-javascript",
	"url": "https://github.com/benoitvallon/computer-science-in-javascript/tree/master/sorting-algorithms-in-javascript",
	"id": 2146,
	"parentId": "2137",
	"dateAddedLocal": "6/21/2021, 2:12:25 PM",
	"dateAddedUTC": "2021-06-21T18:12:25.000Z"
},{
	"index": 9,
	"title": "Dashboard | HackerRank",
	"url": "https://www.hackerrank.com/dashboard",
	"id": 2147,
	"parentId": "2137",
	"dateAddedLocal": "6/21/2021, 2:12:25 PM",
	"dateAddedUTC": "2021-06-21T18:12:25.000Z"
},{
	"index": 10,
	"title": "Data Structures - GeeksforGeeks",
	"url": "https://www.geeksforgeeks.org/data-structures/",
	"id": 2148,
	"parentId": "2137",
	"dateAddedLocal": "6/21/2021, 2:12:25 PM",
	"dateAddedUTC": "2021-06-21T18:12:25.000Z"
},{
	"index": 11,
	"title": "Data Structures and Algorithm: Data structures and algorithm book",
	"url": "http://www.dsalgo.com/2013/02/index.php.html?m=1",
	"id": 2149,
	"parentId": "2137",
	"dateAddedLocal": "6/21/2021, 2:12:25 PM",
	"dateAddedUTC": "2021-06-21T18:12:25.000Z"
},{
	"index": 12,
	"title": "FitCoding - Interview Questions | Problem Solving | Java | PHP | JavaScript | Software",
	"url": "https://www.fitcoding.com/",
	"id": 2150,
	"parentId": "2137",
	"dateAddedLocal": "6/21/2021, 2:12:25 PM",
	"dateAddedUTC": "2021-06-21T18:12:25.000Z"
},{
	"index": 13,
	"title": "GeeksforGeeks | A computer science portal for geeks",
	"url": "https://www.geeksforgeeks.org/",
	"id": 2151,
	"parentId": "2137",
	"dateAddedLocal": "6/21/2021, 2:12:25 PM",
	"dateAddedUTC": "2021-06-21T18:12:25.000Z"
},{
	"index": 14,
	"title": "h5bp/Front-end-Developer-Interview-Questions: A list of helpful front-end related questions you can use to interview potential candidates, test yourself or completely ignore.",
	"url": "https://github.com/h5bp/Front-end-Developer-Interview-Questions",
	"id": 2152,
	"parentId": "2137",
	"dateAddedLocal": "6/21/2021, 2:12:25 PM",
	"dateAddedUTC": "2021-06-21T18:12:25.000Z"
},{
	"index": 15,
	"title": "HackerRank | Technical Recruiting | Hiring the Best Engineers",
	"url": "https://www.hackerrank.com/",
	"id": 2153,
	"parentId": "2137",
	"dateAddedLocal": "6/21/2021, 2:12:25 PM",
	"dateAddedUTC": "2021-06-21T18:12:25.000Z"
},{
	"index": 16,
	"title": "InterviewBit: Coding Interview Questions",
	"url": "https://www.interviewbit.com/",
	"id": 2154,
	"parentId": "2137",
	"dateAddedLocal": "6/21/2021, 2:12:25 PM",
	"dateAddedUTC": "2021-06-21T18:12:25.000Z"
},{
	"index": 17,
	"title": "JavaScript functions to calculate combinations of elements in Array.",
	"url": "https://gist.github.com/axelpale/3118596",
	"id": 2155,
	"parentId": "2137",
	"dateAddedLocal": "6/21/2021, 2:12:25 PM",
	"dateAddedUTC": "2021-06-21T18:12:25.000Z"
},{
	"index": 18,
	"title": "JavaScript Tutorials - GeeksforGeeks",
	"url": "https://www.geeksforgeeks.org/javascript-tutorial/",
	"id": 2156,
	"parentId": "2137",
	"dateAddedLocal": "6/21/2021, 2:12:25 PM",
	"dateAddedUTC": "2021-06-21T18:12:25.000Z"
},{
	"index": 19,
	"title": "kennyledet/Algorithm-Implementations: Share, discuss and learn about algorithm implementations!",
	"url": "https://github.com/kennyledet/Algorithm-Implementations",
	"id": 2157,
	"parentId": "2137",
	"dateAddedLocal": "6/21/2021, 2:12:25 PM",
	"dateAddedUTC": "2021-06-21T18:12:25.000Z"
},{
	"index": 20,
	"title": "Largest Sum Contiguous Subarray - GeeksforGeeks",
	"url": "http://www.geeksforgeeks.org/largest-sum-contiguous-subarray/",
	"id": 2158,
	"parentId": "2137",
	"dateAddedLocal": "6/21/2021, 2:12:25 PM",
	"dateAddedUTC": "2021-06-21T18:12:25.000Z"
},{
	"index": 21,
	"title": "LeetCode - The World's Leading Online Programming Learning Platform",
	"url": "https://leetcode.com/",
	"id": 2159,
	"parentId": "2137",
	"dateAddedLocal": "6/21/2021, 2:12:25 PM",
	"dateAddedUTC": "2021-06-21T18:12:25.000Z"
},{
	"index": 22,
	"title": "Linked list - Wikipedia",
	"url": "https://en.wikipedia.org/wiki/Linked_list",
	"id": 2160,
	"parentId": "2137",
	"dateAddedLocal": "6/21/2021, 2:12:25 PM",
	"dateAddedUTC": "2021-06-21T18:12:25.000Z"
},{
	"index": 23,
	"title": "mr-mig/every-programmer-should-know: A collection of (mostly) technical things every software developer should know",
	"url": "https://github.com/mr-mig/every-programmer-should-know",
	"id": 2161,
	"parentId": "2137",
	"dateAddedLocal": "6/21/2021, 2:12:25 PM",
	"dateAddedUTC": "2021-06-21T18:12:25.000Z"
},{
	"index": 24,
	"title": "Problems - LeetCode",
	"url": "https://leetcode.com/problemset/algorithms/",
	"id": 2162,
	"parentId": "2137",
	"dateAddedLocal": "6/21/2021, 2:12:25 PM",
	"dateAddedUTC": "2021-06-21T18:12:25.000Z"
},{
	"index": 25,
	"title": "Ruby Technical Interview Questions | Interview Cake",
	"url": "https://www.interviewcake.com/all-questions/ruby",
	"id": 2163,
	"parentId": "2137",
	"dateAddedLocal": "6/21/2021, 2:12:25 PM",
	"dateAddedUTC": "2021-06-21T18:12:25.000Z"
},{
	"index": 26,
	"title": "Sorting Algorithm Animations | Toptal",
	"url": "https://www.toptal.com/developers/sorting-algorithms/",
	"id": 2164,
	"parentId": "2137",
	"dateAddedLocal": "6/21/2021, 2:12:25 PM",
	"dateAddedUTC": "2021-06-21T18:12:25.000Z"
},{
	"index": 27,
	"title": "The Coding Interview Bootcamp: Algorithms + Data Structures | Udemy",
	"url": "https://www.udemy.com/coding-interview-bootcamp-algorithms-and-data-structure/learn/v4/overview",
	"id": 2165,
	"parentId": "2137",
	"dateAddedLocal": "6/21/2021, 2:12:25 PM",
	"dateAddedUTC": "2021-06-21T18:12:25.000Z"
},{
	"index": 28,
	"title": "Top 10 Algorithms for Coding Interview",
	"url": "https://www.programcreek.com/2012/11/top-10-algorithms-for-coding-interview/",
	"id": 2166,
	"parentId": "2137",
	"dateAddedLocal": "6/21/2021, 2:12:25 PM",
	"dateAddedUTC": "2021-06-21T18:12:25.000Z"
},{
	"index": 29,
	"title": "M/Monit",
	"url": "https://mmonit.com/",
	"id": 2167,
	"parentId": "2137",
	"dateAddedLocal": "6/21/2021, 2:12:25 PM",
	"dateAddedUTC": "2021-06-21T18:12:25.000Z"
},{
	"index": 4,
	"title": "analytics",
	"id": 882,
	"parentId": "871",
	"dateAddedLocal": "6/21/2021, 2:28:37 PM",
	"dateAddedUTC": "2021-06-21T18:28:37.057Z"
},{
	"index": 0,
	"title": "Analytics API and Customer Data Platform | Segment",
	"url": "https://segment.com/",
	"id": 883,
	"parentId": "882",
	"dateAddedLocal": "6/21/2021, 2:12:25 PM",
	"dateAddedUTC": "2021-06-21T18:12:25.000Z"
},{
	"index": 1,
	"title": "Audience Overview - Analytics",
	"url": "https://analytics.google.com/analytics/web/#report/defaultid/a38216775w66803952p68711783/",
	"id": 884,
	"parentId": "882",
	"dateAddedLocal": "6/21/2021, 2:12:25 PM",
	"dateAddedUTC": "2021-06-21T18:12:25.000Z"
},{
	"index": 2,
	"title": "Heap | Mobile and Web Analytics",
	"url": "https://heapanalytics.com/?utm_source=adwords&utm_medium=keyword&utm_campaign=cpc_text&utm_term=heap%20analytics",
	"id": 885,
	"parentId": "882",
	"dateAddedLocal": "6/21/2021, 2:12:25 PM",
	"dateAddedUTC": "2021-06-21T18:12:25.000Z"
},{
	"index": 3,
	"title": "Weather Forecast & Reports - Long Range & Local | Wunderground | Weather Underground",
	"url": "https://www.wunderground.com/",
	"id": 886,
	"parentId": "882",
	"dateAddedLocal": "6/21/2021, 2:12:25 PM",
	"dateAddedUTC": "2021-06-21T18:12:25.000Z"
},{
	"index": 4,
	"title": "Exception and Uptime Monitoring for Application Developers",
	"url": "https://www.honeybadger.io/",
	"id": 887,
	"parentId": "882",
	"dateAddedLocal": "6/21/2021, 2:12:25 PM",
	"dateAddedUTC": "2021-06-21T18:12:25.000Z"
},{
	"index": 5,
	"title": "angular",
	"id": 888,
	"parentId": "871",
	"dateAddedLocal": "6/21/2021, 2:28:37 PM",
	"dateAddedUTC": "2021-06-21T18:28:37.057Z"
},{
	"index": 0,
	"title": "Angular - QuickStart",
	"url": "https://angular.io/guide/quickstart",
	"id": 889,
	"parentId": "888",
	"dateAddedLocal": "6/21/2021, 2:12:25 PM",
	"dateAddedUTC": "2021-06-21T18:12:25.000Z"
},{
	"index": 6,
	"title": "animation",
	"id": 890,
	"parentId": "871",
	"dateAddedLocal": "6/21/2021, 2:28:37 PM",
	"dateAddedUTC": "2021-06-21T18:28:37.057Z"
},{
	"index": 0,
	"title": "Animate.less",
	"url": "http://animateforless.com/",
	"id": 891,
	"parentId": "890",
	"dateAddedLocal": "6/21/2021, 2:12:25 PM",
	"dateAddedUTC": "2021-06-21T18:12:25.000Z"
},{
	"index": 7,
	"title": "api",
	"id": 892,
	"parentId": "871",
	"dateAddedLocal": "6/21/2021, 2:28:37 PM",
	"dateAddedUTC": "2021-06-21T18:28:37.058Z"
},{
	"index": 0,
	"title": "33n - Finding Meaning at 33Â°N",
	"url": "https://33n.atlantaregional.com/",
	"id": 893,
	"parentId": "892",
	"dateAddedLocal": "6/21/2021, 2:12:25 PM",
	"dateAddedUTC": "2021-06-21T18:12:25.000Z"
},{
	"index": 1,
	"title": "Boston, MA Forecast | Weather Underground",
	"url": "https://www.wunderground.com/weather/us/ma/boston/42.36%2F-71.07",
	"id": 894,
	"parentId": "892",
	"dateAddedLocal": "6/21/2021, 2:12:25 PM",
	"dateAddedUTC": "2021-06-21T18:12:25.000Z"
},{
	"index": 2,
	"title": "Cloudinary - Management Console Login",
	"url": "https://cloudinary.com/users/login",
	"id": 895,
	"parentId": "892",
	"dateAddedLocal": "6/21/2021, 2:12:25 PM",
	"dateAddedUTC": "2021-06-21T18:12:25.000Z"
},{
	"index": 3,
	"title": "Dark Sky API: Developer Console",
	"url": "https://darksky.net/dev/account",
	"id": 896,
	"parentId": "892",
	"dateAddedLocal": "6/21/2021, 2:12:25 PM",
	"dateAddedUTC": "2021-06-21T18:12:25.000Z"
},{
	"index": 4,
	"title": "Dark Sky API: Documentation Overview",
	"url": "https://darksky.net/dev/docs#time-machine-request",
	"id": 897,
	"parentId": "892",
	"dateAddedLocal": "6/21/2021, 2:12:25 PM",
	"dateAddedUTC": "2021-06-21T18:12:25.000Z"
},{
	"index": 5,
	"title": "Dark Sky for iOS and Android",
	"url": "https://darksky.net/app",
	"id": 898,
	"parentId": "892",
	"dateAddedLocal": "6/21/2021, 2:12:25 PM",
	"dateAddedUTC": "2021-06-21T18:12:25.000Z"
},{
	"index": 6,
	"title": "End of Service for the Weather Underground API | The WeatherAPI Community Customer Community",
	"url": "https://apicommunity.wunderground.com/weatherapi/topics/end-of-service-for-the-weather-underground-api?topic-reply-list%5Bsettings%5D%5Bpage%5D=4#topic-reply-list",
	"id": 899,
	"parentId": "892",
	"dateAddedLocal": "6/21/2021, 2:12:25 PM",
	"dateAddedUTC": "2021-06-21T18:12:25.000Z"
},{
	"index": 7,
	"title": "Explore - Mashape - Free API Management Platform & Marketplace",
	"url": "https://market.mashape.com/explore?page=1",
	"id": 900,
	"parentId": "892",
	"dateAddedLocal": "6/21/2021, 2:12:25 PM",
	"dateAddedUTC": "2021-06-21T18:12:25.000Z"
},{
	"index": 8,
	"title": "Face Detection - Face++ Cognitive Services",
	"url": "https://www.faceplusplus.com/face-detection/",
	"id": 901,
	"parentId": "892",
	"dateAddedLocal": "6/21/2021, 2:12:25 PM",
	"dateAddedUTC": "2021-06-21T18:12:25.000Z"
},{
	"index": 9,
	"title": "Faraday: One HTTP Client to Rule Them All |",
	"url": "https://www.mobomo.com/2012/03/faraday-one-http-client-to-rule-them-all/",
	"id": 902,
	"parentId": "892",
	"dateAddedLocal": "6/21/2021, 2:12:25 PM",
	"dateAddedUTC": "2021-06-21T18:12:25.000Z"
},{
	"index": 10,
	"title": "Firebase Auth REST API Â |Â  Firebase",
	"url": "https://firebase.google.com/docs/reference/rest/auth/",
	"id": 903,
	"parentId": "892",
	"dateAddedLocal": "6/21/2021, 2:12:25 PM",
	"dateAddedUTC": "2021-06-21T18:12:25.000Z"
},{
	"index": 11,
	"title": "imdb-api - npm",
	"url": "https://www.npmjs.com/package/imdb-api",
	"id": 904,
	"parentId": "892",
	"dateAddedLocal": "6/21/2021, 2:12:25 PM",
	"dateAddedUTC": "2021-06-21T18:12:25.000Z"
},{
	"index": 12,
	"title": "Integrate your data, APIs, and cloud services in minutes - Pipedream",
	"url": "https://pipedream.com/",
	"id": 905,
	"parentId": "892",
	"dateAddedLocal": "6/21/2021, 2:12:25 PM",
	"dateAddedUTC": "2021-06-21T18:12:25.000Z"
},{
	"index": 13,
	"title": "Maps API links",
	"url": "http://www.geocodezip.com/",
	"id": 906,
	"parentId": "892",
	"dateAddedLocal": "6/21/2021, 2:12:25 PM",
	"dateAddedUTC": "2021-06-21T18:12:25.000Z"
},{
	"index": 14,
	"title": "Postman | API Development Environment",
	"url": "https://www.getpostman.com/",
	"id": 907,
	"parentId": "892",
	"dateAddedLocal": "6/21/2021, 2:12:25 PM",
	"dateAddedUTC": "2021-06-21T18:12:25.000Z"
},{
	"index": 15,
	"title": "RapidAPI Quick Start Guide",
	"url": "https://docs.rapidapi.com/docs/basics-creating-a-project",
	"id": 908,
	"parentId": "892",
	"dateAddedLocal": "6/21/2021, 2:12:25 PM",
	"dateAddedUTC": "2021-06-21T18:12:25.000Z"
},{
	"index": 16,
	"title": "Spotify",
	"url": "https://developer.spotify.com/web-api/endpoint-reference/",
	"id": 909,
	"parentId": "892",
	"dateAddedLocal": "6/21/2021, 2:12:25 PM",
	"dateAddedUTC": "2021-06-21T18:12:25.000Z"
},{
	"index": 17,
	"title": "TV API | TVmaze - Add TV information to your website or app.",
	"url": "https://www.tvmaze.com/api",
	"id": 910,
	"parentId": "892",
	"dateAddedLocal": "6/21/2021, 2:12:25 PM",
	"dateAddedUTC": "2021-06-21T18:12:25.000Z"
},{
	"index": 18,
	"title": "Yoda Translator API Documentation",
	"url": "https://market.mashape.com/orthosie/yoda-translator",
	"id": 911,
	"parentId": "892",
	"dateAddedLocal": "6/21/2021, 2:12:25 PM",
	"dateAddedUTC": "2021-06-21T18:12:25.000Z"
},{
	"index": 19,
	"title": "Youtube To Mp3 Download API Documentation",
	"url": "https://market.mashape.com/CoolGuruji/youtube-to-mp3-download",
	"id": 912,
	"parentId": "892",
	"dateAddedLocal": "6/21/2021, 2:12:25 PM",
	"dateAddedUTC": "2021-06-21T18:12:25.000Z"
},{
	"index": 20,
	"title": "Free Public APIs",
	"url": "https://www.freepublicapis.com/",
	"id": 2946,
	"parentId": "892",
	"dateAddedLocal": "9/19/2024, 4:16:55 PM",
	"dateAddedUTC": "2024-09-19T20:16:55.206Z"
},{
	"index": 21,
	"title": "FoodData Central",
	"url": "https://fdc.nal.usda.gov/api-guide.html",
	"id": 2963,
	"parentId": "892",
	"dateAddedLocal": "9/25/2024, 8:17:31 AM",
	"dateAddedUTC": "2024-09-25T12:17:31.061Z"
},{
	"index": 22,
	"title": "Nutrition API by Nutritionix",
	"url": "https://www.nutritionix.com/business/api?creative=249135079381&keyword=barcode%20api&matchtype=b&network=g&device=c&utm_source=google&utm_medium=cpc&utm_campaign=NutritionAPI&gad_source=1&gclid=EAIaIQobChMIo_zk-I_eiAMVCzcIBR3WAA-MEAAYAyAAEgKGGvD_BwE",
	"id": 2964,
	"parentId": "892",
	"dateAddedLocal": "9/25/2024, 8:46:49 AM",
	"dateAddedUTC": "2024-09-25T12:46:49.978Z"
},{
	"index": 23,
	"title": "Human API",
	"url": "https://www.humanapi.co/",
	"id": 2972,
	"parentId": "892",
	"dateAddedLocal": "9/29/2024, 8:21:44 PM",
	"dateAddedUTC": "2024-09-30T00:21:44.031Z"
},{
	"index": 24,
	"title": "Pull requests Â· Ed-Learning/lift",
	"url": "https://scm.eng.hmhco.com/Ed-Learning/lift/pulls/smithb1",
	"id": 2973,
	"parentId": "892",
	"dateAddedLocal": "10/1/2024, 9:03:05 PM",
	"dateAddedUTC": "2024-10-02T01:03:05.337Z"
},{
	"index": 8,
	"title": "API google drive",
	"id": 2168,
	"parentId": "871",
	"dateAddedLocal": "6/21/2021, 2:28:37 PM",
	"dateAddedUTC": "2021-06-21T18:28:37.165Z"
},{
	"index": 0,
	"title": "API Reference Â |Â  Google Drive API Â |Â  Google Developers",
	"url": "https://developers.google.com/drive/api/v3/reference",
	"id": 2169,
	"parentId": "2168",
	"dateAddedLocal": "6/21/2021, 2:12:25 PM",
	"dateAddedUTC": "2021-06-21T18:12:25.000Z"
},{
	"index": 1,
	"title": "Console Help",
	"url": "https://support.google.com/cloud#topic=3340599",
	"id": 2170,
	"parentId": "2168",
	"dateAddedLocal": "6/21/2021, 2:12:25 PM",
	"dateAddedUTC": "2021-06-21T18:12:25.000Z"
},{
	"index": 2,
	"title": "First Drive app in Ruby",
	"url": "https://www.youtube.com/watch?v=-1K3lmlyjWA",
	"id": 2171,
	"parentId": "2168",
	"dateAddedLocal": "6/21/2021, 2:12:25 PM",
	"dateAddedUTC": "2021-06-21T18:12:25.000Z"
},{
	"index": 3,
	"title": "googleapis/google-api-ruby-client: REST client for Google APIs",
	"url": "https://github.com/googleapis/google-api-ruby-client",
	"id": 2172,
	"parentId": "2168",
	"dateAddedLocal": "6/21/2021, 2:12:25 PM",
	"dateAddedUTC": "2021-06-21T18:12:25.000Z"
},{
	"index": 4,
	"title": "Ruby Quickstart Â |Â  Google Drive API Â |Â  Google Developers",
	"url": "https://developers.google.com/drive/api/v3/quickstart/ruby",
	"id": 2173,
	"parentId": "2168",
	"dateAddedLocal": "6/21/2021, 2:12:25 PM",
	"dateAddedUTC": "2021-06-21T18:12:25.000Z"
},{
	"index": 5,
	"title": "salsa-cloud-project1 â€“ API Console",
	"url": "https://console.developers.google.com/apis/dashboard?project=salsa-cloud-proj-1605358896836&authuser=0&pli=1",
	"id": 2174,
	"parentId": "2168",
	"dateAddedLocal": "6/21/2021, 2:12:25 PM",
	"dateAddedUTC": "2021-06-21T18:12:25.000Z"
},{
	"index": 9,
	"title": "api-google-drive",
	"id": 923,
	"parentId": "871",
	"dateAddedLocal": "6/21/2021, 2:28:37 PM",
	"dateAddedUTC": "2021-06-21T18:28:37.060Z"
},{
	"index": 0,
	"title": "(1) Introduction to AWS EC2 - How to deploy a Rails App to EC2 for the first time - YouTube",
	"url": "https://www.youtube.com/watch?v=jFBbcleSPoY",
	"id": 924,
	"parentId": "923",
	"dateAddedLocal": "6/21/2021, 2:12:25 PM",
	"dateAddedUTC": "2021-06-21T18:12:25.000Z"
},{
	"index": 1,
	"title": "AWS",
	"url": "https://aws.amazon.com/developer/",
	"id": 925,
	"parentId": "923",
	"dateAddedLocal": "6/21/2021, 2:12:25 PM",
	"dateAddedUTC": "2021-06-21T18:12:25.000Z"
},{
	"index": 2,
	"title": "AWS - swt",
	"url": "https://aws.amazon.com/developer/",
	"id": 926,
	"parentId": "923",
	"dateAddedLocal": "6/21/2021, 2:12:25 PM",
	"dateAddedUTC": "2021-06-21T18:12:25.000Z"
},{
	"index": 3,
	"title": "AWS in Plain English",
	"url": "https://www.expeditedssl.com/aws-in-plain-english",
	"id": 927,
	"parentId": "923",
	"dateAddedLocal": "6/21/2021, 2:12:25 PM",
	"dateAddedUTC": "2021-06-21T18:12:25.000Z"
},{
	"index": 4,
	"title": "AWS Lambda â€“ Resources",
	"url": "https://aws.amazon.com/lambda/resources/?aws-lambda-resources-blog.sort-by=item.additionalFields.createdDate&aws-lambda-resources-blog.sort-order=desc#Getting_Started",
	"id": 928,
	"parentId": "923",
	"dateAddedLocal": "6/21/2021, 2:12:25 PM",
	"dateAddedUTC": "2021-06-21T18:12:25.000Z"
},{
	"index": 5,
	"title": "AWS SDK for Ruby",
	"url": "https://aws.amazon.com/sdk-for-ruby/",
	"id": 929,
	"parentId": "923",
	"dateAddedLocal": "6/21/2021, 2:12:25 PM",
	"dateAddedUTC": "2021-06-21T18:12:25.000Z"
},{
	"index": 6,
	"title": "aws/aws-sdk-rails: Official repository for the aws-sdk-rails gem, which integrates the AWS SDK for Ruby with Ruby on Rails.",
	"url": "https://github.com/aws/aws-sdk-rails",
	"id": 930,
	"parentId": "923",
	"dateAddedLocal": "6/21/2021, 2:12:25 PM",
	"dateAddedUTC": "2021-06-21T18:12:25.000Z"
},{
	"index": 7,
	"title": "bootcamp to AWS",
	"url": "https://medium.com/@KerrySheldon/aws-for-the-bootcamp-grad-79dfd91d0ff8",
	"id": 931,
	"parentId": "923",
	"dateAddedLocal": "6/21/2021, 2:12:25 PM",
	"dateAddedUTC": "2021-06-21T18:12:25.000Z"
},{
	"index": 8,
	"title": "chmod",
	"url": "https://www.linode.com/docs/tools-reference/tools/modify-file-permissions-with-chmod/",
	"id": 932,
	"parentId": "923",
	"dateAddedLocal": "6/21/2021, 2:12:25 PM",
	"dateAddedUTC": "2021-06-21T18:12:25.000Z"
},{
	"index": 9,
	"title": "Deploy your Rails app with Capistrano - Runtime Revolution",
	"url": "https://revs.runtime-revolution.com/deploy-your-rails-app-with-capistrano-5ad5d58e9b07",
	"id": 933,
	"parentId": "923",
	"dateAddedLocal": "6/21/2021, 2:12:25 PM",
	"dateAddedUTC": "2021-06-21T18:12:25.000Z"
},{
	"index": 10,
	"title": "Deploying a Ruby app on Ubuntu 18.04 LTS (with APT) on a Linux/Unix production server with Passenger open source in Nginx mode - Passenger + Ruby deployment tutorial - Passenger Library",
	"url": "https://www.phusionpassenger.com/library/walkthroughs/deploy/ruby/ownserver/nginx/oss/bionic/deploy_app.html",
	"id": 934,
	"parentId": "923",
	"dateAddedLocal": "6/21/2021, 2:12:25 PM",
	"dateAddedUTC": "2021-06-21T18:12:25.000Z"
},{
	"index": 11,
	"title": "EC2 Exercise 1.6: Deploy a Rails App to an EC2 Instance Using Capistrano",
	"url": "https://medium.com/@KerrySheldon/ec2-exercise-1-6-deploy-a-rails-app-to-an-ec2-instance-using-capistrano-3485238e4a4a",
	"id": 935,
	"parentId": "923",
	"dateAddedLocal": "6/21/2021, 2:12:25 PM",
	"dateAddedUTC": "2021-06-21T18:12:25.000Z"
},{
	"index": 12,
	"title": "Getting Started with AWS | Amazon Web Services BASICS - YouTube",
	"url": "https://www.youtube.com/watch?v=ubCNZRNjhyo",
	"id": 936,
	"parentId": "923",
	"dateAddedLocal": "6/21/2021, 2:12:25 PM",
	"dateAddedUTC": "2021-06-21T18:12:25.000Z"
},{
	"index": 13,
	"title": "How to deploy Rails 5.2 on AWS EC2 + Ubuntu + Nginx + Passenger",
	"url": "https://itnext.io/how-to-deploy-rails-5-2-on-aws-ec2-ubuntu-nginx-passenger-cd842c1c35ee",
	"id": 937,
	"parentId": "923",
	"dateAddedLocal": "6/21/2021, 2:12:25 PM",
	"dateAddedUTC": "2021-06-21T18:12:25.000Z"
},{
	"index": 14,
	"title": "How To Install Nginx on Ubuntu 16.04 | DigitalOcean",
	"url": "https://www.digitalocean.com/community/tutorials/how-to-install-nginx-on-ubuntu-16-04",
	"id": 938,
	"parentId": "923",
	"dateAddedLocal": "6/21/2021, 2:12:25 PM",
	"dateAddedUTC": "2021-06-21T18:12:25.000Z"
},{
	"index": 15,
	"title": "Install and Use PostgreSQL on Ubuntu 18.04 | DigitalOcean",
	"url": "https://www.digitalocean.com/community/tutorials/how-to-install-and-use-postgresql-on-ubuntu-18-04",
	"id": 939,
	"parentId": "923",
	"dateAddedLocal": "6/21/2021, 2:12:25 PM",
	"dateAddedUTC": "2021-06-21T18:12:25.000Z"
},{
	"index": 16,
	"title": "Install RVM on Amazon Linux",
	"url": "https://gist.github.com/kainam00/a5593550a3dbd77f1b3b",
	"id": 940,
	"parentId": "923",
	"dateAddedLocal": "6/21/2021, 2:12:25 PM",
	"dateAddedUTC": "2021-06-21T18:12:25.000Z"
},{
	"index": 17,
	"title": "linux - AWS EC2 apache log file location on AMI - Stack Overflow",
	"url": "https://stackoverflow.com/questions/16157197/aws-ec2-apache-log-file-location-on-ami",
	"id": 941,
	"parentId": "923",
	"dateAddedLocal": "6/21/2021, 2:12:25 PM",
	"dateAddedUTC": "2021-06-21T18:12:25.000Z"
},{
	"index": 18,
	"title": "RDS Â· AWS Console",
	"url": "https://console.aws.amazon.com/rds/home?region=us-east-1#databases:",
	"id": 942,
	"parentId": "923",
	"dateAddedLocal": "6/21/2021, 2:12:25 PM",
	"dateAddedUTC": "2021-06-21T18:12:25.000Z"
},{
	"index": 19,
	"title": "ruby on rails - Nginx and Phusion Passenger running but passenger-status showing 0 processes running - Stack Overflow",
	"url": "https://stackoverflow.com/questions/27608262/nginx-and-phusion-passenger-running-but-passenger-status-showing-0-processes-run",
	"id": 943,
	"parentId": "923",
	"dateAddedLocal": "6/21/2021, 2:12:25 PM",
	"dateAddedUTC": "2021-06-21T18:12:25.000Z"
},{
	"index": 20,
	"title": "Setting up an Ubuntu EC2 instance â€“ James Hamann â€“ Medium",
	"url": "https://medium.com/@jameshamann/setting-up-an-ubuntu-ec2-instance-from-scratch-78a166167a22",
	"id": 944,
	"parentId": "923",
	"dateAddedLocal": "6/21/2021, 2:12:25 PM",
	"dateAddedUTC": "2021-06-21T18:12:25.000Z"
},{
	"index": 21,
	"title": "Setting Up File Storage Using AWS S3 for Rails and React",
	"url": "https://medium.com/@spikeburton/setting-up-file-storage-using-aws-s3-for-rails-and-react-c25cceac56d8",
	"id": 945,
	"parentId": "923",
	"dateAddedLocal": "6/21/2021, 2:12:25 PM",
	"dateAddedUTC": "2021-06-21T18:12:25.000Z"
},{
	"index": 22,
	"title": "Steps for Using Active Storage to Upload Files to S3 with Ruby on Rails",
	"url": "https://www.dailysmarty.com/posts/steps-for-using-active-storage-to-upload-files-to-s3-with-ruby-on-rails",
	"id": 946,
	"parentId": "923",
	"dateAddedLocal": "6/21/2021, 2:12:25 PM",
	"dateAddedUTC": "2021-06-21T18:12:25.000Z"
},{
	"index": 10,
	"title": "arel",
	"id": 913,
	"parentId": "871",
	"dateAddedLocal": "6/21/2021, 2:28:37 PM",
	"dateAddedUTC": "2021-06-21T18:28:37.059Z"
},{
	"index": 0,
	"title": "File: README â€” Documentation for rails/arel (master)",
	"url": "http://www.rubydoc.info/github/rails/arel",
	"id": 914,
	"parentId": "913",
	"dateAddedLocal": "6/21/2021, 2:12:25 PM",
	"dateAddedUTC": "2021-06-21T18:12:25.000Z"
},{
	"index": 1,
	"title": "The definitive guide to Arel, the SQL manager for Ruby - JiÅ™Ã­ PospÃ­Å¡il's blog",
	"url": "https://jpospisil.com/2014/06/16/the-definitive-guide-to-arel-the-sql-manager-for-ruby.html",
	"id": 915,
	"parentId": "913",
	"dateAddedLocal": "6/21/2021, 2:12:25 PM",
	"dateAddedUTC": "2021-06-21T18:12:25.000Z"
},{
	"index": 2,
	"title": "Composable SQL Queries in Rails Using Arel | Viget",
	"url": "https://www.viget.com/articles/composable-sql-queries-in-rails-using-arel/",
	"id": 916,
	"parentId": "913",
	"dateAddedLocal": "6/21/2021, 2:12:25 PM",
	"dateAddedUTC": "2021-06-21T18:12:25.000Z"
},{
	"index": 3,
	"title": "Creating Advanced Active Record DB Queries with Arel",
	"url": "https://www.cloudbees.com/blog/creating-advanced-active-record-db-queries-arel/",
	"id": 917,
	"parentId": "913",
	"dateAddedLocal": "6/21/2021, 2:12:25 PM",
	"dateAddedUTC": "2021-06-21T18:12:25.000Z"
},{
	"index": 4,
	"title": "How Arel Converts Ruby Queries Into SQL Statements",
	"url": "https://www.cloudbees.com/blog/how-arel-converts-ruby-queries-into-sql-statements/",
	"id": 918,
	"parentId": "913",
	"dateAddedLocal": "6/21/2021, 2:12:25 PM",
	"dateAddedUTC": "2021-06-21T18:12:25.000Z"
},{
	"index": 5,
	"title": "File: README â€” Documentation for arel (9.0.0)",
	"url": "https://www.rubydoc.info/gems/arel",
	"id": 919,
	"parentId": "913",
	"dateAddedLocal": "6/21/2021, 2:12:25 PM",
	"dateAddedUTC": "2021-06-21T18:12:25.000Z"
},{
	"index": 11,
	"title": "async",
	"id": 920,
	"parentId": "871",
	"dateAddedLocal": "6/21/2021, 2:28:37 PM",
	"dateAddedUTC": "2021-06-21T18:28:37.060Z"
},{
	"index": 0,
	"title": "Fetch API - Web APIs | MDN",
	"url": "https://developer.mozilla.org/en-US/docs/Web/API/Fetch_API",
	"id": 921,
	"parentId": "920",
	"dateAddedLocal": "6/21/2021, 2:12:25 PM",
	"dateAddedUTC": "2021-06-21T18:12:25.000Z"
},{
	"index": 1,
	"title": "Body - Web APIs | MDN",
	"url": "https://developer.mozilla.org/en-US/docs/Web/API/Body",
	"id": 922,
	"parentId": "920",
	"dateAddedLocal": "6/21/2021, 2:12:25 PM",
	"dateAddedUTC": "2021-06-21T18:12:25.000Z"
},{
	"index": 12,
	"title": "babel",
	"id": 947,
	"parentId": "871",
	"dateAddedLocal": "6/21/2021, 2:28:37 PM",
	"dateAddedUTC": "2021-06-21T18:28:37.062Z"
},{
	"index": 0,
	"title": "Babel Â· a JavaScript compiler",
	"url": "http://babeljs.io/",
	"id": 948,
	"parentId": "947",
	"dateAddedLocal": "6/21/2021, 2:12:25 PM",
	"dateAddedUTC": "2021-06-21T18:12:25.000Z"
},{
	"index": 1,
	"title": "babel/babelify: Browserify transform for Babel",
	"url": "https://github.com/babel/babelify",
	"id": 949,
	"parentId": "947",
	"dateAddedLocal": "6/21/2021, 2:12:25 PM",
	"dateAddedUTC": "2021-06-21T18:12:25.000Z"
},{
	"index": 2,
	"title": "Plugins Â· Babel",
	"url": "https://babeljs.io/docs/plugins/",
	"id": 950,
	"parentId": "947",
	"dateAddedLocal": "6/21/2021, 2:12:25 PM",
	"dateAddedUTC": "2021-06-21T18:12:25.000Z"
},{
	"index": 3,
	"title": "substack/node-browserify: browser-side require() the node.js way",
	"url": "https://github.com/substack/node-browserify",
	"id": 951,
	"parentId": "947",
	"dateAddedLocal": "6/21/2021, 2:12:25 PM",
	"dateAddedUTC": "2021-06-21T18:12:25.000Z"
},{
	"index": 13,
	"title": "backbone",
	"id": 1441,
	"parentId": "871",
	"dateAddedLocal": "6/21/2021, 2:28:37 PM",
	"dateAddedUTC": "2021-06-21T18:28:37.102Z"
},{
	"index": 0,
	"title": "Backbone.js",
	"url": "http://backbonejs.org/",
	"id": 1442,
	"parentId": "1441",
	"dateAddedLocal": "6/21/2021, 2:12:25 PM",
	"dateAddedUTC": "2021-06-21T18:12:25.000Z"
},{
	"index": 1,
	"title": "Javascript MV* Frameworks Like Angular.js and Backbone.js | The Odin Project",
	"url": "https://www.theodinproject.com/courses/javascript-and-jquery/lessons/javascript-mv-frameworks-like-angular-js-and-backbone-js",
	"id": 1443,
	"parentId": "1441",
	"dateAddedLocal": "6/21/2021, 2:12:25 PM",
	"dateAddedUTC": "2021-06-21T18:12:25.000Z"
},{
	"index": 14,
	"title": "bem",
	"id": 952,
	"parentId": "871",
	"dateAddedLocal": "6/21/2021, 2:28:37 PM",
	"dateAddedUTC": "2021-06-21T18:28:37.063Z"
},{
	"index": 0,
	"title": "Quick start / Methodology / BEM",
	"url": "https://en.bem.info/methodology/quick-start/",
	"id": 953,
	"parentId": "952",
	"dateAddedLocal": "6/21/2021, 2:12:25 PM",
	"dateAddedUTC": "2021-06-21T18:12:25.000Z"
},{
	"index": 1,
	"title": "BEM by Example: Best Practices for BEM CSS Naming",
	"url": "https://seesparkbox.com/foundry/bem_by_example",
	"id": 954,
	"parentId": "952",
	"dateAddedLocal": "6/21/2021, 2:12:25 PM",
	"dateAddedUTC": "2021-06-21T18:12:25.000Z"
},{
	"index": 2,
	"title": "BEM â€” Block Element Modifier",
	"url": "http://getbem.com/introduction/",
	"id": 955,
	"parentId": "952",
	"dateAddedLocal": "6/21/2021, 2:12:25 PM",
	"dateAddedUTC": "2021-06-21T18:12:25.000Z"
},{
	"index": 3,
	"title": "Methodology / BEM",
	"url": "https://en.bem.info/methodology/",
	"id": 956,
	"parentId": "952",
	"dateAddedLocal": "6/21/2021, 2:12:25 PM",
	"dateAddedUTC": "2021-06-21T18:12:25.000Z"
},{
	"index": 15,
	"title": "benchmarking",
	"id": 957,
	"parentId": "871",
	"dateAddedLocal": "6/21/2021, 2:28:37 PM",
	"dateAddedUTC": "2021-06-21T18:28:37.063Z"
},{
	"index": 0,
	"title": "benchmark Ruby code? // RubyLearning Blog",
	"url": "http://rubylearning.com/blog/2013/06/19/how-do-i-benchmark-ruby-code/",
	"id": 958,
	"parentId": "957",
	"dateAddedLocal": "6/21/2021, 2:12:25 PM",
	"dateAddedUTC": "2021-06-21T18:12:25.000Z"
},{
	"index": 1,
	"title": "Learn - Collect and Return Values",
	"url": "https://learn.co/tracks/full-stack-web-dev-with-react/procedural-ruby/iteration/prime-lab",
	"id": 959,
	"parentId": "957",
	"dateAddedLocal": "6/21/2021, 2:12:25 PM",
	"dateAddedUTC": "2021-06-21T18:12:25.000Z"
},{
	"index": 16,
	"title": "biz",
	"id": 960,
	"parentId": "871",
	"dateAddedLocal": "6/21/2021, 2:28:37 PM",
	"dateAddedUTC": "2021-06-21T18:28:37.063Z"
},{
	"index": 0,
	"title": "100 Conversion Optimization Case Studies",
	"url": "https://neilpatel.com/blog/100-conversion-optimization-case-studies/",
	"id": 961,
	"parentId": "960",
	"dateAddedLocal": "6/21/2021, 2:12:25 PM",
	"dateAddedUTC": "2021-06-21T18:12:25.000Z"
},{
	"index": 1,
	"title": "CSS Spice Chrome Extension",
	"url": "https://gumroad.com/d/67ddc7a213fbcab2dce97586e631418a",
	"id": 962,
	"parentId": "960",
	"dateAddedLocal": "6/21/2021, 2:12:25 PM",
	"dateAddedUTC": "2021-06-21T18:12:25.000Z"
},{
	"index": 2,
	"title": "The Complete Freelancing Bundle",
	"url": "https://gumroad.com/d/ebdfe4dc499974b81ce9ec2a43feab49",
	"id": 963,
	"parentId": "960",
	"dateAddedLocal": "6/21/2021, 2:12:25 PM",
	"dateAddedUTC": "2021-06-21T18:12:25.000Z"
},{
	"index": 3,
	"title": "Customer Success Stories & Case Studies | VWO",
	"url": "https://vwo.com/success-stories/",
	"id": 964,
	"parentId": "960",
	"dateAddedLocal": "6/21/2021, 2:12:25 PM",
	"dateAddedUTC": "2021-06-21T18:12:25.000Z"
},{
	"index": 4,
	"title": "A/B Testing",
	"url": "https://www.optimizely.com/optimization-glossary/ab-testing/",
	"id": 965,
	"parentId": "960",
	"dateAddedLocal": "6/21/2021, 2:12:25 PM",
	"dateAddedUTC": "2021-06-21T18:12:25.000Z"
},{
	"index": 5,
	"title": "Unbounce Landing Page & Conversion Optimization Blog",
	"url": "https://unbounce.com/blog/",
	"id": 966,
	"parentId": "960",
	"dateAddedLocal": "6/21/2021, 2:12:25 PM",
	"dateAddedUTC": "2021-06-21T18:12:25.000Z"
},{
	"index": 6,
	"title": "Compare Business Structures - LLC vs. Corporation, S Corporation and C Corporation | LegalZoom",
	"url": "https://www.legalzoom.com/business/business-formation/compare.html?kid=_k_EAIaIQobChMIvbC00euG6QIVhQiICR1IQASyEAAYASAAEgJPAPD_BwE_k_&utm_source=google&utm_medium=cpc&utm_term=%2Bllc%20%2Bvs%20%2Bincorporation&utm_content=388562791178&utm_campaign=BIZ%20|%20LLC/Business%20Formation%20|%20Comparison&kpid=go_849130737_43350394466_388562791178_kwd-337738739215_c&gclid=EAIaIQobChMIvbC00euG6QIVhQiICR1IQASyEAAYASAAEgJPAPD_BwE",
	"id": 967,
	"parentId": "960",
	"dateAddedLocal": "6/21/2021, 2:12:25 PM",
	"dateAddedUTC": "2021-06-21T18:12:25.000Z"
},{
	"index": 7,
	"title": "Creating your LLC",
	"url": "https://www.legalzoom.com/llc/essentials/registered-agent",
	"id": 968,
	"parentId": "960",
	"dateAddedLocal": "6/21/2021, 2:12:25 PM",
	"dateAddedUTC": "2021-06-21T18:12:25.000Z"
},{
	"index": 8,
	"title": "ViperChill",
	"url": "http://www.viperchill.com/",
	"id": 969,
	"parentId": "960",
	"dateAddedLocal": "6/21/2021, 2:12:25 PM",
	"dateAddedUTC": "2021-06-21T18:12:25.000Z"
},{
	"index": 9,
	"title": "Detailed.com | SEO Analysis, Tools & Insights",
	"url": "https://detailed.com/",
	"id": 970,
	"parentId": "960",
	"dateAddedLocal": "6/21/2021, 2:12:25 PM",
	"dateAddedUTC": "2021-06-21T18:12:25.000Z"
},{
	"index": 10,
	"title": "Gaps. Online business ideas",
	"url": "https://gaps.com/",
	"id": 971,
	"parentId": "960",
	"dateAddedLocal": "6/21/2021, 2:12:25 PM",
	"dateAddedUTC": "2021-06-21T18:12:25.000Z"
},{
	"index": 11,
	"title": "Blog Neil Patel's Digital Marketing Blog",
	"url": "https://neilpatel.com/blog/",
	"id": 972,
	"parentId": "960",
	"dateAddedLocal": "6/21/2021, 2:12:25 PM",
	"dateAddedUTC": "2021-06-21T18:12:25.000Z"
},{
	"index": 12,
	"title": "portfolio-example.jpg (1200Ã—2650)",
	"url": "https://studywebdevelopment.com/portfolio-example.jpg",
	"id": 973,
	"parentId": "960",
	"dateAddedLocal": "6/21/2021, 2:12:25 PM",
	"dateAddedUTC": "2021-06-21T18:12:25.000Z"
},{
	"index": 13,
	"title": "How to Add a Business to Google Maps: 13 Steps (with Pictures)",
	"url": "https://www.wikihow.com/Add-a-Business-to-Google-Maps",
	"id": 974,
	"parentId": "960",
	"dateAddedLocal": "6/21/2021, 2:12:25 PM",
	"dateAddedUTC": "2021-06-21T18:12:25.000Z"
},{
	"index": 14,
	"title": "Coolors - The super fast color schemes generator!",
	"url": "https://coolors.co/",
	"id": 975,
	"parentId": "960",
	"dateAddedLocal": "6/21/2021, 2:12:25 PM",
	"dateAddedUTC": "2021-06-21T18:12:25.000Z"
},{
	"index": 17,
	"title": "bootstrap",
	"id": 976,
	"parentId": "871",
	"dateAddedLocal": "6/21/2021, 2:28:37 PM",
	"dateAddedUTC": "2021-06-21T18:28:37.065Z"
},{
	"index": 0,
	"title": "Bootstrap vs Foundation - Top 2 CSS Frameworks",
	"url": "https://www.keycdn.com/blog/bootstrap-vs-foundation/",
	"id": 977,
	"parentId": "976",
	"dateAddedLocal": "6/21/2021, 2:12:25 PM",
	"dateAddedUTC": "2021-06-21T18:12:25.000Z"
},{
	"index": 1,
	"title": "bootstrap-learn-lab",
	"url": "https://learn.co/tracks/full-stack-web-dev-with-react/rails-and-javascript/asset-pipeline/bootstrap-and-the-asset-pipeline",
	"id": 978,
	"parentId": "976",
	"dateAddedLocal": "6/21/2021, 2:12:25 PM",
	"dateAddedUTC": "2021-06-21T18:12:25.000Z"
},{
	"index": 2,
	"title": "twbs/bootstrap-sass: Official Sass port of Bootstrap 2 and 3.",
	"url": "https://github.com/twbs/bootstrap-sass",
	"id": 979,
	"parentId": "976",
	"dateAddedLocal": "6/21/2021, 2:12:25 PM",
	"dateAddedUTC": "2021-06-21T18:12:25.000Z"
},{
	"index": 3,
	"title": "Bootstrap 4 Cheat Sheet - The ultimate list of Bootstrap classes",
	"url": "https://hackerthemes.com/bootstrap-cheatsheet/",
	"id": 980,
	"parentId": "976",
	"dateAddedLocal": "6/21/2021, 2:12:25 PM",
	"dateAddedUTC": "2021-06-21T18:12:25.000Z"
},{
	"index": 18,
	"title": "browser-refresh",
	"id": 2616,
	"parentId": "871",
	"dateAddedLocal": "11/28/2023, 9:23:02 AM",
	"dateAddedUTC": "2023-11-28T14:23:02.489Z"
},{
	"index": 0,
	"title": "HTML Standard",
	"url": "https://html.spec.whatwg.org/multipage/interaction.html#user-activation-processing-model",
	"id": 2619,
	"parentId": "2616",
	"dateAddedLocal": "11/28/2023, 9:23:07 AM",
	"dateAddedUTC": "2023-11-28T14:23:07.462Z"
},{
	"index": 1,
	"title": "javascript - what constitues user gesture - Stack Overflow",
	"url": "https://stackoverflow.com/questions/56388258/what-constitues-user-gesture",
	"id": 2617,
	"parentId": "2616",
	"dateAddedLocal": "11/28/2023, 9:23:31 AM",
	"dateAddedUTC": "2023-11-28T14:23:31.512Z"
},{
	"index": 2,
	"title": "Easy fix for: Blocked attempt to show a 'beforeunload' confirmation panel for a frame that never had a user gesture since its load",
	"url": "https://www.uriports.com/blog/easy-fix-for-blocked-attempt-beforeunload-confirmation-panel/",
	"id": 2620,
	"parentId": "2616",
	"dateAddedLocal": "11/28/2023, 9:23:37 AM",
	"dateAddedUTC": "2023-11-28T14:23:37.716Z"
},{
	"index": 3,
	"title": "Handling Browser Refresh in React: Best Practices and Pitfalls | by Theodore John.S | Medium",
	"url": "https://medium.com/@stheodorejohn/handling-browser-refresh-in-react-best-practices-and-pitfalls-5d4451d579ff#:~:text=To%20stop%20the%20refresh%20process,confirmation%20message%20to%20the%20user.",
	"id": 2618,
	"parentId": "2616",
	"dateAddedLocal": "11/28/2023, 9:23:43 AM",
	"dateAddedUTC": "2023-11-28T14:23:43.240Z"
},{
	"index": 4,
	"title": "javascript - How to show a custom reload popup instead of default one of a browser? - Stack Overflow",
	"url": "https://stackoverflow.com/questions/76238289/how-to-show-a-custom-reload-popup-instead-of-default-one-of-a-browser",
	"id": 2626,
	"parentId": "2616",
	"dateAddedLocal": "12/4/2023, 9:30:45 AM",
	"dateAddedUTC": "2023-12-04T14:30:45.862Z"
},{
	"index": 19,
	"title": "capistrano",
	"id": 981,
	"parentId": "871",
	"dateAddedLocal": "6/21/2021, 2:28:37 PM",
	"dateAddedUTC": "2021-06-21T18:28:37.065Z"
},{
	"index": 20,
	"title": "cartography",
	"id": 982,
	"parentId": "871",
	"dateAddedLocal": "6/21/2021, 2:28:37 PM",
	"dateAddedUTC": "2021-06-21T18:28:37.065Z"
},{
	"index": 0,
	"title": "Make Maps People Want to Look At",
	"url": "http://www.esri.com/news/arcuser/0112/make-maps-people-want-to-look-at.html",
	"id": 983,
	"parentId": "982",
	"dateAddedLocal": "6/21/2021, 2:12:25 PM",
	"dateAddedUTC": "2021-06-21T18:12:25.000Z"
},{
	"index": 1,
	"title": "Principles of Cartographic Design ~ GIS Lounge",
	"url": "https://www.gislounge.com/principles-of-cartographic-design/",
	"id": 984,
	"parentId": "982",
	"dateAddedLocal": "6/21/2021, 2:12:25 PM",
	"dateAddedUTC": "2021-06-21T18:12:25.000Z"
},{
	"index": 21,
	"title": "centos",
	"id": 985,
	"parentId": "871",
	"dateAddedLocal": "6/21/2021, 2:28:37 PM",
	"dateAddedUTC": "2021-06-21T18:28:37.065Z"
},{
	"index": 0,
	"title": "CentOS6.9",
	"url": "https://wiki.centos.org/Manuals/ReleaseNotes/CentOS6.9",
	"id": 986,
	"parentId": "985",
	"dateAddedLocal": "6/21/2021, 2:12:25 PM",
	"dateAddedUTC": "2021-06-21T18:12:25.000Z"
},{
	"index": 1,
	"title": "How To Deploy Rails Apps Using Unicorn And Nginx on CentOS 6.5 | DigitalOcean",
	"url": "https://www.digitalocean.com/community/tutorials/how-to-deploy-rails-apps-using-unicorn-and-nginx-on-centos-6-5",
	"id": 987,
	"parentId": "985",
	"dateAddedLocal": "6/21/2021, 2:12:25 PM",
	"dateAddedUTC": "2021-06-21T18:12:25.000Z"
},{
	"index": 2,
	"title": "A Comparison of (Rack) Web Servers for Ruby Web Applications | DigitalOcean",
	"url": "https://www.digitalocean.com/community/tutorials/a-comparison-of-rack-web-servers-for-ruby-web-applications",
	"id": 988,
	"parentId": "985",
	"dateAddedLocal": "6/21/2021, 2:12:25 PM",
	"dateAddedUTC": "2021-06-21T18:12:25.000Z"
},{
	"index": 3,
	"title": "How To Deploy Rails Apps Using Passenger With Nginx on CentOS 6.5 | DigitalOcean",
	"url": "https://www.digitalocean.com/community/tutorials/how-to-deploy-rails-apps-using-passenger-with-nginx-on-centos-6-5",
	"id": 989,
	"parentId": "985",
	"dateAddedLocal": "6/21/2021, 2:12:25 PM",
	"dateAddedUTC": "2021-06-21T18:12:25.000Z"
},{
	"index": 22,
	"title": "cheatsheet",
	"id": 990,
	"parentId": "871",
	"dateAddedLocal": "6/21/2021, 2:28:37 PM",
	"dateAddedUTC": "2021-06-21T18:28:37.066Z"
},{
	"index": 0,
	"title": "OverAPI",
	"url": "http://overapi.com/",
	"id": 991,
	"parentId": "990",
	"dateAddedLocal": "6/21/2021, 2:12:25 PM",
	"dateAddedUTC": "2021-06-21T18:12:25.000Z"
},{
	"index": 1,
	"title": "Character table",
	"url": "http://www.ams.org/STIX/table06.html",
	"id": 992,
	"parentId": "990",
	"dateAddedLocal": "6/21/2021, 2:12:25 PM",
	"dateAddedUTC": "2021-06-21T18:12:25.000Z"
},{
	"index": 2,
	"title": "HTML Cheat Sheet ðŸ“ƒ - The best interactive cheat sheet",
	"url": "https://htmlcheatsheet.com/",
	"id": 993,
	"parentId": "990",
	"dateAddedLocal": "6/21/2021, 2:12:25 PM",
	"dateAddedUTC": "2021-06-21T18:12:25.000Z"
},{
	"index": 23,
	"title": "chirp",
	"id": 994,
	"parentId": "871",
	"dateAddedLocal": "6/21/2021, 2:28:37 PM",
	"dateAddedUTC": "2021-06-21T18:28:37.066Z"
},{
	"index": 0,
	"title": "Beginners Guide - CHIRP",
	"url": "http://chirp.danplanet.com/projects/chirp/wiki/Beginners_Guide",
	"id": 995,
	"parentId": "994",
	"dateAddedLocal": "6/21/2021, 2:12:25 PM",
	"dateAddedUTC": "2021-06-21T18:12:25.000Z"
},{
	"index": 1,
	"title": "Chirp for JavaScript Â· Chirp",
	"url": "http://developers.chirp.io/docs/chirp-for-javascript",
	"id": 996,
	"parentId": "994",
	"dateAddedLocal": "6/21/2021, 2:12:25 PM",
	"dateAddedUTC": "2021-06-21T18:12:25.000Z"
},{
	"index": 24,
	"title": "cloudinary",
	"id": 997,
	"parentId": "871",
	"dateAddedLocal": "6/21/2021, 2:28:37 PM",
	"dateAddedUTC": "2021-06-21T18:28:37.066Z"
},{
	"index": 0,
	"title": "DmsChrisPena/cloudinary-image-upload: Image upload with Cloudinary. It's a beautiful thing.",
	"url": "https://github.com/DmsChrisPena/cloudinary-image-upload",
	"id": 998,
	"parentId": "997",
	"dateAddedLocal": "6/21/2021, 2:12:25 PM",
	"dateAddedUTC": "2021-06-21T18:12:25.000Z"
},{
	"index": 1,
	"title": "[Vue JS Tutorials] Image Upload in 15 Minutes with Cloudinary and Javascript - Tutorial - YouTube",
	"url": "https://www.youtube.com/watch?v=7CktX4lmHyQ",
	"id": 999,
	"parentId": "997",
	"dateAddedLocal": "6/21/2021, 2:12:25 PM",
	"dateAddedUTC": "2021-06-21T18:12:25.000Z"
},{
	"index": 25,
	"title": "cmd line",
	"id": 1000,
	"parentId": "871",
	"dateAddedLocal": "6/21/2021, 2:28:37 PM",
	"dateAddedUTC": "2021-06-21T18:28:37.066Z"
},{
	"index": 0,
	"title": "Calling shell commands from Ruby - Stack Overflow",
	"url": "http://stackoverflow.com/questions/2232/calling-shell-commands-from-ruby",
	"id": 1001,
	"parentId": "1000",
	"dateAddedLocal": "6/21/2021, 2:12:25 PM",
	"dateAddedUTC": "2021-06-21T18:12:25.000Z"
},{
	"index": 26,
	"title": "cmd-line",
	"id": 1012,
	"parentId": "871",
	"dateAddedLocal": "6/21/2021, 2:28:37 PM",
	"dateAddedUTC": "2021-06-21T18:28:37.067Z"
},{
	"index": 0,
	"title": "Continuous Integration and Deployment service for Windows developers | AppVeyor",
	"url": "https://www.appveyor.com/",
	"id": 1013,
	"parentId": "1012",
	"dateAddedLocal": "6/21/2021, 2:12:25 PM",
	"dateAddedUTC": "2021-06-21T18:12:25.000Z"
},{
	"index": 27,
	"title": "cms",
	"id": 1002,
	"parentId": "871",
	"dateAddedLocal": "6/21/2021, 2:28:37 PM",
	"dateAddedUTC": "2021-06-21T18:28:37.066Z"
},{
	"index": 0,
	"title": "Getting Started - Guides - Refinery CMS",
	"url": "http://www.refinerycms.com/guides/getting-started",
	"id": 1003,
	"parentId": "1002",
	"dateAddedLocal": "6/21/2021, 2:12:25 PM",
	"dateAddedUTC": "2021-06-21T18:12:25.000Z"
},{
	"index": 1,
	"title": "Craft CMS | Focused content management for web professionals",
	"url": "https://craftcms.com/",
	"id": 1004,
	"parentId": "1002",
	"dateAddedLocal": "6/21/2021, 2:12:25 PM",
	"dateAddedUTC": "2021-06-21T18:12:25.000Z"
},{
	"index": 2,
	"title": "About Craft CMS | Craft 3 Documentation",
	"url": "https://docs.craftcms.com/v3/#what-it%E2%80%99s-for",
	"id": 1005,
	"parentId": "1002",
	"dateAddedLocal": "6/21/2021, 2:12:25 PM",
	"dateAddedUTC": "2021-06-21T18:12:25.000Z"
},{
	"index": 3,
	"title": "Contentful: Content Infrastructure for Digital Teams",
	"url": "https://www.contentful.com/",
	"id": 1006,
	"parentId": "1002",
	"dateAddedLocal": "6/21/2021, 2:12:25 PM",
	"dateAddedUTC": "2021-06-21T18:12:25.000Z"
},{
	"index": 4,
	"title": "Headless CMS - Wikipedia",
	"url": "https://en.wikipedia.org/wiki/Headless_CMS",
	"id": 1007,
	"parentId": "1002",
	"dateAddedLocal": "6/21/2021, 2:12:25 PM",
	"dateAddedUTC": "2021-06-21T18:12:25.000Z"
},{
	"index": 5,
	"title": "Headless API CMS for both developers and marketers - Prismic",
	"url": "https://prismic.io/",
	"id": 1008,
	"parentId": "1002",
	"dateAddedLocal": "6/21/2021, 2:12:25 PM",
	"dateAddedUTC": "2021-06-21T18:12:25.000Z"
},{
	"index": 6,
	"title": "Siteleaf - A friendly CMS for your static site",
	"url": "https://www.siteleaf.com/",
	"id": 1009,
	"parentId": "1002",
	"dateAddedLocal": "6/21/2021, 2:12:25 PM",
	"dateAddedUTC": "2021-06-21T18:12:25.000Z"
},{
	"index": 28,
	"title": "coffee-script",
	"id": 1020,
	"parentId": "871",
	"dateAddedLocal": "6/21/2021, 2:28:37 PM",
	"dateAddedUTC": "2021-06-21T18:28:37.067Z"
},{
	"index": 0,
	"title": "MAPC/cooler-communities",
	"url": "https://github.com/MAPC/cooler-communities",
	"id": 1021,
	"parentId": "1020",
	"dateAddedLocal": "6/21/2021, 2:12:25 PM",
	"dateAddedUTC": "2021-06-21T18:12:25.000Z"
},{
	"index": 1,
	"title": "MAPC:Cooler Heroku",
	"url": "https://mapc-cooler.herokuapp.com/",
	"id": 1022,
	"parentId": "1020",
	"dateAddedLocal": "6/21/2021, 2:12:25 PM",
	"dateAddedUTC": "2021-06-21T18:12:25.000Z"
},{
	"index": 2,
	"title": "Airtable:Question Matrix",
	"url": "https://airtable.com/tblqjVoPKquQTwtsk/viw05mSZSnBFoP3dW?blocks=hide",
	"id": 1023,
	"parentId": "1020",
	"dateAddedLocal": "6/21/2021, 2:12:25 PM",
	"dateAddedUTC": "2021-06-21T18:12:25.000Z"
},{
	"index": 3,
	"title": "Cooler Communities survey",
	"url": "https://mapc.az1.qualtrics.com/jfe/form/SV_0wiHeWbuN9GJ81f",
	"id": 1024,
	"parentId": "1020",
	"dateAddedLocal": "6/21/2021, 2:12:25 PM",
	"dateAddedUTC": "2021-06-21T18:12:25.000Z"
},{
	"index": 4,
	"title": "Qualtrics",
	"url": "https://www.qualtrics.com/",
	"id": 1025,
	"parentId": "1020",
	"dateAddedLocal": "6/21/2021, 2:12:25 PM",
	"dateAddedUTC": "2021-06-21T18:12:25.000Z"
},{
	"index": 5,
	"title": "Cooler Communities Onbaord - Google Docs",
	"url": "https://docs.google.com/document/d/1i_yzWp_vDVkrMzPhmSpCAw6OpplHnDHqtlIno_PFWwE/edit?ts=5c7d4a31",
	"id": 1026,
	"parentId": "1020",
	"dateAddedLocal": "6/21/2021, 2:12:25 PM",
	"dateAddedUTC": "2021-06-21T18:12:25.000Z"
},{
	"index": 6,
	"title": "Berkely example: CoolClimate Calculator",
	"url": "https://coolclimate.berkeley.edu/calculator",
	"id": 1027,
	"parentId": "1020",
	"dateAddedLocal": "6/21/2021, 2:12:25 PM",
	"dateAddedUTC": "2021-06-21T18:12:25.000Z"
},{
	"index": 7,
	"title": "Cooler Concord Display board - Google Slides",
	"url": "https://docs.google.com/presentation/d/11PYZIMFanrMezVLV9Hx0iRmlUi-PNhRBMM5MlBMp5so/edit#slide=id.p",
	"id": 1028,
	"parentId": "1020",
	"dateAddedLocal": "6/21/2021, 2:12:25 PM",
	"dateAddedUTC": "2021-06-21T18:12:25.000Z"
},{
	"index": 8,
	"title": "1002-Carbon Points Estimator-V1.25 - Google Sheets",
	"url": "https://docs.google.com/spreadsheets/d/1grL8negJsB5ejzpnjpwSdW1jJvMo8NQ7Fkd-1XV0fbU/edit",
	"id": 1029,
	"parentId": "1020",
	"dateAddedLocal": "6/21/2021, 2:12:25 PM",
	"dateAddedUTC": "2021-06-21T18:12:25.000Z"
},{
	"index": 9,
	"title": "Cooler Concord Carbon Points Estimator Description - Google Docs",
	"url": "https://docs.google.com/document/d/1jejnfkJ5KIlUaq6FuVc3f7_yupRSKhNaiGO7AogkUx4/edit",
	"id": 1030,
	"parentId": "1020",
	"dateAddedLocal": "6/21/2021, 2:12:25 PM",
	"dateAddedUTC": "2021-06-21T18:12:25.000Z"
},{
	"index": 10,
	"title": "Qualtrics API",
	"url": "https://api.qualtrics.com/",
	"id": 1031,
	"parentId": "1020",
	"dateAddedLocal": "6/21/2021, 2:12:25 PM",
	"dateAddedUTC": "2021-06-21T18:12:25.000Z"
},{
	"index": 11,
	"title": "Qualtrics API curl list",
	"url": "https://api.qualtrics.com/reference/list-surveys",
	"id": 1032,
	"parentId": "1020",
	"dateAddedLocal": "6/21/2021, 2:12:25 PM",
	"dateAddedUTC": "2021-06-21T18:12:25.000Z"
},{
	"index": 12,
	"title": "Python, generate survey responses",
	"url": "https://api.qualtrics.com/docs/survey-response-import-guide#section-python-code-to-generate-responses",
	"id": 1033,
	"parentId": "1020",
	"dateAddedLocal": "6/21/2021, 2:12:25 PM",
	"dateAddedUTC": "2021-06-21T18:12:25.000Z"
},{
	"index": 13,
	"title": "curl-to-ruby: Convert curl commands to ruby's net/http",
	"url": "https://jhawthorn.github.io/curl-to-ruby/",
	"id": 1034,
	"parentId": "1020",
	"dateAddedLocal": "6/21/2021, 2:12:25 PM",
	"dateAddedUTC": "2021-06-21T18:12:25.000Z"
},{
	"index": 14,
	"title": "Copy of 1002-Carbon Points Estimator-V1.25 - Google Sheets",
	"url": "https://docs.google.com/spreadsheets/u/1/d/1grL8negJsB5ejzpnjpwSdW1jJvMo8NQ7Fkd-1XV0fbU/edit?usp=sharing",
	"id": 1035,
	"parentId": "1020",
	"dateAddedLocal": "6/21/2021, 2:12:25 PM",
	"dateAddedUTC": "2021-06-21T18:12:25.000Z"
},{
	"index": 15,
	"title": "MAPC (mapc6) | Trello",
	"url": "https://trello.com/mapc6/members?utm_source=eval-email&utm_medium=email&utm_campaign=team-invite",
	"id": 1036,
	"parentId": "1020",
	"dateAddedLocal": "6/21/2021, 2:12:25 PM",
	"dateAddedUTC": "2021-06-21T18:12:25.000Z"
},{
	"index": 16,
	"title": "Sprint1",
	"url": "https://github.com/MAPC/cooler-communities/projects/1",
	"id": 1037,
	"parentId": "1020",
	"dateAddedLocal": "6/21/2021, 2:12:25 PM",
	"dateAddedUTC": "2021-06-21T18:12:25.000Z"
},{
	"index": 17,
	"title": "noUiSlider - JavaScript Range Slider | Refreshless.com",
	"url": "https://refreshless.com/nouislider/",
	"id": 1038,
	"parentId": "1020",
	"dateAddedLocal": "6/21/2021, 2:12:25 PM",
	"dateAddedUTC": "2021-06-21T18:12:25.000Z"
},{
	"index": 18,
	"title": "rails/webpacker: Use Webpack to manage app-like JavaScript modules in Rails",
	"url": "https://github.com/rails/webpacker#resolved",
	"id": 1039,
	"parentId": "1020",
	"dateAddedLocal": "6/21/2021, 2:12:25 PM",
	"dateAddedUTC": "2021-06-21T18:12:25.000Z"
},{
	"index": 19,
	"title": "Cooler",
	"url": "https://mapc-cooler.herokuapp.com/",
	"id": 1040,
	"parentId": "1020",
	"dateAddedLocal": "6/21/2021, 2:12:25 PM",
	"dateAddedUTC": "2021-06-21T18:12:25.000Z"
},{
	"index": 20,
	"title": "Cooler-Staging",
	"url": "http://staging.cooler-communities.mapc.org/",
	"id": 1041,
	"parentId": "1020",
	"dateAddedLocal": "6/21/2021, 2:12:25 PM",
	"dateAddedUTC": "2021-06-21T18:12:25.000Z"
},{
	"index": 29,
	"title": "coffeeScript",
	"id": 1010,
	"parentId": "871",
	"dateAddedLocal": "6/21/2021, 2:28:37 PM",
	"dateAddedUTC": "2021-06-21T18:28:37.067Z"
},{
	"index": 0,
	"title": "CoffeeScript",
	"url": "http://coffeescript.org/",
	"id": 1011,
	"parentId": "1010",
	"dateAddedLocal": "6/21/2021, 2:12:25 PM",
	"dateAddedUTC": "2021-06-21T18:12:25.000Z"
},{
	"index": 30,
	"title": "cookies",
	"id": 1014,
	"parentId": "871",
	"dateAddedLocal": "6/21/2021, 2:28:37 PM",
	"dateAddedUTC": "2021-06-21T18:28:37.067Z"
},{
	"index": 0,
	"title": "All About Computer Cookies - Session Cookies, Persistent Cookies,How to Enable/Disable/Manage Cookies",
	"url": "http://www.allaboutcookies.org/",
	"id": 1015,
	"parentId": "1014",
	"dateAddedLocal": "6/21/2021, 2:12:25 PM",
	"dateAddedUTC": "2021-06-21T18:12:25.000Z"
},{
	"index": 1,
	"title": "Cookie properties - EditThisCookie",
	"url": "http://www.editthiscookie.com/blog/2014/03/cookie-properties/",
	"id": 1016,
	"parentId": "1014",
	"dateAddedLocal": "6/21/2021, 2:12:25 PM",
	"dateAddedUTC": "2021-06-21T18:12:25.000Z"
},{
	"index": 2,
	"title": "Getting Started with EditThisCookie - EditThisCookie",
	"url": "http://www.editthiscookie.com/start/",
	"id": 1017,
	"parentId": "1014",
	"dateAddedLocal": "6/21/2021, 2:12:25 PM",
	"dateAddedUTC": "2021-06-21T18:12:25.000Z"
},{
	"index": 3,
	"title": "HTTP cookie - Wikipedia, the free encyclopedia",
	"url": "https://en.wikipedia.org/wiki/HTTP_cookie#Session_cookie",
	"id": 1018,
	"parentId": "1014",
	"dateAddedLocal": "6/21/2021, 2:12:25 PM",
	"dateAddedUTC": "2021-06-21T18:12:25.000Z"
},{
	"index": 4,
	"title": "Support EditThisCookie",
	"url": "chrome-extension://fngmhnnpilhplaeedifhccceomclgfbg/options_pages/support.html",
	"id": 1019,
	"parentId": "1014",
	"dateAddedLocal": "6/21/2021, 2:12:25 PM",
	"dateAddedUTC": "2021-06-21T18:12:25.000Z"
},{
	"index": 31,
	"title": "courses",
	"id": 1042,
	"parentId": "871",
	"dateAddedLocal": "6/21/2021, 2:28:37 PM",
	"dateAddedUTC": "2021-06-21T18:28:37.070Z"
},{
	"index": 0,
	"title": "JavaScript: The Hard Parts",
	"url": "https://frontendmasters.com/courses/javascript-hard-parts/",
	"id": 1043,
	"parentId": "1042",
	"dateAddedLocal": "6/21/2021, 2:12:25 PM",
	"dateAddedUTC": "2021-06-21T18:12:25.000Z"
},{
	"index": 32,
	"title": "css",
	"id": 1044,
	"parentId": "871",
	"dateAddedLocal": "6/21/2021, 2:28:37 PM",
	"dateAddedUTC": "2021-06-21T18:28:37.070Z"
},{
	"index": 0,
	"title": "30 CSS Selectors you Must Memorize - Envato Tuts+ Code Tutorial",
	"url": "http://code.tutsplus.com/tutorials/the-30-css-selectors-you-must-memorize--net-16048",
	"id": 1045,
	"parentId": "1044",
	"dateAddedLocal": "6/21/2021, 2:12:25 PM",
	"dateAddedUTC": "2021-06-21T18:12:25.000Z"
},{
	"index": 1,
	"title": "Attribute selectors - CSS | MDN",
	"url": "https://developer.mozilla.org/en-US/docs/Web/CSS/Attribute_selectors",
	"id": 1046,
	"parentId": "1044",
	"dateAddedLocal": "6/21/2021, 2:12:25 PM",
	"dateAddedUTC": "2021-06-21T18:12:25.000Z"
},{
	"index": 2,
	"title": "Basscss",
	"url": "http://basscss.com/",
	"id": 1047,
	"parentId": "1044",
	"dateAddedLocal": "6/21/2021, 2:12:25 PM",
	"dateAddedUTC": "2021-06-21T18:12:25.000Z"
},{
	"index": 3,
	"title": "Best design freebies from all over the Internet - AND CO collection",
	"url": "https://docs.google.com/spreadsheets/u/1/d/1qaUZxJSl4kHl-l16H2oC04HlidUNXwfSFExV_oD68Cg/htmlview#",
	"id": 1048,
	"parentId": "1044",
	"dateAddedLocal": "6/21/2021, 2:12:25 PM",
	"dateAddedUTC": "2021-06-21T18:12:25.000Z"
},{
	"index": 4,
	"title": "Bulma: a modern CSS framework based on Flexbox",
	"url": "https://bulma.io/",
	"id": 1049,
	"parentId": "1044",
	"dateAddedLocal": "6/21/2021, 2:12:25 PM",
	"dateAddedUTC": "2021-06-21T18:12:25.000Z"
},{
	"index": 5,
	"title": "Code Guide by @mdo",
	"url": "http://codeguide.co/#html-javascript",
	"id": 1050,
	"parentId": "1044",
	"dateAddedLocal": "6/21/2021, 2:12:25 PM",
	"dateAddedUTC": "2021-06-21T18:12:25.000Z"
},{
	"index": 6,
	"title": "Columns | Bulma: a modern CSS framework based on Flexbox",
	"url": "https://bulma.io/documentation/columns/",
	"id": 1051,
	"parentId": "1044",
	"dateAddedLocal": "6/21/2021, 2:12:25 PM",
	"dateAddedUTC": "2021-06-21T18:12:25.000Z"
},{
	"index": 7,
	"title": "CSS - Pseudo Class Selectors | CSS-Tricks",
	"url": "https://css-tricks.com/pseudo-class-selectors/",
	"id": 1052,
	"parentId": "1044",
	"dateAddedLocal": "6/21/2021, 2:12:25 PM",
	"dateAddedUTC": "2021-06-21T18:12:25.000Z"
},{
	"index": 8,
	"title": "CSS | Mozilla.org",
	"url": "https://developer.mozilla.org/en-US/docs/Web/CSS",
	"id": 1053,
	"parentId": "1044",
	"dateAddedLocal": "6/21/2021, 2:12:25 PM",
	"dateAddedUTC": "2021-06-21T18:12:25.000Z"
},{
	"index": 9,
	"title": "CSS Grid â€” Learn all about CSS Grid with Wes Bos in this free video series!",
	"url": "https://cssgrid.io/",
	"id": 1054,
	"parentId": "1044",
	"dateAddedLocal": "6/21/2021, 2:12:25 PM",
	"dateAddedUTC": "2021-06-21T18:12:25.000Z"
},{
	"index": 10,
	"title": "CSS Grid Tutorial #1 - Why Use CSS Grid? - YouTube",
	"url": "https://www.youtube.com/watch?v=x7tLPhnA06w&list=PL4cUxeGkcC9itC4TxYMzFCfveyutyPOCY",
	"id": 1055,
	"parentId": "1044",
	"dateAddedLocal": "6/21/2021, 2:12:25 PM",
	"dateAddedUTC": "2021-06-21T18:12:25.000Z"
},{
	"index": 11,
	"title": "CSS Overlay Techniques:MODAL",
	"url": "https://tympanus.net/codrops/2013/11/07/css-overlay-techniques/",
	"id": 1056,
	"parentId": "1044",
	"dateAddedLocal": "6/21/2021, 2:12:25 PM",
	"dateAddedUTC": "2021-06-21T18:12:25.000Z"
},{
	"index": 12,
	"title": "CSS reference - CSS | MDN",
	"url": "https://developer.mozilla.org/en-US/docs/Web/CSS/Reference",
	"id": 1057,
	"parentId": "1044",
	"dateAddedLocal": "6/21/2021, 2:12:25 PM",
	"dateAddedUTC": "2021-06-21T18:12:25.000Z"
},{
	"index": 13,
	"title": "CSS Tools: Reset CSS",
	"url": "https://meyerweb.com/eric/tools/css/reset/",
	"id": 1058,
	"parentId": "1044",
	"dateAddedLocal": "6/21/2021, 2:12:25 PM",
	"dateAddedUTC": "2021-06-21T18:12:25.000Z"
},{
	"index": 14,
	"title": "Flat UI Colors - Color Pallette from Flat UI Theme",
	"url": "http://flatuicolors.com/",
	"id": 1059,
	"parentId": "1044",
	"dateAddedLocal": "6/21/2021, 2:12:25 PM",
	"dateAddedUTC": "2021-06-21T18:12:25.000Z"
},{
	"index": 15,
	"title": "Foundation: The most advanced responsive front-end framework in the world. | Foundation",
	"url": "https://foundation.zurb.com/",
	"id": 1060,
	"parentId": "1044",
	"dateAddedLocal": "6/21/2021, 2:12:25 PM",
	"dateAddedUTC": "2021-06-21T18:12:25.000Z"
},{
	"index": 16,
	"title": "Getting Started with SASS (with Interactive Examples) â€• Scotch.io",
	"url": "https://scotch.io/tutorials/getting-started-with-sass",
	"id": 1061,
	"parentId": "1044",
	"dateAddedLocal": "6/21/2021, 2:12:25 PM",
	"dateAddedUTC": "2021-06-21T18:12:25.000Z"
},{
	"index": 17,
	"title": "Google Fonts",
	"url": "https://fonts.google.com/",
	"id": 1062,
	"parentId": "1044",
	"dateAddedLocal": "6/21/2021, 2:12:25 PM",
	"dateAddedUTC": "2021-06-21T18:12:25.000Z"
},{
	"index": 18,
	"title": "icon-finder",
	"url": "https://www.iconfinder.com/",
	"id": 1063,
	"parentId": "1044",
	"dateAddedLocal": "6/21/2021, 2:12:25 PM",
	"dateAddedUTC": "2021-06-21T18:12:25.000Z"
},{
	"index": 19,
	"title": "ITCSS: Scalable and Maintainable CSS Architecture - Xfive",
	"url": "https://www.xfive.co/blog/itcss-scalable-maintainable-css-architecture/",
	"id": 1064,
	"parentId": "1044",
	"dateAddedLocal": "6/21/2021, 2:12:25 PM",
	"dateAddedUTC": "2021-06-21T18:12:25.000Z"
},{
	"index": 20,
	"title": "Learn CSS Grid for free | Scrimba.com",
	"url": "https://scrimba.com/g/gR8PTE",
	"id": 1065,
	"parentId": "1044",
	"dateAddedLocal": "6/21/2021, 2:12:25 PM",
	"dateAddedUTC": "2021-06-21T18:12:25.000Z"
},{
	"index": 21,
	"title": "Learn HTML & CSS - a book that teaches you in a nicer way",
	"url": "http://www.htmlandcssbook.com/",
	"id": 1066,
	"parentId": "1044",
	"dateAddedLocal": "6/21/2021, 2:12:25 PM",
	"dateAddedUTC": "2021-06-21T18:12:25.000Z"
},{
	"index": 22,
	"title": "Modular CSS with Sass & BEM ~ Front-end Developer ~ Mat Hayward",
	"url": "http://mathayward.com/modular-css-with-sass-and-bem/",
	"id": 1067,
	"parentId": "1044",
	"dateAddedLocal": "6/21/2021, 2:12:25 PM",
	"dateAddedUTC": "2021-06-21T18:12:25.000Z"
},{
	"index": 23,
	"title": "Net magazine | Creative Bloq",
	"url": "https://www.creativebloq.com/net-magazine",
	"id": 1068,
	"parentId": "1044",
	"dateAddedLocal": "6/21/2021, 2:12:25 PM",
	"dateAddedUTC": "2021-06-21T18:12:25.000Z"
},{
	"index": 24,
	"title": "Pragmatic Guide to Sass",
	"url": "file:///Users/bradsmith/Dropbox/dev1/books/design/Hampton_Catlin-Pragmatic_Guide_to_Sass-EN.pdf",
	"id": 1069,
	"parentId": "1044",
	"dateAddedLocal": "6/21/2021, 2:12:25 PM",
	"dateAddedUTC": "2021-06-21T18:12:25.000Z"
},{
	"index": 25,
	"title": "Pragmatic Guide to Sass",
	"url": "file:///Users/bradsmith/Dropbox/dev1/books/design/Hampton_Catlin-Pragmatic_Guide_to_Sass-EN.pdf",
	"id": 1070,
	"parentId": "1044",
	"dateAddedLocal": "6/21/2021, 2:12:25 PM",
	"dateAddedUTC": "2021-06-21T18:12:25.000Z"
},{
	"index": 26,
	"title": "reset.css",
	"url": "https://meyerweb.com/eric/tools/css/reset/reset.css",
	"id": 1071,
	"parentId": "1044",
	"dateAddedLocal": "6/21/2021, 2:12:25 PM",
	"dateAddedUTC": "2021-06-21T18:12:25.000Z"
},{
	"index": 27,
	"title": "Semantic HTML and Why You Should Use It",
	"url": "https://www.lifewire.com/why-use-semantic-html-3468271",
	"id": 1072,
	"parentId": "1044",
	"dateAddedLocal": "6/21/2021, 2:12:25 PM",
	"dateAddedUTC": "2021-06-21T18:12:25.000Z"
},{
	"index": 28,
	"title": "Semantic HTML and Why You Should Use It",
	"url": "https://www.lifewire.com/why-use-semantic-html-3468271",
	"id": 1073,
	"parentId": "1044",
	"dateAddedLocal": "6/21/2021, 2:12:25 PM",
	"dateAddedUTC": "2021-06-21T18:12:25.000Z"
},{
	"index": 29,
	"title": "Single Element CSS Spinners",
	"url": "https://projects.lukehaas.me/css-loaders/",
	"id": 1074,
	"parentId": "1044",
	"dateAddedLocal": "6/21/2021, 2:12:25 PM",
	"dateAddedUTC": "2021-06-21T18:12:25.000Z"
},{
	"index": 30,
	"title": "The Extend Concept | CSS-Tricks",
	"url": "https://css-tricks.com/the-extend-concept/",
	"id": 1075,
	"parentId": "1044",
	"dateAddedLocal": "6/21/2021, 2:12:25 PM",
	"dateAddedUTC": "2021-06-21T18:12:25.000Z"
},{
	"index": 31,
	"title": "The Extend Concept | CSS-Tricks",
	"url": "https://css-tricks.com/the-extend-concept/",
	"id": 1076,
	"parentId": "1044",
	"dateAddedLocal": "6/21/2021, 2:12:25 PM",
	"dateAddedUTC": "2021-06-21T18:12:25.000Z"
},{
	"index": 32,
	"title": "True CSS Masonry with Grid Layout",
	"url": "https://codepen.io/max1128/pen/WoZjPa?sort_col=item_updated_at",
	"id": 1077,
	"parentId": "1044",
	"dateAddedLocal": "6/21/2021, 2:12:25 PM",
	"dateAddedUTC": "2021-06-21T18:12:25.000Z"
},{
	"index": 33,
	"title": "Typeplate Â» A typographic starter kit encouraging great type on the Web",
	"url": "http://typeplate.com/",
	"id": 1078,
	"parentId": "1044",
	"dateAddedLocal": "6/21/2021, 2:12:25 PM",
	"dateAddedUTC": "2021-06-21T18:12:25.000Z"
},{
	"index": 34,
	"title": "Understanding the Bootstrap 3 Grid System â€• Scotch",
	"url": "https://scotch.io/tutorials/understanding-the-bootstrap-3-grid-system",
	"id": 1079,
	"parentId": "1044",
	"dateAddedLocal": "6/21/2021, 2:12:25 PM",
	"dateAddedUTC": "2021-06-21T18:12:25.000Z"
},{
	"index": 35,
	"title": "Using Sass to Control Scope With BEM Naming | CSS-Tricks",
	"url": "https://css-tricks.com/using-sass-control-scope-bem-naming/",
	"id": 1080,
	"parentId": "1044",
	"dateAddedLocal": "6/21/2021, 2:12:25 PM",
	"dateAddedUTC": "2021-06-21T18:12:25.000Z"
},{
	"index": 36,
	"title": "Using Sass to Control Scope With BEM Naming | CSS-Tricks",
	"url": "https://css-tricks.com/using-sass-control-scope-bem-naming/",
	"id": 1081,
	"parentId": "1044",
	"dateAddedLocal": "6/21/2021, 2:12:25 PM",
	"dateAddedUTC": "2021-06-21T18:12:25.000Z"
},{
	"index": 37,
	"title": "Video Screencasts | CSS-Tricks",
	"url": "https://css-tricks.com/video-screencasts/",
	"id": 1082,
	"parentId": "1044",
	"dateAddedLocal": "6/21/2021, 2:12:25 PM",
	"dateAddedUTC": "2021-06-21T18:12:25.000Z"
},{
	"index": 38,
	"title": "www.google.com",
	"url": "https://www.google.com/search?q=rails+refinery+documentation&rlz=1C5CHFA_enUS839US839&oq=rails+refinery+documentation&aqs=chrome..69i57j69i64.8283j0j7&sourceid=chrome&ie=UTF-8",
	"id": 1083,
	"parentId": "1044",
	"dateAddedLocal": "6/21/2021, 2:12:25 PM",
	"dateAddedUTC": "2021-06-21T18:12:25.000Z"
},{
	"index": 39,
	"title": "A Complete Guide to Grid | CSS-Tricks",
	"url": "https://css-tricks.com/snippets/css/complete-guide-grid/",
	"id": 1084,
	"parentId": "1044",
	"dateAddedLocal": "6/21/2021, 2:12:25 PM",
	"dateAddedUTC": "2021-06-21T18:12:25.000Z"
},{
	"index": 40,
	"title": "Code Guide by @mdo",
	"url": "http://codeguide.co/",
	"id": 1085,
	"parentId": "1044",
	"dateAddedLocal": "6/21/2021, 2:12:25 PM",
	"dateAddedUTC": "2021-06-21T18:12:25.000Z"
},{
	"index": 41,
	"title": "Getting Started with SASS (with Interactive Examples) â€• Scotch.io",
	"url": "https://scotch.io/tutorials/getting-started-with-sass",
	"id": 1086,
	"parentId": "1044",
	"dateAddedLocal": "6/21/2021, 2:12:25 PM",
	"dateAddedUTC": "2021-06-21T18:12:25.000Z"
},{
	"index": 42,
	"title": "Modular CSS with Sass & BEM ~ Front-end Developer ~ Mat Hayward",
	"url": "http://mathayward.com/modular-css-with-sass-and-bem/",
	"id": 1087,
	"parentId": "1044",
	"dateAddedLocal": "6/21/2021, 2:12:25 PM",
	"dateAddedUTC": "2021-06-21T18:12:25.000Z"
},{
	"index": 43,
	"title": "Net magazine | Creative Bloq",
	"url": "https://www.creativebloq.com/net-magazine",
	"id": 1088,
	"parentId": "1044",
	"dateAddedLocal": "6/21/2021, 2:12:25 PM",
	"dateAddedUTC": "2021-06-21T18:12:25.000Z"
},{
	"index": 44,
	"title": "Pragmatic Guide to Sass",
	"url": "file:///Users/bradsmith/Dropbox/dev1/books/design/Hampton_Catlin-Pragmatic_Guide_to_Sass-EN.pdf",
	"id": 1089,
	"parentId": "1044",
	"dateAddedLocal": "6/21/2021, 2:12:25 PM",
	"dateAddedUTC": "2021-06-21T18:12:25.000Z"
},{
	"index": 45,
	"title": "Semantic HTML and Why You Should Use It",
	"url": "https://www.lifewire.com/why-use-semantic-html-3468271",
	"id": 1090,
	"parentId": "1044",
	"dateAddedLocal": "6/21/2021, 2:12:25 PM",
	"dateAddedUTC": "2021-06-21T18:12:25.000Z"
},{
	"index": 46,
	"title": "The Extend Concept | CSS-Tricks",
	"url": "https://css-tricks.com/the-extend-concept/",
	"id": 1091,
	"parentId": "1044",
	"dateAddedLocal": "6/21/2021, 2:12:25 PM",
	"dateAddedUTC": "2021-06-21T18:12:25.000Z"
},{
	"index": 47,
	"title": "Using Sass to Control Scope With BEM Naming | CSS-Tricks",
	"url": "https://css-tricks.com/using-sass-control-scope-bem-naming/",
	"id": 1092,
	"parentId": "1044",
	"dateAddedLocal": "6/21/2021, 2:12:25 PM",
	"dateAddedUTC": "2021-06-21T18:12:25.000Z"
},{
	"index": 33,
	"title": "csv",
	"id": 1093,
	"parentId": "871",
	"dateAddedLocal": "6/21/2021, 2:28:37 PM",
	"dateAddedUTC": "2021-06-21T18:28:37.074Z"
},{
	"index": 0,
	"title": "Class: CSV (Ruby 1.9.3)",
	"url": "http://ruby-doc.org/stdlib-1.9.3/libdoc/csv/rdoc/CSV.html",
	"id": 1094,
	"parentId": "1093",
	"dateAddedLocal": "6/21/2021, 2:12:25 PM",
	"dateAddedUTC": "2021-06-21T18:12:25.000Z"
},{
	"index": 1,
	"title": "Learn - Paperclip",
	"url": "https://learn.co/tracks/full-stack-web-development-v3/rails-and-javascript/workers/long-running-tasks-in-rails",
	"id": 1095,
	"parentId": "1093",
	"dateAddedLocal": "6/21/2021, 2:12:25 PM",
	"dateAddedUTC": "2021-06-21T18:12:25.000Z"
},{
	"index": 2,
	"title": "How To Import CSV Files In Rails â€” Matt Morgante",
	"url": "http://www.mattmorgante.com/technology/csv",
	"id": 1096,
	"parentId": "1093",
	"dateAddedLocal": "6/21/2021, 2:12:25 PM",
	"dateAddedUTC": "2021-06-21T18:12:25.000Z"
},{
	"index": 3,
	"title": "RFC 4180 - Common Format and MIME Type for Comma-Separated Values (CSV) Files",
	"url": "https://tools.ietf.org/html/rfc4180",
	"id": 1097,
	"parentId": "1093",
	"dateAddedLocal": "6/21/2021, 2:12:25 PM",
	"dateAddedUTC": "2021-06-21T18:12:25.000Z"
},{
	"index": 34,
	"title": "curl",
	"id": 1098,
	"parentId": "871",
	"dateAddedLocal": "6/21/2021, 2:28:37 PM",
	"dateAddedUTC": "2021-06-21T18:28:37.074Z"
},{
	"index": 0,
	"title": "curl - Manual",
	"url": "https://curl.haxx.se/docs/manual.html",
	"id": 1099,
	"parentId": "1098",
	"dateAddedLocal": "6/21/2021, 2:12:25 PM",
	"dateAddedUTC": "2021-06-21T18:12:25.000Z"
},{
	"index": 1,
	"title": "How to Use cURL to Test RESTful Rails // RailsTips by John Nunemaker",
	"url": "http://www.railstips.org/blog/archives/2006/08/04/how-to-use-curl-to-test-restful-rails/",
	"id": 1100,
	"parentId": "1098",
	"dateAddedLocal": "6/21/2021, 2:12:25 PM",
	"dateAddedUTC": "2021-06-21T18:12:25.000Z"
},{
	"index": 2,
	"title": "libcurl - What Developers Say About It",
	"url": "https://curl.haxx.se/libcurl/theysay.html",
	"id": 1101,
	"parentId": "1098",
	"dateAddedLocal": "6/21/2021, 2:12:25 PM",
	"dateAddedUTC": "2021-06-21T18:12:25.000Z"
},{
	"index": 3,
	"title": "ruby on rails - curl command line POST - Stack Overflow",
	"url": "http://stackoverflow.com/questions/5826690/curl-command-line-post",
	"id": 1102,
	"parentId": "1098",
	"dateAddedLocal": "6/21/2021, 2:12:25 PM",
	"dateAddedUTC": "2021-06-21T18:12:25.000Z"
},{
	"index": 35,
	"title": "d3",
	"id": 1103,
	"parentId": "871",
	"dateAddedLocal": "6/21/2021, 2:28:37 PM",
	"dateAddedUTC": "2021-06-21T18:28:37.075Z"
},{
	"index": 0,
	"title": "D3.js - Data-Driven Documents",
	"url": "https://d3js.org/",
	"id": 1104,
	"parentId": "1103",
	"dateAddedLocal": "6/21/2021, 2:12:25 PM",
	"dateAddedUTC": "2021-06-21T18:12:25.000Z"
},{
	"index": 1,
	"title": "d3/d3-scale: Encodings that map abstract data to visual representation.",
	"url": "https://github.com/d3/d3-scale",
	"id": 1105,
	"parentId": "1103",
	"dateAddedLocal": "6/21/2021, 2:12:25 PM",
	"dateAddedUTC": "2021-06-21T18:12:25.000Z"
},{
	"index": 2,
	"title": "https://christopheviau.com/d3list/gallery.html",
	"url": "https://christopheviau.com/d3list/gallery.html",
	"id": 1106,
	"parentId": "1103",
	"dateAddedLocal": "6/21/2021, 2:12:25 PM",
	"dateAddedUTC": "2021-06-21T18:12:25.000Z"
},{
	"index": 3,
	"title": "Introduction to D3 - YouTube",
	"url": "https://www.youtube.com/watch?v=8jvoTV54nXw",
	"id": 1107,
	"parentId": "1103",
	"dateAddedLocal": "6/21/2021, 2:12:25 PM",
	"dateAddedUTC": "2021-06-21T18:12:25.000Z"
},{
	"index": 4,
	"title": "Simple column chart with D3 | Socrata",
	"url": "https://dev.socrata.com/blog/2013/08/13/simple-chart-with-d3.html",
	"id": 1108,
	"parentId": "1103",
	"dateAddedLocal": "6/21/2021, 2:12:25 PM",
	"dateAddedUTC": "2021-06-21T18:12:25.000Z"
},{
	"index": 36,
	"title": "dash",
	"id": 1109,
	"parentId": "871",
	"dateAddedLocal": "6/21/2021, 2:28:37 PM",
	"dateAddedUTC": "2021-06-21T18:28:37.075Z"
},{
	"index": 0,
	"title": "Dash for macOS - API Documentation Browser, Snippet Manager - Kapeli",
	"url": "https://kapeli.com/dash",
	"id": 1110,
	"parentId": "1109",
	"dateAddedLocal": "6/21/2021, 2:12:25 PM",
	"dateAddedUTC": "2021-06-21T18:12:25.000Z"
},{
	"index": 37,
	"title": "data",
	"id": 1111,
	"parentId": "871",
	"dateAddedLocal": "6/21/2021, 2:28:37 PM",
	"dateAddedUTC": "2021-06-21T18:28:37.075Z"
},{
	"index": 0,
	"title": "Home - schema.org",
	"url": "https://schema.org/",
	"id": 1112,
	"parentId": "1111",
	"dateAddedLocal": "6/21/2021, 2:12:25 PM",
	"dateAddedUTC": "2021-06-21T18:12:25.000Z"
},{
	"index": 1,
	"title": "Mockaroo - Random Data Generator and API Mocking Tool | JSON / CSV / SQL / Excel",
	"url": "https://www.mockaroo.com/schemas/288753",
	"id": 1113,
	"parentId": "1111",
	"dateAddedLocal": "6/21/2021, 2:12:25 PM",
	"dateAddedUTC": "2021-06-21T18:12:25.000Z"
},{
	"index": 2,
	"title": "stympy/faker: A library for generating fake data such as names, addresses, and phone numbers.",
	"url": "https://github.com/stympy/faker",
	"id": 1114,
	"parentId": "1111",
	"dateAddedLocal": "6/21/2021, 2:12:25 PM",
	"dateAddedUTC": "2021-06-21T18:12:25.000Z"
},{
	"index": 38,
	"title": "data-id*",
	"id": 1115,
	"parentId": "871",
	"dateAddedLocal": "6/21/2021, 2:28:37 PM",
	"dateAddedUTC": "2021-06-21T18:28:37.076Z"
},{
	"index": 0,
	"title": "Using data attributes - Learn web development | MDN",
	"url": "https://developer.mozilla.org/en-US/docs/Learn/HTML/Howto/Use_data_attributes",
	"id": 1116,
	"parentId": "1115",
	"dateAddedLocal": "6/21/2021, 2:12:25 PM",
	"dateAddedUTC": "2021-06-21T18:12:25.000Z"
},{
	"index": 39,
	"title": "debug",
	"id": 1117,
	"parentId": "871",
	"dateAddedLocal": "6/21/2021, 2:28:37 PM",
	"dateAddedUTC": "2021-06-21T18:28:37.076Z"
},{
	"index": 0,
	"title": "Debugging",
	"url": "https://curriculum-content.s3.amazonaws.com/web-development/js/basics/intro-to-debugging-readme/nick_parlante_debugging_zen_1996.pdf",
	"id": 1118,
	"parentId": "1117",
	"dateAddedLocal": "6/21/2021, 2:12:25 PM",
	"dateAddedUTC": "2021-06-21T18:12:25.000Z"
},{
	"index": 40,
	"title": "deployment",
	"id": 1119,
	"parentId": "871",
	"dateAddedLocal": "6/21/2021, 2:28:37 PM",
	"dateAddedUTC": "2021-06-21T18:28:37.076Z"
},{
	"index": 0,
	"title": "PostgreSQL command line cheatsheet",
	"url": "https://gist.github.com/Kartones/dd3ff5ec5ea238d4c546",
	"id": 1120,
	"parentId": "1119",
	"dateAddedLocal": "6/21/2021, 2:12:25 PM",
	"dateAddedUTC": "2021-06-21T18:12:25.000Z"
},{
	"index": 1,
	"title": "deployment tutorial",
	"url": "https://www.youtube.com/watch?v=DbPDraCYju8",
	"id": 1121,
	"parentId": "1119",
	"dateAddedLocal": "6/21/2021, 2:12:25 PM",
	"dateAddedUTC": "2021-06-21T18:12:25.000Z"
},{
	"index": 2,
	"title": "RailsConf 2014 - Deploying Rails is Easier Than it Looks by Ben Dixon - YouTube",
	"url": "https://www.youtube.com/watch?v=hTofBnxyBUU",
	"id": 1122,
	"parentId": "1119",
	"dateAddedLocal": "6/21/2021, 2:12:25 PM",
	"dateAddedUTC": "2021-06-21T18:12:25.000Z"
},{
	"index": 3,
	"title": "capistrano/capistrano: Remote multi-server automation tool",
	"url": "https://github.com/capistrano/capistrano#install-the-capistrano-gem",
	"id": 1123,
	"parentId": "1119",
	"dateAddedLocal": "6/21/2021, 2:12:25 PM",
	"dateAddedUTC": "2021-06-21T18:12:25.000Z"
},{
	"index": 4,
	"title": "Rails Encrypted Credentials on Rails 5.2",
	"url": "https://www.engineyard.com/blog/rails-encrypted-credentials-on-rails-5.2",
	"id": 1124,
	"parentId": "1119",
	"dateAddedLocal": "6/21/2021, 2:12:25 PM",
	"dateAddedUTC": "2021-06-21T18:12:25.000Z"
},{
	"index": 5,
	"title": "Open Source Security Platform | Snyk",
	"url": "https://snyk.io/",
	"id": 1125,
	"parentId": "1119",
	"dateAddedLocal": "6/21/2021, 2:12:25 PM",
	"dateAddedUTC": "2021-06-21T18:12:25.000Z"
},{
	"index": 6,
	"title": "Installing Passenger + Nginx on Ubuntu 18.04 LTS (with APT) - Passenger Library",
	"url": "https://www.phusionpassenger.com/library/install/nginx/install/oss/bionic/",
	"id": 1126,
	"parentId": "1119",
	"dateAddedLocal": "6/21/2021, 2:12:25 PM",
	"dateAddedUTC": "2021-06-21T18:12:25.000Z"
},{
	"index": 7,
	"title": "Deploy Ruby on Rails To Production in 2019 - YouTube",
	"url": "https://www.youtube.com/watch?v=vzEEfAj45zw",
	"id": 1127,
	"parentId": "1119",
	"dateAddedLocal": "6/21/2021, 2:12:25 PM",
	"dateAddedUTC": "2021-06-21T18:12:25.000Z"
},{
	"index": 8,
	"title": "Fundamental concepts - Passenger + Ruby basics - Passenger Library",
	"url": "https://www.phusionpassenger.com/library/walkthroughs/basics/ruby/fundamental_concepts.html",
	"id": 1128,
	"parentId": "1119",
	"dateAddedLocal": "6/21/2021, 2:12:25 PM",
	"dateAddedUTC": "2021-06-21T18:12:25.000Z"
},{
	"index": 9,
	"title": "MAPC:InfrastructureDoc",
	"url": "https://github.com/MAPC/infrastructure",
	"id": 1129,
	"parentId": "1119",
	"dateAddedLocal": "6/21/2021, 2:12:25 PM",
	"dateAddedUTC": "2021-06-21T18:12:25.000Z"
},{
	"index": 10,
	"title": "Vagrant by HashiCorp",
	"url": "https://www.vagrantup.com/",
	"id": 1130,
	"parentId": "1119",
	"dateAddedLocal": "6/21/2021, 2:12:25 PM",
	"dateAddedUTC": "2021-06-21T18:12:25.000Z"
},{
	"index": 11,
	"title": "Ubuntu Server on VirtualBox Â· James Hibbard",
	"url": "https://hibbard.eu/install-ubuntu-virtual-box/",
	"id": 1131,
	"parentId": "1119",
	"dateAddedLocal": "6/21/2021, 2:12:25 PM",
	"dateAddedUTC": "2021-06-21T18:12:25.000Z"
},{
	"index": 12,
	"title": "MONIT Easy, proactive monitoring of processes, programs, files, directories, filesystems and hosts | Monit",
	"url": "https://mmonit.com/monit/",
	"id": 1132,
	"parentId": "1119",
	"dateAddedLocal": "6/21/2021, 2:12:25 PM",
	"dateAddedUTC": "2021-06-21T18:12:25.000Z"
},{
	"index": 13,
	"title": "How To Set Up SSH Keys | DigitalOcean",
	"url": "https://www.digitalocean.com/community/tutorials/how-to-set-up-ssh-keys--2",
	"id": 1133,
	"parentId": "1119",
	"dateAddedLocal": "6/21/2021, 2:12:25 PM",
	"dateAddedUTC": "2021-06-21T18:12:25.000Z"
},{
	"index": 14,
	"title": "Rails Encrypted Credentials on Rails 5.2",
	"url": "https://www.engineyard.com/blog/rails-encrypted-credentials-on-rails-5.2",
	"id": 1134,
	"parentId": "1119",
	"dateAddedLocal": "6/21/2021, 2:12:25 PM",
	"dateAddedUTC": "2021-06-21T18:12:25.000Z"
},{
	"index": 15,
	"title": "capistrano/capistrano: Remote multi-server automation tool",
	"url": "https://github.com/capistrano/capistrano#install-the-capistrano-gem",
	"id": 1135,
	"parentId": "1119",
	"dateAddedLocal": "6/21/2021, 2:12:25 PM",
	"dateAddedUTC": "2021-06-21T18:12:25.000Z"
},{
	"index": 16,
	"title": "RailsConf 2014 - Deploying Rails is Easier Than it Looks by Ben Dixon - YouTube",
	"url": "https://www.youtube.com/watch?v=hTofBnxyBUU",
	"id": 1136,
	"parentId": "1119",
	"dateAddedLocal": "6/21/2021, 2:12:25 PM",
	"dateAddedUTC": "2021-06-21T18:12:25.000Z"
},{
	"index": 17,
	"title": "How to Configure NGINX to Proxy WebSockets - Serverlab",
	"url": "https://www.serverlab.ca/tutorials/linux/web-servers-linux/how-to-configure-nginx-for-websockets/",
	"id": 1137,
	"parentId": "1119",
	"dateAddedLocal": "6/21/2021, 2:12:25 PM",
	"dateAddedUTC": "2021-06-21T18:12:25.000Z"
},{
	"index": 41,
	"title": "design",
	"id": 1138,
	"parentId": "871",
	"dateAddedLocal": "6/21/2021, 2:28:37 PM",
	"dateAddedUTC": "2021-06-21T18:28:37.078Z"
},{
	"index": 0,
	"title": "A Pragmatic Approach to Design Principles | Julian Gaviria â€” Web Designer",
	"url": "https://julian.is/article/pragmatic-design-principles/",
	"id": 1139,
	"parentId": "1138",
	"dateAddedLocal": "6/21/2021, 2:12:25 PM",
	"dateAddedUTC": "2021-06-21T18:12:25.000Z"
},{
	"index": 1,
	"title": "Balsamiq. Rapid, effective and fun wireframing software. | Balsamiq",
	"url": "https://balsamiq.com/",
	"id": 1140,
	"parentId": "1138",
	"dateAddedLocal": "6/21/2021, 2:12:25 PM",
	"dateAddedUTC": "2021-06-21T18:12:25.000Z"
},{
	"index": 2,
	"title": "Bootstrap",
	"url": "http://getbootstrap.com/getting-started/#download",
	"id": 1141,
	"parentId": "1138",
	"dateAddedLocal": "6/21/2021, 2:12:25 PM",
	"dateAddedUTC": "2021-06-21T18:12:25.000Z"
},{
	"index": 3,
	"title": "Bootstrap-Getting started TEMPLATE",
	"url": "http://getbootstrap.com/getting-started/#template",
	"id": 1142,
	"parentId": "1138",
	"dateAddedLocal": "6/21/2021, 2:12:25 PM",
	"dateAddedUTC": "2021-06-21T18:12:25.000Z"
},{
	"index": 4,
	"title": "BootstrapCDN by MaxCDN",
	"url": "http://www.bootstrapcdn.com/",
	"id": 1143,
	"parentId": "1138",
	"dateAddedLocal": "6/21/2021, 2:12:25 PM",
	"dateAddedUTC": "2021-06-21T18:12:25.000Z"
},{
	"index": 5,
	"title": "Complete Guide to Reducing Page Weight",
	"url": "http://www.sitepoint.com/complete-guide-reducing-page-weight/",
	"id": 1144,
	"parentId": "1138",
	"dateAddedLocal": "6/21/2021, 2:12:25 PM",
	"dateAddedUTC": "2021-06-21T18:12:25.000Z"
},{
	"index": 6,
	"title": "CSS Gradient Generator - ColorZilla.com",
	"url": "http://www.colorzilla.com/gradient-editor/",
	"id": 1145,
	"parentId": "1138",
	"dateAddedLocal": "6/21/2021, 2:12:25 PM",
	"dateAddedUTC": "2021-06-21T18:12:25.000Z"
},{
	"index": 7,
	"title": "CSS Validation Service - W3C",
	"url": "http://jigsaw.w3.org/css-validator/#validate_by_input",
	"id": 1146,
	"parentId": "1138",
	"dateAddedLocal": "6/21/2021, 2:12:25 PM",
	"dateAddedUTC": "2021-06-21T18:12:25.000Z"
},{
	"index": 8,
	"title": "Design for Developers",
	"url": "http://designfordevelopers.co/",
	"id": 1147,
	"parentId": "1138",
	"dateAddedLocal": "6/21/2021, 2:12:25 PM",
	"dateAddedUTC": "2021-06-21T18:12:25.000Z"
},{
	"index": 9,
	"title": "draw.io",
	"url": "https://www.draw.io/",
	"id": 1148,
	"parentId": "1138",
	"dateAddedLocal": "6/21/2021, 2:12:25 PM",
	"dateAddedUTC": "2021-06-21T18:12:25.000Z"
},{
	"index": 10,
	"title": "Everything Easy is Hard Again â€“ Frank Chimero",
	"url": "https://frankchimero.com/writing/everything-easy-is-hard-again/",
	"id": 1149,
	"parentId": "1138",
	"dateAddedLocal": "6/21/2021, 2:12:25 PM",
	"dateAddedUTC": "2021-06-21T18:12:25.000Z"
},{
	"index": 11,
	"title": "Free stock photos Â· Pexels",
	"url": "https://www.pexels.com/",
	"id": 1150,
	"parentId": "1138",
	"dateAddedLocal": "6/21/2021, 2:12:25 PM",
	"dateAddedUTC": "2021-06-21T18:12:25.000Z"
},{
	"index": 12,
	"title": "Free Trial - Pixelmator Pro",
	"url": "https://www.pixelmator.com/pro/free-trial/",
	"id": 1151,
	"parentId": "1138",
	"dateAddedLocal": "6/21/2021, 2:12:25 PM",
	"dateAddedUTC": "2021-06-21T18:12:25.000Z"
},{
	"index": 13,
	"title": "Google Fonts",
	"url": "https://www.google.com/fonts",
	"id": 1152,
	"parentId": "1138",
	"dateAddedLocal": "6/21/2021, 2:12:25 PM",
	"dateAddedUTC": "2021-06-21T18:12:25.000Z"
},{
	"index": 14,
	"title": "Gradient CSS Generator | CSSmatic",
	"url": "http://www.cssmatic.com/gradient-generator#'\\-moz\\-linear\\-gradient\\%28left\\%2C\\%20rgba\\%28248\\%2C80\\%2C50\\%2C1\\%29\\%200\\%25\\%2C\\%20rgba\\%28241\\%2C111\\%2C92\\%2C1\\%29\\%2050\\%25\\%2C\\%20rgba\\%28246\\%2C41\\%2C12\\%2C1\\%29\\%2051\\%25\\%2C\\%20rgba\\%28240\\%2C47\\%2C23\\%2C1\\%29\\%2071\\%25\\%2C\\%20rgba\\%28231\\%2C56\\%2C39\\%2C1\\%29\\%20100\\%25\\%29\\%3B'",
	"id": 1153,
	"parentId": "1138",
	"dateAddedLocal": "6/21/2021, 2:12:25 PM",
	"dateAddedUTC": "2021-06-21T18:12:25.000Z"
},{
	"index": 15,
	"title": "HTML UTF-8 Reference",
	"url": "http://www.w3schools.com/charsets/ref_html_utf8.asp",
	"id": 1154,
	"parentId": "1138",
	"dateAddedLocal": "6/21/2021, 2:12:25 PM",
	"dateAddedUTC": "2021-06-21T18:12:25.000Z"
},{
	"index": 16,
	"title": "Image Meta Data",
	"url": "https://www.verexif.com/en/",
	"id": 1155,
	"parentId": "1138",
	"dateAddedLocal": "6/21/2021, 2:12:25 PM",
	"dateAddedUTC": "2021-06-21T18:12:25.000Z"
},{
	"index": 17,
	"title": "ISO 2 Letter Language Codes - SitePoint",
	"url": "http://www.sitepoint.com/web-foundations/iso-2-letter-language-codes/",
	"id": 1156,
	"parentId": "1138",
	"dateAddedLocal": "6/21/2021, 2:12:25 PM",
	"dateAddedUTC": "2021-06-21T18:12:25.000Z"
},{
	"index": 18,
	"title": "JavaScript Â· Bootstrap",
	"url": "http://getbootstrap.com/javascript/",
	"id": 1157,
	"parentId": "1138",
	"dateAddedLocal": "6/21/2021, 2:12:25 PM",
	"dateAddedUTC": "2021-06-21T18:12:25.000Z"
},{
	"index": 19,
	"title": "Media Queries & Common Sizes Cheat Sheet | BSideStudios",
	"url": "http://www.bsidestudios.com/blog/media-queries-common-sizes-cheat-sheet",
	"id": 1158,
	"parentId": "1138",
	"dateAddedLocal": "6/21/2021, 2:12:25 PM",
	"dateAddedUTC": "2021-06-21T18:12:25.000Z"
},{
	"index": 20,
	"title": "Media Queries for Standard Devices | CSS-Tricks",
	"url": "https://css-tricks.com/snippets/css/media-queries-for-standard-devices/",
	"id": 1159,
	"parentId": "1138",
	"dateAddedLocal": "6/21/2021, 2:12:25 PM",
	"dateAddedUTC": "2021-06-21T18:12:25.000Z"
},{
	"index": 21,
	"title": "Mockingbird - wireframe",
	"url": "https://gomockingbird.com/projects/g7artlo/4gXVnC",
	"id": 1160,
	"parentId": "1138",
	"dateAddedLocal": "6/21/2021, 2:12:25 PM",
	"dateAddedUTC": "2021-06-21T18:12:25.000Z"
},{
	"index": 22,
	"title": "Modernizr: the feature detection library for HTML5/CSS3",
	"url": "https://modernizr.com/",
	"id": 1161,
	"parentId": "1138",
	"dateAddedLocal": "6/21/2021, 2:12:25 PM",
	"dateAddedUTC": "2021-06-21T18:12:25.000Z"
},{
	"index": 23,
	"title": "normalize - cdnjs.com - The free and open source CDN for web related libraries to speed up your website!",
	"url": "https://cdnjs.com/libraries/normalize",
	"id": 1162,
	"parentId": "1138",
	"dateAddedLocal": "6/21/2021, 2:12:25 PM",
	"dateAddedUTC": "2021-06-21T18:12:25.000Z"
},{
	"index": 24,
	"title": "normalize.css â€“ Nicolas Gallagher",
	"url": "http://nicolasgallagher.com/about-normalize-css/",
	"id": 1163,
	"parentId": "1138",
	"dateAddedLocal": "6/21/2021, 2:12:25 PM",
	"dateAddedUTC": "2021-06-21T18:12:25.000Z"
},{
	"index": 25,
	"title": "Opera browser - The fast, safe web browser - Download free",
	"url": "http://www.opera.com/",
	"id": 1164,
	"parentId": "1138",
	"dateAddedLocal": "6/21/2021, 2:12:25 PM",
	"dateAddedUTC": "2021-06-21T18:12:25.000Z"
},{
	"index": 26,
	"title": "PlaceCorgi",
	"url": "http://placecorgi.com/",
	"id": 1165,
	"parentId": "1138",
	"dateAddedLocal": "6/21/2021, 2:12:25 PM",
	"dateAddedUTC": "2021-06-21T18:12:25.000Z"
},{
	"index": 27,
	"title": "The Ultimate Complete Final Social Media Sizing Cheat Sheet | Bounteous",
	"url": "https://www.bounteous.com/insights/2012/11/12/infographic-ultimate-complete-final-social-media-sizing-cheat-sheet/?ns=l",
	"id": 1166,
	"parentId": "1138",
	"dateAddedLocal": "6/21/2021, 2:12:25 PM",
	"dateAddedUTC": "2021-06-21T18:12:25.000Z"
},{
	"index": 28,
	"title": "transform - CSS",
	"url": "https://developer.mozilla.org/en-US/docs/Web/CSS/transform#Live_example",
	"id": 1167,
	"parentId": "1138",
	"dateAddedLocal": "6/21/2021, 2:12:25 PM",
	"dateAddedUTC": "2021-06-21T18:12:25.000Z"
},{
	"index": 29,
	"title": "twbs/bootstrap",
	"url": "https://github.com/twbs/bootstrap",
	"id": 1168,
	"parentId": "1138",
	"dateAddedLocal": "6/21/2021, 2:12:25 PM",
	"dateAddedUTC": "2021-06-21T18:12:25.000Z"
},{
	"index": 30,
	"title": "twitter-bootstrap - cdnjs.com - The free and open source CDN for web related libraries to speed up your website!",
	"url": "http://cdnjs.com/libraries/twitter-bootstrap",
	"id": 1169,
	"parentId": "1138",
	"dateAddedLocal": "6/21/2021, 2:12:25 PM",
	"dateAddedUTC": "2021-06-21T18:12:25.000Z"
},{
	"index": 31,
	"title": "Using Jekyll with Pages - User Documentation",
	"url": "https://help.github.com/articles/using-jekyll-with-pages/",
	"id": 1170,
	"parentId": "1138",
	"dateAddedLocal": "6/21/2021, 2:12:25 PM",
	"dateAddedUTC": "2021-06-21T18:12:25.000Z"
},{
	"index": 32,
	"title": "Validation Service",
	"url": "https://validator.w3.org/",
	"id": 1171,
	"parentId": "1138",
	"dateAddedLocal": "6/21/2021, 2:12:25 PM",
	"dateAddedUTC": "2021-06-21T18:12:25.000Z"
},{
	"index": 33,
	"title": "Noun Project - Icons for Everything",
	"url": "https://thenounproject.com/",
	"id": 1172,
	"parentId": "1138",
	"dateAddedLocal": "6/21/2021, 2:12:25 PM",
	"dateAddedUTC": "2021-06-21T18:12:25.000Z"
},{
	"index": 34,
	"title": "ImageOptim â€” better Save for Web",
	"url": "https://imageoptim.com/mac",
	"id": 1173,
	"parentId": "1138",
	"dateAddedLocal": "6/21/2021, 2:12:25 PM",
	"dateAddedUTC": "2021-06-21T18:12:25.000Z"
},{
	"index": 35,
	"title": "chroma.js palette helper",
	"url": "https://gka.github.io/palettes/#/9|s|00429d,96ffea,ffffe0|ffffe0,ff005e,93003a|1|1",
	"id": 1174,
	"parentId": "1138",
	"dateAddedLocal": "6/21/2021, 2:12:25 PM",
	"dateAddedUTC": "2021-06-21T18:12:25.000Z"
},{
	"index": 36,
	"title": "Behance :: Best of Behance",
	"url": "https://www.behance.net/",
	"id": 1175,
	"parentId": "1138",
	"dateAddedLocal": "6/21/2021, 2:12:25 PM",
	"dateAddedUTC": "2021-06-21T18:12:25.000Z"
},{
	"index": 42,
	"title": "devise",
	"id": 1176,
	"parentId": "871",
	"dateAddedLocal": "6/21/2021, 2:28:37 PM",
	"dateAddedUTC": "2021-06-21T18:28:37.082Z"
},{
	"index": 0,
	"title": "Devise RDOCS",
	"url": "http://www.rubydoc.info/github/plataformatec/devise/master/frames",
	"id": 1177,
	"parentId": "1176",
	"dateAddedLocal": "6/21/2021, 2:12:25 PM",
	"dateAddedUTC": "2021-06-21T18:12:25.000Z"
},{
	"index": 1,
	"title": "https://launchschool.com/blog/how-to-use-devise-in-rails-for-authentication",
	"url": "https://launchschool.com/blog/how-to-use-devise-in-rails-for-authentication",
	"id": 1178,
	"parentId": "1176",
	"dateAddedLocal": "6/21/2021, 2:12:25 PM",
	"dateAddedUTC": "2021-06-21T18:12:25.000Z"
},{
	"index": 2,
	"title": "Learn - Devise",
	"url": "https://learn.co/tracks/full-stack-web-dev-with-react/rails/authentication/devise",
	"id": 1179,
	"parentId": "1176",
	"dateAddedLocal": "6/21/2021, 2:12:25 PM",
	"dateAddedUTC": "2021-06-21T18:12:25.000Z"
},{
	"index": 3,
	"title": "Module: Devise::Models::DatabaseAuthenticatable â€” Documentation for plataformatec/devise (master)",
	"url": "http://www.rubydoc.info/github/plataformatec/devise/master/Devise/Models/DatabaseAuthenticatable",
	"id": 1180,
	"parentId": "1176",
	"dateAddedLocal": "6/21/2021, 2:12:25 PM",
	"dateAddedUTC": "2021-06-21T18:12:25.000Z"
},{
	"index": 4,
	"title": "plataformatec/devise: Flexible authentication solution for Rails with Warden.",
	"url": "https://github.com/plataformatec/devise",
	"id": 1181,
	"parentId": "1176",
	"dateAddedLocal": "6/21/2021, 2:12:25 PM",
	"dateAddedUTC": "2021-06-21T18:12:25.000Z"
},{
	"index": 5,
	"title": "Ruby on Rails api authentication with devise and Doorkeeper - DEV Community",
	"url": "https://dev.to/codesalley/rails-api-authentication-with-devise-and-doorkeeper-16oh",
	"id": 3033,
	"parentId": "1176",
	"dateAddedLocal": "10/16/2024, 9:22:43 PM",
	"dateAddedUTC": "2024-10-17T01:22:43.126Z"
},{
	"index": 43,
	"title": "devops",
	"id": 1182,
	"parentId": "871",
	"dateAddedLocal": "6/21/2021, 2:28:37 PM",
	"dateAddedUTC": "2021-06-21T18:28:37.083Z"
},{
	"index": 0,
	"title": "Crontab â€“ Quick Reference",
	"url": "https://www.adminschoice.com/crontab-quick-reference",
	"id": 1183,
	"parentId": "1182",
	"dateAddedLocal": "6/21/2021, 2:12:25 PM",
	"dateAddedUTC": "2021-06-21T18:12:25.000Z"
},{
	"index": 1,
	"title": "Nagios - IT infrastructure",
	"url": "https://www.nagios.com/about-nagios-enterprises/",
	"id": 1184,
	"parentId": "1182",
	"dateAddedLocal": "6/21/2021, 2:12:25 PM",
	"dateAddedUTC": "2021-06-21T18:12:25.000Z"
},{
	"index": 44,
	"title": "digitalocean",
	"id": 1185,
	"parentId": "871",
	"dateAddedLocal": "6/21/2021, 2:28:37 PM",
	"dateAddedUTC": "2021-06-21T18:28:37.083Z"
},{
	"index": 0,
	"title": "How to Upload SSH Public Keys to a DigitalOcean Account :: DigitalOcean Product Documentation",
	"url": "https://www.digitalocean.com/docs/droplets/how-to/add-ssh-keys/to-account/",
	"id": 1186,
	"parentId": "1185",
	"dateAddedLocal": "6/21/2021, 2:12:25 PM",
	"dateAddedUTC": "2021-06-21T18:12:25.000Z"
},{
	"index": 45,
	"title": "django",
	"id": 1187,
	"parentId": "871",
	"dateAddedLocal": "6/21/2021, 2:28:37 PM",
	"dateAddedUTC": "2021-06-21T18:28:37.083Z"
},{
	"index": 0,
	"title": "6. Modules â€” Python 3.7.3 documentation",
	"url": "https://docs.python.org/3/tutorial/modules.html#tut-packages",
	"id": 1188,
	"parentId": "1187",
	"dateAddedLocal": "6/21/2021, 2:12:25 PM",
	"dateAddedUTC": "2021-06-21T18:12:25.000Z"
},{
	"index": 1,
	"title": "Plotly",
	"url": "https://go.plot.ly/demo-dash?_ga=2.52438888.1566795367.1561501870-911711292.1557879204",
	"id": 1189,
	"parentId": "1187",
	"dateAddedLocal": "6/21/2021, 2:12:25 PM",
	"dateAddedUTC": "2021-06-21T18:12:25.000Z"
},{
	"index": 2,
	"title": "Django Content Management System | Wagtail CMS",
	"url": "https://wagtail.io/",
	"id": 1190,
	"parentId": "1187",
	"dateAddedLocal": "6/21/2021, 2:12:25 PM",
	"dateAddedUTC": "2021-06-21T18:12:25.000Z"
},{
	"index": 3,
	"title": "docs.djangoproject.com",
	"url": "https://docs.djangoproject.com/en/2.2/ref/django-admin/",
	"id": 1191,
	"parentId": "1187",
	"dateAddedLocal": "6/21/2021, 2:12:25 PM",
	"dateAddedUTC": "2021-06-21T18:12:25.000Z"
},{
	"index": 4,
	"title": "url dispatcher",
	"url": "https://docs.djangoproject.com/en/2.2/topics/http/urls/",
	"id": 1192,
	"parentId": "1187",
	"dateAddedLocal": "6/21/2021, 2:12:25 PM",
	"dateAddedUTC": "2021-06-21T18:12:25.000Z"
},{
	"index": 5,
	"title": "Shiny - Gallery",
	"url": "https://shiny.rstudio.com/gallery/",
	"id": 1193,
	"parentId": "1187",
	"dateAddedLocal": "6/21/2021, 2:12:25 PM",
	"dateAddedUTC": "2021-06-21T18:12:25.000Z"
},{
	"index": 6,
	"title": "",
	"url": "http://127.0.0.1:3000/announcements/1",
	"id": 1194,
	"parentId": "1187",
	"dateAddedLocal": "6/21/2021, 2:12:25 PM",
	"dateAddedUTC": "2021-06-21T18:12:25.000Z"
},{
	"index": 46,
	"title": "dns",
	"id": 3010,
	"parentId": "871",
	"dateAddedLocal": "10/11/2024, 8:18:30 PM",
	"dateAddedUTC": "2024-10-12T00:18:30.258Z"
},{
	"index": 0,
	"title": "DNS Checker - DNS Check Propagation Tool",
	"url": "https://dnschecker.org/#A/voter.smithwebtek.com",
	"id": 3009,
	"parentId": "3010",
	"dateAddedLocal": "10/11/2024, 8:18:00 PM",
	"dateAddedUTC": "2024-10-12T00:18:00.276Z"
},{
	"index": 1,
	"title": "DNS Checker - DNS Check Propagation Tool",
	"url": "https://dnschecker.org/#A/smithwebtek.com",
	"id": 3035,
	"parentId": "3010",
	"dateAddedLocal": "10/19/2024, 4:33:34 PM",
	"dateAddedUTC": "2024-10-19T20:33:34.138Z"
},{
	"index": 2,
	"title": "dig Command in Linux with Examples",
	"url": "https://phoenixnap.com/kb/linux-dig-command-examples",
	"id": 3037,
	"parentId": "3010",
	"dateAddedLocal": "10/19/2024, 4:34:02 PM",
	"dateAddedUTC": "2024-10-19T20:34:02.395Z"
},{
	"index": 47,
	"title": "docker",
	"id": 1195,
	"parentId": "871",
	"dateAddedLocal": "6/21/2021, 2:28:37 PM",
	"dateAddedUTC": "2021-06-21T18:28:37.084Z"
},{
	"index": 0,
	"title": "Docker Hub",
	"url": "https://hub.docker.com/",
	"id": 1196,
	"parentId": "1195",
	"dateAddedLocal": "6/21/2021, 2:12:25 PM",
	"dateAddedUTC": "2021-06-21T18:12:25.000Z"
},{
	"index": 1,
	"title": "Docker + Rails 6 Application setup",
	"url": "https://rubyinrails.com/2019/03/29/dockerify-rails-6-application-setup/",
	"id": 1197,
	"parentId": "1195",
	"dateAddedLocal": "6/21/2021, 2:12:25 PM",
	"dateAddedUTC": "2021-06-21T18:12:25.000Z"
},{
	"index": 2,
	"title": "Docker Hub",
	"url": "https://hub.docker.com/",
	"id": 1198,
	"parentId": "1195",
	"dateAddedLocal": "6/21/2021, 2:12:25 PM",
	"dateAddedUTC": "2021-06-21T18:12:25.000Z"
},{
	"index": 48,
	"title": "document-convo",
	"id": 1199,
	"parentId": "871",
	"dateAddedLocal": "6/21/2021, 2:28:37 PM",
	"dateAddedUTC": "2021-06-21T18:28:37.084Z"
},{
	"index": 0,
	"title": "using pandoc with rails - Google Search",
	"url": "https://www.google.com/webhp?sourceid=chrome-instant&rlz=1C5CHFA_enUS700US700&ion=1&espv=2&ie=UTF-8#q=using+pandoc+with+rails",
	"id": 1200,
	"parentId": "1199",
	"dateAddedLocal": "6/21/2021, 2:12:25 PM",
	"dateAddedUTC": "2021-06-21T18:12:25.000Z"
},{
	"index": 49,
	"title": "elixir",
	"id": 2216,
	"parentId": "871",
	"dateAddedLocal": "6/21/2021, 2:28:37 PM",
	"dateAddedUTC": "2021-06-21T18:28:37.172Z"
},{
	"index": 0,
	"title": "Plug â€” Plug v1.11.1",
	"url": "https://hexdocs.pm/plug/readme.html",
	"id": 2217,
	"parentId": "2216",
	"dateAddedLocal": "6/21/2021, 2:12:25 PM",
	"dateAddedUTC": "2021-06-21T18:12:25.000Z"
},{
	"index": 1,
	"title": "The Elixir programming language",
	"url": "https://elixir-lang.org/",
	"id": 2218,
	"parentId": "2216",
	"dateAddedLocal": "6/21/2021, 2:12:25 PM",
	"dateAddedUTC": "2021-06-21T18:12:25.000Z"
},{
	"index": 50,
	"title": "ember",
	"id": 1201,
	"parentId": "871",
	"dateAddedLocal": "6/21/2021, 2:28:37 PM",
	"dateAddedUTC": "2021-06-21T18:28:37.084Z"
},{
	"index": 0,
	"title": "Ember.js - A framework for ambitious web developers",
	"url": "https://emberjs.com/",
	"id": 1202,
	"parentId": "1201",
	"dateAddedLocal": "6/21/2021, 2:12:25 PM",
	"dateAddedUTC": "2021-06-21T18:12:25.000Z"
},{
	"index": 1,
	"title": "Ember.js - Getting Started: Quick Start",
	"url": "https://guides.emberjs.com/v3.1.0/getting-started/quick-start/",
	"id": 1203,
	"parentId": "1201",
	"dateAddedLocal": "6/21/2021, 2:12:25 PM",
	"dateAddedUTC": "2021-06-21T18:12:25.000Z"
},{
	"index": 2,
	"title": "Ember.js Essential Training",
	"url": "https://www.lynda.com/Ember-js-tutorials/Ember-js-Essential-Training/480960-2.html",
	"id": 1204,
	"parentId": "1201",
	"dateAddedLocal": "6/21/2021, 2:12:25 PM",
	"dateAddedUTC": "2021-06-21T18:12:25.000Z"
},{
	"index": 3,
	"title": "Quick Start - Getting Started - Ember Guides",
	"url": "https://guides.emberjs.com/release/getting-started/quick-start/",
	"id": 1205,
	"parentId": "1201",
	"dateAddedLocal": "6/21/2021, 2:12:25 PM",
	"dateAddedUTC": "2021-06-21T18:12:25.000Z"
},{
	"index": 4,
	"title": "Build Web Apps Using EmberJS: The Complete Course | Udemy",
	"url": "https://www.udemy.com/course/build-web-apps-using-emberjs-the-complete-course/learn/lecture/4128832#questions",
	"id": 1206,
	"parentId": "1201",
	"dateAddedLocal": "6/21/2021, 2:12:25 PM",
	"dateAddedUTC": "2021-06-21T18:12:25.000Z"
},{
	"index": 5,
	"title": "handlebars.js - VSCODE - Code formatting in *.hbs files - Stack Overflow",
	"url": "https://stackoverflow.com/questions/34433915/vscode-code-formatting-in-hbs-files",
	"id": 1207,
	"parentId": "1201",
	"dateAddedLocal": "6/21/2021, 2:12:25 PM",
	"dateAddedUTC": "2021-06-21T18:12:25.000Z"
},{
	"index": 51,
	"title": "emmet",
	"id": 1208,
	"parentId": "871",
	"dateAddedLocal": "6/21/2021, 2:28:37 PM",
	"dateAddedUTC": "2021-06-21T18:28:37.085Z"
},{
	"index": 0,
	"title": "Emmet 2.0 in Visual Studio Code",
	"url": "https://code.visualstudio.com/blogs/2017/08/07/emmet-2.0",
	"id": 1209,
	"parentId": "1208",
	"dateAddedLocal": "6/21/2021, 2:12:25 PM",
	"dateAddedUTC": "2021-06-21T18:12:25.000Z"
},{
	"index": 52,
	"title": "enum",
	"id": 1210,
	"parentId": "871",
	"dateAddedLocal": "6/21/2021, 2:28:37 PM",
	"dateAddedUTC": "2021-06-21T18:28:37.085Z"
},{
	"index": 0,
	"title": "Enum",
	"url": "https://naturaily.com/blog/ruby-on-rails-enum",
	"id": 1211,
	"parentId": "1210",
	"dateAddedLocal": "6/21/2021, 2:12:25 PM",
	"dateAddedUTC": "2021-06-21T18:12:25.000Z"
},{
	"index": 53,
	"title": "env",
	"id": 1212,
	"parentId": "871",
	"dateAddedLocal": "6/21/2021, 2:28:37 PM",
	"dateAddedUTC": "2021-06-21T18:28:37.085Z"
},{
	"index": 0,
	"title": "dotenv - npm",
	"url": "https://www.npmjs.com/package/dotenv",
	"id": 1213,
	"parentId": "1212",
	"dateAddedLocal": "6/21/2021, 2:12:25 PM",
	"dateAddedUTC": "2021-06-21T18:12:25.000Z"
},{
	"index": 1,
	"title": "ENV credentials",
	"url": "https://medium.com/@thejasonfile/hide-your-api-keys-hide-your-skype-api-keys-884427746f9c",
	"id": 1214,
	"parentId": "1212",
	"dateAddedLocal": "6/21/2021, 2:12:25 PM",
	"dateAddedUTC": "2021-06-21T18:12:25.000Z"
},{
	"index": 2,
	"title": "Exploring the DotEnv Gem: A handy guide â€“ Ryan McNeely â€“ Medium",
	"url": "https://medium.com/@rmcneely/exploring-the-dotenv-gem-a-handy-guide-20a0d7541883",
	"id": 1215,
	"parentId": "1212",
	"dateAddedLocal": "6/21/2021, 2:12:25 PM",
	"dateAddedUTC": "2021-06-21T18:12:25.000Z"
},{
	"index": 3,
	"title": "How can I completely remove a file from a git repository? - Stack Overflow",
	"url": "https://stackoverflow.com/questions/3458685/how-can-i-completely-remove-a-file-from-a-git-repository",
	"id": 1216,
	"parentId": "1212",
	"dateAddedLocal": "6/21/2021, 2:12:25 PM",
	"dateAddedUTC": "2021-06-21T18:12:25.000Z"
},{
	"index": 4,
	"title": "How to safely store API keys in Rails apps | Arkency Blog",
	"url": "https://blog.arkency.com/2017/07/how-to-safely-store-api-keys-in-rails-apps/",
	"id": 1217,
	"parentId": "1212",
	"dateAddedLocal": "6/21/2021, 2:12:25 PM",
	"dateAddedUTC": "2021-06-21T18:12:25.000Z"
},{
	"index": 5,
	"title": "Removing sensitive data from a repository - User Documentation",
	"url": "https://help.github.com/articles/removing-sensitive-data-from-a-repository/",
	"id": 1218,
	"parentId": "1212",
	"dateAddedLocal": "6/21/2021, 2:12:25 PM",
	"dateAddedUTC": "2021-06-21T18:12:25.000Z"
},{
	"index": 54,
	"title": "equity training",
	"id": 1219,
	"parentId": "871",
	"dateAddedLocal": "6/21/2021, 2:28:37 PM",
	"dateAddedUTC": "2021-06-21T18:28:37.086Z"
},{
	"index": 0,
	"title": "Action Plan â€¢ Racial Equity Tools",
	"url": "https://www.racialequitytools.org/plan/action-plan/action-plan-examples",
	"id": 1220,
	"parentId": "1219",
	"dateAddedLocal": "6/21/2021, 2:12:25 PM",
	"dateAddedUTC": "2021-06-21T18:12:25.000Z"
},{
	"index": 1,
	"title": "Challenging White Dominant Culture: Time to Look in the Mirror | CompassPoint",
	"url": "https://www.compasspoint.org/blog/challenging-white-dominant-culture-time-look-mirror",
	"id": 1221,
	"parentId": "1219",
	"dateAddedLocal": "6/21/2021, 2:12:25 PM",
	"dateAddedUTC": "2021-06-21T18:12:25.000Z"
},{
	"index": 2,
	"title": "Fundamentals â€¢ Racial Equity Tools",
	"url": "https://www.racialequitytools.org/fundamentals",
	"id": 1222,
	"parentId": "1219",
	"dateAddedLocal": "6/21/2021, 2:12:25 PM",
	"dateAddedUTC": "2021-06-21T18:12:25.000Z"
},{
	"index": 3,
	"title": "G10-courageous-conversation-protocol-overview.pdf",
	"url": "http://iel.org/sites/default/files/G10-courageous-conversation-protocol-overview.pdf",
	"id": 1223,
	"parentId": "1219",
	"dateAddedLocal": "6/21/2021, 2:12:25 PM",
	"dateAddedUTC": "2021-06-21T18:12:25.000Z"
},{
	"index": 4,
	"title": "https://www.bridgespan.org/bridgespan/Images/articles/role-senior-leaders-building-race-equity-culture/ProInspire-Equity-in-Center-publication-digital-July-2018.pdf",
	"url": "https://www.bridgespan.org/bridgespan/Images/articles/role-senior-leaders-building-race-equity-culture/ProInspire-Equity-in-Center-publication-digital-July-2018.pdf",
	"id": 1224,
	"parentId": "1219",
	"dateAddedLocal": "6/21/2021, 2:12:25 PM",
	"dateAddedUTC": "2021-06-21T18:12:25.000Z"
},{
	"index": 5,
	"title": "https://www.puttingracismonthetable.org",
	"url": "https://www.puttingracismonthetable.org/",
	"id": 1225,
	"parentId": "1219",
	"dateAddedLocal": "6/21/2021, 2:12:25 PM",
	"dateAddedUTC": "2021-06-21T18:12:25.000Z"
},{
	"index": 6,
	"title": "Implicit Bias Explained - Perception Institute",
	"url": "https://perception.org/research/implicit-bias/",
	"id": 1226,
	"parentId": "1219",
	"dateAddedLocal": "6/21/2021, 2:12:25 PM",
	"dateAddedUTC": "2021-06-21T18:12:25.000Z"
},{
	"index": 7,
	"title": "Implicit bias in hiring",
	"url": "https://hbr.org/2017/06/7-practical-ways-to-reduce-bias-in-your-hiring-process",
	"id": 1227,
	"parentId": "1219",
	"dateAddedLocal": "6/21/2021, 2:12:25 PM",
	"dateAddedUTC": "2021-06-21T18:12:25.000Z"
},{
	"index": 8,
	"title": "Leadership for Educational Equity",
	"url": "https://educationalequity.org/",
	"id": 1228,
	"parentId": "1219",
	"dateAddedLocal": "6/21/2021, 2:12:25 PM",
	"dateAddedUTC": "2021-06-21T18:12:25.000Z"
},{
	"index": 9,
	"title": "ProInspire",
	"url": "https://www.equityinthecenter.org/",
	"id": 1229,
	"parentId": "1219",
	"dateAddedLocal": "6/21/2021, 2:12:25 PM",
	"dateAddedUTC": "2021-06-21T18:12:25.000Z"
},{
	"index": 10,
	"title": "racetolead.org",
	"url": "http://racetolead.org/",
	"id": 1230,
	"parentId": "1219",
	"dateAddedLocal": "6/21/2021, 2:12:25 PM",
	"dateAddedUTC": "2021-06-21T18:12:25.000Z"
},{
	"index": 11,
	"title": "Report: Day-to-Day Experiences of Emotional Tax Among Women and Men of Color in the Workplace - Catalyst",
	"url": "https://www.catalyst.org/research/day-to-day-experiences-of-emotional-tax-among-women-and-men-of-color-in-the-workplace/",
	"id": 1231,
	"parentId": "1219",
	"dateAddedLocal": "6/21/2021, 2:12:25 PM",
	"dateAddedUTC": "2021-06-21T18:12:25.000Z"
},{
	"index": 12,
	"title": "Year Up - Closing the Opportunity Divide",
	"url": "https://www.yearup.org/",
	"id": 1232,
	"parentId": "1219",
	"dateAddedLocal": "6/21/2021, 2:12:25 PM",
	"dateAddedUTC": "2021-06-21T18:12:25.000Z"
},{
	"index": 55,
	"title": "erd",
	"id": 1233,
	"parentId": "871",
	"dateAddedLocal": "6/21/2021, 2:28:37 PM",
	"dateAddedUTC": "2021-06-21T18:28:37.087Z"
},{
	"index": 0,
	"title": "dbdiagram.io - Database Relationship Diagrams Design Tool",
	"url": "https://dbdiagram.io/home?utm_source=holistics&utm_medium=rails_erd_blog",
	"id": 1234,
	"parentId": "1233",
	"dateAddedLocal": "6/21/2021, 2:12:25 PM",
	"dateAddedUTC": "2021-06-21T18:12:25.000Z"
},{
	"index": 1,
	"title": "RailRoad diagrams generator",
	"url": "http://railroad.rubyforge.org/#examples",
	"id": 1235,
	"parentId": "1233",
	"dateAddedLocal": "6/21/2021, 2:12:25 PM",
	"dateAddedUTC": "2021-06-21T18:12:25.000Z"
},{
	"index": 2,
	"title": "Rails ERD â€“ Customisation options",
	"url": "https://voormedia.github.io/rails-erd/customise.html",
	"id": 1236,
	"parentId": "1233",
	"dateAddedLocal": "6/21/2021, 2:12:25 PM",
	"dateAddedUTC": "2021-06-21T18:12:25.000Z"
},{
	"index": 3,
	"title": "voormedia/rails-erd: Generate Entity-Relationship Diagrams for Rails applications",
	"url": "https://github.com/voormedia/rails-erd",
	"id": 1237,
	"parentId": "1233",
	"dateAddedLocal": "6/21/2021, 2:12:25 PM",
	"dateAddedUTC": "2021-06-21T18:12:25.000Z"
},{
	"index": 56,
	"title": "esri",
	"id": 1238,
	"parentId": "871",
	"dateAddedLocal": "6/21/2021, 2:28:37 PM",
	"dateAddedUTC": "2021-06-21T18:28:37.087Z"
},{
	"index": 0,
	"title": "Import SketchUp file | GeoNet, The Esri Community | GIS and Geospatial Professional Community",
	"url": "https://community.esri.com/thread/220445-import-sketchup-file",
	"id": 1239,
	"parentId": "1238",
	"dateAddedLocal": "6/21/2021, 2:12:25 PM",
	"dateAddedUTC": "2021-06-21T18:12:25.000Z"
},{
	"index": 57,
	"title": "express",
	"id": 1240,
	"parentId": "871",
	"dateAddedLocal": "6/21/2021, 2:28:37 PM",
	"dateAddedUTC": "2021-06-21T18:28:37.087Z"
},{
	"index": 0,
	"title": "Express - Node.js web application framework",
	"url": "https://expressjs.com/",
	"id": 1241,
	"parentId": "1240",
	"dateAddedLocal": "6/21/2021, 2:12:25 PM",
	"dateAddedUTC": "2021-06-21T18:12:25.000Z"
},{
	"index": 58,
	"title": "facebook",
	"id": 1242,
	"parentId": "871",
	"dateAddedLocal": "6/21/2021, 2:28:37 PM",
	"dateAddedUTC": "2021-06-21T18:28:37.087Z"
},{
	"index": 0,
	"title": "Facebook for Developers",
	"url": "https://developers.facebook.com/",
	"id": 1243,
	"parentId": "1242",
	"dateAddedLocal": "6/21/2021, 2:12:25 PM",
	"dateAddedUTC": "2021-06-21T18:12:25.000Z"
},{
	"index": 59,
	"title": "fetch",
	"id": 1244,
	"parentId": "871",
	"dateAddedLocal": "6/21/2021, 2:28:37 PM",
	"dateAddedUTC": "2021-06-21T18:28:37.088Z"
},{
	"index": 0,
	"title": "Fetch vs. Axios.js for making http requests â€“ Jason Arnold â€“ Medium",
	"url": "https://medium.com/@thejasonfile/fetch-vs-axios-js-for-making-http-requests-2b261cdd3af5",
	"id": 1245,
	"parentId": "1244",
	"dateAddedLocal": "6/21/2021, 2:12:25 PM",
	"dateAddedUTC": "2021-06-21T18:12:25.000Z"
},{
	"index": 60,
	"title": "file_upload",
	"id": 1246,
	"parentId": "871",
	"dateAddedLocal": "6/21/2021, 2:28:37 PM",
	"dateAddedUTC": "2021-06-21T18:28:37.088Z"
},{
	"index": 0,
	"title": "Handling file upload using Ruby on Rails 5 API (Example) | hack.guides()",
	"url": "https://www.pluralsight.com/guides/ruby-ruby-on-rails/handling-file-upload-using-ruby-on-rails-5-api#using-base64-strings-in-json",
	"id": 1247,
	"parentId": "1246",
	"dateAddedLocal": "6/21/2021, 2:12:25 PM",
	"dateAddedUTC": "2021-06-21T18:12:25.000Z"
},{
	"index": 1,
	"title": "Ruby on Rails File Uploading",
	"url": "https://www.tutorialspoint.com/ruby-on-rails/rails-file-uploading.htm",
	"id": 1248,
	"parentId": "1246",
	"dateAddedLocal": "6/21/2021, 2:12:25 PM",
	"dateAddedUTC": "2021-06-21T18:12:25.000Z"
},{
	"index": 61,
	"title": "firebase",
	"id": 1249,
	"parentId": "871",
	"dateAddedLocal": "6/21/2021, 2:28:37 PM",
	"dateAddedUTC": "2021-06-21T18:28:37.088Z"
},{
	"index": 0,
	"title": "Firebase console",
	"url": "https://console.firebase.google.com/u/0/?pli=1",
	"id": 1250,
	"parentId": "1249",
	"dateAddedLocal": "6/21/2021, 2:12:25 PM",
	"dateAddedUTC": "2021-06-21T18:12:25.000Z"
},{
	"index": 1,
	"title": "Installation & Setup in JavaScript Â |Â  Firebase Realtime Database Â |Â  Firebase",
	"url": "https://firebase.google.com/docs/database/web/start",
	"id": 1251,
	"parentId": "1249",
	"dateAddedLocal": "6/21/2021, 2:12:25 PM",
	"dateAddedUTC": "2021-06-21T18:12:25.000Z"
},{
	"index": 62,
	"title": "fish-shell",
	"id": 1252,
	"parentId": "871",
	"dateAddedLocal": "6/21/2021, 2:28:37 PM",
	"dateAddedUTC": "2021-06-21T18:28:37.088Z"
},{
	"index": 0,
	"title": "fish shell",
	"url": "https://fishshell.com/",
	"id": 1253,
	"parentId": "1252",
	"dateAddedLocal": "6/21/2021, 2:12:25 PM",
	"dateAddedUTC": "2021-06-21T18:12:25.000Z"
},{
	"index": 63,
	"title": "front end",
	"id": 2175,
	"parentId": "871",
	"dateAddedLocal": "6/21/2021, 2:28:37 PM",
	"dateAddedUTC": "2021-06-21T18:28:37.166Z"
},{
	"index": 0,
	"title": "An Overview of HTML5 Semantics by Michelle on CodePen",
	"url": "https://codepen.io/mi-lee/post/an-overview-of-html5-semantics",
	"id": 2176,
	"parentId": "2175",
	"dateAddedLocal": "6/21/2021, 2:12:25 PM",
	"dateAddedUTC": "2021-06-21T18:12:25.000Z"
},{
	"index": 1,
	"title": "arta practices",
	"url": "https://www.w3.org/TR/wai-aria-practices-1.1/",
	"id": 2177,
	"parentId": "2175",
	"dateAddedLocal": "6/21/2021, 2:12:25 PM",
	"dateAddedUTC": "2021-06-21T18:12:25.000Z"
},{
	"index": 2,
	"title": "Emmet â€” the essential toolkit for web-developers",
	"url": "https://emmet.io/",
	"id": 2178,
	"parentId": "2175",
	"dateAddedLocal": "6/21/2021, 2:12:25 PM",
	"dateAddedUTC": "2021-06-21T18:12:25.000Z"
},{
	"index": 3,
	"title": "frontend-manual/head-tags-recomended.html at master Â· oddcamp/frontend-manual",
	"url": "https://github.com/oddcamp/frontend-manual/blob/master/examples/head-tags-recomended.html",
	"id": 2179,
	"parentId": "2175",
	"dateAddedLocal": "6/21/2021, 2:12:25 PM",
	"dateAddedUTC": "2021-06-21T18:12:25.000Z"
},{
	"index": 4,
	"title": "frontend-manual/manifest.json at master Â· oddcamp/frontend-manual",
	"url": "https://github.com/oddcamp/frontend-manual/blob/master/examples/manifest.json",
	"id": 2180,
	"parentId": "2175",
	"dateAddedLocal": "6/21/2021, 2:12:25 PM",
	"dateAddedUTC": "2021-06-21T18:12:25.000Z"
},{
	"index": 5,
	"title": "getbem.com",
	"url": "http://getbem.com/",
	"id": 2181,
	"parentId": "2175",
	"dateAddedLocal": "6/21/2021, 2:12:25 PM",
	"dateAddedUTC": "2021-06-21T18:12:25.000Z"
},{
	"index": 6,
	"title": "sass-utils#units",
	"url": "https://github.com/kollegorna/sass-utils#units",
	"id": 2182,
	"parentId": "2175",
	"dateAddedLocal": "6/21/2021, 2:12:25 PM",
	"dateAddedUTC": "2021-06-21T18:12:25.000Z"
},{
	"index": 7,
	"title": "Introduction to ARIA Â |Â  Web Fundamentals Â |Â  Google Developers",
	"url": "https://developers.google.com/web/fundamentals/accessibility/semantics-aria",
	"id": 2183,
	"parentId": "2175",
	"dateAddedLocal": "6/21/2021, 2:12:25 PM",
	"dateAddedUTC": "2021-06-21T18:12:25.000Z"
},{
	"index": 8,
	"title": "linters",
	"url": "https://github.com/oddcamp/frontend-manual#linters",
	"id": 2184,
	"parentId": "2175",
	"dateAddedLocal": "6/21/2021, 2:12:25 PM",
	"dateAddedUTC": "2021-06-21T18:12:25.000Z"
},{
	"index": 9,
	"title": "Normalize.css: Make browsers render all elements more consistently.",
	"url": "https://necolas.github.io/normalize.css/",
	"id": 2185,
	"parentId": "2175",
	"dateAddedLocal": "6/21/2021, 2:12:25 PM",
	"dateAddedUTC": "2021-06-21T18:12:25.000Z"
},{
	"index": 10,
	"title": "Now hiring: Sr Front End Developer | Careers at Odd Camp",
	"url": "https://www.oddcamp.com/careers/frontend",
	"id": 2186,
	"parentId": "2175",
	"dateAddedLocal": "6/21/2021, 2:12:25 PM",
	"dateAddedUTC": "2021-06-21T18:12:25.000Z"
},{
	"index": 11,
	"title": "Odd Camp â€“ Design & Engineering",
	"url": "https://www.oddcamp.com/",
	"id": 2187,
	"parentId": "2175",
	"dateAddedLocal": "6/21/2021, 2:12:25 PM",
	"dateAddedUTC": "2021-06-21T18:12:25.000Z"
},{
	"index": 12,
	"title": "oddcamp/design-system-boilerplate: Kollegorna's boilerplate for design systems",
	"url": "https://github.com/oddcamp/design-system-boilerplate",
	"id": 2188,
	"parentId": "2175",
	"dateAddedLocal": "6/21/2021, 2:12:25 PM",
	"dateAddedUTC": "2021-06-21T18:12:25.000Z"
},{
	"index": 13,
	"title": "oddcamp/frontend-manual: Kollegorna's handbook for frontend people",
	"url": "https://github.com/oddcamp/frontend-manual",
	"id": 2189,
	"parentId": "2175",
	"dateAddedLocal": "6/21/2021, 2:12:25 PM",
	"dateAddedUTC": "2021-06-21T18:12:25.000Z"
},{
	"index": 14,
	"title": "oddcamp/frontend-manual: Kollegorna's handbook for frontend people",
	"url": "https://github.com/oddcamp/frontend-manual",
	"id": 2190,
	"parentId": "2175",
	"dateAddedLocal": "6/21/2021, 2:12:25 PM",
	"dateAddedUTC": "2021-06-21T18:12:25.000Z"
},{
	"index": 15,
	"title": "oddcamp/js-utils: Odd Camp's JavaScript utilities",
	"url": "https://github.com/oddcamp/js-utils",
	"id": 2191,
	"parentId": "2175",
	"dateAddedLocal": "6/21/2021, 2:12:25 PM",
	"dateAddedUTC": "2021-06-21T18:12:25.000Z"
},{
	"index": 16,
	"title": "polished.js.org",
	"url": "https://polished.js.org/docs/#rem",
	"id": 2192,
	"parentId": "2175",
	"dateAddedLocal": "6/21/2021, 2:12:25 PM",
	"dateAddedUTC": "2021-06-21T18:12:25.000Z"
},{
	"index": 17,
	"title": "PX, EM or REM Media Queries? | Zell Liew",
	"url": "https://zellwk.com/blog/media-query-units/",
	"id": 2193,
	"parentId": "2175",
	"dateAddedLocal": "6/21/2021, 2:12:25 PM",
	"dateAddedUTC": "2021-06-21T18:12:25.000Z"
},{
	"index": 18,
	"title": "Raleway - Google Fonts",
	"url": "https://fonts.google.com/specimen/Raleway",
	"id": 2194,
	"parentId": "2175",
	"dateAddedLocal": "6/21/2021, 2:12:25 PM",
	"dateAddedUTC": "2021-06-21T18:12:25.000Z"
},{
	"index": 19,
	"title": "Smart Quotes for Smart People",
	"url": "https://smartquotesforsmartpeople.com/",
	"id": 2195,
	"parentId": "2175",
	"dateAddedLocal": "6/21/2021, 2:12:25 PM",
	"dateAddedUTC": "2021-06-21T18:12:25.000Z"
},{
	"index": 20,
	"title": "WAI-ARIA Authoring Practices 1.1",
	"url": "https://www.w3.org/TR/wai-aria-practices-1.1/#kbd_layout_landmark_XHTML",
	"id": 2196,
	"parentId": "2175",
	"dateAddedLocal": "6/21/2021, 2:12:25 PM",
	"dateAddedUTC": "2021-06-21T18:12:25.000Z"
},{
	"index": 64,
	"title": "ftp",
	"id": 1254,
	"parentId": "871",
	"dateAddedLocal": "6/21/2021, 2:28:37 PM",
	"dateAddedUTC": "2021-06-21T18:28:37.088Z"
},{
	"index": 0,
	"title": "Transmit 5",
	"url": "https://panic.com/transmit/",
	"id": 1255,
	"parentId": "1254",
	"dateAddedLocal": "6/21/2021, 2:12:25 PM",
	"dateAddedUTC": "2021-06-21T18:12:25.000Z"
},{
	"index": 65,
	"title": "funstuff",
	"id": 1256,
	"parentId": "871",
	"dateAddedLocal": "6/21/2021, 2:28:37 PM",
	"dateAddedUTC": "2021-06-21T18:28:37.088Z"
},{
	"index": 0,
	"title": "Geocities-izer - Make Any Webpage Look Like It Was Made By A 13 Year-Old In 1996",
	"url": "http://www.wonder-tonic.com/geocitiesizer/",
	"id": 1257,
	"parentId": "1256",
	"dateAddedLocal": "6/21/2021, 2:12:25 PM",
	"dateAddedUTC": "2021-06-21T18:12:25.000Z"
},{
	"index": 66,
	"title": "gem",
	"id": 1258,
	"parentId": "871",
	"dateAddedLocal": "6/21/2021, 2:28:37 PM",
	"dateAddedUTC": "2021-06-21T18:28:37.088Z"
},{
	"index": 0,
	"title": "#245 New Gem with Bundler - RailsCasts",
	"url": "http://railscasts.com/episodes/245-new-gem-with-bundler",
	"id": 1259,
	"parentId": "1258",
	"dateAddedLocal": "6/21/2021, 2:12:25 PM",
	"dateAddedUTC": "2021-06-21T18:12:25.000Z"
},{
	"index": 1,
	"title": "Awesome Ruby libraries, tools, frameworks and software",
	"url": "https://github.com/markets/awesome-ruby",
	"id": 1260,
	"parentId": "1258",
	"dateAddedLocal": "6/21/2021, 2:12:25 PM",
	"dateAddedUTC": "2021-06-21T18:12:25.000Z"
},{
	"index": 2,
	"title": "Awesome-rails-gem: A collection of awesome Ruby Gems for Rails development.",
	"url": "https://github.com/hothero/awesome-rails-gem",
	"id": 1261,
	"parentId": "1258",
	"dateAddedLocal": "6/21/2021, 2:12:25 PM",
	"dateAddedUTC": "2021-06-21T18:12:25.000Z"
},{
	"index": 3,
	"title": "Bundler: The best way to manage a Ruby application's gems",
	"url": "http://bundler.io/gemfile.html",
	"id": 1262,
	"parentId": "1258",
	"dateAddedLocal": "6/21/2021, 2:12:25 PM",
	"dateAddedUTC": "2021-06-21T18:12:25.000Z"
},{
	"index": 4,
	"title": "Learn - CLI Data Gem Project",
	"url": "https://learn.co/tracks/full-stack-web-development/object-oriented-ruby/final-projects/cli-data-gem-project",
	"id": 1263,
	"parentId": "1258",
	"dateAddedLocal": "6/21/2021, 2:12:25 PM",
	"dateAddedUTC": "2021-06-21T18:12:25.000Z"
},{
	"index": 5,
	"title": "Make your own gem - RubyGems Guides",
	"url": "http://guides.rubygems.org/make-your-own-gem/",
	"id": 1264,
	"parentId": "1258",
	"dateAddedLocal": "6/21/2021, 2:12:25 PM",
	"dateAddedUTC": "2021-06-21T18:12:25.000Z"
},{
	"index": 6,
	"title": "Publishing your gem - RubyGems Guides",
	"url": "http://guides.rubygems.org/publishing/",
	"id": 1265,
	"parentId": "1258",
	"dateAddedLocal": "6/21/2021, 2:12:25 PM",
	"dateAddedUTC": "2021-06-21T18:12:25.000Z"
},{
	"index": 7,
	"title": "RubyGems Documentation LOCALHOST: run gem server",
	"url": "http://localhost:8808/#liquid",
	"id": 1266,
	"parentId": "1258",
	"dateAddedLocal": "6/21/2021, 2:12:25 PM",
	"dateAddedUTC": "2021-06-21T18:12:25.000Z"
},{
	"index": 8,
	"title": "The Ruby Toolbox - Know Your Options!",
	"url": "https://www.ruby-toolbox.com/resources",
	"id": 1267,
	"parentId": "1258",
	"dateAddedLocal": "6/21/2021, 2:12:25 PM",
	"dateAddedUTC": "2021-06-21T18:12:25.000Z"
},{
	"index": 67,
	"title": "geo",
	"id": 1268,
	"parentId": "871",
	"dateAddedLocal": "6/21/2021, 2:28:37 PM",
	"dateAddedUTC": "2021-06-21T18:28:37.089Z"
},{
	"index": 0,
	"title": "alexreisner/geocoder: Complete Ruby geocoding solution.",
	"url": "https://github.com/alexreisner/geocoder",
	"id": 1269,
	"parentId": "1268",
	"dateAddedLocal": "6/21/2021, 2:12:25 PM",
	"dateAddedUTC": "2021-06-21T18:12:25.000Z"
},{
	"index": 1,
	"title": "ArcMap | ArcGIS Desktop",
	"url": "http://desktop.arcgis.com/en/arcmap/",
	"id": 1270,
	"parentId": "1268",
	"dateAddedLocal": "6/21/2021, 2:12:25 PM",
	"dateAddedUTC": "2021-06-21T18:12:25.000Z"
},{
	"index": 2,
	"title": "CARTO â€” Location Intelligence Software",
	"url": "https://carto.com/",
	"id": 1271,
	"parentId": "1268",
	"dateAddedLocal": "6/21/2021, 2:12:25 PM",
	"dateAddedUTC": "2021-06-21T18:12:25.000Z"
},{
	"index": 3,
	"title": "Edit fiddle - JSFiddle",
	"url": "https://jsfiddle.net/api/mdn/",
	"id": 1272,
	"parentId": "1268",
	"dateAddedLocal": "6/21/2021, 2:12:25 PM",
	"dateAddedUTC": "2021-06-21T18:12:25.000Z"
},{
	"index": 4,
	"title": "GeoJSON",
	"url": "http://geojson.org/",
	"id": 1273,
	"parentId": "1268",
	"dateAddedLocal": "6/21/2021, 2:12:25 PM",
	"dateAddedUTC": "2021-06-21T18:12:25.000Z"
},{
	"index": 5,
	"title": "Getting Started Â |Â  Google Maps Geocoding API Â |Â  Google Developers",
	"url": "https://developers.google.com/maps/documentation/geocoding/start?hl=en_US",
	"id": 1274,
	"parentId": "1268",
	"dateAddedLocal": "6/21/2021, 2:12:25 PM",
	"dateAddedUTC": "2021-06-21T18:12:25.000Z"
},{
	"index": 6,
	"title": "Google Maps JavaScript API Â |Â  Google Developers",
	"url": "https://developers.google.com/maps/documentation/javascript/?hl=en_US",
	"id": 1275,
	"parentId": "1268",
	"dateAddedLocal": "6/21/2021, 2:12:25 PM",
	"dateAddedUTC": "2021-06-21T18:12:25.000Z"
},{
	"index": 7,
	"title": "GoogleAPI Credentials - spc-v1",
	"url": "https://console.developers.google.com/apis/credentials?project=spc-v1&organizationId=431234920510",
	"id": 1276,
	"parentId": "1268",
	"dateAddedLocal": "6/21/2021, 2:12:25 PM",
	"dateAddedUTC": "2021-06-21T18:12:25.000Z"
},{
	"index": 8,
	"title": "How to Integrate Google Maps into Ruby on Rails App - Anadea",
	"url": "https://anadea.info/blog/how-to-integrate-google-maps-into-ruby-on-rails-app",
	"id": 1277,
	"parentId": "1268",
	"dateAddedLocal": "6/21/2021, 2:12:25 PM",
	"dateAddedUTC": "2021-06-21T18:12:25.000Z"
},{
	"index": 9,
	"title": "Leaflet - a JavaScript library for interactive maps",
	"url": "http://leafletjs.com/",
	"id": 1278,
	"parentId": "1268",
	"dateAddedLocal": "6/21/2021, 2:12:25 PM",
	"dateAddedUTC": "2021-06-21T18:12:25.000Z"
},{
	"index": 10,
	"title": "Mapbox",
	"url": "https://www.mapbox.com/",
	"id": 1279,
	"parentId": "1268",
	"dateAddedLocal": "6/21/2021, 2:12:25 PM",
	"dateAddedUTC": "2021-06-21T18:12:25.000Z"
},{
	"index": 11,
	"title": "Using geolocation - Web APIs | MDN",
	"url": "https://developer.mozilla.org/en-US/docs/Web/API/Geolocation/Using_geolocation",
	"id": 1280,
	"parentId": "1268",
	"dateAddedLocal": "6/21/2021, 2:12:25 PM",
	"dateAddedUTC": "2021-06-21T18:12:25.000Z"
},{
	"index": 12,
	"title": "Welcome to the QGIS project!",
	"url": "http://www.qgis.org/en/site/",
	"id": 1281,
	"parentId": "1268",
	"dateAddedLocal": "6/21/2021, 2:12:25 PM",
	"dateAddedUTC": "2021-06-21T18:12:25.000Z"
},{
	"index": 13,
	"title": "mapshaper",
	"url": "https://mapshaper.org/",
	"id": 1282,
	"parentId": "1268",
	"dateAddedLocal": "6/21/2021, 2:12:25 PM",
	"dateAddedUTC": "2021-06-21T18:12:25.000Z"
},{
	"index": 14,
	"title": "pelias/pelias: Pelias is a modular open-source geocoder using Elasticsearch.",
	"url": "https://github.com/pelias/pelias",
	"id": 1283,
	"parentId": "1268",
	"dateAddedLocal": "6/21/2021, 2:12:25 PM",
	"dateAddedUTC": "2021-06-21T18:12:25.000Z"
},{
	"index": 15,
	"title": "pelias/in_code_documentation_guidelines.md at master Â· pelias/pelias",
	"url": "https://github.com/pelias/pelias/blob/master/in_code_documentation_guidelines.md",
	"id": 1284,
	"parentId": "1268",
	"dateAddedLocal": "6/21/2021, 2:12:25 PM",
	"dateAddedUTC": "2021-06-21T18:12:25.000Z"
},{
	"index": 16,
	"title": "GTFS Static Overview Â |Â  Static Transit Â |Â  Google Developers",
	"url": "https://developers.google.com/transit/gtfs/",
	"id": 1285,
	"parentId": "1268",
	"dateAddedLocal": "6/21/2021, 2:12:25 PM",
	"dateAddedUTC": "2021-06-21T18:12:25.000Z"
},{
	"index": 17,
	"title": "Open Web Mapping: Penn State Course",
	"url": "https://www.e-education.psu.edu/geog585/node/519",
	"id": 1286,
	"parentId": "1268",
	"dateAddedLocal": "6/21/2021, 2:12:25 PM",
	"dateAddedUTC": "2021-06-21T18:12:25.000Z"
},{
	"index": 18,
	"title": "Esri Support GIS Dictionary",
	"url": "https://support.esri.com/en/other-resources/gis-dictionary",
	"id": 1287,
	"parentId": "1268",
	"dateAddedLocal": "6/21/2021, 2:12:25 PM",
	"dateAddedUTC": "2021-06-21T18:12:25.000Z"
},{
	"index": 19,
	"title": "Converting a Shapefile to GeoJSON with QGIS - YouTube",
	"url": "https://www.youtube.com/watch?v=K9648vyQEFM&feature=youtu.be",
	"id": 1288,
	"parentId": "1268",
	"dateAddedLocal": "6/21/2021, 2:12:25 PM",
	"dateAddedUTC": "2021-06-21T18:12:25.000Z"
},{
	"index": 68,
	"title": "gimp",
	"id": 1289,
	"parentId": "871",
	"dateAddedLocal": "6/21/2021, 2:28:37 PM",
	"dateAddedUTC": "2021-06-21T18:28:37.091Z"
},{
	"index": 0,
	"title": "GIMP - GNU Image Manipulation Program",
	"url": "https://www.gimp.org/",
	"id": 1290,
	"parentId": "1289",
	"dateAddedLocal": "6/21/2021, 2:12:25 PM",
	"dateAddedUTC": "2021-06-21T18:12:25.000Z"
},{
	"index": 69,
	"title": "git",
	"id": 1291,
	"parentId": "871",
	"dateAddedLocal": "6/21/2021, 2:28:37 PM",
	"dateAddedUTC": "2021-06-21T18:28:37.091Z"
},{
	"index": 0,
	"title": "5 Useful Tips For A Better Commit Message",
	"url": "https://thoughtbot.com/blog/5-useful-tips-for-a-better-commit-message",
	"id": 1292,
	"parentId": "1291",
	"dateAddedLocal": "6/21/2021, 2:12:25 PM",
	"dateAddedUTC": "2021-06-21T18:12:25.000Z"
},{
	"index": 1,
	"title": "Clean up unused git branches | ardalis",
	"url": "https://ardalis.com/clean-up-unused-git-branches",
	"id": 1293,
	"parentId": "1291",
	"dateAddedLocal": "6/21/2021, 2:12:25 PM",
	"dateAddedUTC": "2021-06-21T18:12:25.000Z"
},{
	"index": 2,
	"title": "Connecting to GitHub with SSH - User Documentation",
	"url": "https://help.github.com/articles/connecting-to-github-with-ssh/",
	"id": 1294,
	"parentId": "1291",
	"dateAddedLocal": "6/21/2021, 2:12:25 PM",
	"dateAddedUTC": "2021-06-21T18:12:25.000Z"
},{
	"index": 3,
	"title": "Don't Be Scared of git rebase | I care, I share, I'm Nathan LeClaire.",
	"url": "https://nathanleclaire.com/blog/2014/09/14/dont-be-scared-of-git-rebase/",
	"id": 1295,
	"parentId": "1291",
	"dateAddedLocal": "6/21/2021, 2:12:25 PM",
	"dateAddedUTC": "2021-06-21T18:12:25.000Z"
},{
	"index": 4,
	"title": "Exclude files from git without committing changes to .gitignore ðŸ™…",
	"url": "https://medium.com/@dave_lunny/exclude-files-from-git-without-committing-changes-to-gitignore-986fa712e78d",
	"id": 1296,
	"parentId": "1291",
	"dateAddedLocal": "6/21/2021, 2:12:25 PM",
	"dateAddedUTC": "2021-06-21T18:12:25.000Z"
},{
	"index": 5,
	"title": "find forks of a repo",
	"url": "http://forked.yannick.io/",
	"id": 1297,
	"parentId": "1291",
	"dateAddedLocal": "6/21/2021, 2:12:25 PM",
	"dateAddedUTC": "2021-06-21T18:12:25.000Z"
},{
	"index": 6,
	"title": "Git - Stashing",
	"url": "https://git-scm.com/book/en/v1/Git-Tools-Stashing",
	"id": 1298,
	"parentId": "1291",
	"dateAddedLocal": "6/21/2021, 2:12:25 PM",
	"dateAddedUTC": "2021-06-21T18:12:25.000Z"
},{
	"index": 7,
	"title": "Git branch in your prompt",
	"url": "https://alicja.dev/blog/programming/2018/01/17/git-branch-in-your-prompt.html",
	"id": 1299,
	"parentId": "1291",
	"dateAddedLocal": "6/21/2021, 2:12:25 PM",
	"dateAddedUTC": "2021-06-21T18:12:25.000Z"
},{
	"index": 8,
	"title": "Git is, like many professional tools, something you simply got to learn. But li... | Hacker News",
	"url": "https://news.ycombinator.com/item?id=12622746",
	"id": 1300,
	"parentId": "1291",
	"dateAddedLocal": "6/21/2021, 2:12:25 PM",
	"dateAddedUTC": "2021-06-21T18:12:25.000Z"
},{
	"index": 9,
	"title": "Git Large File Storage | Git Large File Storage (LFS) replaces large files such as audio samples, videos, datasets, and graphics with text pointers inside Git, while storing the file contents on a remote server like GitHub.com or GitHub Enterprise.",
	"url": "https://git-lfs.github.com/",
	"id": 1301,
	"parentId": "1291",
	"dateAddedLocal": "6/21/2021, 2:12:25 PM",
	"dateAddedUTC": "2021-06-21T18:12:25.000Z"
},{
	"index": 10,
	"title": "Git Tutorial - Try Git",
	"url": "https://try.github.io/levels/1/challenges/3",
	"id": 1302,
	"parentId": "1291",
	"dateAddedLocal": "6/21/2021, 2:12:25 PM",
	"dateAddedUTC": "2021-06-21T18:12:25.000Z"
},{
	"index": 11,
	"title": "Git Video Tutorial - cheatsheet",
	"url": "http://www.newthinktank.com/2014/04/git-video-tutorial/",
	"id": 1303,
	"parentId": "1291",
	"dateAddedLocal": "6/21/2021, 2:12:25 PM",
	"dateAddedUTC": "2021-06-21T18:12:25.000Z"
},{
	"index": 12,
	"title": "GitHub Glossary - User Documentation",
	"url": "https://help.github.com/articles/github-glossary/",
	"id": 1304,
	"parentId": "1291",
	"dateAddedLocal": "6/21/2021, 2:12:25 PM",
	"dateAddedUTC": "2021-06-21T18:12:25.000Z"
},{
	"index": 13,
	"title": "github-git-cheat-sheet",
	"url": "https://services.github.com/on-demand/downloads/github-git-cheat-sheet.pdf",
	"id": 1305,
	"parentId": "1291",
	"dateAddedLocal": "6/21/2021, 2:12:25 PM",
	"dateAddedUTC": "2021-06-21T18:12:25.000Z"
},{
	"index": 14,
	"title": "Global gitignore",
	"url": "https://gist.github.com/subfuzion/db7f57fff2fb6998a16c",
	"id": 1306,
	"parentId": "1291",
	"dateAddedLocal": "6/21/2021, 2:12:25 PM",
	"dateAddedUTC": "2021-06-21T18:12:25.000Z"
},{
	"index": 15,
	"title": "How to Write a Git Commit Message",
	"url": "https://chris.beams.io/posts/git-commit/",
	"id": 1307,
	"parentId": "1291",
	"dateAddedLocal": "6/21/2021, 2:12:25 PM",
	"dateAddedUTC": "2021-06-21T18:12:25.000Z"
},{
	"index": 16,
	"title": "Ignoring files - User Documentation",
	"url": "https://help.github.com/articles/ignoring-files/",
	"id": 1308,
	"parentId": "1291",
	"dateAddedLocal": "6/21/2021, 2:12:25 PM",
	"dateAddedUTC": "2021-06-21T18:12:25.000Z"
},{
	"index": 17,
	"title": "Learn Git Branching",
	"url": "http://learngitbranching.js.org/?NODEMO",
	"id": 1309,
	"parentId": "1291",
	"dateAddedLocal": "6/21/2021, 2:12:25 PM",
	"dateAddedUTC": "2021-06-21T18:12:25.000Z"
},{
	"index": 18,
	"title": "Learn Version Control with Git for Free",
	"url": "https://www.git-tower.com/learn/",
	"id": 1310,
	"parentId": "1291",
	"dateAddedLocal": "6/21/2021, 2:12:25 PM",
	"dateAddedUTC": "2021-06-21T18:12:25.000Z"
},{
	"index": 19,
	"title": "Oh, shit, git!",
	"url": "http://ohshitgit.com/",
	"id": 1311,
	"parentId": "1291",
	"dateAddedLocal": "6/21/2021, 2:12:25 PM",
	"dateAddedUTC": "2021-06-21T18:12:25.000Z"
},{
	"index": 20,
	"title": "Quick Tip: Leveraging the Power of Git Stash",
	"url": "https://code.tutsplus.com/tutorials/quick-tip-leveraging-the-power-of-git-stash--cms-22988",
	"id": 1312,
	"parentId": "1291",
	"dateAddedLocal": "6/21/2021, 2:12:25 PM",
	"dateAddedUTC": "2021-06-21T18:12:25.000Z"
},{
	"index": 21,
	"title": "Ruby gitignore list",
	"url": "https://github.com/github/gitignore/blob/master/Ruby.gitignore",
	"id": 1313,
	"parentId": "1291",
	"dateAddedLocal": "6/21/2021, 2:12:25 PM",
	"dateAddedUTC": "2021-06-21T18:12:25.000Z"
},{
	"index": 22,
	"title": "The Basic Workflow of Version Control",
	"url": "https://www.git-tower.com/learn/git/videos/basic-workflow?channel=cli",
	"id": 1314,
	"parentId": "1291",
	"dateAddedLocal": "6/21/2021, 2:12:25 PM",
	"dateAddedUTC": "2021-06-21T18:12:25.000Z"
},{
	"index": 70,
	"title": "go",
	"id": 1315,
	"parentId": "871",
	"dateAddedLocal": "6/21/2021, 2:28:37 PM",
	"dateAddedUTC": "2021-06-21T18:28:37.093Z"
},{
	"index": 0,
	"title": "fiorix/go-daemon: Utility to \"daemonize\" Go programs",
	"url": "https://github.com/fiorix/go-daemon",
	"id": 1316,
	"parentId": "1315",
	"dateAddedLocal": "6/21/2021, 2:12:25 PM",
	"dateAddedUTC": "2021-06-21T18:12:25.000Z"
},{
	"index": 71,
	"title": "google-analytics",
	"id": 1317,
	"parentId": "871",
	"dateAddedLocal": "6/21/2021, 2:28:37 PM",
	"dateAddedUTC": "2021-06-21T18:28:37.093Z"
},{
	"index": 0,
	"title": "gtag.js Developer Guide Â |Â  Global site tag (gtag.js)",
	"url": "https://developers.google.com/gtagjs",
	"id": 1318,
	"parentId": "1317",
	"dateAddedLocal": "6/21/2021, 2:12:25 PM",
	"dateAddedUTC": "2021-06-21T18:12:25.000Z"
},{
	"index": 1,
	"title": "Introduction to gtag.js - The Google Global Site Tag",
	"url": "https://www.optimizesmart.com/guide-google-global-site-tag-gtag-js/",
	"id": 1319,
	"parentId": "1317",
	"dateAddedLocal": "6/21/2021, 2:12:25 PM",
	"dateAddedUTC": "2021-06-21T18:12:25.000Z"
},{
	"index": 2,
	"title": "Google Analytics Event tracking with custom code â€“ Instapage Help Center",
	"url": "https://help.instapage.com/hc/en-us/articles/360018939612-Google-Analytics-Event-tracking-with-custom-code",
	"id": 1320,
	"parentId": "1317",
	"dateAddedLocal": "6/21/2021, 2:12:25 PM",
	"dateAddedUTC": "2021-06-21T18:12:25.000Z"
},{
	"index": 3,
	"title": "Google Tag Manager",
	"url": "https://tagmanager.google.com/?authuser=1#/versions/accounts/4703160023/containers/13344222/versions/1",
	"id": 1321,
	"parentId": "1317",
	"dateAddedLocal": "6/21/2021, 2:12:25 PM",
	"dateAddedUTC": "2021-06-21T18:12:25.000Z"
},{
	"index": 4,
	"title": "Analytics",
	"url": "https://analytics.google.com/analytics/web/?authuser=1#/report/content-pages/a112829281w168057200p168296057/_r.drilldown=analytics.pagePath:~2Fabout/",
	"id": 1322,
	"parentId": "1317",
	"dateAddedLocal": "6/21/2021, 2:12:25 PM",
	"dateAddedUTC": "2021-06-21T18:12:25.000Z"
},{
	"index": 5,
	"title": "Set up the Analytics tag - Analytics Help",
	"url": "https://support.google.com/analytics/answer/1008080?hl=en",
	"id": 1323,
	"parentId": "1317",
	"dateAddedLocal": "6/21/2021, 2:12:25 PM",
	"dateAddedUTC": "2021-06-21T18:12:25.000Z"
},{
	"index": 6,
	"title": "SPAnalytics",
	"url": "https://analytics.google.com/analytics/web/provision/?authuser=0#/provision",
	"id": 1324,
	"parentId": "1317",
	"dateAddedLocal": "6/21/2021, 2:12:25 PM",
	"dateAddedUTC": "2021-06-21T18:12:25.000Z"
},{
	"index": 7,
	"title": "Spotify-Analytics",
	"url": "https://analytics.google.com/analytics/web/?authuser=2#/report-home/a143879074w205329203p198489830",
	"id": 1325,
	"parentId": "1317",
	"dateAddedLocal": "6/21/2021, 2:12:25 PM",
	"dateAddedUTC": "2021-06-21T18:12:25.000Z"
},{
	"index": 8,
	"title": "Add gtag.js to your site Â |Â  Analytics for Web (gtag.js)",
	"url": "https://developers.google.com/analytics/devguides/collection/gtagjs/",
	"id": 1326,
	"parentId": "1317",
	"dateAddedLocal": "6/21/2021, 2:12:25 PM",
	"dateAddedUTC": "2021-06-21T18:12:25.000Z"
},{
	"index": 9,
	"title": "Analytics.js Field Reference Â |Â  Analytics for Web (analytics.js)",
	"url": "https://developers.google.com/analytics/devguides/collection/analyticsjs/field-reference#trackingId",
	"id": 1327,
	"parentId": "1317",
	"dateAddedLocal": "6/21/2021, 2:12:25 PM",
	"dateAddedUTC": "2021-06-21T18:12:25.000Z"
},{
	"index": 10,
	"title": "Event Tracking in Google Analytics - Complete Guide",
	"url": "https://www.optimizesmart.com/event-tracking-guide-google-analytics-simplified-version/",
	"id": 1328,
	"parentId": "1317",
	"dateAddedLocal": "6/21/2021, 2:12:25 PM",
	"dateAddedUTC": "2021-06-21T18:12:25.000Z"
},{
	"index": 11,
	"title": "Tracker Object Reference Â |Â  Analytics for Web (analytics.js)",
	"url": "https://developers.google.com/analytics/devguides/collection/analyticsjs/tracker-object-reference",
	"id": 1329,
	"parentId": "1317",
	"dateAddedLocal": "6/21/2021, 2:12:25 PM",
	"dateAddedUTC": "2021-06-21T18:12:25.000Z"
},{
	"index": 12,
	"title": "Introduction to Google Analytics Commands",
	"url": "https://www.optimizesmart.com/introduction-to-google-analytics-commands/",
	"id": 1330,
	"parentId": "1317",
	"dateAddedLocal": "6/21/2021, 2:12:25 PM",
	"dateAddedUTC": "2021-06-21T18:12:25.000Z"
},{
	"index": 13,
	"title": "Creating Trackers Â |Â  Analytics for Web (analytics.js)",
	"url": "https://developers.google.com/analytics/devguides/collection/analyticsjs/creating-trackers",
	"id": 1331,
	"parentId": "1317",
	"dateAddedLocal": "6/21/2021, 2:12:25 PM",
	"dateAddedUTC": "2021-06-21T18:12:25.000Z"
},{
	"index": 14,
	"title": "Introduction to Analytics.js - The Google Analytics JavaScript Library",
	"url": "https://www.optimizesmart.com/introduction-to-google-analytics-javascript-library-analytics-js/",
	"id": 1332,
	"parentId": "1317",
	"dateAddedLocal": "6/21/2021, 2:12:25 PM",
	"dateAddedUTC": "2021-06-21T18:12:25.000Z"
},{
	"index": 15,
	"title": "Campaign URL Builder â€” Google Analytics Demos & Tools",
	"url": "https://ga-dev-tools.appspot.com/campaign-url-builder/",
	"id": 1333,
	"parentId": "1317",
	"dateAddedLocal": "6/21/2021, 2:12:25 PM",
	"dateAddedUTC": "2021-06-21T18:12:25.000Z"
},{
	"index": 72,
	"title": "gov",
	"id": 1334,
	"parentId": "871",
	"dateAddedLocal": "6/21/2021, 2:28:37 PM",
	"dateAddedUTC": "2021-06-21T18:28:37.095Z"
},{
	"index": 0,
	"title": "18F: Digital service delivery | Blog",
	"url": "https://18f.gsa.gov/blog/",
	"id": 1335,
	"parentId": "1334",
	"dateAddedLocal": "6/21/2021, 2:12:25 PM",
	"dateAddedUTC": "2021-06-21T18:12:25.000Z"
},{
	"index": 1,
	"title": "18F: Digital service delivery | The Agile Delivery BPA is here!",
	"url": "https://18f.gsa.gov/2015/06/15/agile-bpa-is-here/",
	"id": 1336,
	"parentId": "1334",
	"dateAddedLocal": "6/21/2021, 2:12:25 PM",
	"dateAddedUTC": "2021-06-21T18:12:25.000Z"
},{
	"index": 2,
	"title": "cloud.gov",
	"url": "https://cloud.gov/",
	"id": 1337,
	"parentId": "1334",
	"dateAddedLocal": "6/21/2021, 2:12:25 PM",
	"dateAddedUTC": "2021-06-21T18:12:25.000Z"
},{
	"index": 3,
	"title": "Corporate Overview | The MITRE Corporation",
	"url": "https://www.mitre.org/about/corporate-overview",
	"id": 1338,
	"parentId": "1334",
	"dateAddedLocal": "6/21/2021, 2:12:25 PM",
	"dateAddedUTC": "2021-06-21T18:12:25.000Z"
},{
	"index": 4,
	"title": "Design Kit",
	"url": "http://www.designkit.org/mindsets",
	"id": 1339,
	"parentId": "1334",
	"dateAddedLocal": "6/21/2021, 2:12:25 PM",
	"dateAddedUTC": "2021-06-21T18:12:25.000Z"
},{
	"index": 5,
	"title": "Design principles | U.S. Web Design Standards",
	"url": "https://standards.usa.gov/design-principles/",
	"id": 1340,
	"parentId": "1334",
	"dateAddedLocal": "6/21/2021, 2:12:25 PM",
	"dateAddedUTC": "2021-06-21T18:12:25.000Z"
},{
	"index": 6,
	"title": "Government Financial Intelligence & Transparency | OpenGov",
	"url": "https://opengov.com/",
	"id": 1341,
	"parentId": "1334",
	"dateAddedLocal": "6/21/2021, 2:12:25 PM",
	"dateAddedUTC": "2021-06-21T18:12:25.000Z"
},{
	"index": 7,
	"title": "Management and Oversight of Federal Information Technology",
	"url": "https://management.cio.gov/",
	"id": 1342,
	"parentId": "1334",
	"dateAddedLocal": "6/21/2021, 2:12:25 PM",
	"dateAddedUTC": "2021-06-21T18:12:25.000Z"
},{
	"index": 8,
	"title": "United States Digital Service - The United States Digital Service is transforming how the federal government works for the American people. And we need you.",
	"url": "https://www.usds.gov/",
	"id": 1343,
	"parentId": "1334",
	"dateAddedLocal": "6/21/2021, 2:12:25 PM",
	"dateAddedUTC": "2021-06-21T18:12:25.000Z"
},{
	"index": 73,
	"title": "graphql",
	"id": 1344,
	"parentId": "871",
	"dateAddedLocal": "6/21/2021, 2:28:37 PM",
	"dateAddedUTC": "2021-06-21T18:28:37.095Z"
},{
	"index": 0,
	"title": "Apollo GraphQL - Visual Studio Marketplace",
	"url": "https://marketplace.visualstudio.com/items?itemName=apollographql.vscode-apollo",
	"id": 1345,
	"parentId": "1344",
	"dateAddedLocal": "6/21/2021, 2:12:25 PM",
	"dateAddedUTC": "2021-06-21T18:12:25.000Z"
},{
	"index": 1,
	"title": "Apollo Client Developer Tools - Chrome Web Store",
	"url": "https://chrome.google.com/webstore/detail/apollo-client-developer-t/jdkknkkbebbapilgoeccciglkfbmbnfm",
	"id": 1346,
	"parentId": "1344",
	"dateAddedLocal": "6/21/2021, 2:12:25 PM",
	"dateAddedUTC": "2021-06-21T18:12:25.000Z"
},{
	"index": 2,
	"title": "0. Introduction - Apollo Basics - Apollo GraphQL Docs",
	"url": "https://www.apollographql.com/docs/tutorial/introduction",
	"id": 1347,
	"parentId": "1344",
	"dateAddedLocal": "6/21/2021, 2:12:25 PM",
	"dateAddedUTC": "2021-06-21T18:12:25.000Z"
},{
	"index": 3,
	"title": "Engine | smithwebtek | Org Settings",
	"url": "https://engine.apollographql.com/account/smithwebtek/settings",
	"id": 1348,
	"parentId": "1344",
	"dateAddedLocal": "6/21/2021, 2:12:25 PM",
	"dateAddedUTC": "2021-06-21T18:12:25.000Z"
},{
	"index": 4,
	"title": "Prisma - Database tools for modern application development",
	"url": "https://www.prisma.io/",
	"id": 1349,
	"parentId": "1344",
	"dateAddedLocal": "6/21/2021, 2:12:25 PM",
	"dateAddedUTC": "2021-06-21T18:12:25.000Z"
},{
	"index": 5,
	"title": "hasura/graphql-engine: Blazing fast, instant realtime GraphQL APIs on Postgres with fine grained access control, also trigger webhooks on database events.",
	"url": "https://github.com/hasura/graphql-engine",
	"id": 1350,
	"parentId": "1344",
	"dateAddedLocal": "6/21/2021, 2:12:25 PM",
	"dateAddedUTC": "2021-06-21T18:12:25.000Z"
},{
	"index": 6,
	"title": "https://blog.hasura.io/tagged/apollo/",
	"url": "https://blog.hasura.io/tagged/apollo/",
	"id": 1351,
	"parentId": "1344",
	"dateAddedLocal": "6/21/2021, 2:12:25 PM",
	"dateAddedUTC": "2021-06-21T18:12:25.000Z"
},{
	"index": 7,
	"title": "https://postlight.com/trackchanges/what-do-you-need-to-know-about-graphql",
	"url": "https://postlight.com/trackchanges/what-do-you-need-to-know-about-graphql",
	"id": 1352,
	"parentId": "1344",
	"dateAddedLocal": "6/21/2021, 2:12:25 PM",
	"dateAddedUTC": "2021-06-21T18:12:25.000Z"
},{
	"index": 8,
	"title": "https://www.apollographql.com/docs/apollo-server/",
	"url": "https://www.apollographql.com/docs/apollo-server/",
	"id": 1353,
	"parentId": "1344",
	"dateAddedLocal": "6/21/2021, 2:12:25 PM",
	"dateAddedUTC": "2021-06-21T18:12:25.000Z"
},{
	"index": 9,
	"title": "https://www.graphile.org/postgraphile/",
	"url": "https://www.graphile.org/postgraphile/",
	"id": 1354,
	"parentId": "1344",
	"dateAddedLocal": "6/21/2021, 2:12:25 PM",
	"dateAddedUTC": "2021-06-21T18:12:25.000Z"
},{
	"index": 10,
	"title": "https://postlight.com/trackchanges/choosing-react-first",
	"url": "https://postlight.com/trackchanges/choosing-react-first",
	"id": 1355,
	"parentId": "1344",
	"dateAddedLocal": "6/21/2021, 2:12:25 PM",
	"dateAddedUTC": "2021-06-21T18:12:25.000Z"
},{
	"index": 11,
	"title": "https://github.com/graphql/graphiql",
	"url": "https://github.com/graphql/graphiql",
	"id": 1356,
	"parentId": "1344",
	"dateAddedLocal": "6/21/2021, 2:12:25 PM",
	"dateAddedUTC": "2021-06-21T18:12:25.000Z"
},{
	"index": 12,
	"title": "https://facebook.github.io/relay/graphql/connections.htm",
	"url": "https://facebook.github.io/relay/graphql/connections.htm",
	"id": 1357,
	"parentId": "1344",
	"dateAddedLocal": "6/21/2021, 2:12:25 PM",
	"dateAddedUTC": "2021-06-21T18:12:25.000Z"
},{
	"index": 13,
	"title": "https://restfulapi.net/",
	"url": "https://restfulapi.net/",
	"id": 1358,
	"parentId": "1344",
	"dateAddedLocal": "6/21/2021, 2:12:25 PM",
	"dateAddedUTC": "2021-06-21T18:12:25.000Z"
},{
	"index": 14,
	"title": "https://www.apollographql.com/docs/apollo-server/performance/apq/",
	"url": "https://www.apollographql.com/docs/apollo-server/performance/apq/",
	"id": 1359,
	"parentId": "1344",
	"dateAddedLocal": "6/21/2021, 2:12:25 PM",
	"dateAddedUTC": "2021-06-21T18:12:25.000Z"
},{
	"index": 15,
	"title": "https://github.blog/2016-09-14-the-github-graphql-api/",
	"url": "https://github.blog/2016-09-14-the-github-graphql-api/",
	"id": 1360,
	"parentId": "1344",
	"dateAddedLocal": "6/21/2021, 2:12:25 PM",
	"dateAddedUTC": "2021-06-21T18:12:25.000Z"
},{
	"index": 16,
	"title": "https://hasura.io/",
	"url": "https://hasura.io/",
	"id": 1361,
	"parentId": "1344",
	"dateAddedLocal": "6/21/2021, 2:12:25 PM",
	"dateAddedUTC": "2021-06-21T18:12:25.000Z"
},{
	"index": 17,
	"title": "GraphQLÂ on Rails6: From zero to the first query â€” Martian Chronicles, Evil Martiansâ€™ team blog",
	"url": "https://evilmartians.com/chronicles/graphql-on-rails-1-from-zero-to-the-first-query",
	"id": 1362,
	"parentId": "1344",
	"dateAddedLocal": "6/21/2021, 2:12:25 PM",
	"dateAddedUTC": "2021-06-21T18:12:25.000Z"
},{
	"index": 18,
	"title": "GraphQL | A query language for your API",
	"url": "https://graphql.org/",
	"id": 1363,
	"parentId": "1344",
	"dateAddedLocal": "6/21/2021, 2:12:25 PM",
	"dateAddedUTC": "2021-06-21T18:12:25.000Z"
},{
	"index": 19,
	"title": "Explore GraphQL: The API for modern apps.",
	"url": "https://www.graphql.com/",
	"id": 1364,
	"parentId": "1344",
	"dateAddedLocal": "6/21/2021, 2:12:25 PM",
	"dateAddedUTC": "2021-06-21T18:12:25.000Z"
},{
	"index": 20,
	"title": "What Is GraphQL? - YouTube",
	"url": "https://www.youtube.com/watch?v=VjXb3PRL9WI",
	"id": 1365,
	"parentId": "1344",
	"dateAddedLocal": "6/21/2021, 2:12:25 PM",
	"dateAddedUTC": "2021-06-21T18:12:25.000Z"
},{
	"index": 21,
	"title": "(1) How To Use GraphQL with Ruby on Rails - Part 1 - Backend - YouTube",
	"url": "https://www.youtube.com/watch?v=kSlJH3hrV58",
	"id": 1366,
	"parentId": "1344",
	"dateAddedLocal": "6/21/2021, 2:12:25 PM",
	"dateAddedUTC": "2021-06-21T18:12:25.000Z"
},{
	"index": 22,
	"title": "ar_lazy_preload: Lazy loading associations for the ActiveRecord models",
	"url": "https://github.com/DmitryTsepelev/ar_lazy_preload",
	"id": 1367,
	"parentId": "1344",
	"dateAddedLocal": "6/21/2021, 2:12:25 PM",
	"dateAddedUTC": "2021-06-21T18:12:25.000Z"
},{
	"index": 23,
	"title": "Build a Rails 6 API Featuring Graphql - DEV Community",
	"url": "https://dev.to/ethanmgustafson/build-a-rails-6-api-featuring-graphql-6a8",
	"id": 1368,
	"parentId": "1344",
	"dateAddedLocal": "6/21/2021, 2:12:25 PM",
	"dateAddedUTC": "2021-06-21T18:12:25.000Z"
},{
	"index": 24,
	"title": "Explore GraphQL: The API for modern apps.",
	"url": "https://www.graphql.com/",
	"id": 1369,
	"parentId": "1344",
	"dateAddedLocal": "6/21/2021, 2:12:25 PM",
	"dateAddedUTC": "2021-06-21T18:12:25.000Z"
},{
	"index": 25,
	"title": "GraphQL | A query language for your API",
	"url": "https://graphql.org/",
	"id": 1370,
	"parentId": "1344",
	"dateAddedLocal": "6/21/2021, 2:12:25 PM",
	"dateAddedUTC": "2021-06-21T18:12:25.000Z"
},{
	"index": 26,
	"title": "GraphQL Ruby API Documentation",
	"url": "https://graphql-ruby.org/api-doc/1.12.8/",
	"id": 1371,
	"parentId": "1344",
	"dateAddedLocal": "6/21/2021, 2:12:25 PM",
	"dateAddedUTC": "2021-06-21T18:12:25.000Z"
},{
	"index": 27,
	"title": "How to use GraphQL with Javascript â€“ GraphQL.js tutorial - Apollo Blog",
	"url": "https://www.apollographql.com/blog/how-to-use-graphql-with-javascript-graphql-js-tutorial/",
	"id": 1372,
	"parentId": "1344",
	"dateAddedLocal": "6/21/2021, 2:12:25 PM",
	"dateAddedUTC": "2021-06-21T18:12:25.000Z"
},{
	"index": 28,
	"title": "Shopify/graphql-batch: A query batching executor for the graphql gem",
	"url": "https://github.com/Shopify/graphql-batch",
	"id": 1373,
	"parentId": "1344",
	"dateAddedLocal": "6/21/2021, 2:12:25 PM",
	"dateAddedUTC": "2021-06-21T18:12:25.000Z"
},{
	"index": 29,
	"title": "smithwebtek | Graph List | Studio",
	"url": "https://studio.apollographql.com/org/smithwebtek/graphs?defaultGraphType=development&overlay=create-graph",
	"id": 1374,
	"parentId": "1344",
	"dateAddedLocal": "6/21/2021, 2:12:25 PM",
	"dateAddedUTC": "2021-06-21T18:12:25.000Z"
},{
	"index": 30,
	"title": "What Is GraphQL? - YouTube",
	"url": "https://www.youtube.com/watch?v=VjXb3PRL9WI",
	"id": 1375,
	"parentId": "1344",
	"dateAddedLocal": "6/21/2021, 2:12:25 PM",
	"dateAddedUTC": "2021-06-21T18:12:25.000Z"
},{
	"index": 31,
	"title": "Building our schema | Lift-off part 1 | Apollo Odyssey",
	"url": "https://odyssey.apollographql.com/lift-off-part1/building-our-schema",
	"id": 1376,
	"parentId": "1344",
	"dateAddedLocal": "6/21/2021, 2:12:25 PM",
	"dateAddedUTC": "2021-06-21T18:12:25.000Z"
},{
	"index": 74,
	"title": "gulp",
	"id": 1377,
	"parentId": "871",
	"dateAddedLocal": "6/21/2021, 2:28:37 PM",
	"dateAddedUTC": "2021-06-21T18:28:37.097Z"
},{
	"index": 0,
	"title": "gulp.js - The streaming build system",
	"url": "https://gulpjs.com/",
	"id": 1378,
	"parentId": "1377",
	"dateAddedLocal": "6/21/2021, 2:12:25 PM",
	"dateAddedUTC": "2021-06-21T18:12:25.000Z"
},{
	"index": 75,
	"title": "hacking",
	"id": 1379,
	"parentId": "871",
	"dateAddedLocal": "6/21/2021, 2:28:37 PM",
	"dateAddedUTC": "2021-06-21T18:28:37.097Z"
},{
	"index": 0,
	"title": "Hackathon IO - Organize & Discover Hackathons - Hackathon.IO",
	"url": "http://www.hackathon.io/events",
	"id": 1380,
	"parentId": "1379",
	"dateAddedLocal": "6/21/2021, 2:12:25 PM",
	"dateAddedUTC": "2021-06-21T18:12:25.000Z"
},{
	"index": 1,
	"title": "Hackathons | Hacker League",
	"url": "https://www.hackerleague.org/hackathons",
	"id": 1381,
	"parentId": "1379",
	"dateAddedLocal": "6/21/2021, 2:12:25 PM",
	"dateAddedUTC": "2021-06-21T18:12:25.000Z"
},{
	"index": 2,
	"title": "New & upcoming hackthons Â· Devpost",
	"url": "http://devpost.com/hackathons",
	"id": 1382,
	"parentId": "1379",
	"dateAddedLocal": "6/21/2021, 2:12:25 PM",
	"dateAddedUTC": "2021-06-21T18:12:25.000Z"
},{
	"index": 3,
	"title": "Upcoming Hackathons | AngelHack",
	"url": "http://angelhack.com/events/",
	"id": 1383,
	"parentId": "1379",
	"dateAddedLocal": "6/21/2021, 2:12:25 PM",
	"dateAddedUTC": "2021-06-21T18:12:25.000Z"
},{
	"index": 76,
	"title": "hash table",
	"id": 1384,
	"parentId": "871",
	"dateAddedLocal": "6/21/2021, 2:28:37 PM",
	"dateAddedUTC": "2021-06-21T18:28:37.098Z"
},{
	"index": 0,
	"title": "Hash Tables - YouTube",
	"url": "https://www.youtube.com/watch?time_continue=19&v=2wyCY1sX9II",
	"id": 1385,
	"parentId": "1384",
	"dateAddedLocal": "6/21/2021, 2:12:25 PM",
	"dateAddedUTC": "2021-06-21T18:12:25.000Z"
},{
	"index": 77,
	"title": "heroku",
	"id": 1386,
	"parentId": "871",
	"dateAddedLocal": "6/21/2021, 2:28:37 PM",
	"dateAddedUTC": "2021-06-21T18:28:37.098Z"
},{
	"index": 0,
	"title": "crash-data-v1",
	"url": "http://crash-data-v1.herokuapp.com/",
	"id": 1387,
	"parentId": "1386",
	"dateAddedLocal": "6/21/2021, 2:12:25 PM",
	"dateAddedUTC": "2021-06-21T18:12:25.000Z"
},{
	"index": 1,
	"title": "Deploying with Git | Heroku Dev Center",
	"url": "https://devcenter.heroku.com/articles/git#tracking-your-app-in-git",
	"id": 1388,
	"parentId": "1386",
	"dateAddedLocal": "6/21/2021, 2:12:25 PM",
	"dateAddedUTC": "2021-06-21T18:12:25.000Z"
},{
	"index": 2,
	"title": "diet-planner-v8",
	"url": "https://diet-planner-v8.herokuapp.com/",
	"id": 1389,
	"parentId": "1386",
	"dateAddedLocal": "6/21/2021, 2:12:25 PM",
	"dateAddedUTC": "2021-06-21T18:12:25.000Z"
},{
	"index": 3,
	"title": "goal-mgr-v1",
	"url": "https://goal-mgr-v1.herokuapp.com/",
	"id": 1390,
	"parentId": "1386",
	"dateAddedLocal": "6/21/2021, 2:12:25 PM",
	"dateAddedUTC": "2021-06-21T18:12:25.000Z"
},{
	"index": 4,
	"title": "How to add a git remote to a heroku app | The Agile Warrior",
	"url": "https://agilewarrior.wordpress.com/2013/08/02/how-to-add-a-git-remote-to-a-heroku-app/",
	"id": 1391,
	"parentId": "1386",
	"dateAddedLocal": "6/21/2021, 2:12:25 PM",
	"dateAddedUTC": "2021-06-21T18:12:25.000Z"
},{
	"index": 5,
	"title": "job-crm-v1",
	"url": "http://job-crm-v1.herokuapp.com/",
	"id": 1392,
	"parentId": "1386",
	"dateAddedLocal": "6/21/2021, 2:12:25 PM",
	"dateAddedUTC": "2021-06-21T18:12:25.000Z"
},{
	"index": 6,
	"title": "lab-rat-v1",
	"url": "https://lab-rat-v1.herokuapp.com/",
	"id": 1393,
	"parentId": "1386",
	"dateAddedLocal": "6/21/2021, 2:12:25 PM",
	"dateAddedUTC": "2021-06-21T18:12:25.000Z"
},{
	"index": 7,
	"title": "loco-v1",
	"url": "https://loco-v1.herokuapp.com/",
	"id": 1394,
	"parentId": "1386",
	"dateAddedLocal": "6/21/2021, 2:12:25 PM",
	"dateAddedUTC": "2021-06-21T18:12:25.000Z"
},{
	"index": 8,
	"title": "Personal apps | Heroku",
	"url": "https://dashboard.heroku.com/apps",
	"id": 1395,
	"parentId": "1386",
	"dateAddedLocal": "6/21/2021, 2:12:25 PM",
	"dateAddedUTC": "2021-06-21T18:12:25.000Z"
},{
	"index": 9,
	"title": "postgresql - pgadmin: getting \"DETAIL: User does not have CONNECT privilege.\" error - Stack Overflow",
	"url": "http://stackoverflow.com/questions/39169264/pgadmin-getting-detail-user-does-not-have-connect-privilege-error",
	"id": 1396,
	"parentId": "1386",
	"dateAddedLocal": "6/21/2021, 2:12:25 PM",
	"dateAddedUTC": "2021-06-21T18:12:25.000Z"
},{
	"index": 10,
	"title": "Sign In - Pluralsight",
	"url": "https://app.pluralsight.com/id/signin/sso?RedirectTo=%2Fcourses%2Fadvanced-javascript&Alias=flatironschool.com",
	"id": 1397,
	"parentId": "1386",
	"dateAddedLocal": "6/21/2021, 2:12:25 PM",
	"dateAddedUTC": "2021-06-21T18:12:25.000Z"
},{
	"index": 11,
	"title": "sp-v2",
	"url": "https://sp-v2.herokuapp.com/",
	"id": 1398,
	"parentId": "1386",
	"dateAddedLocal": "6/21/2021, 2:12:25 PM",
	"dateAddedUTC": "2021-06-21T18:12:25.000Z"
},{
	"index": 12,
	"title": "spc-v1",
	"url": "https://spc-v1.herokuapp.com/",
	"id": 1399,
	"parentId": "1386",
	"dateAddedLocal": "6/21/2021, 2:12:25 PM",
	"dateAddedUTC": "2021-06-21T18:12:25.000Z"
},{
	"index": 13,
	"title": "swt-v3",
	"url": "https://swt-v3.herokuapp.com/",
	"id": 1400,
	"parentId": "1386",
	"dateAddedLocal": "6/21/2021, 2:12:25 PM",
	"dateAddedUTC": "2021-06-21T18:12:25.000Z"
},{
	"index": 14,
	"title": "Deploying your app on Heroku with staging and production environments",
	"url": "https://medium.com/@ivanpilot/deploying-your-app-on-heroku-with-staging-and-production-environments-17156870983e",
	"id": 1401,
	"parentId": "1386",
	"dateAddedLocal": "6/21/2021, 2:12:25 PM",
	"dateAddedUTC": "2021-06-21T18:12:25.000Z"
},{
	"index": 15,
	"title": "Heroku Tips and Hacks",
	"url": "https://www.airpair.com/heroku/posts/heroku-tips-and-hacks",
	"id": 1402,
	"parentId": "1386",
	"dateAddedLocal": "6/21/2021, 2:12:25 PM",
	"dateAddedUTC": "2021-06-21T18:12:25.000Z"
},{
	"index": 16,
	"title": "Account Â· Billing | Heroku",
	"url": "https://dashboard.heroku.com/account/billing",
	"id": 1403,
	"parentId": "1386",
	"dateAddedLocal": "6/21/2021, 2:12:25 PM",
	"dateAddedUTC": "2021-06-21T18:12:25.000Z"
},{
	"index": 78,
	"title": "homebrew",
	"id": 1404,
	"parentId": "871",
	"dateAddedLocal": "6/21/2021, 2:28:37 PM",
	"dateAddedUTC": "2021-06-21T18:28:37.099Z"
},{
	"index": 0,
	"title": "brew trash",
	"url": "http://stackoverflow.com/questions/2642147/how-to-remove-files-and-directories-quickly",
	"id": 1405,
	"parentId": "1404",
	"dateAddedLocal": "6/21/2021, 2:12:25 PM",
	"dateAddedUTC": "2021-06-21T18:12:25.000Z"
},{
	"index": 79,
	"title": "hosting",
	"id": 1406,
	"parentId": "871",
	"dateAddedLocal": "6/21/2021, 2:28:37 PM",
	"dateAddedUTC": "2021-06-21T18:28:37.099Z"
},{
	"index": 0,
	"title": "Deploy Your Rails App to AWS",
	"url": "https://www.sitepoint.com/deploy-your-rails-app-to-aws/",
	"id": 1407,
	"parentId": "1406",
	"dateAddedLocal": "6/21/2021, 2:12:25 PM",
	"dateAddedUTC": "2021-06-21T18:12:25.000Z"
},{
	"index": 1,
	"title": "DreamHost",
	"url": "https://www.dreamhost.com/hosting/vps/",
	"id": 1408,
	"parentId": "1406",
	"dateAddedLocal": "6/21/2021, 2:12:25 PM",
	"dateAddedUTC": "2021-06-21T18:12:25.000Z"
},{
	"index": 2,
	"title": "How to Choose A Web Host? 15-Point Hosting Checklist",
	"url": "http://www.webhostingsecretrevealed.net/choose-the-right-web-hosting/",
	"id": 1409,
	"parentId": "1406",
	"dateAddedLocal": "6/21/2021, 2:12:25 PM",
	"dateAddedUTC": "2021-06-21T18:12:25.000Z"
},{
	"index": 3,
	"title": "How to Start a Web Hosting Business - GreenGeeksÂ®",
	"url": "https://www.greengeeks.com/how-to-start-a-web-hosting-business",
	"id": 1410,
	"parentId": "1406",
	"dateAddedLocal": "6/21/2021, 2:12:25 PM",
	"dateAddedUTC": "2021-06-21T18:12:25.000Z"
},{
	"index": 4,
	"title": "Ruby on Rails applications Hosting",
	"url": "https://www.allerin.com/blog/ruby-on-rails-website-hosting",
	"id": 1411,
	"parentId": "1406",
	"dateAddedLocal": "6/21/2021, 2:12:25 PM",
	"dateAddedUTC": "2021-06-21T18:12:25.000Z"
},{
	"index": 5,
	"title": "ngrok â€“ documentation",
	"url": "https://ngrok.com/docs",
	"id": 1412,
	"parentId": "1406",
	"dateAddedLocal": "6/21/2021, 2:12:25 PM",
	"dateAddedUTC": "2021-06-21T18:12:25.000Z"
},{
	"index": 6,
	"title": "AWS",
	"url": "https://console.aws.amazon.com/console/home?region=us-east-1",
	"id": 1413,
	"parentId": "1406",
	"dateAddedLocal": "6/21/2021, 2:12:25 PM",
	"dateAddedUTC": "2021-06-21T18:12:25.000Z"
},{
	"index": 7,
	"title": "Firebase",
	"url": "https://console.firebase.google.com/u/0/project/swt-burger/database/swt-burger/data",
	"id": 1414,
	"parentId": "1406",
	"dateAddedLocal": "6/21/2021, 2:12:25 PM",
	"dateAddedUTC": "2021-06-21T18:12:25.000Z"
},{
	"index": 8,
	"title": "Heroku",
	"url": "https://dashboard.heroku.com/apps",
	"id": 1415,
	"parentId": "1406",
	"dateAddedLocal": "6/21/2021, 2:12:25 PM",
	"dateAddedUTC": "2021-06-21T18:12:25.000Z"
},{
	"index": 80,
	"title": "html",
	"id": 1416,
	"parentId": "871",
	"dateAddedLocal": "6/21/2021, 2:28:37 PM",
	"dateAddedUTC": "2021-06-21T18:28:37.100Z"
},{
	"index": 0,
	"title": "HTML -best-practices",
	"url": "https://github.com/hail2u/html-best-practices#add-title-element",
	"id": 1417,
	"parentId": "1416",
	"dateAddedLocal": "6/21/2021, 2:12:25 PM",
	"dateAddedUTC": "2021-06-21T18:12:25.000Z"
},{
	"index": 1,
	"title": "HTML cheatsheet",
	"url": "http://www.cril.univ-artois.fr/~lecoutre/teaching/web/sheets/HTML.pdf",
	"id": 1418,
	"parentId": "1416",
	"dateAddedLocal": "6/21/2021, 2:12:25 PM",
	"dateAddedUTC": "2021-06-21T18:12:25.000Z"
},{
	"index": 2,
	"title": "HTML element reference - HTML | MDN",
	"url": "https://developer.mozilla.org/en-US/docs/Web/HTML/Element",
	"id": 1419,
	"parentId": "1416",
	"dateAddedLocal": "6/21/2021, 2:12:25 PM",
	"dateAddedUTC": "2021-06-21T18:12:25.000Z"
},{
	"index": 3,
	"title": "Showing results for contents of text-input area - Nu Html Checker",
	"url": "https://validator.w3.org/nu/#textarea",
	"id": 1420,
	"parentId": "1416",
	"dateAddedLocal": "6/21/2021, 2:12:25 PM",
	"dateAddedUTC": "2021-06-21T18:12:25.000Z"
},{
	"index": 4,
	"title": "Page Ruler - Chrome Web Store",
	"url": "https://chrome.google.com/webstore/detail/page-ruler/jlpkojjdgbllmedoapgfodplfhcbnbpn/related?hl=en",
	"id": 1421,
	"parentId": "1416",
	"dateAddedLocal": "6/21/2021, 2:12:25 PM",
	"dateAddedUTC": "2021-06-21T18:12:25.000Z"
},{
	"index": 81,
	"title": "internet engineering",
	"id": 1422,
	"parentId": "871",
	"dateAddedLocal": "6/21/2021, 2:28:37 PM",
	"dateAddedUTC": "2021-06-21T18:28:37.100Z"
},{
	"index": 0,
	"title": "A remote server automation and deployment tool written in Ruby.",
	"url": "http://capistranorb.com/",
	"id": 1423,
	"parentId": "1422",
	"dateAddedLocal": "6/21/2021, 2:12:25 PM",
	"dateAddedUTC": "2021-06-21T18:12:25.000Z"
},{
	"index": 1,
	"title": "Charles Web Debugging Proxy",
	"url": "https://www.charlesproxy.com/download/",
	"id": 1424,
	"parentId": "1422",
	"dateAddedLocal": "6/21/2021, 2:12:25 PM",
	"dateAddedUTC": "2021-06-21T18:12:25.000Z"
},{
	"index": 2,
	"title": "Fiddler - Free Web Debugging Proxy - Telerik",
	"url": "https://www.telerik.com/fiddler",
	"id": 1425,
	"parentId": "1422",
	"dateAddedLocal": "6/21/2021, 2:12:25 PM",
	"dateAddedUTC": "2021-06-21T18:12:25.000Z"
},{
	"index": 82,
	"title": "jamstack",
	"id": 1426,
	"parentId": "871",
	"dateAddedLocal": "6/21/2021, 2:28:37 PM",
	"dateAddedUTC": "2021-06-21T18:28:37.101Z"
},{
	"index": 0,
	"title": "JAMstack | JavaScript, APIs, and Markup",
	"url": "https://jamstack.org/",
	"id": 1427,
	"parentId": "1426",
	"dateAddedLocal": "6/21/2021, 2:12:25 PM",
	"dateAddedUTC": "2021-06-21T18:12:25.000Z"
},{
	"index": 1,
	"title": "JAMstack | JavaScript, APIs, and Markup",
	"url": "https://jamstack.org/",
	"id": 1428,
	"parentId": "1426",
	"dateAddedLocal": "6/21/2021, 2:12:25 PM",
	"dateAddedUTC": "2021-06-21T18:12:25.000Z"
},{
	"index": 83,
	"title": "java",
	"id": 2584,
	"parentId": "871",
	"dateAddedLocal": "10/14/2023, 8:25:45 AM",
	"dateAddedUTC": "2023-10-14T12:25:45.156Z"
},{
	"index": 0,
	"title": "JDK 21 Documentation - Home",
	"url": "https://docs.oracle.com/en/java/javase/21/index.html",
	"id": 2583,
	"parentId": "2584",
	"dateAddedLocal": "10/14/2023, 8:25:26 AM",
	"dateAddedUTC": "2023-10-14T12:25:26.428Z"
},{
	"index": 1,
	"title": "JetBrains: Essential tools for software developers and teams",
	"url": "https://www.jetbrains.com/",
	"id": 2585,
	"parentId": "2584",
	"dateAddedLocal": "10/14/2023, 8:27:01 AM",
	"dateAddedUTC": "2023-10-14T12:27:01.784Z"
},{
	"index": 2,
	"title": "Videos: Computer Programming Tips by Tim Buchalka - YouTube",
	"url": "https://www.youtube.com/watch?v=z_8Hocokycg&list=PLXtTjtWmQhg1YRG0L0dIT5B22Utujaq20",
	"id": 2586,
	"parentId": "2584",
	"dateAddedLocal": "10/14/2023, 9:16:55 AM",
	"dateAddedUTC": "2023-10-14T13:16:55.545Z"
},{
	"index": 3,
	"title": "Maven â€“ Introduction to the Build Lifecycle",
	"url": "https://maven.apache.org/guides/introduction/introduction-to-the-lifecycle.html#Lifecycle_Reference",
	"id": 2587,
	"parentId": "2584",
	"dateAddedLocal": "10/15/2023, 9:52:19 AM",
	"dateAddedUTC": "2023-10-15T13:52:19.919Z"
},{
	"index": 4,
	"title": "Maven â€“ Available Plugins",
	"url": "https://maven.apache.org/plugins/index.html",
	"id": 2588,
	"parentId": "2584",
	"dateAddedLocal": "10/15/2023, 9:56:03 AM",
	"dateAddedUTC": "2023-10-15T13:56:03.959Z"
},{
	"index": 84,
	"title": "java",
	"id": 1429,
	"parentId": "871",
	"dateAddedLocal": "6/21/2021, 2:28:37 PM",
	"dateAddedUTC": "2021-06-21T18:28:37.101Z"
},{
	"index": 0,
	"title": "Overview (Java SE 11 & JDK 11 )",
	"url": "https://docs.oracle.com/en/java/javase/11/docs/api/",
	"id": 1430,
	"parentId": "1429",
	"dateAddedLocal": "6/21/2021, 2:12:25 PM",
	"dateAddedUTC": "2021-06-21T18:12:25.000Z"
},{
	"index": 1,
	"title": "AdoptOpenJDK - Open source, prebuilt OpenJDK binaries",
	"url": "https://adoptopenjdk.net/?variant=openjdk11&jvmVariant=hotspot",
	"id": 1431,
	"parentId": "1429",
	"dateAddedLocal": "6/21/2021, 2:12:25 PM",
	"dateAddedUTC": "2021-06-21T18:12:25.000Z"
},{
	"index": 2,
	"title": "Apache Download Mirrors",
	"url": "https://www.apache.org/dyn/closer.lua/lucene/solr/8.5.1/solr-8.5.1-src.tgz",
	"id": 1432,
	"parentId": "1429",
	"dateAddedLocal": "6/21/2021, 2:12:25 PM",
	"dateAddedUTC": "2021-06-21T18:12:25.000Z"
},{
	"index": 3,
	"title": "Installing Java on macOS 10.15 Catalina â€“ Wolf Paulus",
	"url": "https://wolfpaulus.com/java-on-macos-catalina/",
	"id": 1433,
	"parentId": "1429",
	"dateAddedLocal": "6/21/2021, 2:12:25 PM",
	"dateAddedUTC": "2021-06-21T18:12:25.000Z"
},{
	"index": 4,
	"title": "Installation | AdoptOpenJDK - Open source, prebuilt OpenJDK binaries",
	"url": "https://adoptopenjdk.net/installation.html?variant=openjdk11&jvmVariant=hotspot#macos-pkg",
	"id": 1434,
	"parentId": "1429",
	"dateAddedLocal": "6/21/2021, 2:12:25 PM",
	"dateAddedUTC": "2021-06-21T18:12:25.000Z"
},{
	"index": 5,
	"title": "JDK 15 Documentation - Home",
	"url": "https://docs.oracle.com/en/java/javase/15/",
	"id": 1435,
	"parentId": "1429",
	"dateAddedLocal": "6/21/2021, 2:12:25 PM",
	"dateAddedUTC": "2021-06-21T18:12:25.000Z"
},{
	"index": 6,
	"title": "Spring Boot - Introduction - Tutorialspoint",
	"url": "https://www.tutorialspoint.com/spring_boot/spring_boot_introduction.htm",
	"id": 1436,
	"parentId": "1429",
	"dateAddedLocal": "6/21/2021, 2:12:25 PM",
	"dateAddedUTC": "2021-06-21T18:12:25.000Z"
},{
	"index": 7,
	"title": "spring framework: Online Courses, Training and Tutorials on LinkedIn Learning",
	"url": "https://www.linkedin.com/learning/search?keywords=spring%20framework&u=2114857",
	"id": 1437,
	"parentId": "1429",
	"dateAddedLocal": "6/21/2021, 2:12:25 PM",
	"dateAddedUTC": "2021-06-21T18:12:25.000Z"
},{
	"index": 8,
	"title": "The Use of Java Technologies in Web Application Development",
	"url": "https://www.orangemantra.com/blog/the-use-of-java-technologies-in-web-application-development/",
	"id": 1438,
	"parentId": "1429",
	"dateAddedLocal": "6/21/2021, 2:12:25 PM",
	"dateAddedUTC": "2021-06-21T18:12:25.000Z"
},{
	"index": 9,
	"title": "What Is Spring Boot? â€“ Stackify",
	"url": "https://stackify.com/what-is-spring-boot/",
	"id": 1439,
	"parentId": "1429",
	"dateAddedLocal": "6/21/2021, 2:12:25 PM",
	"dateAddedUTC": "2021-06-21T18:12:25.000Z"
},{
	"index": 85,
	"title": "javascript",
	"id": 1440,
	"parentId": "871",
	"dateAddedLocal": "6/21/2021, 2:28:37 PM",
	"dateAddedUTC": "2021-06-21T18:28:37.102Z"
},{
	"index": 0,
	"title": "console - js",
	"id": 1444,
	"parentId": "1440",
	"dateAddedLocal": "6/21/2021, 2:28:37 PM",
	"dateAddedUTC": "2021-06-21T18:28:37.102Z"
},{
	"index": 0,
	"title": "Console - Web APIs | MDN",
	"url": "https://developer.mozilla.org/en-US/docs/Web/API/Console",
	"id": 1445,
	"parentId": "1444",
	"dateAddedLocal": "6/21/2021, 2:12:25 PM",
	"dateAddedUTC": "2021-06-21T18:12:25.000Z"
},{
	"index": 1,
	"title": "Mastering The Developer Tools Console - Treehouse Blog",
	"url": "http://blog.teamtreehouse.com/mastering-developer-tools-console",
	"id": 1446,
	"parentId": "1444",
	"dateAddedLocal": "6/21/2021, 2:12:25 PM",
	"dateAddedUTC": "2021-06-21T18:12:25.000Z"
},{
	"index": 1,
	"title": "jquery",
	"id": 1447,
	"parentId": "1440",
	"dateAddedLocal": "6/21/2021, 2:28:37 PM",
	"dateAddedUTC": "2021-06-21T18:28:37.102Z"
},{
	"index": 0,
	"title": "A Tour of Railsâ€™ jQuery UJS",
	"url": "https://robots.thoughtbot.com/a-tour-of-rails-jquery-ujs",
	"id": 1448,
	"parentId": "1447",
	"dateAddedLocal": "6/21/2021, 2:12:25 PM",
	"dateAddedUTC": "2021-06-21T18:12:25.000Z"
},{
	"index": 1,
	"title": "jQuery Learning Center",
	"url": "http://learn.jquery.com/",
	"id": 1449,
	"parentId": "1447",
	"dateAddedLocal": "6/21/2021, 2:12:25 PM",
	"dateAddedUTC": "2021-06-21T18:12:25.000Z"
},{
	"index": 2,
	"title": "JS Lab - jQuery demo",
	"url": "file:///Users/BradSmith/dev/js-lab/js-lab3/index.html",
	"id": 1450,
	"parentId": "1447",
	"dateAddedLocal": "6/21/2021, 2:12:25 PM",
	"dateAddedUTC": "2021-06-21T18:12:25.000Z"
},{
	"index": 2,
	"title": "js-libraries",
	"id": 1451,
	"parentId": "1440",
	"dateAddedLocal": "6/21/2021, 2:28:37 PM",
	"dateAddedUTC": "2021-06-21T18:28:37.103Z"
},{
	"index": 0,
	"title": "jQuery",
	"url": "http://jquery.com/",
	"id": 1452,
	"parentId": "1451",
	"dateAddedLocal": "6/21/2021, 2:12:25 PM",
	"dateAddedUTC": "2021-06-21T18:12:25.000Z"
},{
	"index": 1,
	"title": "MooTools",
	"url": "https://mootools.net/",
	"id": 1453,
	"parentId": "1451",
	"dateAddedLocal": "6/21/2021, 2:12:25 PM",
	"dateAddedUTC": "2021-06-21T18:12:25.000Z"
},{
	"index": 2,
	"title": "Prototype JavaScript framework: a foundation for ambitious web applications",
	"url": "http://prototypejs.org/",
	"id": 1454,
	"parentId": "1451",
	"dateAddedLocal": "6/21/2021, 2:12:25 PM",
	"dateAddedUTC": "2021-06-21T18:12:25.000Z"
},{
	"index": 3,
	"title": "The Dojo Foundation",
	"url": "http://dojofoundation.org/index.php",
	"id": 1455,
	"parentId": "1451",
	"dateAddedLocal": "6/21/2021, 2:12:25 PM",
	"dateAddedUTC": "2021-06-21T18:12:25.000Z"
},{
	"index": 3,
	"title": "lodash",
	"id": 1456,
	"parentId": "1440",
	"dateAddedLocal": "6/21/2021, 2:28:37 PM",
	"dateAddedUTC": "2021-06-21T18:28:37.103Z"
},{
	"index": 0,
	"title": "Lodash",
	"url": "https://lodash.com/",
	"id": 1457,
	"parentId": "1456",
	"dateAddedLocal": "6/21/2021, 2:12:25 PM",
	"dateAddedUTC": "2021-06-21T18:12:25.000Z"
},{
	"index": 1,
	"title": "Lodash Documentation",
	"url": "https://lodash.com/docs/4.17.4#template",
	"id": 1458,
	"parentId": "1456",
	"dateAddedLocal": "6/21/2021, 2:12:25 PM",
	"dateAddedUTC": "2021-06-21T18:12:25.000Z"
},{
	"index": 2,
	"title": "Build Podcast 034 Lodash - YouTube",
	"url": "https://www.youtube.com/watch?v=_5YYmQ8XKMk&t=264s",
	"id": 1459,
	"parentId": "1456",
	"dateAddedLocal": "6/21/2021, 2:12:25 PM",
	"dateAddedUTC": "2021-06-21T18:12:25.000Z"
},{
	"index": 4,
	"title": "node",
	"id": 1460,
	"parentId": "1440",
	"dateAddedLocal": "6/21/2021, 2:28:37 PM",
	"dateAddedUTC": "2021-06-21T18:28:37.103Z"
},{
	"index": 0,
	"title": "Introduction to Node.js with Ryan Dahl - YouTube",
	"url": "https://www.youtube.com/watch?v=jo_B4LTHi3I",
	"id": 1461,
	"parentId": "1460",
	"dateAddedLocal": "6/21/2021, 2:12:25 PM",
	"dateAddedUTC": "2021-06-21T18:12:25.000Z"
},{
	"index": 1,
	"title": "npm ERR! Cannot find module 'internal/util/types' (tested with n lts and n latest) Â· Issue #476 Â· tj/n",
	"url": "https://github.com/tj/n/issues/476",
	"id": 1462,
	"parentId": "1460",
	"dateAddedLocal": "6/21/2021, 2:12:25 PM",
	"dateAddedUTC": "2021-06-21T18:12:25.000Z"
},{
	"index": 2,
	"title": "Modern CSS Explained For Dinosaurs â€“ Actualize â€“ Medium",
	"url": "https://medium.com/actualize-network/modern-css-explained-for-dinosaurs-5226febe3525",
	"id": 1463,
	"parentId": "1460",
	"dateAddedLocal": "6/21/2021, 2:12:25 PM",
	"dateAddedUTC": "2021-06-21T18:12:25.000Z"
},{
	"index": 3,
	"title": "Node.js v9.5.0 Documentation",
	"url": "https://nodejs.org/api/",
	"id": 1464,
	"parentId": "1460",
	"dateAddedLocal": "6/21/2021, 2:12:25 PM",
	"dateAddedUTC": "2021-06-21T18:12:25.000Z"
},{
	"index": 4,
	"title": "yargs/yargs: yargs the modern, pirate-themed successor to optimist.",
	"url": "https://github.com/yargs/yargs",
	"id": 1465,
	"parentId": "1460",
	"dateAddedLocal": "6/21/2021, 2:12:25 PM",
	"dateAddedUTC": "2021-06-21T18:12:25.000Z"
},{
	"index": 5,
	"title": "Node.js",
	"url": "https://nodejs.org/en/",
	"id": 1466,
	"parentId": "1460",
	"dateAddedLocal": "6/21/2021, 2:12:25 PM",
	"dateAddedUTC": "2021-06-21T18:12:25.000Z"
},{
	"index": 5,
	"title": "promises",
	"id": 1467,
	"parentId": "1440",
	"dateAddedLocal": "6/21/2021, 2:28:37 PM",
	"dateAddedUTC": "2021-06-21T18:28:37.104Z"
},{
	"index": 0,
	"title": "JavaScript Promises: an Introduction Â |Â  Web Fundamentals Â |Â  Google Developers",
	"url": "https://developers.google.com/web/fundamentals/primers/promises",
	"id": 1468,
	"parentId": "1467",
	"dateAddedLocal": "6/21/2021, 2:12:25 PM",
	"dateAddedUTC": "2021-06-21T18:12:25.000Z"
},{
	"index": 1,
	"title": "JavaScript Promises: an Introduction Â |Â  Web Fundamentals Â |Â  Google Developers",
	"url": "https://developers.google.com/web/fundamentals/primers/promises#promise-terminology",
	"id": 1469,
	"parentId": "1467",
	"dateAddedLocal": "6/21/2021, 2:12:25 PM",
	"dateAddedUTC": "2021-06-21T18:12:25.000Z"
},{
	"index": 2,
	"title": "JavaScript Promises: an Introduction Â |Â  Web Fundamentals Â |Â  Google Developers",
	"url": "https://developers.google.com/web/fundamentals/primers/promises#whats-all-the-fuss-about",
	"id": 1470,
	"parentId": "1467",
	"dateAddedLocal": "6/21/2021, 2:12:25 PM",
	"dateAddedUTC": "2021-06-21T18:12:25.000Z"
},{
	"index": 3,
	"title": "Promises API reference",
	"url": "https://developers.google.com/web/fundamentals/primers/promises#promise-api-reference",
	"id": 1471,
	"parentId": "1467",
	"dateAddedLocal": "6/21/2021, 2:12:25 PM",
	"dateAddedUTC": "2021-06-21T18:12:25.000Z"
},{
	"index": 4,
	"title": "Promises",
	"url": "http://exploringjs.com/es6/ch_promises.html",
	"id": 1472,
	"parentId": "1467",
	"dateAddedLocal": "6/21/2021, 2:12:25 PM",
	"dateAddedUTC": "2021-06-21T18:12:25.000Z"
},{
	"index": 5,
	"title": "How to Use Javascript Promises - YouTube",
	"url": "https://www.youtube.com/watch?v=104J7_HyaG4",
	"id": 1473,
	"parentId": "1467",
	"dateAddedLocal": "6/21/2021, 2:12:25 PM",
	"dateAddedUTC": "2021-06-21T18:12:25.000Z"
},{
	"index": 6,
	"title": "21 Essential JavaScript Interview Questions | Codementor",
	"url": "https://www.codementor.io/nihantanu/21-essential-javascript-tech-interview-practice-questions-answers-du107p62z",
	"id": 1474,
	"parentId": "1440",
	"dateAddedLocal": "6/21/2021, 2:12:25 PM",
	"dateAddedUTC": "2021-06-21T18:12:25.000Z"
},{
	"index": 7,
	"title": "airbnb/javascript: JavaScript Style Guide",
	"url": "https://github.com/airbnb/javascript",
	"id": 1520,
	"parentId": "1440",
	"dateAddedLocal": "6/21/2021, 2:12:25 PM",
	"dateAddedUTC": "2021-06-21T18:12:25.000Z"
},{
	"index": 8,
	"title": "Ajax: A New Approach to Web Applications | Adaptive Path",
	"url": "http://adaptivepath.org/ideas/ajax-new-approach-web-applications/",
	"id": 1475,
	"parentId": "1440",
	"dateAddedLocal": "6/21/2021, 2:12:25 PM",
	"dateAddedUTC": "2021-06-21T18:12:25.000Z"
},{
	"index": 9,
	"title": "Babel Â· The compiler for writing next generation JavaScript",
	"url": "https://babeljs.io/",
	"id": 1476,
	"parentId": "1440",
	"dateAddedLocal": "6/21/2021, 2:12:25 PM",
	"dateAddedUTC": "2021-06-21T18:12:25.000Z"
},{
	"index": 10,
	"title": "Babel Â· The compiler for writing next generation JavaScript",
	"url": "https://babeljs.io/repl/#?babili=false&evaluate=true&lineWrap=false&presets=es2015%2Creact%2Cstage-2&targets=&browsers=&builtIns=false&code=",
	"id": 1528,
	"parentId": "1440",
	"dateAddedLocal": "6/21/2021, 2:12:25 PM",
	"dateAddedUTC": "2021-06-21T18:12:25.000Z"
},{
	"index": 11,
	"title": "best-practices/best-practices.md at master Â· stevekwan/best-practices",
	"url": "https://github.com/stevekwan/best-practices/blob/master/javascript/best-practices.md",
	"id": 1477,
	"parentId": "1440",
	"dateAddedLocal": "6/21/2021, 2:12:25 PM",
	"dateAddedUTC": "2021-06-21T18:12:25.000Z"
},{
	"index": 12,
	"title": "bower",
	"url": "https://www.npmjs.com/package/bower",
	"id": 1478,
	"parentId": "1440",
	"dateAddedLocal": "6/21/2021, 2:12:25 PM",
	"dateAddedUTC": "2021-06-21T18:12:25.000Z"
},{
	"index": 13,
	"title": "Chrome DevTools Â |Â  Tools for Web Developers Â |Â  Google Developers",
	"url": "https://developers.google.com/web/tools/chrome-devtools/?utm_source=dcc&utm_medium=redirect&utm_campaign=2016q3",
	"id": 1523,
	"parentId": "1440",
	"dateAddedLocal": "6/21/2021, 2:12:25 PM",
	"dateAddedUTC": "2021-06-21T18:12:25.000Z"
},{
	"index": 14,
	"title": "Chrome Devtools Cheatsheet",
	"url": "http://anti-code.com/devtools-cheatsheet/",
	"id": 1524,
	"parentId": "1440",
	"dateAddedLocal": "6/21/2021, 2:12:25 PM",
	"dateAddedUTC": "2021-06-21T18:12:25.000Z"
},{
	"index": 15,
	"title": "Dark Sky for iOS and Android",
	"url": "https://darksky.net/app/",
	"id": 1479,
	"parentId": "1440",
	"dateAddedLocal": "6/21/2021, 2:12:25 PM",
	"dateAddedUTC": "2021-06-21T18:12:25.000Z"
},{
	"index": 16,
	"title": "Dark Sky Maps",
	"url": "https://maps.darksky.net/",
	"id": 1480,
	"parentId": "1440",
	"dateAddedLocal": "6/21/2021, 2:12:25 PM",
	"dateAddedUTC": "2021-06-21T18:12:25.000Z"
},{
	"index": 17,
	"title": "ECMAScript 6: New Features: Overview and Comparison",
	"url": "http://es6-features.org/#ExpressionBodies",
	"id": 1481,
	"parentId": "1440",
	"dateAddedLocal": "6/21/2021, 2:12:25 PM",
	"dateAddedUTC": "2021-06-21T18:12:25.000Z"
},{
	"index": 18,
	"title": "ecmascript spec",
	"url": "http://www.ecma-international.org/ecma-262/8.0/index.html",
	"id": 1482,
	"parentId": "1440",
	"dateAddedLocal": "6/21/2021, 2:12:25 PM",
	"dateAddedUTC": "2021-06-21T18:12:25.000Z"
},{
	"index": 19,
	"title": "Eloquent JavaScript",
	"url": "http://eloquentjavascript.net/index.html",
	"id": 1483,
	"parentId": "1440",
	"dateAddedLocal": "6/21/2021, 2:12:25 PM",
	"dateAddedUTC": "2021-06-21T18:12:25.000Z"
},{
	"index": 20,
	"title": "Event KeyCodes",
	"url": "http://keycode.info/",
	"id": 1484,
	"parentId": "1440",
	"dateAddedLocal": "6/21/2021, 2:12:25 PM",
	"dateAddedUTC": "2021-06-21T18:12:25.000Z"
},{
	"index": 21,
	"title": "event listeners",
	"url": "https://developer.mozilla.org/en-US/docs/Web/Events",
	"id": 1485,
	"parentId": "1440",
	"dateAddedLocal": "6/21/2021, 2:12:25 PM",
	"dateAddedUTC": "2021-06-21T18:12:25.000Z"
},{
	"index": 22,
	"title": "Execution context, Scope chain and JavaScript internals",
	"url": "https://hackernoon.com/execution-context-in-javascript-319dd72e8e2c",
	"id": 1515,
	"parentId": "1440",
	"dateAddedLocal": "6/21/2021, 2:12:25 PM",
	"dateAddedUTC": "2021-06-21T18:12:25.000Z"
},{
	"index": 23,
	"title": "fetch-jsonp",
	"url": "https://www.npmjs.com/package/fetch-jsonp",
	"id": 1486,
	"parentId": "1440",
	"dateAddedLocal": "6/21/2021, 2:12:25 PM",
	"dateAddedUTC": "2021-06-21T18:12:25.000Z"
},{
	"index": 24,
	"title": "Flatiron School Presents (New York, NY) | Meetup",
	"url": "https://www.meetup.com/Flatiron-School-Presents/?scroll=true",
	"id": 1487,
	"parentId": "1440",
	"dateAddedLocal": "6/21/2021, 2:12:25 PM",
	"dateAddedUTC": "2021-06-21T18:12:25.000Z"
},{
	"index": 25,
	"title": "Flow | A static type checker for JavaScript",
	"url": "https://flowtype.org/",
	"id": 1488,
	"parentId": "1440",
	"dateAddedLocal": "6/21/2021, 2:12:25 PM",
	"dateAddedUTC": "2021-06-21T18:12:25.000Z"
},{
	"index": 26,
	"title": "Functions are first class objects in javascript â€“ Helephant.com",
	"url": "https://web.archive.org/web/20170606141950/http://helephant.com/2008/08/19/functions-are-first-class-objects-in-javascript/",
	"id": 1489,
	"parentId": "1440",
	"dateAddedLocal": "6/21/2021, 2:12:25 PM",
	"dateAddedUTC": "2021-06-21T18:12:25.000Z"
},{
	"index": 27,
	"title": "Grunt: The JavaScript Task Runner",
	"url": "http://gruntjs.com/",
	"id": 1490,
	"parentId": "1440",
	"dateAddedLocal": "6/21/2021, 2:12:25 PM",
	"dateAddedUTC": "2021-06-21T18:12:25.000Z"
},{
	"index": 28,
	"title": "Handlebars.js: Minimal Templating on Steroids",
	"url": "http://handlebarsjs.com/",
	"id": 1491,
	"parentId": "1440",
	"dateAddedLocal": "6/21/2021, 2:12:25 PM",
	"dateAddedUTC": "2021-06-21T18:12:25.000Z"
},{
	"index": 29,
	"title": "How to Install Node.js and NPM on a Mac",
	"url": "http://blog.teamtreehouse.com/install-node-js-npm-mac",
	"id": 1492,
	"parentId": "1440",
	"dateAddedLocal": "6/21/2021, 2:12:25 PM",
	"dateAddedUTC": "2021-06-21T18:12:25.000Z"
},{
	"index": 30,
	"title": "JavaScript | MDN",
	"url": "https://developer.mozilla.org/en-US/docs/Web/JavaScript",
	"id": 1499,
	"parentId": "1440",
	"dateAddedLocal": "6/21/2021, 2:12:25 PM",
	"dateAddedUTC": "2021-06-21T18:12:25.000Z"
},{
	"index": 31,
	"title": "JavaScript 30 â€” Build 30 things with vanilla JS in 30 days with 30 tutorials",
	"url": "https://javascript30.com/",
	"id": 1493,
	"parentId": "1440",
	"dateAddedLocal": "6/21/2021, 2:12:25 PM",
	"dateAddedUTC": "2021-06-21T18:12:25.000Z"
},{
	"index": 32,
	"title": "JavaScript at Microsoft | Microsoft Developer",
	"url": "https://developer.microsoft.com/en-us/javascript/",
	"id": 2599,
	"parentId": "1440",
	"dateAddedLocal": "11/4/2023, 9:10:05 AM",
	"dateAddedUTC": "2023-11-04T13:10:05.676Z"
},{
	"index": 33,
	"title": "JavaScript Cheat Sheet | Codementor",
	"url": "https://www.codementor.io/johnnyb/javascript-cheatsheet-fb54lz08k",
	"id": 1494,
	"parentId": "1440",
	"dateAddedLocal": "6/21/2021, 2:12:25 PM",
	"dateAddedUTC": "2021-06-21T18:12:25.000Z"
},{
	"index": 34,
	"title": "JavaScript Glossary | Codecademy",
	"url": "https://www.codecademy.com/articles/glossary-javascript#strings",
	"id": 1495,
	"parentId": "1440",
	"dateAddedLocal": "6/21/2021, 2:12:25 PM",
	"dateAddedUTC": "2021-06-21T18:12:25.000Z"
},{
	"index": 35,
	"title": "JavaScript Guide - JavaScript | MDN",
	"url": "https://developer.mozilla.org/en-US/docs/Web/JavaScript/Guide",
	"id": 1496,
	"parentId": "1440",
	"dateAddedLocal": "6/21/2021, 2:12:25 PM",
	"dateAddedUTC": "2021-06-21T18:12:25.000Z"
},{
	"index": 36,
	"title": "JavaScript Promises",
	"url": "https://davidwalsh.name/promises",
	"id": 1516,
	"parentId": "1440",
	"dateAddedLocal": "6/21/2021, 2:12:25 PM",
	"dateAddedUTC": "2021-06-21T18:12:25.000Z"
},{
	"index": 37,
	"title": "JavaScript Prototypes - Sebastian's Blog",
	"url": "http://sporto.github.io/blog/2013/02/22/a-plain-english-guide-to-javascript-prototypes/",
	"id": 1497,
	"parentId": "1440",
	"dateAddedLocal": "6/21/2021, 2:12:25 PM",
	"dateAddedUTC": "2021-06-21T18:12:25.000Z"
},{
	"index": 38,
	"title": "JavaScript Standard Style",
	"url": "https://standardjs.com/#are-there-text-editor-plugins",
	"id": 1498,
	"parentId": "1440",
	"dateAddedLocal": "6/21/2021, 2:12:25 PM",
	"dateAddedUTC": "2021-06-21T18:12:25.000Z"
},{
	"index": 39,
	"title": "JavaScript: Understanding the Weird Parts - The First 3.5 Hours - YouTube",
	"url": "https://www.youtube.com/watch?v=Bv_5Zv5c-Ts",
	"id": 1500,
	"parentId": "1440",
	"dateAddedLocal": "6/21/2021, 2:12:25 PM",
	"dateAddedUTC": "2021-06-21T18:12:25.000Z"
},{
	"index": 40,
	"title": "javascript/react at master Â· airbnb/javascript",
	"url": "https://github.com/airbnb/javascript/tree/master/react",
	"id": 1521,
	"parentId": "1440",
	"dateAddedLocal": "6/21/2021, 2:12:25 PM",
	"dateAddedUTC": "2021-06-21T18:12:25.000Z"
},{
	"index": 41,
	"title": "JS Bin - Collaborative JavaScript Debugging",
	"url": "https://jsbin.com/gareno/edit?html,js,output",
	"id": 1501,
	"parentId": "1440",
	"dateAddedLocal": "6/21/2021, 2:12:25 PM",
	"dateAddedUTC": "2021-06-21T18:12:25.000Z"
},{
	"index": 42,
	"title": "JSFiddle",
	"url": "https://jsfiddle.net/",
	"id": 1502,
	"parentId": "1440",
	"dateAddedLocal": "6/21/2021, 2:12:25 PM",
	"dateAddedUTC": "2021-06-21T18:12:25.000Z"
},{
	"index": 43,
	"title": "JSJ Episodes Archive - Devchat.tv",
	"url": "https://devchat.tv/js-jabber",
	"id": 1519,
	"parentId": "1440",
	"dateAddedLocal": "6/21/2021, 2:12:25 PM",
	"dateAddedUTC": "2021-06-21T18:12:25.000Z"
},{
	"index": 44,
	"title": "jslint - Google Search",
	"url": "https://www.google.com/webhp?sourceid=chrome-instant&rlz=1C5CHFA_enUS700US700&ion=1&espv=2&ie=UTF-8#q=jslint",
	"id": 1503,
	"parentId": "1440",
	"dateAddedLocal": "6/21/2021, 2:12:25 PM",
	"dateAddedUTC": "2021-06-21T18:12:25.000Z"
},{
	"index": 45,
	"title": "JSLint:Â The JavaScript Code Quality Tool",
	"url": "http://www.jslint.com/",
	"id": 1504,
	"parentId": "1440",
	"dateAddedLocal": "6/21/2021, 2:12:25 PM",
	"dateAddedUTC": "2021-06-21T18:12:25.000Z"
},{
	"index": 46,
	"title": "Learn JavaScript & jQuery - a book about interactive front-end web development",
	"url": "http://javascriptbook.com/",
	"id": 1518,
	"parentId": "1440",
	"dateAddedLocal": "6/21/2021, 2:12:25 PM",
	"dateAddedUTC": "2021-06-21T18:12:25.000Z"
},{
	"index": 47,
	"title": "Learning JavaScript Data Structures and Algorithms: Introduction to Arrays | packtpub.com - YouTube",
	"url": "https://www.youtube.com/watch?v=8GRQtvpXBbQ",
	"id": 1522,
	"parentId": "1440",
	"dateAddedLocal": "6/21/2021, 2:12:25 PM",
	"dateAddedUTC": "2021-06-21T18:12:25.000Z"
},{
	"index": 48,
	"title": "LearnWebDev.net",
	"url": "http://learnwebdev.net/",
	"id": 1505,
	"parentId": "1440",
	"dateAddedLocal": "6/21/2021, 2:12:25 PM",
	"dateAddedUTC": "2021-06-21T18:12:25.000Z"
},{
	"index": 49,
	"title": "Moment.js | Home",
	"url": "https://momentjs.com/",
	"id": 1506,
	"parentId": "1440",
	"dateAddedLocal": "6/21/2021, 2:12:25 PM",
	"dateAddedUTC": "2021-06-21T18:12:25.000Z"
},{
	"index": 50,
	"title": "npm",
	"url": "https://www.npmjs.com/",
	"id": 1507,
	"parentId": "1440",
	"dateAddedLocal": "6/21/2021, 2:12:25 PM",
	"dateAddedUTC": "2021-06-21T18:12:25.000Z"
},{
	"index": 51,
	"title": "npm Documentation",
	"url": "https://docs.npmjs.com/",
	"id": 1508,
	"parentId": "1440",
	"dateAddedLocal": "6/21/2021, 2:12:25 PM",
	"dateAddedUTC": "2021-06-21T18:12:25.000Z"
},{
	"index": 52,
	"title": "Operator precedence - JavaScript | MDN",
	"url": "https://developer.mozilla.org/en-US/docs/Web/JavaScript/Reference/Operators/Operator_Precedence#Table",
	"id": 1517,
	"parentId": "1440",
	"dateAddedLocal": "6/21/2021, 2:12:25 PM",
	"dateAddedUTC": "2021-06-21T18:12:25.000Z"
},{
	"index": 53,
	"title": "Plugins - Grunt: The JavaScript Task Runner",
	"url": "http://gruntjs.com/plugins",
	"id": 1509,
	"parentId": "1440",
	"dateAddedLocal": "6/21/2021, 2:12:25 PM",
	"dateAddedUTC": "2021-06-21T18:12:25.000Z"
},{
	"index": 54,
	"title": "Reduce Advanced - Part 4 of Functional Programming in JavaScript - YouTube",
	"url": "https://www.youtube.com/watch?v=1DMolJ2FrNY",
	"id": 1510,
	"parentId": "1440",
	"dateAddedLocal": "6/21/2021, 2:12:25 PM",
	"dateAddedUTC": "2021-06-21T18:12:25.000Z"
},{
	"index": 55,
	"title": "Sass: Syntactically Awesome Style Sheets",
	"url": "http://sass-lang.com/",
	"id": 1511,
	"parentId": "1440",
	"dateAddedLocal": "6/21/2021, 2:12:25 PM",
	"dateAddedUTC": "2021-06-21T18:12:25.000Z"
},{
	"index": 56,
	"title": "TypeScript - JavaScript that scales.",
	"url": "https://www.typescriptlang.org/",
	"id": 1512,
	"parentId": "1440",
	"dateAddedLocal": "6/21/2021, 2:12:25 PM",
	"dateAddedUTC": "2021-06-21T18:12:25.000Z"
},{
	"index": 57,
	"title": "Underscore.js",
	"url": "http://underscorejs.org/",
	"id": 1513,
	"parentId": "1440",
	"dateAddedLocal": "6/21/2021, 2:12:25 PM",
	"dateAddedUTC": "2021-06-21T18:12:25.000Z"
},{
	"index": 58,
	"title": "Understanding JavaScript Memoization In 3 Minutes - codeburst",
	"url": "https://codeburst.io/understanding-memoization-in-3-minutes-2e58daf33a19",
	"id": 1525,
	"parentId": "1440",
	"dateAddedLocal": "6/21/2021, 2:12:25 PM",
	"dateAddedUTC": "2021-06-21T18:12:25.000Z"
},{
	"index": 59,
	"title": "Your Guide to Semicolons in JavaScript | Codecademy",
	"url": "https://www.codecademy.com/blog/78",
	"id": 1514,
	"parentId": "1440",
	"dateAddedLocal": "6/21/2021, 2:12:25 PM",
	"dateAddedUTC": "2021-06-21T18:12:25.000Z"
},{
	"index": 60,
	"title": "visualizations",
	"id": 3022,
	"parentId": "1440",
	"dateAddedLocal": "10/14/2024, 10:20:39 AM",
	"dateAddedUTC": "2024-10-14T14:20:39.889Z"
},{
	"index": 0,
	"title": "SurveyJS - JavaScript Libraries for Surveys and Forms",
	"url": "https://surveyjs.io/",
	"id": 3021,
	"parentId": "3022",
	"dateAddedLocal": "10/14/2024, 10:19:38 AM",
	"dateAddedUTC": "2024-10-14T14:19:38.072Z"
},{
	"index": 86,
	"title": "jquery",
	"id": 1529,
	"parentId": "871",
	"dateAddedLocal": "6/21/2021, 2:28:37 PM",
	"dateAddedUTC": "2021-06-21T18:28:37.111Z"
},{
	"index": 0,
	"title": "jQuery docs",
	"url": "http://api.jquery.com/",
	"id": 1530,
	"parentId": "1529",
	"dateAddedLocal": "6/21/2021, 2:12:25 PM",
	"dateAddedUTC": "2021-06-21T18:12:25.000Z"
},{
	"index": 1,
	"title": "Hosted Libraries Â |Â  Hosted Libraries Â |Â  Google Developers",
	"url": "https://developers.google.com/speed/libraries/#jquery",
	"id": 1531,
	"parentId": "1529",
	"dateAddedLocal": "6/21/2021, 2:12:25 PM",
	"dateAddedUTC": "2021-06-21T18:12:25.000Z"
},{
	"index": 2,
	"title": "jQuery Cheat Sheet",
	"url": "https://oscarotero.com/jquery/",
	"id": 1532,
	"parentId": "1529",
	"dateAddedLocal": "6/21/2021, 2:12:25 PM",
	"dateAddedUTC": "2021-06-21T18:12:25.000Z"
},{
	"index": 87,
	"title": "js animations",
	"id": 1533,
	"parentId": "871",
	"dateAddedLocal": "6/21/2021, 2:28:37 PM",
	"dateAddedUTC": "2021-06-21T18:28:37.111Z"
},{
	"index": 88,
	"title": "js-rotation",
	"id": 1534,
	"parentId": "871",
	"dateAddedLocal": "6/21/2021, 2:28:37 PM",
	"dateAddedUTC": "2021-06-21T18:28:37.111Z"
},{
	"index": 0,
	"title": "Thrown for a loop: understanding for loops and timeouts in JavaScript",
	"url": "https://medium.freecodecamp.org/thrown-for-a-loop-understanding-for-loops-and-timeouts-in-javascript-558d8255d8a4",
	"id": 1535,
	"parentId": "1534",
	"dateAddedLocal": "6/21/2021, 2:12:25 PM",
	"dateAddedUTC": "2021-06-21T18:12:25.000Z"
},{
	"index": 1,
	"title": "JavaScript Fun: Looping with a Delay | Scottie's Tech.Info",
	"url": "https://scottiestech.info/2014/07/01/javascript-fun-looping-with-a-delay/",
	"id": 1536,
	"parentId": "1534",
	"dateAddedLocal": "6/21/2021, 2:12:25 PM",
	"dateAddedUTC": "2021-06-21T18:12:25.000Z"
},{
	"index": 2,
	"title": "Can you use a setTimeout in a for loop? : javascript",
	"url": "https://www.reddit.com/r/javascript/comments/6riwss/can_you_use_a_settimeout_in_a_for_loop/",
	"id": 1537,
	"parentId": "1534",
	"dateAddedLocal": "6/21/2021, 2:12:25 PM",
	"dateAddedUTC": "2021-06-21T18:12:25.000Z"
},{
	"index": 3,
	"title": "How to cycle through each element of an array each second - jQuery Forum",
	"url": "https://forum.jquery.com/topic/how-to-cycle-through-each-element-of-an-array-each-second",
	"id": 1538,
	"parentId": "1534",
	"dateAddedLocal": "6/21/2021, 2:12:25 PM",
	"dateAddedUTC": "2021-06-21T18:12:25.000Z"
},{
	"index": 4,
	"title": "setInterval() simply put, is a timed loop â€“ Eric Stermer â€“ Medium",
	"url": "https://medium.com/@eric.stermer/setinterval-simply-put-is-a-timed-loop-652eb54bd5f8",
	"id": 1539,
	"parentId": "1534",
	"dateAddedLocal": "6/21/2021, 2:12:25 PM",
	"dateAddedUTC": "2021-06-21T18:12:25.000Z"
},{
	"index": 5,
	"title": "Thrown for a loop: understanding for loops and timeouts in JavaScript",
	"url": "https://medium.freecodecamp.org/thrown-for-a-loop-understanding-for-loops-and-timeouts-in-javascript-558d8255d8a4",
	"id": 1540,
	"parentId": "1534",
	"dateAddedLocal": "6/21/2021, 2:12:25 PM",
	"dateAddedUTC": "2021-06-21T18:12:25.000Z"
},{
	"index": 6,
	"title": "JavaScript Fun: Looping with a Delay | Scottie's Tech.Info",
	"url": "https://scottiestech.info/2014/07/01/javascript-fun-looping-with-a-delay/",
	"id": 1541,
	"parentId": "1534",
	"dateAddedLocal": "6/21/2021, 2:12:25 PM",
	"dateAddedUTC": "2021-06-21T18:12:25.000Z"
},{
	"index": 7,
	"title": "Can you use a setTimeout in a for loop? : javascript",
	"url": "https://www.reddit.com/r/javascript/comments/6riwss/can_you_use_a_settimeout_in_a_for_loop/",
	"id": 1542,
	"parentId": "1534",
	"dateAddedLocal": "6/21/2021, 2:12:25 PM",
	"dateAddedUTC": "2021-06-21T18:12:25.000Z"
},{
	"index": 8,
	"title": "How to cycle through each element of an array each second - jQuery Forum",
	"url": "https://forum.jquery.com/topic/how-to-cycle-through-each-element-of-an-array-each-second",
	"id": 1543,
	"parentId": "1534",
	"dateAddedLocal": "6/21/2021, 2:12:25 PM",
	"dateAddedUTC": "2021-06-21T18:12:25.000Z"
},{
	"index": 9,
	"title": "setInterval() simply put, is a timed loop â€“ Eric Stermer â€“ Medium",
	"url": "https://medium.com/@eric.stermer/setinterval-simply-put-is-a-timed-loop-652eb54bd5f8",
	"id": 1544,
	"parentId": "1534",
	"dateAddedLocal": "6/21/2021, 2:12:25 PM",
	"dateAddedUTC": "2021-06-21T18:12:25.000Z"
},{
	"index": 89,
	"title": "jwt",
	"id": 1545,
	"parentId": "871",
	"dateAddedLocal": "6/21/2021, 2:28:37 PM",
	"dateAddedUTC": "2021-06-21T18:28:37.112Z"
},{
	"index": 0,
	"title": "JSON Web Token Introduction - jwt.io",
	"url": "https://jwt.io/introduction/",
	"id": 1546,
	"parentId": "1545",
	"dateAddedLocal": "6/21/2021, 2:12:25 PM",
	"dateAddedUTC": "2021-06-21T18:12:25.000Z"
},{
	"index": 90,
	"title": "laravel",
	"id": 1547,
	"parentId": "871",
	"dateAddedLocal": "6/21/2021, 2:28:37 PM",
	"dateAddedUTC": "2021-06-21T18:28:37.112Z"
},{
	"index": 0,
	"title": "Laravel - The PHP Framework For Web Artisans",
	"url": "https://laravel.com/",
	"id": 1548,
	"parentId": "1547",
	"dateAddedLocal": "6/21/2021, 2:12:25 PM",
	"dateAddedUTC": "2021-06-21T18:12:25.000Z"
},{
	"index": 91,
	"title": "linux",
	"id": 1549,
	"parentId": "871",
	"dateAddedLocal": "6/21/2021, 2:28:37 PM",
	"dateAddedUTC": "2021-06-21T18:28:37.112Z"
},{
	"index": 0,
	"title": "Running a Linux Web Server on an Android device | Codementor",
	"url": "https://www.codementor.io/maxpleaner/run-a-linux-web-server-on-android-device-du1083k05",
	"id": 1550,
	"parentId": "1549",
	"dateAddedLocal": "6/21/2021, 2:12:25 PM",
	"dateAddedUTC": "2021-06-21T18:12:25.000Z"
},{
	"index": 1,
	"title": "About nixCraft - nixCraft",
	"url": "https://www.cyberciti.biz/tips/about-us",
	"id": 1551,
	"parentId": "1549",
	"dateAddedLocal": "6/21/2021, 2:12:25 PM",
	"dateAddedUTC": "2021-06-21T18:12:25.000Z"
},{
	"index": 2,
	"title": "Use grep to search for strings in files on the shell",
	"url": "https://www.howtoforge.com/tutorial/linux-grep-command/",
	"id": 1552,
	"parentId": "1549",
	"dateAddedLocal": "6/21/2021, 2:12:25 PM",
	"dateAddedUTC": "2021-06-21T18:12:25.000Z"
},{
	"index": 3,
	"title": "How to Compress and Extract Files Using the tar Command on Linux",
	"url": "https://www.howtogeek.com/248780/how-to-compress-and-extract-files-using-the-tar-command-on-linux/",
	"id": 1553,
	"parentId": "1549",
	"dateAddedLocal": "6/21/2021, 2:12:25 PM",
	"dateAddedUTC": "2021-06-21T18:12:25.000Z"
},{
	"index": 92,
	"title": "lorem",
	"id": 2197,
	"parentId": "871",
	"dateAddedLocal": "6/21/2021, 2:28:37 PM",
	"dateAddedUTC": "2021-06-21T18:28:37.170Z"
},{
	"index": 0,
	"title": "https://hipsum.co",
	"url": "https://hipsum.co/",
	"id": 2198,
	"parentId": "2197",
	"dateAddedLocal": "6/21/2021, 2:12:25 PM",
	"dateAddedUTC": "2021-06-21T18:12:25.000Z"
},{
	"index": 93,
	"title": "mac",
	"id": 1554,
	"parentId": "871",
	"dateAddedLocal": "6/21/2021, 2:28:37 PM",
	"dateAddedUTC": "2021-06-21T18:28:37.113Z"
},{
	"index": 0,
	"title": "OS X Command line reference",
	"url": "http://ss64.com/osx/",
	"id": 1555,
	"parentId": "1554",
	"dateAddedLocal": "6/21/2021, 2:12:25 PM",
	"dateAddedUTC": "2021-06-21T18:12:25.000Z"
},{
	"index": 94,
	"title": "mailgun",
	"id": 1556,
	"parentId": "871",
	"dateAddedLocal": "6/21/2021, 2:28:37 PM",
	"dateAddedUTC": "2021-06-21T18:28:37.113Z"
},{
	"index": 0,
	"title": "mailgun",
	"url": "https://mailgun.com/",
	"id": 1557,
	"parentId": "1556",
	"dateAddedLocal": "6/21/2021, 2:12:25 PM",
	"dateAddedUTC": "2021-06-21T18:12:25.000Z"
},{
	"index": 95,
	"title": "make-files",
	"id": 1558,
	"parentId": "871",
	"dateAddedLocal": "6/21/2021, 2:28:37 PM",
	"dateAddedUTC": "2021-06-21T18:28:37.113Z"
},{
	"index": 0,
	"title": "What is a Makefile and how does it work? | Opensource.com",
	"url": "https://opensource.com/article/18/8/what-how-makefile",
	"id": 1559,
	"parentId": "1558",
	"dateAddedLocal": "6/21/2021, 2:12:25 PM",
	"dateAddedUTC": "2021-06-21T18:12:25.000Z"
},{
	"index": 96,
	"title": "markdown",
	"id": 1560,
	"parentId": "871",
	"dateAddedLocal": "6/21/2021, 2:28:37 PM",
	"dateAddedUTC": "2021-06-21T18:28:37.113Z"
},{
	"index": 0,
	"title": "Markdown Cheatsheet Â· adam-p/markdown-here Wiki",
	"url": "https://github.com/adam-p/markdown-here/wiki/Markdown-Cheatsheet",
	"id": 1561,
	"parentId": "1560",
	"dateAddedLocal": "6/21/2021, 2:12:25 PM",
	"dateAddedUTC": "2021-06-21T18:12:25.000Z"
},{
	"index": 1,
	"title": "Markdown Cheatsheet Â· adam-p/markdown-here Wiki",
	"url": "https://github.com/adam-p/markdown-here/wiki/Markdown-Cheatsheet#links",
	"id": 1562,
	"parentId": "1560",
	"dateAddedLocal": "6/21/2021, 2:12:25 PM",
	"dateAddedUTC": "2021-06-21T18:12:25.000Z"
},{
	"index": 2,
	"title": "Markdown editing with Visual Studio Code",
	"url": "https://code.visualstudio.com/docs/languages/markdown#_compiling-markdown-into-html",
	"id": 1563,
	"parentId": "1560",
	"dateAddedLocal": "6/21/2021, 2:12:25 PM",
	"dateAddedUTC": "2021-06-21T18:12:25.000Z"
},{
	"index": 3,
	"title": "redcarpet | RubyGems.org | your community gem host",
	"url": "https://rubygems.org/gems/redcarpet/versions/3.3.4",
	"id": 1564,
	"parentId": "1560",
	"dateAddedLocal": "6/21/2021, 2:12:25 PM",
	"dateAddedUTC": "2021-06-21T18:12:25.000Z"
},{
	"index": 4,
	"title": "vmg/redcarpet: The safe Markdown parser, reloaded.",
	"url": "https://github.com/vmg/redcarpet",
	"id": 1565,
	"parentId": "1560",
	"dateAddedLocal": "6/21/2021, 2:12:25 PM",
	"dateAddedUTC": "2021-06-21T18:12:25.000Z"
},{
	"index": 5,
	"title": "Mastering Markdown Â· GitHub Guides",
	"url": "https://guides.github.com/features/mastering-markdown/",
	"id": 1566,
	"parentId": "1560",
	"dateAddedLocal": "6/21/2021, 2:12:25 PM",
	"dateAddedUTC": "2021-06-21T18:12:25.000Z"
},{
	"index": 6,
	"title": "doctoc: generate toc for markdown files inside local git repo",
	"url": "https://github.com/thlorenz/doctoc",
	"id": 1567,
	"parentId": "1560",
	"dateAddedLocal": "6/21/2021, 2:12:25 PM",
	"dateAddedUTC": "2021-06-21T18:12:25.000Z"
},{
	"index": 7,
	"title": "Style feature layers | ArcGIS for Developers",
	"url": "https://developers.arcgis.com/labs/javascript/style-feature-layers/",
	"id": 1568,
	"parentId": "1560",
	"dateAddedLocal": "6/21/2021, 2:12:25 PM",
	"dateAddedUTC": "2021-06-21T18:12:25.000Z"
},{
	"index": 8,
	"title": "Ruby on Rails #71 Gem Redcarpet to Parse Markdown text to HTML - YouTube",
	"url": "https://www.youtube.com/watch?v=4tTRbJLeua8&t=901s",
	"id": 3024,
	"parentId": "1560",
	"dateAddedLocal": "10/14/2024, 12:13:53 PM",
	"dateAddedUTC": "2024-10-14T16:13:53.505Z"
},{
	"index": 97,
	"title": "mean-stack",
	"id": 1569,
	"parentId": "871",
	"dateAddedLocal": "6/21/2021, 2:28:37 PM",
	"dateAddedUTC": "2021-06-21T18:28:37.114Z"
},{
	"index": 0,
	"title": "WORK IN LINNOVATE | Linnovate - Enterprise Web Solutions",
	"url": "http://www.linnovate.net/content/work-linnovate",
	"id": 1570,
	"parentId": "1569",
	"dateAddedLocal": "6/21/2021, 2:12:25 PM",
	"dateAddedUTC": "2021-06-21T18:12:25.000Z"
},{
	"index": 1,
	"title": "Professional Services - Mongo Express Angular Node",
	"url": "http://mean.io/services/",
	"id": 1571,
	"parentId": "1569",
	"dateAddedLocal": "6/21/2021, 2:12:25 PM",
	"dateAddedUTC": "2021-06-21T18:12:25.000Z"
},{
	"index": 98,
	"title": "mechanize",
	"id": 1572,
	"parentId": "871",
	"dateAddedLocal": "6/21/2021, 2:28:37 PM",
	"dateAddedUTC": "2021-06-21T18:28:37.114Z"
},{
	"index": 0,
	"title": "Mechanize",
	"url": "http://docs.seattlerb.org/mechanize/",
	"id": 1573,
	"parentId": "1572",
	"dateAddedLocal": "6/21/2021, 2:12:25 PM",
	"dateAddedUTC": "2021-06-21T18:12:25.000Z"
},{
	"index": 99,
	"title": "memoization",
	"id": 1574,
	"parentId": "871",
	"dateAddedLocal": "6/21/2021, 2:28:37 PM",
	"dateAddedUTC": "2021-06-21T18:28:37.114Z"
},{
	"index": 0,
	"title": "Implementing Memoization in JavaScript â€” SitePoint",
	"url": "https://www.sitepoint.com/implementing-memoization-in-javascript/",
	"id": 1575,
	"parentId": "1574",
	"dateAddedLocal": "6/21/2021, 2:12:25 PM",
	"dateAddedUTC": "2021-06-21T18:12:25.000Z"
},{
	"index": 100,
	"title": "mentors",
	"id": 1576,
	"parentId": "871",
	"dateAddedLocal": "6/21/2021, 2:28:37 PM",
	"dateAddedUTC": "2021-06-21T18:28:37.114Z"
},{
	"index": 0,
	"title": "Syntax.fm",
	"url": "https://syntax.fm/",
	"id": 1577,
	"parentId": "1576",
	"dateAddedLocal": "6/21/2021, 2:12:25 PM",
	"dateAddedUTC": "2021-06-21T18:12:25.000Z"
},{
	"index": 1,
	"title": "Tuts+",
	"url": "https://tutsplus.com/",
	"id": 1578,
	"parentId": "1576",
	"dateAddedLocal": "6/21/2021, 2:12:25 PM",
	"dateAddedUTC": "2021-06-21T18:12:25.000Z"
},{
	"index": 2,
	"title": "Academind-Max",
	"url": "https://www.academind.com/",
	"id": 1579,
	"parentId": "1576",
	"dateAddedLocal": "6/21/2021, 2:12:25 PM",
	"dateAddedUTC": "2021-06-21T18:12:25.000Z"
},{
	"index": 3,
	"title": "Fun Fun Function - YouTube",
	"url": "https://www.youtube.com/channel/UCO1cgjhGzsSYb1rsB4bFe4Q",
	"id": 1580,
	"parentId": "1576",
	"dateAddedLocal": "6/21/2021, 2:12:25 PM",
	"dateAddedUTC": "2021-06-21T18:12:25.000Z"
},{
	"index": 4,
	"title": "Max: Learning Web Development in 2019+",
	"url": "https://www.academind.com/learn/web-dev/web-development-overview/",
	"id": 1581,
	"parentId": "1576",
	"dateAddedLocal": "6/21/2021, 2:12:25 PM",
	"dateAddedUTC": "2021-06-21T18:12:25.000Z"
},{
	"index": 101,
	"title": "midi",
	"id": 1582,
	"parentId": "871",
	"dateAddedLocal": "6/21/2021, 2:28:37 PM",
	"dateAddedUTC": "2021-06-21T18:28:37.115Z"
},{
	"index": 0,
	"title": "Web MIDI API",
	"url": "https://www.w3.org/TR/webmidi/",
	"id": 1583,
	"parentId": "1582",
	"dateAddedLocal": "6/21/2021, 2:12:25 PM",
	"dateAddedUTC": "2021-06-21T18:12:25.000Z"
},{
	"index": 102,
	"title": "minify",
	"id": 1584,
	"parentId": "871",
	"dateAddedLocal": "6/21/2021, 2:28:37 PM",
	"dateAddedUTC": "2021-06-21T18:28:37.115Z"
},{
	"index": 0,
	"title": "Minify Resources (HTML, CSS, and JavaScript) Â |Â  PageSpeed Insights Â |Â  Google Developers",
	"url": "https://developers.google.com/speed/docs/insights/MinifyResources",
	"id": 1585,
	"parentId": "1584",
	"dateAddedLocal": "6/21/2021, 2:12:25 PM",
	"dateAddedUTC": "2021-06-21T18:12:25.000Z"
},{
	"index": 103,
	"title": "mobile",
	"id": 1586,
	"parentId": "871",
	"dateAddedLocal": "6/21/2021, 2:28:37 PM",
	"dateAddedUTC": "2021-06-21T18:28:37.115Z"
},{
	"index": 0,
	"title": "Create a React Native App and Run it on the iOS Simulator and Android Emulator from @chrisachard on @eggheadio",
	"url": "https://egghead.io/lessons/react-native-create-a-react-native-app-and-run-it-on-the-ios-simulator-and-android-emulator",
	"id": 1587,
	"parentId": "1586",
	"dateAddedLocal": "6/21/2021, 2:12:25 PM",
	"dateAddedUTC": "2021-06-21T18:12:25.000Z"
},{
	"index": 1,
	"title": "Have a eureka moment with React Native ðŸ’¡ - smithwebtek@gmail.com - Gmail",
	"url": "https://mail.google.com/mail/u/0/?tab=rm#inbox/FMfcgxwBWKQvfhwwVcLFxBcdVqnnNfst",
	"id": 1588,
	"parentId": "1586",
	"dateAddedLocal": "6/21/2021, 2:12:25 PM",
	"dateAddedUTC": "2021-06-21T18:12:25.000Z"
},{
	"index": 2,
	"title": "Chloe Wiegand - Google Search",
	"url": "https://www.google.com/search?q=Chloe+Wiegand&rlz=1CDGOYI_enUS699US699&oq=Chloe+Wiegand&aqs=chrome..69i57.1676j0j7&hl=en-US&sourceid=chrome-mobile&ie=UTF-8",
	"id": 1589,
	"parentId": "1586",
	"dateAddedLocal": "6/21/2021, 2:12:25 PM",
	"dateAddedUTC": "2021-06-21T18:12:25.000Z"
},{
	"index": 3,
	"title": "Create a React Native App and Run it on the iOS Simulator and Android Emulator from @chrisachard on @eggheadio",
	"url": "https://egghead.io/lessons/react-native-create-a-react-native-app-and-run-it-on-the-ios-simulator-and-android-emulator",
	"id": 1590,
	"parentId": "1586",
	"dateAddedLocal": "6/21/2021, 2:12:25 PM",
	"dateAddedUTC": "2021-06-21T18:12:25.000Z"
},{
	"index": 4,
	"title": "Have a eureka moment with React Native ðŸ’¡ - smithwebtek@gmail.com - Gmail",
	"url": "https://mail.google.com/mail/u/0/?tab=rm#inbox/FMfcgxwBWKQvfhwwVcLFxBcdVqnnNfst",
	"id": 1591,
	"parentId": "1586",
	"dateAddedLocal": "6/21/2021, 2:12:25 PM",
	"dateAddedUTC": "2021-06-21T18:12:25.000Z"
},{
	"index": 104,
	"title": "monitoring",
	"id": 2213,
	"parentId": "871",
	"dateAddedLocal": "6/21/2021, 2:28:37 PM",
	"dateAddedUTC": "2021-06-21T18:28:37.172Z"
},{
	"index": 105,
	"title": "mysql",
	"id": 1592,
	"parentId": "871",
	"dateAddedLocal": "6/21/2021, 2:28:37 PM",
	"dateAddedUTC": "2021-06-21T18:28:37.116Z"
},{
	"index": 0,
	"title": "How To Install &amp; Locate MySQL in Terminal.app on Mac OS X - YouTube",
	"url": "https://www.youtube.com/watch?v=MCn10HWUxwo",
	"id": 1593,
	"parentId": "1592",
	"dateAddedLocal": "6/21/2021, 2:12:25 PM",
	"dateAddedUTC": "2021-06-21T18:12:25.000Z"
},{
	"index": 1,
	"title": "How To Install MySQL on Mac OS X - YouTube",
	"url": "https://www.youtube.com/watch?v=UcpHkYfWarM",
	"id": 1594,
	"parentId": "1592",
	"dateAddedLocal": "6/21/2021, 2:12:25 PM",
	"dateAddedUTC": "2021-06-21T18:12:25.000Z"
},{
	"index": 2,
	"title": "MySQL :: MySQL 8.0 Reference Manual :: Search Results",
	"url": "https://dev.mysql.com/doc/search/?d=201&p=1&q=sha2_password",
	"id": 1595,
	"parentId": "1592",
	"dateAddedLocal": "6/21/2021, 2:12:25 PM",
	"dateAddedUTC": "2021-06-21T18:12:25.000Z"
},{
	"index": 3,
	"title": "MySQL Error: Authentication plugin 'caching_sha2_password' cannot be loaded - Database Administrators Stack Exchange",
	"url": "https://dba.stackexchange.com/questions/204549/mysql-error-authentication-plugin-caching-sha2-password-cannot-be-loaded?utm_medium=organic&utm_source=google_rich_qa&utm_campaign=google_rich_qa",
	"id": 1596,
	"parentId": "1592",
	"dateAddedLocal": "6/21/2021, 2:12:25 PM",
	"dateAddedUTC": "2021-06-21T18:12:25.000Z"
},{
	"index": 4,
	"title": "Managing MySQL databases and users from the command line",
	"url": "https://www.a2hosting.com/kb/developer-corner/mysql/managing-mysql-databases-and-users-from-the-command-line",
	"id": 1597,
	"parentId": "1592",
	"dateAddedLocal": "6/21/2021, 2:12:25 PM",
	"dateAddedUTC": "2021-06-21T18:12:25.000Z"
},{
	"index": 5,
	"title": "[MySQL] Note: Create Admin User â€“ Hacker Noon",
	"url": "https://hackernoon.com/mysql-note-create-admin-user-5e77b43ecc8e",
	"id": 1598,
	"parentId": "1592",
	"dateAddedLocal": "6/21/2021, 2:12:25 PM",
	"dateAddedUTC": "2021-06-21T18:12:25.000Z"
},{
	"index": 6,
	"title": "MySQL :: MySQL 8.0 Reference Manual :: 6.5.1.3 Caching SHA-2 Pluggable Authentication",
	"url": "https://dev.mysql.com/doc/refman/8.0/en/caching-sha2-pluggable-authentication.html",
	"id": 1599,
	"parentId": "1592",
	"dateAddedLocal": "6/21/2021, 2:12:25 PM",
	"dateAddedUTC": "2021-06-21T18:12:25.000Z"
},{
	"index": 7,
	"title": "MySQL :: MySQL 8.0 Reference Manual :: 4.2.6 Using Option Files",
	"url": "https://dev.mysql.com/doc/refman/8.0/en/option-files.html",
	"id": 1600,
	"parentId": "1592",
	"dateAddedLocal": "6/21/2021, 2:12:25 PM",
	"dateAddedUTC": "2021-06-21T18:12:25.000Z"
},{
	"index": 8,
	"title": "MySQL :: MySQL 8.0 Reference Manual :: 4.3.1 mysqld â€” The MySQL Server",
	"url": "https://dev.mysql.com/doc/refman/8.0/en/mysqld.html",
	"id": 1601,
	"parentId": "1592",
	"dateAddedLocal": "6/21/2021, 2:12:25 PM",
	"dateAddedUTC": "2021-06-21T18:12:25.000Z"
},{
	"index": 9,
	"title": "How to Grant All Privileges on a Database in MySQL",
	"url": "https://chartio.com/resources/tutorials/how-to-grant-all-privileges-on-a-database-in-mysql/",
	"id": 1602,
	"parentId": "1592",
	"dateAddedLocal": "6/21/2021, 2:12:25 PM",
	"dateAddedUTC": "2021-06-21T18:12:25.000Z"
},{
	"index": 10,
	"title": "MySQL :: MySQL 8.0 Reference Manual :: 6.3.6 Setting Account Resource Limits",
	"url": "https://dev.mysql.com/doc/refman/8.0/en/user-resources.html",
	"id": 1603,
	"parentId": "1592",
	"dateAddedLocal": "6/21/2021, 2:12:25 PM",
	"dateAddedUTC": "2021-06-21T18:12:25.000Z"
},{
	"index": 11,
	"title": "How to use MySQL With Your Ruby on Rails Application - 1&amp;1",
	"url": "https://www.1and1.com/cloud-community/learn/application/ruby-on-rails/how-to-use-mysql-with-your-ruby-on-rails-application/",
	"id": 1604,
	"parentId": "1592",
	"dateAddedLocal": "6/21/2021, 2:12:25 PM",
	"dateAddedUTC": "2021-06-21T18:12:25.000Z"
},{
	"index": 12,
	"title": "Create a new Ruby on Rails application using MySQL instead of SQLite - Stack Overflow",
	"url": "https://stackoverflow.com/questions/3585/create-a-new-ruby-on-rails-application-using-mysql-instead-of-sqlite?utm_medium=organic&utm_source=google_rich_qa&utm_campaign=google_rich_qa",
	"id": 1605,
	"parentId": "1592",
	"dateAddedLocal": "6/21/2021, 2:12:25 PM",
	"dateAddedUTC": "2021-06-21T18:12:25.000Z"
},{
	"index": 13,
	"title": "MySQL :: MySQL Documentation",
	"url": "https://dev.mysql.com/doc/",
	"id": 1606,
	"parentId": "1592",
	"dateAddedLocal": "6/21/2021, 2:12:25 PM",
	"dateAddedUTC": "2021-06-21T18:12:25.000Z"
},{
	"index": 14,
	"title": "Navicat GUI | DB Admin Tool for MySQL, MariaDB, SQL Server, SQLite, Oracle & PostgreSQL client",
	"url": "https://www.navicat.com/en/",
	"id": 1607,
	"parentId": "1592",
	"dateAddedLocal": "6/21/2021, 2:12:25 PM",
	"dateAddedUTC": "2021-06-21T18:12:25.000Z"
},{
	"index": 15,
	"title": "MySQL :: Sakila Sample Database :: 4 Installation",
	"url": "https://dev.mysql.com/doc/sakila/en/sakila-installation.html",
	"id": 1608,
	"parentId": "1592",
	"dateAddedLocal": "6/21/2021, 2:12:25 PM",
	"dateAddedUTC": "2021-06-21T18:12:25.000Z"
},{
	"index": 16,
	"title": "Create ER Diagram of a Database in MySQL Workbench | by Tushar Soam | Medium",
	"url": "https://medium.com/@tushar0618/how-to-create-er-diagram-of-a-database-in-mysql-workbench-209fbf63fd03",
	"id": 1609,
	"parentId": "1592",
	"dateAddedLocal": "6/21/2021, 2:12:25 PM",
	"dateAddedUTC": "2021-06-21T18:12:25.000Z"
},{
	"index": 17,
	"title": "How to create ER diagram for existing MySQL database with MySQL Workbench - MySQL Workbench Tutorials",
	"url": "https://dataedo.com/kb/tools/mysql-workbench/create-database-diagram",
	"id": 1610,
	"parentId": "1592",
	"dateAddedLocal": "6/21/2021, 2:12:25 PM",
	"dateAddedUTC": "2021-06-21T18:12:25.000Z"
},{
	"index": 18,
	"title": "ER Diagram Tutorial | Complete Guide to Entity Relationship Diagrams",
	"url": "https://creately.com/blog/diagrams/er-diagrams-tutorial/",
	"id": 1611,
	"parentId": "1592",
	"dateAddedLocal": "6/21/2021, 2:12:25 PM",
	"dateAddedUTC": "2021-06-21T18:12:25.000Z"
},{
	"index": 19,
	"title": "Launch Meeting - Zoom",
	"url": "https://dfci.zoom.us/j/927930924?pwd=NUE3WjZ5ZWFYUExuK0lIaytYUUZRUT09#success",
	"id": 1612,
	"parentId": "1592",
	"dateAddedLocal": "6/21/2021, 2:12:25 PM",
	"dateAddedUTC": "2021-06-21T18:12:25.000Z"
},{
	"index": 20,
	"title": "React-router and nginx - Stack Overflow",
	"url": "https://stackoverflow.com/questions/43951720/react-router-and-nginx",
	"id": 1613,
	"parentId": "1592",
	"dateAddedLocal": "6/21/2021, 2:12:25 PM",
	"dateAddedUTC": "2021-06-21T18:12:25.000Z"
},{
	"index": 21,
	"title": "MySQL :: MySQL 5.7 Reference Manual :: 2.10 Postinstallation Setup and Testing",
	"url": "https://dev.mysql.com/doc/refman/5.7/en/postinstallation.html",
	"id": 1614,
	"parentId": "1592",
	"dateAddedLocal": "6/21/2021, 2:12:25 PM",
	"dateAddedUTC": "2021-06-21T18:12:25.000Z"
},{
	"index": 106,
	"title": "New folder",
	"id": 2214,
	"parentId": "871",
	"dateAddedLocal": "6/21/2021, 2:28:37 PM",
	"dateAddedUTC": "2021-06-21T18:28:37.172Z"
},{
	"index": 0,
	"title": "Eleventy is a simpler static site generator.",
	"url": "https://www.11ty.dev/",
	"id": 2215,
	"parentId": "2214",
	"dateAddedLocal": "6/23/2021, 8:47:13 AM",
	"dateAddedUTC": "2021-06-23T12:47:13.340Z"
},{
	"index": 107,
	"title": "nginx",
	"id": 1615,
	"parentId": "871",
	"dateAddedLocal": "6/21/2021, 2:28:37 PM",
	"dateAddedUTC": "2021-06-21T18:28:37.118Z"
},{
	"index": 0,
	"title": "How to easily set up Subdomain routing in Nginx",
	"url": "http://blog.manugarri.com/how-to-easily-set-up-subdomain-routing-in-nginx/",
	"id": 1616,
	"parentId": "1615",
	"dateAddedLocal": "6/21/2021, 2:12:25 PM",
	"dateAddedUTC": "2021-06-21T18:12:25.000Z"
},{
	"index": 1,
	"title": "Howard Lee Cloud",
	"url": "https://howardlee.cloud/blog/33/",
	"id": 1617,
	"parentId": "1615",
	"dateAddedLocal": "6/21/2021, 2:12:25 PM",
	"dateAddedUTC": "2021-06-21T18:12:25.000Z"
},{
	"index": 108,
	"title": "node",
	"id": 1618,
	"parentId": "871",
	"dateAddedLocal": "6/21/2021, 2:28:37 PM",
	"dateAddedUTC": "2021-06-21T18:28:37.118Z"
},{
	"index": 0,
	"title": "Browserify",
	"url": "http://browserify.org/",
	"id": 1619,
	"parentId": "1618",
	"dateAddedLocal": "6/21/2021, 2:12:25 PM",
	"dateAddedUTC": "2021-06-21T18:12:25.000Z"
},{
	"index": 1,
	"title": "Node.js Foundation",
	"url": "https://foundation.nodejs.org/",
	"id": 1620,
	"parentId": "1618",
	"dateAddedLocal": "6/21/2021, 2:12:25 PM",
	"dateAddedUTC": "2021-06-21T18:12:25.000Z"
},{
	"index": 2,
	"title": "REPL | Node.js v9.5.0 Documentation",
	"url": "https://nodejs.org/api/repl.html",
	"id": 1621,
	"parentId": "1618",
	"dateAddedLocal": "6/21/2021, 2:12:25 PM",
	"dateAddedUTC": "2021-06-21T18:12:25.000Z"
},{
	"index": 3,
	"title": "Using the Console Â |Â  Tools for Web Developers Â |Â  Google Developers",
	"url": "https://developers.google.com/web/tools/chrome-devtools/console/?utm_source=dcc&utm_medium=redirect&utm_campaign=2016q3",
	"id": 1622,
	"parentId": "1618",
	"dateAddedLocal": "6/21/2021, 2:12:25 PM",
	"dateAddedUTC": "2021-06-21T18:12:25.000Z"
},{
	"index": 4,
	"title": "Expect / Should - Chai",
	"url": "http://www.chaijs.com/api/bdd/",
	"id": 1623,
	"parentId": "1618",
	"dateAddedLocal": "6/21/2021, 2:12:25 PM",
	"dateAddedUTC": "2021-06-21T18:12:25.000Z"
},{
	"index": 5,
	"title": "Test suite - Wikipedia",
	"url": "https://en.wikipedia.org/wiki/Test_suite",
	"id": 1624,
	"parentId": "1618",
	"dateAddedLocal": "6/21/2021, 2:12:25 PM",
	"dateAddedUTC": "2021-06-21T18:12:25.000Z"
},{
	"index": 6,
	"title": "Mocha - the fun, simple, flexible JavaScript test framework",
	"url": "https://mochajs.org/",
	"id": 1625,
	"parentId": "1618",
	"dateAddedLocal": "6/21/2021, 2:12:25 PM",
	"dateAddedUTC": "2021-06-21T18:12:25.000Z"
},{
	"index": 7,
	"title": "Console | Node.js v10.1.0 Documentation",
	"url": "https://nodejs.org/api/console.html",
	"id": 1626,
	"parentId": "1618",
	"dateAddedLocal": "6/21/2021, 2:12:25 PM",
	"dateAddedUTC": "2021-06-21T18:12:25.000Z"
},{
	"index": 8,
	"title": "Node debugger",
	"url": "https://learn.co/tracks/introduction-to-node-js/intro-to-node-js/node-basics/node-debugger",
	"id": 1627,
	"parentId": "1618",
	"dateAddedLocal": "6/21/2021, 2:12:25 PM",
	"dateAddedUTC": "2021-06-21T18:12:25.000Z"
},{
	"index": 9,
	"title": "Debugger Node.js v5.12.0 Manual & Documentation",
	"url": "https://nodejs.org/dist/latest-v5.x/docs/api/debugger.html",
	"id": 1628,
	"parentId": "1618",
	"dateAddedLocal": "6/21/2021, 2:12:25 PM",
	"dateAddedUTC": "2021-06-21T18:12:25.000Z"
},{
	"index": 10,
	"title": "JavaScript Ep. 6: The node debugger - YouTube",
	"url": "https://www.youtube.com/watch?v=-q1z8BPFItw",
	"id": 1629,
	"parentId": "1618",
	"dateAddedLocal": "6/21/2021, 2:12:25 PM",
	"dateAddedUTC": "2021-06-21T18:12:25.000Z"
},{
	"index": 11,
	"title": "Debugging Node.js â€“ Three Options",
	"url": "https://spin.atomicobject.com/2015/09/25/debug-node-js/",
	"id": 1630,
	"parentId": "1618",
	"dateAddedLocal": "6/21/2021, 2:12:25 PM",
	"dateAddedUTC": "2021-06-21T18:12:25.000Z"
},{
	"index": 12,
	"title": "How to debug Node.js? What is the best way to debug Node.js? - { 100PercentJS }",
	"url": "http://www.100percentjs.com/best-way-debug-node-js/",
	"id": 1631,
	"parentId": "1618",
	"dateAddedLocal": "6/21/2021, 2:12:25 PM",
	"dateAddedUTC": "2021-06-21T18:12:25.000Z"
},{
	"index": 13,
	"title": "TechnoSophos: Node.js Debugging with the Built-in Debugger",
	"url": "http://technosophos.com/2011/10/28/nodejs-debugging-built-debugger.html",
	"id": 1632,
	"parentId": "1618",
	"dateAddedLocal": "6/21/2021, 2:12:25 PM",
	"dateAddedUTC": "2021-06-21T18:12:25.000Z"
},{
	"index": 14,
	"title": "Global Objects | Node.js v10.1.0 Documentation",
	"url": "https://nodejs.org/api/globals.html",
	"id": 1633,
	"parentId": "1618",
	"dateAddedLocal": "6/21/2021, 2:12:25 PM",
	"dateAddedUTC": "2021-06-21T18:12:25.000Z"
},{
	"index": 15,
	"title": "Global Variables in Node.js",
	"url": "http://www.hacksparrow.com/global-variables-in-node-js.html",
	"id": 1634,
	"parentId": "1618",
	"dateAddedLocal": "6/21/2021, 2:12:25 PM",
	"dateAddedUTC": "2021-06-21T18:12:25.000Z"
},{
	"index": 16,
	"title": "ChapterÂ 16.Â Variables: Scopes, Environments, and Closures",
	"url": "http://speakingjs.com/es5/ch16.html",
	"id": 1635,
	"parentId": "1618",
	"dateAddedLocal": "6/21/2021, 2:12:25 PM",
	"dateAddedUTC": "2021-06-21T18:12:25.000Z"
},{
	"index": 17,
	"title": "Understand Global Namespace in Node.js from @wfbutton on @eggheadio",
	"url": "https://egghead.io/lessons/node-js-understand-global-namespace-in-node-js",
	"id": 1636,
	"parentId": "1618",
	"dateAddedLocal": "6/21/2021, 2:12:25 PM",
	"dateAddedUTC": "2021-06-21T18:12:25.000Z"
},{
	"index": 18,
	"title": "File System | Node.js v9.0.0 Documentation",
	"url": "https://nodejs.org/api/fs.html",
	"id": 1637,
	"parentId": "1618",
	"dateAddedLocal": "6/21/2021, 2:12:25 PM",
	"dateAddedUTC": "2021-06-21T18:12:25.000Z"
},{
	"index": 19,
	"title": "node.js - Global webpack install vs. project specific webpack install - Stack Overflow",
	"url": "https://stackoverflow.com/questions/42220176/global-webpack-install-vs-project-specific-webpack-install",
	"id": 1638,
	"parentId": "1618",
	"dateAddedLocal": "6/21/2021, 2:12:25 PM",
	"dateAddedUTC": "2021-06-21T18:12:25.000Z"
},{
	"index": 109,
	"title": "npm",
	"id": 1639,
	"parentId": "871",
	"dateAddedLocal": "6/21/2021, 2:28:37 PM",
	"dateAddedUTC": "2021-06-21T18:28:37.120Z"
},{
	"index": 0,
	"title": "npm-check",
	"url": "https://www.npmjs.com/package/npm-check",
	"id": 1640,
	"parentId": "1639",
	"dateAddedLocal": "6/21/2021, 2:12:25 PM",
	"dateAddedUTC": "2021-06-21T18:12:25.000Z"
},{
	"index": 110,
	"title": "nvm",
	"id": 1641,
	"parentId": "871",
	"dateAddedLocal": "6/21/2021, 2:28:37 PM",
	"dateAddedUTC": "2021-06-21T18:28:37.120Z"
},{
	"index": 0,
	"title": "macos - What is the suggested way to install brew, node.js, io.js, nvm, npm on OS X? - Stack Overflow",
	"url": "https://stackoverflow.com/questions/28017374/what-is-the-suggested-way-to-install-brew-node-js-io-js-nvm-npm-on-os-x",
	"id": 1642,
	"parentId": "1641",
	"dateAddedLocal": "6/21/2021, 2:12:25 PM",
	"dateAddedUTC": "2021-06-21T18:12:25.000Z"
},{
	"index": 111,
	"title": "olap",
	"id": 1643,
	"parentId": "871",
	"dateAddedLocal": "6/21/2021, 2:28:37 PM",
	"dateAddedUTC": "2021-06-21T18:28:37.120Z"
},{
	"index": 0,
	"title": "Mondrian OLAP server - Wikipedia",
	"url": "https://en.wikipedia.org/wiki/Mondrian_OLAP_server",
	"id": 1644,
	"parentId": "1643",
	"dateAddedLocal": "6/21/2021, 2:12:25 PM",
	"dateAddedUTC": "2021-06-21T18:12:25.000Z"
},{
	"index": 1,
	"title": "Mondrian | Pentaho Community",
	"url": "http://community.pentaho.com/projects/mondrian/",
	"id": 1645,
	"parentId": "1643",
	"dateAddedLocal": "6/21/2021, 2:12:25 PM",
	"dateAddedUTC": "2021-06-21T18:12:25.000Z"
},{
	"index": 2,
	"title": "Pentaho Mondrian Documentation",
	"url": "http://mondrian.pentaho.com/documentation/faq.php",
	"id": 1646,
	"parentId": "1643",
	"dateAddedLocal": "6/21/2021, 2:12:25 PM",
	"dateAddedUTC": "2021-06-21T18:12:25.000Z"
},{
	"index": 3,
	"title": "Pentaho Mondrian Documentation",
	"url": "http://mondrian.pentaho.com/documentation/schema.php#What_is_a_schema",
	"id": 1647,
	"parentId": "1643",
	"dateAddedLocal": "6/21/2021, 2:12:25 PM",
	"dateAddedUTC": "2021-06-21T18:12:25.000Z"
},{
	"index": 4,
	"title": "rsim/mondrian-olap: JRuby gem for performing multidimensional queries of relational database data using Mondrian OLAP Java library",
	"url": "https://github.com/rsim/mondrian-olap",
	"id": 1648,
	"parentId": "1643",
	"dateAddedLocal": "6/21/2021, 2:12:25 PM",
	"dateAddedUTC": "2021-06-21T18:12:25.000Z"
},{
	"index": 5,
	"title": "rsim/mondrian_demo: mondrian-olap demo Rails application",
	"url": "https://github.com/rsim/mondrian_demo",
	"id": 1649,
	"parentId": "1643",
	"dateAddedLocal": "6/21/2021, 2:12:25 PM",
	"dateAddedUTC": "2021-06-21T18:12:25.000Z"
},{
	"index": 112,
	"title": "omniauth",
	"id": 1650,
	"parentId": "871",
	"dateAddedLocal": "6/21/2021, 2:28:37 PM",
	"dateAddedUTC": "2021-06-21T18:28:37.121Z"
},{
	"index": 0,
	"title": "List of Strategies Â· omniauth/omniauth Wiki",
	"url": "https://github.com/omniauth/omniauth/wiki/List-of-Strategies",
	"id": 1651,
	"parentId": "1650",
	"dateAddedLocal": "6/21/2021, 2:12:25 PM",
	"dateAddedUTC": "2021-06-21T18:12:25.000Z"
},{
	"index": 113,
	"title": "onenote",
	"id": 1652,
	"parentId": "871",
	"dateAddedLocal": "6/21/2021, 2:28:37 PM",
	"dateAddedUTC": "2021-06-21T18:28:37.121Z"
},{
	"index": 0,
	"title": "OneHighlighter on the Mac App Store",
	"url": "https://itunes.apple.com/be/app/onehighlighter/id1131580917?mt=12&ls=1",
	"id": 1653,
	"parentId": "1652",
	"dateAddedLocal": "6/21/2021, 2:12:25 PM",
	"dateAddedUTC": "2021-06-21T18:12:25.000Z"
},{
	"index": 114,
	"title": "online coding",
	"id": 1654,
	"parentId": "871",
	"dateAddedLocal": "6/21/2021, 2:28:37 PM",
	"dateAddedUTC": "2021-06-21T18:28:37.121Z"
},{
	"index": 0,
	"title": "ReactiveX - Links to More Information",
	"url": "http://reactivex.io/tutorials.html",
	"id": 1655,
	"parentId": "1654",
	"dateAddedLocal": "6/21/2021, 2:12:25 PM",
	"dateAddedUTC": "2021-06-21T18:12:25.000Z"
},{
	"index": 1,
	"title": "repl.it - Ruby Compiler",
	"url": "https://repl.it/languages/ruby",
	"id": 1656,
	"parentId": "1654",
	"dateAddedLocal": "6/21/2021, 2:12:25 PM",
	"dateAddedUTC": "2021-06-21T18:12:25.000Z"
},{
	"index": 115,
	"title": "openDataGraphQL",
	"id": 1657,
	"parentId": "871",
	"dateAddedLocal": "6/21/2021, 2:28:37 PM",
	"dateAddedUTC": "2021-06-21T18:28:37.122Z"
},{
	"index": 0,
	"title": "Open Contracting Data Standard",
	"url": "https://github.com/open-contracting",
	"id": 1658,
	"parentId": "1657",
	"dateAddedLocal": "6/21/2021, 2:12:25 PM",
	"dateAddedUTC": "2021-06-21T18:12:25.000Z"
},{
	"index": 1,
	"title": "sample data",
	"url": "https://github.com/open-contracting/sample-data",
	"id": 1659,
	"parentId": "1657",
	"dateAddedLocal": "6/21/2021, 2:12:25 PM",
	"dateAddedUTC": "2021-06-21T18:12:25.000Z"
},{
	"index": 2,
	"title": "schema",
	"url": "https://standard.open-contracting.org/latest/en/_static/docson/index.html#../../release-schema.json$$expand",
	"id": 1660,
	"parentId": "1657",
	"dateAddedLocal": "6/21/2021, 2:12:25 PM",
	"dateAddedUTC": "2021-06-21T18:12:25.000Z"
},{
	"index": 3,
	"title": "tags",
	"url": "https://standard.open-contracting.org/latest/en/schema/codelists/#release-tag",
	"id": 1661,
	"parentId": "1657",
	"dateAddedLocal": "6/21/2021, 2:12:25 PM",
	"dateAddedUTC": "2021-06-21T18:12:25.000Z"
},{
	"index": 4,
	"title": "Government Workflow RFI.docx",
	"url": "https://mapc365.sharepoint.com/:w:/r/sites/DataServicesSP/_layouts/15/Doc.aspx?sourcedoc=%7B64887053-086B-4E32-AACF-F76205C9CB04%7D&file=Government%20Workflow%20RFI.docx&action=default&mobileredirect=true",
	"id": 1662,
	"parentId": "1657",
	"dateAddedLocal": "6/21/2021, 2:12:25 PM",
	"dateAddedUTC": "2021-06-21T18:12:25.000Z"
},{
	"index": 5,
	"title": "ruby-json-schema/json-schema: Ruby JSON Schema Validator",
	"url": "https://github.com/ruby-json-schema/json-schema",
	"id": 1663,
	"parentId": "1657",
	"dateAddedLocal": "6/21/2021, 2:12:25 PM",
	"dateAddedUTC": "2021-06-21T18:12:25.000Z"
},{
	"index": 6,
	"title": "JSON Schema Validator - Newtonsoft",
	"url": "https://www.jsonschemavalidator.net/",
	"id": 1664,
	"parentId": "1657",
	"dateAddedLocal": "6/21/2021, 2:12:25 PM",
	"dateAddedUTC": "2021-06-21T18:12:25.000Z"
},{
	"index": 7,
	"title": "JSON Schema validation online",
	"url": "https://json-schema-validator.herokuapp.com/",
	"id": 1665,
	"parentId": "1657",
	"dateAddedLocal": "6/21/2021, 2:12:25 PM",
	"dateAddedUTC": "2021-06-21T18:12:25.000Z"
},{
	"index": 8,
	"title": "Free Online JSON Formatter - FreeFormatter.com",
	"url": "https://www.freeformatter.com/json-formatter.html",
	"id": 1666,
	"parentId": "1657",
	"dateAddedLocal": "6/21/2021, 2:12:25 PM",
	"dateAddedUTC": "2021-06-21T18:12:25.000Z"
},{
	"index": 9,
	"title": "Validating JSON Schemas with an RSpec Matcher",
	"url": "https://thoughtbot.com/blog/validating-json-schemas-with-an-rspec-matcher",
	"id": 1667,
	"parentId": "1657",
	"dateAddedLocal": "6/21/2021, 2:12:25 PM",
	"dateAddedUTC": "2021-06-21T18:12:25.000Z"
},{
	"index": 10,
	"title": "https://standard.open-contracting.org/schema/1__1__4/release-schema.json",
	"url": "https://standard.open-contracting.org/schema/1__1__4/release-schema.json",
	"id": 1668,
	"parentId": "1657",
	"dateAddedLocal": "6/21/2021, 2:12:25 PM",
	"dateAddedUTC": "2021-06-21T18:12:25.000Z"
},{
	"index": 11,
	"title": "https://standard.open-contracting.org/schema/1__1__0/release-schema.json",
	"url": "https://standard.open-contracting.org/schema/1__1__0/release-schema.json",
	"id": 1669,
	"parentId": "1657",
	"dateAddedLocal": "6/21/2021, 2:12:25 PM",
	"dateAddedUTC": "2021-06-21T18:12:25.000Z"
},{
	"index": 116,
	"title": "paginate",
	"id": 1670,
	"parentId": "871",
	"dateAddedLocal": "6/21/2021, 2:28:37 PM",
	"dateAddedUTC": "2021-06-21T18:28:37.123Z"
},{
	"index": 0,
	"title": "kaminari/kaminari: âš¡ A Scope & Engine based, clean, powerful, customizable and sophisticated paginator for Ruby webapps",
	"url": "https://github.com/kaminari/kaminari",
	"id": 1671,
	"parentId": "1670",
	"dateAddedLocal": "6/21/2021, 2:12:25 PM",
	"dateAddedUTC": "2021-06-21T18:12:25.000Z"
},{
	"index": 117,
	"title": "path",
	"id": 1672,
	"parentId": "871",
	"dateAddedLocal": "6/21/2021, 2:28:37 PM",
	"dateAddedUTC": "2021-06-21T18:28:37.123Z"
},{
	"index": 0,
	"title": "macos - How do I reset the $PATH variable on Mac OS X? - Super User",
	"url": "https://superuser.com/questions/121870/how-do-i-reset-the-path-variable-on-mac-os-x",
	"id": 1673,
	"parentId": "1672",
	"dateAddedLocal": "6/21/2021, 2:12:25 PM",
	"dateAddedUTC": "2021-06-21T18:12:25.000Z"
},{
	"index": 118,
	"title": "pc",
	"id": 1674,
	"parentId": "871",
	"dateAddedLocal": "6/21/2021, 2:28:37 PM",
	"dateAddedUTC": "2021-06-21T18:28:37.123Z"
},{
	"index": 0,
	"title": "Lenovo ThinkPad T450s Touch --- i7 2.6GHz - 12GB Ram - 512GB SSD - IPS 1080p | eBay",
	"url": "https://www.ebay.com/itm/Lenovo-ThinkPad-T450s-Touch-i7-2-6GHz-12GB-Ram-512GB-SSD-IPS-1080p/273132856611?epid=2229866924&hash=item3f97fca523:g:sWoAAOSwNmxZshT0",
	"id": 1675,
	"parentId": "1674",
	"dateAddedLocal": "6/21/2021, 2:12:25 PM",
	"dateAddedUTC": "2021-06-21T18:12:25.000Z"
},{
	"index": 119,
	"title": "pcloud",
	"id": 1676,
	"parentId": "871",
	"dateAddedLocal": "6/21/2021, 2:28:37 PM",
	"dateAddedUTC": "2021-06-21T18:28:37.124Z"
},{
	"index": 0,
	"title": "osxfuse not compatible with MacOS Catalina Â· Issue #595 Â· osxfuse/osxfuse",
	"url": "https://github.com/osxfuse/osxfuse/issues/595",
	"id": 1677,
	"parentId": "1676",
	"dateAddedLocal": "6/21/2021, 2:12:25 PM",
	"dateAddedUTC": "2021-06-21T18:12:25.000Z"
},{
	"index": 120,
	"title": "pdf",
	"id": 1678,
	"parentId": "871",
	"dateAddedLocal": "6/21/2021, 2:28:37 PM",
	"dateAddedUTC": "2021-06-21T18:28:37.124Z"
},{
	"index": 0,
	"title": "react-pdf - npm",
	"url": "https://www.npmjs.com/package/react-pdf",
	"id": 1679,
	"parentId": "1678",
	"dateAddedLocal": "6/21/2021, 2:12:25 PM",
	"dateAddedUTC": "2021-06-21T18:12:25.000Z"
},{
	"index": 1,
	"title": "How to Generate PDFs With Ruby on Rails | PDFTron",
	"url": "https://www.pdftron.com/blog/rails/how-to-generate-pdf-with-ruby-on-rails/",
	"id": 1680,
	"parentId": "1678",
	"dateAddedLocal": "6/21/2021, 2:12:25 PM",
	"dateAddedUTC": "2021-06-21T18:12:25.000Z"
},{
	"index": 2,
	"title": "PDFTron/rails-generate-pdf: rails-generate-pdf",
	"url": "https://github.com/PDFTron/rails-generate-pdf",
	"id": 1681,
	"parentId": "1678",
	"dateAddedLocal": "6/21/2021, 2:12:25 PM",
	"dateAddedUTC": "2021-06-21T18:12:25.000Z"
},{
	"index": 3,
	"title": "Best PDF Merger: Combine Two or More PDF Files Online (FREE)",
	"url": "https://www.freepdfconvert.com/merge-pdf#0ea886acbe1f9f89e267f627790667dd",
	"id": 1682,
	"parentId": "1678",
	"dateAddedLocal": "6/21/2021, 2:12:25 PM",
	"dateAddedUTC": "2021-06-21T18:12:25.000Z"
},{
	"index": 121,
	"title": "perl",
	"id": 1683,
	"parentId": "871",
	"dateAddedLocal": "6/21/2021, 2:28:37 PM",
	"dateAddedUTC": "2021-06-21T18:28:37.124Z"
},{
	"index": 0,
	"title": "CPAN - Wikipedia",
	"url": "https://en.wikipedia.org/wiki/CPAN",
	"id": 1684,
	"parentId": "1683",
	"dateAddedLocal": "6/21/2021, 2:12:25 PM",
	"dateAddedUTC": "2021-06-21T18:12:25.000Z"
},{
	"index": 1,
	"title": "Perl - Wikipedia",
	"url": "https://en.wikipedia.org/wiki/Perl",
	"id": 1685,
	"parentId": "1683",
	"dateAddedLocal": "6/21/2021, 2:12:25 PM",
	"dateAddedUTC": "2021-06-21T18:12:25.000Z"
},{
	"index": 122,
	"title": "php",
	"id": 1686,
	"parentId": "871",
	"dateAddedLocal": "6/21/2021, 2:28:37 PM",
	"dateAddedUTC": "2021-06-21T18:28:37.124Z"
},{
	"index": 0,
	"title": "PEAR - Wikipedia",
	"url": "https://en.wikipedia.org/wiki/PEAR",
	"id": 1687,
	"parentId": "1686",
	"dateAddedLocal": "6/21/2021, 2:12:25 PM",
	"dateAddedUTC": "2021-06-21T18:12:25.000Z"
},{
	"index": 1,
	"title": "PHP - Wikipedia",
	"url": "https://en.wikipedia.org/wiki/PHP",
	"id": 1688,
	"parentId": "1686",
	"dateAddedLocal": "6/21/2021, 2:12:25 PM",
	"dateAddedUTC": "2021-06-21T18:12:25.000Z"
},{
	"index": 2,
	"title": "Laravel - The PHP Framework For Web Artisans",
	"url": "https://laravel.com/",
	"id": 1689,
	"parentId": "1686",
	"dateAddedLocal": "6/21/2021, 2:12:25 PM",
	"dateAddedUTC": "2021-06-21T18:12:25.000Z"
},{
	"index": 123,
	"title": "point-of-sale",
	"id": 1690,
	"parentId": "871",
	"dateAddedLocal": "6/21/2021, 2:28:37 PM",
	"dateAddedUTC": "2021-06-21T18:28:37.125Z"
},{
	"index": 0,
	"title": "AGbrochure_DIGITAL_OL.PDF",
	"url": "http://pages.cayan.com/rs/829-DLL-537/images/AGbrochure_DIGITAL_OL.PDF",
	"id": 1691,
	"parentId": "1690",
	"dateAddedLocal": "6/21/2021, 2:12:25 PM",
	"dateAddedUTC": "2021-06-21T18:12:25.000Z"
},{
	"index": 1,
	"title": "Credit Card Processor Salesman Salary & Job Description > Career Options â€“ Interviews",
	"url": "http://www.jobshadow.com/interview-with-a-credit-card-processing-salesman/",
	"id": 1692,
	"parentId": "1690",
	"dateAddedLocal": "6/21/2021, 2:12:25 PM",
	"dateAddedUTC": "2021-06-21T18:12:25.000Z"
},{
	"index": 2,
	"title": "Datacap Systems Software Download - NETePay",
	"url": "http://files.datacapepay.com/netepay5.htm",
	"id": 1693,
	"parentId": "1690",
	"dateAddedLocal": "6/21/2021, 2:12:25 PM",
	"dateAddedUTC": "2021-06-21T18:12:25.000Z"
},{
	"index": 3,
	"title": "Datacap Systems, Inc.",
	"url": "https://www.datacapsystems.com/",
	"id": 1694,
	"parentId": "1690",
	"dateAddedLocal": "6/21/2021, 2:12:25 PM",
	"dateAddedUTC": "2021-06-21T18:12:25.000Z"
},{
	"index": 4,
	"title": "DiamondScan Point of Sale Software â€“ DS Retail and Fuel Solutions",
	"url": "http://www.diamondscan.com/diamondscan-point-of-sale-software/",
	"id": 1695,
	"parentId": "1690",
	"dateAddedLocal": "6/21/2021, 2:12:25 PM",
	"dateAddedUTC": "2021-06-21T18:12:25.000Z"
},{
	"index": 5,
	"title": "Equipment Types - CreditCardProcessing.com",
	"url": "https://www.creditcardprocessing.com/equipment-types/",
	"id": 1696,
	"parentId": "1690",
	"dateAddedLocal": "6/21/2021, 2:12:25 PM",
	"dateAddedUTC": "2021-06-21T18:12:25.000Z"
},{
	"index": 6,
	"title": "Flipboard: The one place for all your interests",
	"url": "https://flipboard.com/",
	"id": 1697,
	"parentId": "1690",
	"dateAddedLocal": "6/21/2021, 2:12:25 PM",
	"dateAddedUTC": "2021-06-21T18:12:25.000Z"
},{
	"index": 7,
	"title": "Floreant POS :: Open Source POS for Restaurants",
	"url": "http://floreant.org/#download",
	"id": 1698,
	"parentId": "1690",
	"dateAddedLocal": "6/21/2021, 2:12:25 PM",
	"dateAddedUTC": "2021-06-21T18:12:25.000Z"
},{
	"index": 8,
	"title": "Heartland School Solutions Payment Solutions - Heartland School Solutions",
	"url": "https://www.heartlandpaymentsystems.com/school-solutions/payment-solutions",
	"id": 1699,
	"parentId": "1690",
	"dateAddedLocal": "6/21/2021, 2:12:25 PM",
	"dateAddedUTC": "2021-06-21T18:12:25.000Z"
},{
	"index": 9,
	"title": "JPOS Support Drivers",
	"url": "http://www.jpossoftware.com/JPOS/Support/Downloads.aspx",
	"id": 1700,
	"parentId": "1690",
	"dateAddedLocal": "6/21/2021, 2:12:25 PM",
	"dateAddedUTC": "2021-06-21T18:12:25.000Z"
},{
	"index": 10,
	"title": "Lightspeed Integrations for OnSite, Retail, Resto, eCom",
	"url": "https://www.lightspeedhq.com/integrations/",
	"id": 1701,
	"parentId": "1690",
	"dateAddedLocal": "6/21/2021, 2:12:25 PM",
	"dateAddedUTC": "2021-06-21T18:12:25.000Z"
},{
	"index": 11,
	"title": "Lightspeed Integrations for OnSite, Retail, Resto, eCom",
	"url": "https://www.lightspeedhq.com/integrations/?product=onsite",
	"id": 1702,
	"parentId": "1690",
	"dateAddedLocal": "6/21/2021, 2:12:25 PM",
	"dateAddedUTC": "2021-06-21T18:12:25.000Z"
},{
	"index": 12,
	"title": "Microsoft RMS End of Life (Discontinued) - Details & Tips.",
	"url": "https://www.nchannel.com/blog/microsoft-rms-end-of-life-discontinued/",
	"id": 1703,
	"parentId": "1690",
	"dateAddedLocal": "6/21/2021, 2:12:25 PM",
	"dateAddedUTC": "2021-06-21T18:12:25.000Z"
},{
	"index": 13,
	"title": "Payment Possibilities | Cayan",
	"url": "https://cayan.com/",
	"id": 1704,
	"parentId": "1690",
	"dateAddedLocal": "6/21/2021, 2:12:25 PM",
	"dateAddedUTC": "2021-06-21T18:12:25.000Z"
},{
	"index": 14,
	"title": "Payment Processing - Credit Card Processing Solutions | Cayan - EMV, NFC | Cayan",
	"url": "https://cayan.com/payment-processing",
	"id": 1705,
	"parentId": "1690",
	"dateAddedLocal": "6/21/2021, 2:12:25 PM",
	"dateAddedUTC": "2021-06-21T18:12:25.000Z"
},{
	"index": 15,
	"title": "PHPRunner. Web database software, PHP MySQL code generator and PHP form builder",
	"url": "https://xlinesoft.com/index.htm",
	"id": 1706,
	"parentId": "1690",
	"dateAddedLocal": "6/21/2021, 2:12:25 PM",
	"dateAddedUTC": "2021-06-21T18:12:25.000Z"
},{
	"index": 16,
	"title": "POS analytics reporting - Mobile Dashboard | SoftTouch POS",
	"url": "http://softtouchpos.com/mobile-dashboard/",
	"id": 1707,
	"parentId": "1690",
	"dateAddedLocal": "6/21/2021, 2:12:25 PM",
	"dateAddedUTC": "2021-06-21T18:12:25.000Z"
},{
	"index": 17,
	"title": "Pos Software, Retail Software, Restaurant Software, Retail Pos Systems, Restaurant Pos System, Pos",
	"url": "http://www.pcamerica.com/",
	"id": 1708,
	"parentId": "1690",
	"dateAddedLocal": "6/21/2021, 2:12:25 PM",
	"dateAddedUTC": "2021-06-21T18:12:25.000Z"
},{
	"index": 18,
	"title": "Rails Learning: Creating POS Application with Ruby on Rails 4 Part 1",
	"url": "http://railslearning.blogspot.com/2015/06/creating-pos-application-with-ruby-on.html",
	"id": 1709,
	"parentId": "1690",
	"dateAddedLocal": "6/21/2021, 2:12:25 PM",
	"dateAddedUTC": "2021-06-21T18:12:25.000Z"
},{
	"index": 19,
	"title": "TechTools API & Resource Index | Vantiv O.N.E.",
	"url": "https://developer.vantiv.com/groups/techtools-api-resource-index/overview",
	"id": 1710,
	"parentId": "1690",
	"dateAddedLocal": "6/21/2021, 2:12:25 PM",
	"dateAddedUTC": "2021-06-21T18:12:25.000Z"
},{
	"index": 20,
	"title": "Trello",
	"url": "https://trello.com/",
	"id": 1711,
	"parentId": "1690",
	"dateAddedLocal": "6/21/2021, 2:12:25 PM",
	"dateAddedUTC": "2021-06-21T18:12:25.000Z"
},{
	"index": 21,
	"title": "TSYS | People-Centered Payments",
	"url": "http://tsys.com/",
	"id": 1712,
	"parentId": "1690",
	"dateAddedLocal": "6/21/2021, 2:12:25 PM",
	"dateAddedUTC": "2021-06-21T18:12:25.000Z"
},{
	"index": 22,
	"title": "Worldpay | Secure Payment Processing",
	"url": "http://www.worldpay.com/",
	"id": 1713,
	"parentId": "1690",
	"dateAddedLocal": "6/21/2021, 2:12:25 PM",
	"dateAddedUTC": "2021-06-21T18:12:25.000Z"
},{
	"index": 124,
	"title": "postgis",
	"id": 1714,
	"parentId": "871",
	"dateAddedLocal": "6/21/2021, 2:28:37 PM",
	"dateAddedUTC": "2021-06-21T18:28:37.127Z"
},{
	"index": 125,
	"title": "postgis",
	"id": 2199,
	"parentId": "871",
	"dateAddedLocal": "6/21/2021, 2:28:37 PM",
	"dateAddedUTC": "2021-06-21T18:28:37.171Z"
},{
	"index": 126,
	"title": "postgresql",
	"id": 1715,
	"parentId": "871",
	"dateAddedLocal": "6/21/2021, 2:28:37 PM",
	"dateAddedUTC": "2021-06-21T18:28:37.127Z"
},{
	"index": 0,
	"title": "Auto Backup of Database in Rails Application | Ruby on Rails Developers Guide",
	"url": "http://www.agiratech.com/auto-backup-of-database-in-rails-application/",
	"id": 1716,
	"parentId": "1715",
	"dateAddedLocal": "6/21/2021, 2:12:25 PM",
	"dateAddedUTC": "2021-06-21T18:12:25.000Z"
},{
	"index": 1,
	"title": "Backup Databases Using PostgreSQL Backup Tools: pg_dump & pg_dumpall",
	"url": "http://www.postgresqltutorial.com/postgresql-backup-database/",
	"id": 1717,
	"parentId": "1715",
	"dateAddedLocal": "6/21/2021, 2:12:25 PM",
	"dateAddedUTC": "2021-06-21T18:12:25.000Z"
},{
	"index": 2,
	"title": "Heroku PGBackups | Heroku Dev Center",
	"url": "https://devcenter.heroku.com/articles/heroku-postgres-backups",
	"id": 1718,
	"parentId": "1715",
	"dateAddedLocal": "6/21/2021, 2:12:25 PM",
	"dateAddedUTC": "2021-06-21T18:12:25.000Z"
},{
	"index": 127,
	"title": "postman",
	"id": 1719,
	"parentId": "871",
	"dateAddedLocal": "6/21/2021, 2:28:37 PM",
	"dateAddedUTC": "2021-06-21T18:28:37.128Z"
},{
	"index": 0,
	"title": "Testing API with Postman",
	"url": "http://www.sm-cloud.com/testing-api-with-postman/",
	"id": 1720,
	"parentId": "1719",
	"dateAddedLocal": "6/21/2021, 2:12:25 PM",
	"dateAddedUTC": "2021-06-21T18:12:25.000Z"
},{
	"index": 128,
	"title": "presentation",
	"id": 1721,
	"parentId": "871",
	"dateAddedLocal": "6/21/2021, 2:28:37 PM",
	"dateAddedUTC": "2021-06-21T18:28:37.128Z"
},{
	"index": 0,
	"title": "Turn.js Documentation",
	"url": "http://turnjs.com/docs/How_Turn.js_Works",
	"id": 1722,
	"parentId": "1721",
	"dateAddedLocal": "6/21/2021, 2:12:25 PM",
	"dateAddedUTC": "2021-06-21T18:12:25.000Z"
},{
	"index": 1,
	"title": "Free plan sign up | Poll Everywhere",
	"url": "https://www.polleverywhere.com/signup?arlt=signupbutton&usrc=signup_button",
	"id": 1723,
	"parentId": "1721",
	"dateAddedLocal": "6/21/2021, 2:12:25 PM",
	"dateAddedUTC": "2021-06-21T18:12:25.000Z"
},{
	"index": 129,
	"title": "pry",
	"id": 1724,
	"parentId": "871",
	"dateAddedLocal": "6/21/2021, 2:28:37 PM",
	"dateAddedUTC": "2021-06-21T18:28:37.128Z"
},{
	"index": 0,
	"title": "nixme/pry-debugger - Ruby",
	"url": "https://github.com/nixme/pry-debugger",
	"id": 1725,
	"parentId": "1724",
	"dateAddedLocal": "6/21/2021, 2:12:25 PM",
	"dateAddedUTC": "2021-06-21T18:12:25.000Z"
},{
	"index": 1,
	"title": "Pry - an IRB alternative and runtime developer console",
	"url": "http://pryrepl.org/",
	"id": 1726,
	"parentId": "1724",
	"dateAddedLocal": "6/21/2021, 2:12:25 PM",
	"dateAddedUTC": "2021-06-21T18:12:25.000Z"
},{
	"index": 2,
	"title": "pry/pry: An IRB alternative and runtime developer console",
	"url": "https://github.com/pry/pry",
	"id": 1727,
	"parentId": "1724",
	"dateAddedLocal": "6/21/2021, 2:12:25 PM",
	"dateAddedUTC": "2021-06-21T18:12:25.000Z"
},{
	"index": 130,
	"title": "python",
	"id": 1728,
	"parentId": "871",
	"dateAddedLocal": "6/21/2021, 2:28:37 PM",
	"dateAddedUTC": "2021-06-21T18:28:37.129Z"
},{
	"index": 0,
	"title": "Installing Packages â€” Python Packaging User Guide",
	"url": "https://packaging.python.org/tutorials/installing-packages/",
	"id": 1729,
	"parentId": "1728",
	"dateAddedLocal": "6/21/2021, 2:12:25 PM",
	"dateAddedUTC": "2021-06-21T18:12:25.000Z"
},{
	"index": 1,
	"title": "Pipenv & Virtual Environments â€” The Hitchhiker's Guide to Python",
	"url": "http://docs.python-guide.org/en/latest/dev/virtualenvs/#virtualenvironments-ref",
	"id": 1730,
	"parentId": "1728",
	"dateAddedLocal": "6/21/2021, 2:12:25 PM",
	"dateAddedUTC": "2021-06-21T18:12:25.000Z"
},{
	"index": 2,
	"title": "Python (programming language) - Wikipedia",
	"url": "https://en.wikipedia.org/wiki/Python_(programming_language)",
	"id": 1731,
	"parentId": "1728",
	"dateAddedLocal": "6/21/2021, 2:12:25 PM",
	"dateAddedUTC": "2021-06-21T18:12:25.000Z"
},{
	"index": 3,
	"title": "Python Releases for Mac OS X | Python.org",
	"url": "https://www.python.org/downloads/mac-osx/",
	"id": 1732,
	"parentId": "1728",
	"dateAddedLocal": "6/21/2021, 2:12:25 PM",
	"dateAddedUTC": "2021-06-21T18:12:25.000Z"
},{
	"index": 4,
	"title": "Simple HTTP Server with Python",
	"url": "http://www.linuxjournal.com/content/tech-tip-really-simple-http-server-python",
	"id": 1733,
	"parentId": "1728",
	"dateAddedLocal": "6/21/2021, 2:12:25 PM",
	"dateAddedUTC": "2021-06-21T18:12:25.000Z"
},{
	"index": 5,
	"title": "Python Tutor",
	"url": "http://pythontutor.com/",
	"id": 1734,
	"parentId": "1728",
	"dateAddedLocal": "6/21/2021, 2:12:25 PM",
	"dateAddedUTC": "2021-06-21T18:12:25.000Z"
},{
	"index": 6,
	"title": "Managing environments â€” conda 4.7.6.post30+3ca57b16 documentation",
	"url": "https://conda.io/projects/conda/en/latest/user-guide/tasks/manage-environments.html",
	"id": 1735,
	"parentId": "1728",
	"dateAddedLocal": "6/21/2021, 2:12:25 PM",
	"dateAddedUTC": "2021-06-21T18:12:25.000Z"
},{
	"index": 7,
	"title": "setup learn-env jupyter notebook",
	"url": "https://learn.co/tracks/data-science-career-v1-1/section-01/section-01/setting-up-a-professional-ds-environment",
	"id": 1736,
	"parentId": "1728",
	"dateAddedLocal": "6/21/2021, 2:12:25 PM",
	"dateAddedUTC": "2021-06-21T18:12:25.000Z"
},{
	"index": 8,
	"title": "Python for Beginners - YouTube",
	"url": "https://www.youtube.com/playlist?list=PLlrxD0HtieHhS8VzuMCfQD4uJ9yne1mE6",
	"id": 1737,
	"parentId": "1728",
	"dateAddedLocal": "6/21/2021, 2:12:25 PM",
	"dateAddedUTC": "2021-06-21T18:12:25.000Z"
},{
	"index": 9,
	"title": "CodingBat Python",
	"url": "https://codingbat.com/python",
	"id": 1738,
	"parentId": "1728",
	"dateAddedLocal": "6/21/2021, 2:12:25 PM",
	"dateAddedUTC": "2021-06-21T18:12:25.000Z"
},{
	"index": 10,
	"title": "Archived Problems - Project Euler",
	"url": "https://projecteuler.net/archives",
	"id": 1739,
	"parentId": "1728",
	"dateAddedLocal": "6/21/2021, 2:12:25 PM",
	"dateAddedUTC": "2021-06-21T18:12:25.000Z"
},{
	"index": 11,
	"title": "Problems - CodeAbbey",
	"url": "http://www.codeabbey.com/index/task_list",
	"id": 1740,
	"parentId": "1728",
	"dateAddedLocal": "6/21/2021, 2:12:25 PM",
	"dateAddedUTC": "2021-06-21T18:12:25.000Z"
},{
	"index": 12,
	"title": "For learning, refreshing, or just for fun!",
	"url": "https://www.reddit.com/r/dailyprogrammer",
	"id": 1741,
	"parentId": "1728",
	"dateAddedLocal": "6/21/2021, 2:12:25 PM",
	"dateAddedUTC": "2021-06-21T18:12:25.000Z"
},{
	"index": 13,
	"title": "The Python Challenge",
	"url": "http://www.pythonchallenge.com/",
	"id": 1742,
	"parentId": "1728",
	"dateAddedLocal": "6/21/2021, 2:12:25 PM",
	"dateAddedUTC": "2021-06-21T18:12:25.000Z"
},{
	"index": 14,
	"title": "The Python Tutorial â€” Python 3.7.3 documentation",
	"url": "https://docs.python.org/3/tutorial/index.html",
	"id": 1743,
	"parentId": "1728",
	"dateAddedLocal": "6/21/2021, 2:12:25 PM",
	"dateAddedUTC": "2021-06-21T18:12:25.000Z"
},{
	"index": 15,
	"title": "Anaconda Python/R Distribution - Anaconda",
	"url": "https://www.anaconda.com/distribution/",
	"id": 1744,
	"parentId": "1728",
	"dateAddedLocal": "6/21/2021, 2:12:25 PM",
	"dateAddedUTC": "2021-06-21T18:12:25.000Z"
},{
	"index": 16,
	"title": "CodingBat Python",
	"url": "https://codingbat.com/python",
	"id": 1745,
	"parentId": "1728",
	"dateAddedLocal": "6/21/2021, 2:12:25 PM",
	"dateAddedUTC": "2021-06-21T18:12:25.000Z"
},{
	"index": 17,
	"title": "Archived Problems - Project Euler",
	"url": "https://projecteuler.net/archives",
	"id": 1746,
	"parentId": "1728",
	"dateAddedLocal": "6/21/2021, 2:12:25 PM",
	"dateAddedUTC": "2021-06-21T18:12:25.000Z"
},{
	"index": 18,
	"title": "Problems - CodeAbbey",
	"url": "http://www.codeabbey.com/index/task_list",
	"id": 1747,
	"parentId": "1728",
	"dateAddedLocal": "6/21/2021, 2:12:25 PM",
	"dateAddedUTC": "2021-06-21T18:12:25.000Z"
},{
	"index": 19,
	"title": "For learning, refreshing, or just for fun!",
	"url": "https://www.reddit.com/r/dailyprogrammer",
	"id": 1748,
	"parentId": "1728",
	"dateAddedLocal": "6/21/2021, 2:12:25 PM",
	"dateAddedUTC": "2021-06-21T18:12:25.000Z"
},{
	"index": 20,
	"title": "The Python Challenge",
	"url": "http://www.pythonchallenge.com/",
	"id": 1749,
	"parentId": "1728",
	"dateAddedLocal": "6/21/2021, 2:12:25 PM",
	"dateAddedUTC": "2021-06-21T18:12:25.000Z"
},{
	"index": 131,
	"title": "qualtrics",
	"id": 1750,
	"parentId": "871",
	"dateAddedLocal": "6/21/2021, 2:28:37 PM",
	"dateAddedUTC": "2021-06-21T18:28:37.130Z"
},{
	"index": 0,
	"title": "Loading environment variables in JS apps - DEV Community ðŸ‘©â€ðŸ’»ðŸ‘¨â€ðŸ’»",
	"url": "https://dev.to/deammer/loading-environment-variables-in-js-apps-1p7p",
	"id": 1751,
	"parentId": "1750",
	"dateAddedLocal": "6/21/2021, 2:12:25 PM",
	"dateAddedUTC": "2021-06-21T18:12:25.000Z"
},{
	"index": 1,
	"title": "motdotla/dotenv: Loads environment variables from .env for nodejs projects.",
	"url": "https://github.com/motdotla/dotenv",
	"id": 1752,
	"parentId": "1750",
	"dateAddedLocal": "6/21/2021, 2:12:25 PM",
	"dateAddedUTC": "2021-06-21T18:12:25.000Z"
},{
	"index": 2,
	"title": "javascript - Client on node: Uncaught ReferenceError: require is not defined - Stack Overflow",
	"url": "https://stackoverflow.com/questions/19059580/client-on-node-uncaught-referenceerror-require-is-not-defined",
	"id": 1753,
	"parentId": "1750",
	"dateAddedLocal": "6/21/2021, 2:12:25 PM",
	"dateAddedUTC": "2021-06-21T18:12:25.000Z"
},{
	"index": 3,
	"title": "javascript - Trouble with ES6 Modules - Stack Overflow",
	"url": "https://stackoverflow.com/questions/46138375/trouble-with-es6-modules",
	"id": 1754,
	"parentId": "1750",
	"dateAddedLocal": "6/21/2021, 2:12:25 PM",
	"dateAddedUTC": "2021-06-21T18:12:25.000Z"
},{
	"index": 4,
	"title": "smithWEBtek/qualtrics-test-v3-api",
	"url": "https://github.com/smithWEBtek/qualtrics-test-v3-api",
	"id": 1755,
	"parentId": "1750",
	"dateAddedLocal": "6/21/2021, 2:12:25 PM",
	"dateAddedUTC": "2021-06-21T18:12:25.000Z"
},{
	"index": 5,
	"title": "Migration Guide V2 to V3",
	"url": "https://api.qualtrics.com/docs/migration-guide",
	"id": 1756,
	"parentId": "1750",
	"dateAddedLocal": "6/21/2021, 2:12:25 PM",
	"dateAddedUTC": "2021-06-21T18:12:25.000Z"
},{
	"index": 6,
	"title": "Qualtrics IDs | Qualtrics Survey Software",
	"url": "https://mapc.az1.qualtrics.com/Q/QualtricsIdsSection/IdsSection",
	"id": 1757,
	"parentId": "1750",
	"dateAddedLocal": "6/21/2021, 2:12:25 PM",
	"dateAddedUTC": "2021-06-21T18:12:25.000Z"
},{
	"index": 132,
	"title": "r",
	"id": 1758,
	"parentId": "871",
	"dateAddedLocal": "6/21/2021, 2:28:37 PM",
	"dateAddedUTC": "2021-06-21T18:28:37.131Z"
},{
	"index": 0,
	"title": "Data Import | R Tutorial",
	"url": "http://www.r-tutor.com/r-introduction/data-frame/data-import",
	"id": 1759,
	"parentId": "1758",
	"dateAddedLocal": "6/21/2021, 2:12:25 PM",
	"dateAddedUTC": "2021-06-21T18:12:25.000Z"
},{
	"index": 1,
	"title": "R Tutorial with Bayesian Statistics Using OpenBUGS | R Tutorial",
	"url": "http://www.r-tutor.com/content/r-tutorial-ebook",
	"id": 1760,
	"parentId": "1758",
	"dateAddedLocal": "6/21/2021, 2:12:25 PM",
	"dateAddedUTC": "2021-06-21T18:12:25.000Z"
},{
	"index": 2,
	"title": "Send email to multiple recipients in Rails with ActionMailer",
	"url": "https://gist.github.com/maxivak/8460f022f5b369626069",
	"id": 1761,
	"parentId": "1758",
	"dateAddedLocal": "6/21/2021, 2:12:25 PM",
	"dateAddedUTC": "2021-06-21T18:12:25.000Z"
},{
	"index": 3,
	"title": "R Tutorial - Learn R Programming",
	"url": "https://www.datamentor.io/r-programming/",
	"id": 1762,
	"parentId": "1758",
	"dateAddedLocal": "6/21/2021, 2:12:25 PM",
	"dateAddedUTC": "2021-06-21T18:12:25.000Z"
},{
	"index": 133,
	"title": "R",
	"id": 2200,
	"parentId": "871",
	"dateAddedLocal": "6/21/2021, 2:28:37 PM",
	"dateAddedUTC": "2021-06-21T18:28:37.171Z"
},{
	"index": 0,
	"title": "R Tutorial - Learn R Programming",
	"url": "https://www.datamentor.io/r-programming/",
	"id": 2201,
	"parentId": "2200",
	"dateAddedLocal": "6/21/2021, 2:12:25 PM",
	"dateAddedUTC": "2021-06-21T18:12:25.000Z"
},{
	"index": 134,
	"title": "rails",
	"id": 1763,
	"parentId": "871",
	"dateAddedLocal": "6/21/2021, 2:28:37 PM",
	"dateAddedUTC": "2021-06-21T18:28:37.132Z"
},{
	"index": 0,
	"title": "17 Best Resources for Rails Developer - PhraseApp Blog",
	"url": "https://phraseapp.com/blog/posts/17-best-resources-for-rails-developer/",
	"id": 1764,
	"parentId": "1763",
	"dateAddedLocal": "6/21/2021, 2:12:25 PM",
	"dateAddedUTC": "2021-06-21T18:12:25.000Z"
},{
	"index": 1,
	"title": "ActionView::Helpers::FormTagHelper",
	"url": "http://api.rubyonrails.org/classes/ActionView/Helpers/FormTagHelper.html",
	"id": 1765,
	"parentId": "1763",
	"dateAddedLocal": "6/21/2021, 2:12:25 PM",
	"dateAddedUTC": "2021-06-21T18:12:25.000Z"
},{
	"index": 2,
	"title": "Intro To Rails - Intro To Rails",
	"url": "http://docs.railsbridge.org/intro-to-rails/",
	"id": 1766,
	"parentId": "1763",
	"dateAddedLocal": "6/21/2021, 2:12:25 PM",
	"dateAddedUTC": "2021-06-21T18:12:25.000Z"
},{
	"index": 3,
	"title": "plataformatec/responders: A set of Rails responders to dry up your application",
	"url": "https://github.com/plataformatec/responders",
	"id": 1767,
	"parentId": "1763",
	"dateAddedLocal": "6/21/2021, 2:12:25 PM",
	"dateAddedUTC": "2021-06-21T18:12:25.000Z"
},{
	"index": 4,
	"title": "Rails Directory Structure â€” SitePoint",
	"url": "https://www.sitepoint.com/a-quick-study-of-the-rails-directory-structure/",
	"id": 1768,
	"parentId": "1763",
	"dateAddedLocal": "6/21/2021, 2:12:25 PM",
	"dateAddedUTC": "2021-06-21T18:12:25.000Z"
},{
	"index": 5,
	"title": "Rails Style Guid",
	"url": "https://github.com/bbatsov/rails-style-guide#os-specific-gemfile-locks",
	"id": 1769,
	"parentId": "1763",
	"dateAddedLocal": "6/21/2021, 2:12:25 PM",
	"dateAddedUTC": "2021-06-21T18:12:25.000Z"
},{
	"index": 6,
	"title": "RailsCasts",
	"url": "http://railscasts.com/",
	"id": 1770,
	"parentId": "1763",
	"dateAddedLocal": "6/21/2021, 2:12:25 PM",
	"dateAddedUTC": "2021-06-21T18:12:25.000Z"
},{
	"index": 7,
	"title": "RailsGuides",
	"url": "http://guides.rubyonrails.org/",
	"id": 1771,
	"parentId": "1763",
	"dateAddedLocal": "6/21/2021, 2:12:25 PM",
	"dateAddedUTC": "2021-06-21T18:12:25.000Z"
},{
	"index": 8,
	"title": "RoRails Tutorial",
	"url": "https://www.railstutorial.org/book/frontmatter",
	"id": 1772,
	"parentId": "1763",
	"dateAddedLocal": "6/21/2021, 2:12:25 PM",
	"dateAddedUTC": "2021-06-21T18:12:25.000Z"
},{
	"index": 9,
	"title": "ruby - What is the difference between \"rails s\" and \"bundle exec rails s\"? - Stack Overflow",
	"url": "https://stackoverflow.com/questions/23846493/what-is-the-difference-between-rails-s-and-bundle-exec-rails-s",
	"id": 1773,
	"parentId": "1763",
	"dateAddedLocal": "6/21/2021, 2:12:25 PM",
	"dateAddedUTC": "2021-06-21T18:12:25.000Z"
},{
	"index": 10,
	"title": "Ruby and Rails Reserved Words",
	"url": "http://www.rubymagic.org/posts/ruby-and-rails-reserved-words",
	"id": 1774,
	"parentId": "1763",
	"dateAddedLocal": "6/21/2021, 2:12:25 PM",
	"dateAddedUTC": "2021-06-21T18:12:25.000Z"
},{
	"index": 11,
	"title": "Sortable Table Columns - RichOnRails.com",
	"url": "https://richonrails.com/articles/sortable-table-columns",
	"id": 1775,
	"parentId": "1763",
	"dateAddedLocal": "6/21/2021, 2:12:25 PM",
	"dateAddedUTC": "2021-06-21T18:12:25.000Z"
},{
	"index": 12,
	"title": "Telework During COVID-19",
	"url": "https://www.revenue.pa.gov/COVID19/Pages/Telework.aspx",
	"id": 1776,
	"parentId": "1763",
	"dateAddedLocal": "6/21/2021, 2:12:25 PM",
	"dateAddedUTC": "2021-06-21T18:12:25.000Z"
},{
	"index": 13,
	"title": "Tutorial on setting up GitHub login in a Rails application - YouTube",
	"url": "https://www.youtube.com/watch?v=WWcbcNlsK7U",
	"id": 1777,
	"parentId": "1763",
	"dateAddedLocal": "6/21/2021, 2:12:25 PM",
	"dateAddedUTC": "2021-06-21T18:12:25.000Z"
},{
	"index": 14,
	"title": "Using delegate in Rails",
	"url": "https://medium.com/@pk60905/using-delegate-in-rails-527332da7f96",
	"id": 1778,
	"parentId": "1763",
	"dateAddedLocal": "6/21/2021, 2:12:25 PM",
	"dateAddedUTC": "2021-06-21T18:12:25.000Z"
},{
	"index": 15,
	"title": "Visual of nested forms",
	"url": "https://i.imgur.com/sEiHNRX.png",
	"id": 1779,
	"parentId": "1763",
	"dateAddedLocal": "6/21/2021, 2:12:25 PM",
	"dateAddedUTC": "2021-06-21T18:12:25.000Z"
},{
	"index": 16,
	"title": "Rake - learn",
	"url": "https://learn.co/tracks/full-stack-web-dev-with-react/orms-and-activerecord/activerecord/intro-to-rake",
	"id": 1780,
	"parentId": "1763",
	"dateAddedLocal": "6/21/2021, 2:12:25 PM",
	"dateAddedUTC": "2021-06-21T18:12:25.000Z"
},{
	"index": 135,
	"title": "rails-action-cable",
	"id": 1781,
	"parentId": "871",
	"dateAddedLocal": "6/21/2021, 2:28:37 PM",
	"dateAddedUTC": "2021-06-21T18:28:37.133Z"
},{
	"index": 0,
	"title": "Real-Time Rails: Implementing WebSockets in Rails 5 with Action Cable | Heroku",
	"url": "https://blog.heroku.com/real_time_rails_implementing_websockets_in_rails_5_with_action_cable",
	"id": 1782,
	"parentId": "1781",
	"dateAddedLocal": "6/21/2021, 2:12:25 PM",
	"dateAddedUTC": "2021-06-21T18:12:25.000Z"
},{
	"index": 1,
	"title": "SophieDeBenedetto/action-cable-example",
	"url": "https://github.com/SophieDeBenedetto/action-cable-example",
	"id": 1783,
	"parentId": "1781",
	"dateAddedLocal": "6/21/2021, 2:12:25 PM",
	"dateAddedUTC": "2021-06-21T18:12:25.000Z"
},{
	"index": 136,
	"title": "rails-react-heroku",
	"id": 1784,
	"parentId": "871",
	"dateAddedLocal": "6/21/2021, 2:28:37 PM",
	"dateAddedUTC": "2021-06-21T18:28:37.134Z"
},{
	"index": 0,
	"title": "Deploying a React App with Rails API to Heroku - Flatiron School",
	"url": "http://alexandrawright.net/deploying_a_react_app_with_rails_api_to_heroku",
	"id": 1785,
	"parentId": "1784",
	"dateAddedLocal": "6/21/2021, 2:12:25 PM",
	"dateAddedUTC": "2021-06-21T18:12:25.000Z"
},{
	"index": 1,
	"title": "reactjs - How do I deploy a React app and a Rails API to Heroku? - Stack Overflow",
	"url": "https://stackoverflow.com/questions/42657694/how-do-i-deploy-a-react-app-and-a-rails-api-to-heroku",
	"id": 1786,
	"parentId": "1784",
	"dateAddedLocal": "6/21/2021, 2:12:25 PM",
	"dateAddedUTC": "2021-06-21T18:12:25.000Z"
},{
	"index": 2,
	"title": "Deploying App to Heroku (Rails backend, React Frontend)",
	"url": "https://codeburst.io/deploying-app-to-heroku-rails-backend-react-frontend-8f7e5c1ffc19",
	"id": 1787,
	"parentId": "1784",
	"dateAddedLocal": "6/21/2021, 2:12:25 PM",
	"dateAddedUTC": "2021-06-21T18:12:25.000Z"
},{
	"index": 3,
	"title": "javascript - React Routing works in local machine but not Heroku - Stack Overflow",
	"url": "https://stackoverflow.com/questions/41772411/react-routing-works-in-local-machine-but-not-heroku",
	"id": 1788,
	"parentId": "1784",
	"dateAddedLocal": "6/21/2021, 2:12:25 PM",
	"dateAddedUTC": "2021-06-21T18:12:25.000Z"
},{
	"index": 4,
	"title": "node.js - React Routing works in locally but not Heroku - Stack Overflow",
	"url": "https://stackoverflow.com/questions/44723509/react-routing-works-in-locally-but-not-heroku",
	"id": 1789,
	"parentId": "1784",
	"dateAddedLocal": "6/21/2021, 2:12:25 PM",
	"dateAddedUTC": "2021-06-21T18:12:25.000Z"
},{
	"index": 137,
	"title": "rails-refinery-cms",
	"id": 1790,
	"parentId": "871",
	"dateAddedLocal": "6/21/2021, 2:28:37 PM",
	"dateAddedUTC": "2021-06-21T18:28:37.134Z"
},{
	"index": 0,
	"title": "An Overview of Refinery - a Rails CMS",
	"url": "https://en.railsmagazine.com/articles/226",
	"id": 1791,
	"parentId": "1790",
	"dateAddedLocal": "6/21/2021, 2:12:25 PM",
	"dateAddedUTC": "2021-06-21T18:12:25.000Z"
},{
	"index": 1,
	"title": "Heroku - Guides - Refinery CMS",
	"url": "https://www.refinerycms.com/guides/heroku",
	"id": 1792,
	"parentId": "1790",
	"dateAddedLocal": "6/21/2021, 2:12:25 PM",
	"dateAddedUTC": "2021-06-21T18:12:25.000Z"
},{
	"index": 2,
	"title": "On-the-fly image handling with Dragonfly",
	"url": "https://thoughtbot.com/blog/dragonfly",
	"id": 1793,
	"parentId": "1790",
	"dateAddedLocal": "6/21/2021, 2:12:25 PM",
	"dateAddedUTC": "2021-06-21T18:12:25.000Z"
},{
	"index": 3,
	"title": "postgresql - Storing Images in Postgres DB Store RefineryCMS with Dragonfly - Stack Overflow",
	"url": "https://stackoverflow.com/questions/37696397/storing-images-in-postgres-db-store-refinerycms-with-dragonfly",
	"id": 1794,
	"parentId": "1790",
	"dateAddedLocal": "6/21/2021, 2:12:25 PM",
	"dateAddedUTC": "2021-06-21T18:12:25.000Z"
},{
	"index": 4,
	"title": "refinerycms/doc/guides at master Â· refinery/refinerycms",
	"url": "https://github.com/refinery/refinerycms/tree/master/doc/guides",
	"id": 1795,
	"parentId": "1790",
	"dateAddedLocal": "6/21/2021, 2:12:25 PM",
	"dateAddedUTC": "2021-06-21T18:12:25.000Z"
},{
	"index": 5,
	"title": "The Right Way to Store and Serve Dragonfly Thumbnails | Viget",
	"url": "https://www.viget.com/articles/the-right-way-to-store-and-serve-dragonfly-thumbnails/",
	"id": 1796,
	"parentId": "1790",
	"dateAddedLocal": "6/21/2021, 2:12:25 PM",
	"dateAddedUTC": "2021-06-21T18:12:25.000Z"
},{
	"index": 6,
	"title": "Uploading Files With Rails andÂ Dragonfly",
	"url": "https://code.tutsplus.com/tutorials/uploading-files-with-rails-and-dragonfly--cms-28184",
	"id": 1797,
	"parentId": "1790",
	"dateAddedLocal": "6/21/2021, 2:12:25 PM",
	"dateAddedUTC": "2021-06-21T18:12:25.000Z"
},{
	"index": 7,
	"title": "Testing - Guides - Refinery CMS",
	"url": "https://www.refinerycms.com/guides/testing",
	"id": 1798,
	"parentId": "1790",
	"dateAddedLocal": "6/21/2021, 2:12:25 PM",
	"dateAddedUTC": "2021-06-21T18:12:25.000Z"
},{
	"index": 8,
	"title": "postgresql - Storing Images in Postgres DB Store RefineryCMS with Dragonfly - Stack Overflow",
	"url": "https://stackoverflow.com/questions/37696397/storing-images-in-postgres-db-store-refinerycms-with-dragonfly",
	"id": 1799,
	"parentId": "1790",
	"dateAddedLocal": "6/21/2021, 2:12:25 PM",
	"dateAddedUTC": "2021-06-21T18:12:25.000Z"
},{
	"index": 9,
	"title": "refinerycms/doc/guides at master Â· refinery/refinerycms",
	"url": "https://github.com/refinery/refinerycms/tree/master/doc/guides",
	"id": 1800,
	"parentId": "1790",
	"dateAddedLocal": "6/21/2021, 2:12:25 PM",
	"dateAddedUTC": "2021-06-21T18:12:25.000Z"
},{
	"index": 10,
	"title": "On-the-fly image handling with Dragonfly",
	"url": "https://thoughtbot.com/blog/dragonfly",
	"id": 1801,
	"parentId": "1790",
	"dateAddedLocal": "6/21/2021, 2:12:25 PM",
	"dateAddedUTC": "2021-06-21T18:12:25.000Z"
},{
	"index": 11,
	"title": "The Right Way to Store and Serve Dragonfly Thumbnails | Viget",
	"url": "https://www.viget.com/articles/the-right-way-to-store-and-serve-dragonfly-thumbnails/",
	"id": 1802,
	"parentId": "1790",
	"dateAddedLocal": "6/21/2021, 2:12:25 PM",
	"dateAddedUTC": "2021-06-21T18:12:25.000Z"
},{
	"index": 12,
	"title": "Uploading Files With Rails andÂ Dragonfly",
	"url": "https://code.tutsplus.com/tutorials/uploading-files-with-rails-and-dragonfly--cms-28184",
	"id": 1803,
	"parentId": "1790",
	"dateAddedLocal": "6/21/2021, 2:12:25 PM",
	"dateAddedUTC": "2021-06-21T18:12:25.000Z"
},{
	"index": 138,
	"title": "rails-tutorials",
	"id": 1804,
	"parentId": "871",
	"dateAddedLocal": "6/21/2021, 2:28:37 PM",
	"dateAddedUTC": "2021-06-21T18:28:37.135Z"
},{
	"index": 0,
	"title": "Justin Weiss",
	"url": "https://www.justinweiss.com/",
	"id": 1805,
	"parentId": "1804",
	"dateAddedLocal": "6/21/2021, 2:12:25 PM",
	"dateAddedUTC": "2021-06-21T18:12:25.000Z"
},{
	"index": 1,
	"title": "Deploying a Ruby app with Passenger to production - Passenger Library",
	"url": "https://www.phusionpassenger.com/library/walkthroughs/deploy/ruby/?source=post_page-----3485238e4a4a----------------------",
	"id": 1806,
	"parentId": "1804",
	"dateAddedLocal": "6/21/2021, 2:12:25 PM",
	"dateAddedUTC": "2021-06-21T18:12:25.000Z"
},{
	"index": 2,
	"title": "Automating deployments of Ruby application updates through Capistrano - Apache - Passenger Library",
	"url": "https://www.phusionpassenger.com/library/deploy/apache/automating_app_updates/ruby/?source=post_page-----3485238e4a4a----------------------",
	"id": 1807,
	"parentId": "1804",
	"dateAddedLocal": "6/21/2021, 2:12:25 PM",
	"dateAddedUTC": "2021-06-21T18:12:25.000Z"
},{
	"index": 3,
	"title": "Rails 5.2 credentials - Cedarcode - Medium",
	"url": "https://medium.com/cedarcode/rails-5-2-credentials-9b3324851336",
	"id": 1808,
	"parentId": "1804",
	"dateAddedLocal": "6/21/2021, 2:12:25 PM",
	"dateAddedUTC": "2021-06-21T18:12:25.000Z"
},{
	"index": 139,
	"title": "rails-upgrade",
	"id": 1809,
	"parentId": "871",
	"dateAddedLocal": "6/21/2021, 2:28:37 PM",
	"dateAddedUTC": "2021-06-21T18:28:37.136Z"
},{
	"index": 0,
	"title": "RailsDiff",
	"url": "http://railsdiff.org/4.2.10/5.0.1",
	"id": 1810,
	"parentId": "1809",
	"dateAddedLocal": "6/21/2021, 2:12:25 PM",
	"dateAddedUTC": "2021-06-21T18:12:25.000Z"
},{
	"index": 1,
	"title": "Updating to Rails 5.0 Â· RailsApps",
	"url": "http://railsapps.github.io/updating-rails.html",
	"id": 1811,
	"parentId": "1809",
	"dateAddedLocal": "6/21/2021, 2:12:25 PM",
	"dateAddedUTC": "2021-06-21T18:12:25.000Z"
},{
	"index": 2,
	"title": "Upgrading Ruby on Rails â€” Ruby on Rails Guides",
	"url": "https://edgeguides.rubyonrails.org/upgrading_ruby_on_rails.html",
	"id": 1812,
	"parentId": "1809",
	"dateAddedLocal": "6/21/2021, 2:12:25 PM",
	"dateAddedUTC": "2021-06-21T18:12:25.000Z"
},{
	"index": 3,
	"title": "How to upgrade Rails: Workflow advice - makandra dev",
	"url": "https://makandracards.com/makandra/59328-how-to-upgrade-rails-workflow-advice",
	"id": 1813,
	"parentId": "1809",
	"dateAddedLocal": "6/21/2021, 2:12:25 PM",
	"dateAddedUTC": "2021-06-21T18:12:25.000Z"
},{
	"index": 4,
	"title": "A Guide for Upgrading Ruby on Rails â€” Ruby on Rails Guides",
	"url": "https://guides.rubyonrails.org/v4.0/upgrading_ruby_on_rails.html",
	"id": 1814,
	"parentId": "1809",
	"dateAddedLocal": "6/21/2021, 2:12:25 PM",
	"dateAddedUTC": "2021-06-21T18:12:25.000Z"
},{
	"index": 5,
	"title": "May of WTFs",
	"url": "https://weblog.rubyonrails.org/",
	"id": 1815,
	"parentId": "1809",
	"dateAddedLocal": "6/21/2021, 2:12:25 PM",
	"dateAddedUTC": "2021-06-21T18:12:25.000Z"
},{
	"index": 6,
	"title": "The Rails Upgrade Series - FastRuby.io | Rails Upgrade Service",
	"url": "https://www.fastruby.io/blog/rails/upgrade/rails-upgrade-series.html",
	"id": 1816,
	"parentId": "1809",
	"dateAddedLocal": "6/21/2021, 2:12:25 PM",
	"dateAddedUTC": "2021-06-21T18:12:25.000Z"
},{
	"index": 7,
	"title": "RailsDiff",
	"url": "https://railsdiff.org/",
	"id": 1817,
	"parentId": "1809",
	"dateAddedLocal": "6/21/2021, 2:12:25 PM",
	"dateAddedUTC": "2021-06-21T18:12:25.000Z"
},{
	"index": 8,
	"title": "RailsDiff - 4.2.11.1 â†’ 5.0.7.2",
	"url": "https://railsdiff.org/4.2.11.1/5.0.7.2",
	"id": 1818,
	"parentId": "1809",
	"dateAddedLocal": "6/21/2021, 2:12:25 PM",
	"dateAddedUTC": "2021-06-21T18:12:25.000Z"
},{
	"index": 9,
	"title": "rubysec/bundler-audit: Patch-level verification for Bundler",
	"url": "https://github.com/rubysec/bundler-audit",
	"id": 1819,
	"parentId": "1809",
	"dateAddedLocal": "6/21/2021, 2:12:25 PM",
	"dateAddedUTC": "2021-06-21T18:12:25.000Z"
},{
	"index": 140,
	"title": "rails-validation",
	"id": 1820,
	"parentId": "871",
	"dateAddedLocal": "6/21/2021, 2:28:37 PM",
	"dateAddedUTC": "2021-06-21T18:28:37.137Z"
},{
	"index": 0,
	"title": "Active Record Callbacks â€” Ruby on Rails Guides",
	"url": "http://guides.rubyonrails.org/active_record_callbacks.html#running-callbacks",
	"id": 1821,
	"parentId": "1820",
	"dateAddedLocal": "6/21/2021, 2:12:25 PM",
	"dateAddedUTC": "2021-06-21T18:12:25.000Z"
},{
	"index": 1,
	"title": "Active Record Validations â€” Ruby on Rails Guides",
	"url": "http://guides.rubyonrails.org/active_record_validations.html#displaying-validation-errors-in-views",
	"id": 1822,
	"parentId": "1820",
	"dateAddedLocal": "6/21/2021, 2:12:25 PM",
	"dateAddedUTC": "2021-06-21T18:12:25.000Z"
},{
	"index": 2,
	"title": "Active Record Validations â€” Ruby on Rails Guides",
	"url": "http://guides.rubyonrails.org/active_record_validations.html#validation-helpers",
	"id": 1823,
	"parentId": "1820",
	"dateAddedLocal": "6/21/2021, 2:12:25 PM",
	"dateAddedUTC": "2021-06-21T18:12:25.000Z"
},{
	"index": 3,
	"title": "Custom Active Record Validations",
	"url": "http://guides.rubyonrails.org/active_record_validations.html#performing-custom-validations",
	"id": 1824,
	"parentId": "1820",
	"dateAddedLocal": "6/21/2021, 2:12:25 PM",
	"dateAddedUTC": "2021-06-21T18:12:25.000Z"
},{
	"index": 141,
	"title": "rasberry-pi",
	"id": 1825,
	"parentId": "871",
	"dateAddedLocal": "6/21/2021, 2:28:37 PM",
	"dateAddedUTC": "2021-06-21T18:28:37.137Z"
},{
	"index": 0,
	"title": "How to Install Ruby on Rails on Raspberry Pi",
	"url": "https://computers.tutsplus.com/tutorials/how-to-install-ruby-on-rails-on-raspberry-pi--cms-21421",
	"id": 1826,
	"parentId": "1825",
	"dateAddedLocal": "6/21/2021, 2:12:25 PM",
	"dateAddedUTC": "2021-06-21T18:12:25.000Z"
},{
	"index": 1,
	"title": "postgresql on rasberry pi -- Ben Walters - Blog",
	"url": "http://blog.bpwalters.com/setting-up-postgresql-on-raspberry-pi/",
	"id": 1827,
	"parentId": "1825",
	"dateAddedLocal": "6/21/2021, 2:12:25 PM",
	"dateAddedUTC": "2021-06-21T18:12:25.000Z"
},{
	"index": 2,
	"title": "PostgreSQL on Raspberry Pi",
	"url": "http://raspberrypg.org/2015/06/step-5-update-installing-postgresql-on-my-raspberry-pi-1-and-2/#more-248",
	"id": 1828,
	"parentId": "1825",
	"dateAddedLocal": "6/21/2021, 2:12:25 PM",
	"dateAddedUTC": "2021-06-21T18:12:25.000Z"
},{
	"index": 3,
	"title": "Raspberry Pi Blog - News, Announcements, and Ideas",
	"url": "https://www.raspberrypi.org/blog/#amazon-echo-homebrew-version",
	"id": 1829,
	"parentId": "1825",
	"dateAddedLocal": "6/21/2021, 2:12:25 PM",
	"dateAddedUTC": "2021-06-21T18:12:25.000Z"
},{
	"index": 4,
	"title": "raspbian - Connect to Raspberry Pi over ssh: connection refused (from putty) - Raspberry Pi Stack Exchange",
	"url": "https://raspberrypi.stackexchange.com/questions/33431/connect-to-raspberry-pi-over-ssh-connection-refused-from-putty",
	"id": 1830,
	"parentId": "1825",
	"dateAddedLocal": "6/21/2021, 2:12:25 PM",
	"dateAddedUTC": "2021-06-21T18:12:25.000Z"
},{
	"index": 5,
	"title": "Running a Linux Web Server on an Android device | Codementor",
	"url": "https://www.codementor.io/maxpleaner/run-a-linux-web-server-on-android-device-du1083k05",
	"id": 1831,
	"parentId": "1825",
	"dateAddedLocal": "6/21/2021, 2:12:25 PM",
	"dateAddedUTC": "2021-06-21T18:12:25.000Z"
},{
	"index": 6,
	"title": "SONIC PI: LIVE & CODING",
	"url": "http://www.sonicpiliveandcoding.com/",
	"id": 1832,
	"parentId": "1825",
	"dateAddedLocal": "6/21/2021, 2:12:25 PM",
	"dateAddedUTC": "2021-06-21T18:12:25.000Z"
},{
	"index": 142,
	"title": "react",
	"id": 1833,
	"parentId": "871",
	"dateAddedLocal": "6/21/2021, 2:28:37 PM",
	"dateAddedUTC": "2021-06-21T18:28:37.138Z"
},{
	"index": 0,
	"title": "33 Validation Examples with ReactJS",
	"url": "https://react.rocks/tag/Validation",
	"id": 1834,
	"parentId": "1833",
	"dateAddedLocal": "6/21/2021, 2:12:25 PM",
	"dateAddedUTC": "2021-06-21T18:12:25.000Z"
},{
	"index": 1,
	"title": "axios/axios: Promise based HTTP client for the browser and node.js",
	"url": "https://github.com/axios/axios#interceptors",
	"id": 1835,
	"parentId": "1833",
	"dateAddedLocal": "6/21/2021, 2:12:25 PM",
	"dateAddedUTC": "2021-06-21T18:12:25.000Z"
},{
	"index": 2,
	"title": "christianalfoni/formsy-react: A form input builder and validator for React JS",
	"url": "https://github.com/christianalfoni/formsy-react",
	"id": 1836,
	"parentId": "1833",
	"dateAddedLocal": "6/21/2021, 2:12:25 PM",
	"dateAddedUTC": "2021-06-21T18:12:25.000Z"
},{
	"index": 3,
	"title": "Components and Props - React",
	"url": "https://facebook.github.io/react/docs/components-and-props.html",
	"id": 1837,
	"parentId": "1833",
	"dateAddedLocal": "6/21/2021, 2:12:25 PM",
	"dateAddedUTC": "2021-06-21T18:12:25.000Z"
},{
	"index": 4,
	"title": "css-modules/css-modules: Documentation about css-modules",
	"url": "https://github.com/css-modules/css-modules",
	"id": 1838,
	"parentId": "1833",
	"dateAddedLocal": "6/21/2021, 2:12:25 PM",
	"dateAddedUTC": "2021-06-21T18:12:25.000Z"
},{
	"index": 5,
	"title": "Diagram: Fetching API Data with React",
	"url": "https://blog.hellojs.org/fetching-api-data-with-react-js-460fe8bbf8f2",
	"id": 1839,
	"parentId": "1833",
	"dateAddedLocal": "6/21/2021, 2:12:25 PM",
	"dateAddedUTC": "2021-06-21T18:12:25.000Z"
},{
	"index": 6,
	"title": "How to Use CSS Modules with Create React App â€“ Nulogy â€“ Medium",
	"url": "https://medium.com/nulogy/how-to-use-css-modules-with-create-react-app-9e44bec2b5c2",
	"id": 1840,
	"parentId": "1833",
	"dateAddedLocal": "6/21/2021, 2:12:25 PM",
	"dateAddedUTC": "2021-06-21T18:12:25.000Z"
},{
	"index": 7,
	"title": "Learn - Components Lab",
	"url": "https://learn.co/tracks/full-stack-web-dev-with-react/react/rendering/components-lab",
	"id": 1841,
	"parentId": "1833",
	"dateAddedLocal": "6/21/2021, 2:12:25 PM",
	"dateAddedUTC": "2021-06-21T18:12:25.000Z"
},{
	"index": 8,
	"title": "Learn React By Itself -- no JSX, no Flux, no ES6, no Webpack.",
	"url": "http://jamesknelson.com/learn-raw-react-no-jsx-flux-es6-webpack/",
	"id": 1842,
	"parentId": "1833",
	"dateAddedLocal": "6/21/2021, 2:12:25 PM",
	"dateAddedUTC": "2021-06-21T18:12:25.000Z"
},{
	"index": 9,
	"title": "Presentational and Container Components â€“ Dan Abramov â€“ Medium",
	"url": "https://medium.com/@dan_abramov/smart-and-dumb-components-7ca2f9a7c7d0",
	"id": 1843,
	"parentId": "1833",
	"dateAddedLocal": "6/21/2021, 2:12:25 PM",
	"dateAddedUTC": "2021-06-21T18:12:25.000Z"
},{
	"index": 10,
	"title": "Raw React tutorial",
	"url": "https://reactarmory.com/guides/learn-react-by-itself/react-basics",
	"id": 1844,
	"parentId": "1833",
	"dateAddedLocal": "6/21/2021, 2:12:25 PM",
	"dateAddedUTC": "2021-06-21T18:12:25.000Z"
},{
	"index": 11,
	"title": "React Chrome Developer Tools - React Blog",
	"url": "https://facebook.github.io/react/blog/2014/01/02/react-chrome-developer-tools.html",
	"id": 1845,
	"parentId": "1833",
	"dateAddedLocal": "6/21/2021, 2:12:25 PM",
	"dateAddedUTC": "2021-06-21T18:12:25.000Z"
},{
	"index": 12,
	"title": "React Components",
	"url": "https://khan.github.io/react-components/#modal",
	"id": 1846,
	"parentId": "1833",
	"dateAddedLocal": "6/21/2021, 2:12:25 PM",
	"dateAddedUTC": "2021-06-21T18:12:25.000Z"
},{
	"index": 13,
	"title": "React JS Tutorials for Beginners - 1 - Getting Started - YouTube",
	"url": "https://www.youtube.com/watch?v=-AbaV3nrw6E",
	"id": 1847,
	"parentId": "1833",
	"dateAddedLocal": "6/21/2021, 2:12:25 PM",
	"dateAddedUTC": "2021-06-21T18:12:25.000Z"
},{
	"index": 14,
	"title": "React Router: Declarative Routing for React.js",
	"url": "https://reacttraining.com/react-router/web/guides/philosophy",
	"id": 1848,
	"parentId": "1833",
	"dateAddedLocal": "6/21/2021, 2:12:25 PM",
	"dateAddedUTC": "2021-06-21T18:12:25.000Z"
},{
	"index": 15,
	"title": "React The ES6 Way - Lesson 1, Step 2: Tools of the Trade - SitePoint Premium",
	"url": "https://www.sitepoint.com/premium/courses/react-the-es6-way-2914/lesson/1/step/2",
	"id": 1849,
	"parentId": "1833",
	"dateAddedLocal": "6/21/2021, 2:12:25 PM",
	"dateAddedUTC": "2021-06-21T18:12:25.000Z"
},{
	"index": 16,
	"title": "React Top-Level API - React",
	"url": "https://facebook.github.io/react/docs/react-api.html",
	"id": 1850,
	"parentId": "1833",
	"dateAddedLocal": "6/21/2021, 2:12:25 PM",
	"dateAddedUTC": "2021-06-21T18:12:25.000Z"
},{
	"index": 17,
	"title": "react-validation",
	"url": "https://www.npmjs.com/package/react-validation",
	"id": 1851,
	"parentId": "1833",
	"dateAddedLocal": "6/21/2021, 2:12:25 PM",
	"dateAddedUTC": "2021-06-21T18:12:25.000Z"
},{
	"index": 18,
	"title": "reactjs - Any good debug tutorial for React.js - Stack Overflow",
	"url": "http://stackoverflow.com/questions/32772379/any-good-debug-tutorial-for-react-js",
	"id": 1852,
	"parentId": "1833",
	"dateAddedLocal": "6/21/2021, 2:12:25 PM",
	"dateAddedUTC": "2021-06-21T18:12:25.000Z"
},{
	"index": 19,
	"title": "Read Me Â· Redux",
	"url": "http://redux.js.org/",
	"id": 1853,
	"parentId": "1833",
	"dateAddedLocal": "6/21/2021, 2:12:25 PM",
	"dateAddedUTC": "2021-06-21T18:12:25.000Z"
},{
	"index": 20,
	"title": "Understanding the React Component Lifecycle",
	"url": "http://busypeoples.github.io/post/react-component-lifecycle/",
	"id": 1854,
	"parentId": "1833",
	"dateAddedLocal": "6/21/2021, 2:12:25 PM",
	"dateAddedUTC": "2021-06-21T18:12:25.000Z"
},{
	"index": 21,
	"title": "validate.js",
	"url": "https://validatejs.org/",
	"id": 1855,
	"parentId": "1833",
	"dateAddedLocal": "6/21/2021, 2:12:25 PM",
	"dateAddedUTC": "2021-06-21T18:12:25.000Z"
},{
	"index": 22,
	"title": "webpack-a module bundler for JS apps",
	"url": "https://webpack.js.org/concepts/",
	"id": 1856,
	"parentId": "1833",
	"dateAddedLocal": "6/21/2021, 2:12:25 PM",
	"dateAddedUTC": "2021-06-21T18:12:25.000Z"
},{
	"index": 23,
	"title": "reactjs - Get a list of all possible paths with react-router - Stack Overflow",
	"url": "https://stackoverflow.com/questions/27656792/get-a-list-of-all-possible-paths-with-react-router",
	"id": 1857,
	"parentId": "1833",
	"dateAddedLocal": "6/21/2021, 2:12:25 PM",
	"dateAddedUTC": "2021-06-21T18:12:25.000Z"
},{
	"index": 24,
	"title": "How to Structure Your React Project",
	"url": "https://daveceddia.com/react-project-structure/",
	"id": 1858,
	"parentId": "1833",
	"dateAddedLocal": "6/21/2021, 2:12:25 PM",
	"dateAddedUTC": "2021-06-21T18:12:25.000Z"
},{
	"index": 25,
	"title": "React Binding Patterns: 5 Approaches for Handling `this`",
	"url": "https://medium.freecodecamp.org/react-binding-patterns-5-approaches-for-handling-this-92c651b5af56",
	"id": 1859,
	"parentId": "1833",
	"dateAddedLocal": "6/21/2021, 2:12:25 PM",
	"dateAddedUTC": "2021-06-21T18:12:25.000Z"
},{
	"index": 26,
	"title": "Optimizing React: Virtual DOM explained â€” Martian Chronicles, Evil Martiansâ€™ team blog",
	"url": "https://evilmartians.com/chronicles/optimizing-react-virtual-dom-explained",
	"id": 1860,
	"parentId": "1833",
	"dateAddedLocal": "6/21/2021, 2:12:25 PM",
	"dateAddedUTC": "2021-06-21T18:12:25.000Z"
},{
	"index": 27,
	"title": "react-router-course-sitepoint",
	"url": "https://www.sitepoint.com/react-router-v4-complete-guide/",
	"id": 1861,
	"parentId": "1833",
	"dateAddedLocal": "6/21/2021, 2:12:25 PM",
	"dateAddedUTC": "2021-06-21T18:12:25.000Z"
},{
	"index": 28,
	"title": "Using create-react-app with Rails server",
	"url": "https://www.fullstackreact.com/articles/how-to-get-create-react-app-to-work-with-your-rails-api/",
	"id": 1862,
	"parentId": "1833",
	"dateAddedLocal": "6/21/2021, 2:12:25 PM",
	"dateAddedUTC": "2021-06-21T18:12:25.000Z"
},{
	"index": 29,
	"title": "React client-side routing",
	"url": "https://github.com/facebook/create-react-app/blob/master/packages/react-scripts/template/README.md#notes-on-client-side-routing",
	"id": 1863,
	"parentId": "1833",
	"dateAddedLocal": "6/21/2021, 2:12:25 PM",
	"dateAddedUTC": "2021-06-21T18:12:25.000Z"
},{
	"index": 30,
	"title": "rafrex/spa-github-pages: Host single page apps with GitHub Pages",
	"url": "https://github.com/rafrex/spa-github-pages",
	"id": 1864,
	"parentId": "1833",
	"dateAddedLocal": "6/21/2021, 2:12:25 PM",
	"dateAddedUTC": "2021-06-21T18:12:25.000Z"
},{
	"index": 31,
	"title": "Processing errors with Fetch API",
	"url": "https://gist.github.com/odewahn/5a5eeb23279eed6a80d7798fdb47fe91",
	"id": 1865,
	"parentId": "1833",
	"dateAddedLocal": "6/21/2021, 2:12:25 PM",
	"dateAddedUTC": "2021-06-21T18:12:25.000Z"
},{
	"index": 32,
	"title": "Thinking in React â€“ React",
	"url": "https://reactjs.org/docs/thinking-in-react.html",
	"id": 1866,
	"parentId": "1833",
	"dateAddedLocal": "6/21/2021, 2:12:25 PM",
	"dateAddedUTC": "2021-06-21T18:12:25.000Z"
},{
	"index": 33,
	"title": "React Developer Tools - Chrome Web Store",
	"url": "https://chrome.google.com/webstore/detail/react-developer-tools/fmkadmapgofadopljbjfkapdkoienihi?hl=en",
	"id": 1867,
	"parentId": "1833",
	"dateAddedLocal": "6/21/2021, 2:12:25 PM",
	"dateAddedUTC": "2021-06-21T18:12:25.000Z"
},{
	"index": 34,
	"title": "A Simple React Router v4 Tutorial â€“ Paul Sherman â€“ Medium",
	"url": "https://medium.com/@pshrmn/a-simple-react-router-v4-tutorial-7f23ff27adf",
	"id": 1868,
	"parentId": "1833",
	"dateAddedLocal": "6/21/2021, 2:12:25 PM",
	"dateAddedUTC": "2021-06-21T18:12:25.000Z"
},{
	"index": 35,
	"title": "React Training",
	"url": "https://reacttraining.com/",
	"id": 1869,
	"parentId": "1833",
	"dateAddedLocal": "6/21/2021, 2:12:25 PM",
	"dateAddedUTC": "2021-06-21T18:12:25.000Z"
},{
	"index": 36,
	"title": "Introducing the React Profiler â€“ React Blog",
	"url": "https://reactjs.org/blog/2018/09/10/introducing-the-react-profiler.html",
	"id": 1870,
	"parentId": "1833",
	"dateAddedLocal": "6/21/2021, 2:12:25 PM",
	"dateAddedUTC": "2021-06-21T18:12:25.000Z"
},{
	"index": 37,
	"title": "A Complete Guide to useEffect â€” Overreacted",
	"url": "https://overreacted.io/a-complete-guide-to-useeffect/",
	"id": 1871,
	"parentId": "1833",
	"dateAddedLocal": "6/21/2021, 2:12:25 PM",
	"dateAddedUTC": "2021-06-21T18:12:25.000Z"
},{
	"index": 38,
	"title": "Testing React Apps Â· Jest",
	"url": "https://jestjs.io/docs/en/tutorial-react",
	"id": 1872,
	"parentId": "1833",
	"dateAddedLocal": "6/21/2021, 2:12:25 PM",
	"dateAddedUTC": "2021-06-21T18:12:25.000Z"
},{
	"index": 39,
	"title": "3 Types Of Projects That Make YOU A Programmer - YouTube",
	"url": "https://www.youtube.com/watch?v=ydOZ5YAv8Hk",
	"id": 2613,
	"parentId": "1833",
	"dateAddedLocal": "11/26/2023, 5:50:56 PM",
	"dateAddedUTC": "2023-11-26T22:50:56.682Z"
},{
	"index": 40,
	"title": "Running React with Rails 7 | reinteractive article",
	"url": "https://reinteractive.com/articles/running-react-with-rails-7",
	"id": 3026,
	"parentId": "1833",
	"dateAddedLocal": "10/14/2024, 6:35:47 PM",
	"dateAddedUTC": "2024-10-14T22:35:47.623Z"
},{
	"index": 41,
	"title": "example code for implementing markdown parsing in Rails app with Redcarpet gem - Google Search",
	"url": "https://www.google.com/search?q=example+code+for+implementing+markdown+parsing+in+Rails+app+with+Redcarpet+gem&oq=example+code+for+implementing+markdown+parsing+in+Rails+app+with+Redcarpet+gem&gs_lcrp=EgZjaHJvbWUyBggAEEUYOdIBCjE4MzY5ajBqMTWoAgCwAgA&sourceid=chrome&ie=UTF-8#fpstate=ive&vld=cid:e76f373b,vid:4tTRbJLeua8,st:0",
	"id": 3027,
	"parentId": "1833",
	"dateAddedLocal": "10/14/2024, 6:57:20 PM",
	"dateAddedUTC": "2024-10-14T22:57:20.223Z"
},{
	"index": 143,
	"title": "react-jsx",
	"id": 1873,
	"parentId": "871",
	"dateAddedLocal": "6/21/2021, 2:28:37 PM",
	"dateAddedUTC": "2021-06-21T18:28:37.142Z"
},{
	"index": 0,
	"title": "JSX - React",
	"url": "https://facebook.github.io/react/docs/introducing-jsx.html",
	"id": 1874,
	"parentId": "1873",
	"dateAddedLocal": "6/21/2021, 2:12:25 PM",
	"dateAddedUTC": "2021-06-21T18:12:25.000Z"
},{
	"index": 1,
	"title": "JSX - React",
	"url": "https://reactjs.org/docs/introducing-jsx.html",
	"id": 1875,
	"parentId": "1873",
	"dateAddedLocal": "6/21/2021, 2:12:25 PM",
	"dateAddedUTC": "2021-06-21T18:12:25.000Z"
},{
	"index": 2,
	"title": "JSX In Depth - React",
	"url": "https://reactjs.org/docs/jsx-in-depth.html",
	"id": 1876,
	"parentId": "1873",
	"dateAddedLocal": "6/21/2021, 2:12:25 PM",
	"dateAddedUTC": "2021-06-21T18:12:25.000Z"
},{
	"index": 144,
	"title": "react-redux",
	"id": 1877,
	"parentId": "871",
	"dateAddedLocal": "6/21/2021, 2:28:37 PM",
	"dateAddedUTC": "2021-06-21T18:28:37.142Z"
},{
	"index": 0,
	"title": "Actions Â· Redux",
	"url": "https://redux.js.org/docs/basics/Actions.html",
	"id": 1878,
	"parentId": "1877",
	"dateAddedLocal": "6/21/2021, 2:12:25 PM",
	"dateAddedUTC": "2021-06-21T18:12:25.000Z"
},{
	"index": 1,
	"title": "Async Actions Â· Redux",
	"url": "https://redux.js.org/docs/advanced/AsyncActions.html",
	"id": 1879,
	"parentId": "1877",
	"dateAddedLocal": "6/21/2021, 2:12:25 PM",
	"dateAddedUTC": "2021-06-21T18:12:25.000Z"
},{
	"index": 2,
	"title": "Building React Applications with Idiomatic Redux from @dan_abramov on @eggheadio",
	"url": "https://egghead.io/courses/building-react-applications-with-idiomatic-redux",
	"id": 1880,
	"parentId": "1877",
	"dateAddedLocal": "6/21/2021, 2:12:25 PM",
	"dateAddedUTC": "2021-06-21T18:12:25.000Z"
},{
	"index": 3,
	"title": "Core Concepts Â· Redux",
	"url": "https://redux.js.org/docs/introduction/CoreConcepts.html",
	"id": 1881,
	"parentId": "1877",
	"dateAddedLocal": "6/21/2021, 2:12:25 PM",
	"dateAddedUTC": "2021-06-21T18:12:25.000Z"
},{
	"index": 4,
	"title": "FAQ Â· Redux",
	"url": "https://redux.js.org/docs/FAQ.html",
	"id": 1882,
	"parentId": "1877",
	"dateAddedLocal": "6/21/2021, 2:12:25 PM",
	"dateAddedUTC": "2021-06-21T18:12:25.000Z"
},{
	"index": 5,
	"title": "Getting Started with Redux from @dan_abramov on @eggheadio",
	"url": "https://egghead.io/courses/getting-started-with-redux",
	"id": 1883,
	"parentId": "1877",
	"dateAddedLocal": "6/21/2021, 2:12:25 PM",
	"dateAddedUTC": "2021-06-21T18:12:25.000Z"
},{
	"index": 6,
	"title": "Learn Redux â€” 20 video tutorials to help you learn how to build JavaScript apps with React.js and Redux.",
	"url": "https://learnredux.com/",
	"id": 1884,
	"parentId": "1877",
	"dateAddedLocal": "6/21/2021, 2:12:25 PM",
	"dateAddedUTC": "2021-06-21T18:12:25.000Z"
},{
	"index": 7,
	"title": "react-redux-links: Curated tutorial and resource links I've collected on React, Redux, ES6, and more",
	"url": "https://github.com/markerikson/react-redux-links",
	"id": 1885,
	"parentId": "1877",
	"dateAddedLocal": "6/21/2021, 2:12:25 PM",
	"dateAddedUTC": "2021-06-21T18:12:25.000Z"
},{
	"index": 8,
	"title": "markerikson/redux-ecosystem-links: A categorized list of Redux-related addons, libraries, and utilities",
	"url": "https://github.com/markerikson/redux-ecosystem-links",
	"id": 1886,
	"parentId": "1877",
	"dateAddedLocal": "6/21/2021, 2:12:25 PM",
	"dateAddedUTC": "2021-06-21T18:12:25.000Z"
},{
	"index": 9,
	"title": "Middleware Â· Redux",
	"url": "https://redux.js.org/docs/advanced/Middleware.html",
	"id": 1887,
	"parentId": "1877",
	"dateAddedLocal": "6/21/2021, 2:12:25 PM",
	"dateAddedUTC": "2021-06-21T18:12:25.000Z"
},{
	"index": 10,
	"title": "Read Me Â· Redux",
	"url": "https://redux.js.org/",
	"id": 1888,
	"parentId": "1877",
	"dateAddedLocal": "6/21/2021, 2:12:25 PM",
	"dateAddedUTC": "2021-06-21T18:12:25.000Z"
},{
	"index": 11,
	"title": "Reducers Â· Redux",
	"url": "https://redux.js.org/docs/basics/Reducers.html",
	"id": 1889,
	"parentId": "1877",
	"dateAddedLocal": "6/21/2021, 2:12:25 PM",
	"dateAddedUTC": "2021-06-21T18:12:25.000Z"
},{
	"index": 12,
	"title": "slides",
	"url": "file:///Users/BradSmith/Downloads/state-types.pdf",
	"id": 1890,
	"parentId": "1877",
	"dateAddedLocal": "6/21/2021, 2:12:25 PM",
	"dateAddedUTC": "2021-06-21T18:12:25.000Z"
},{
	"index": 13,
	"title": "SophieDeBenedetto/catbook-redux: simple sample redux app",
	"url": "https://github.com/SophieDeBenedetto/catbook-redux/tree/master",
	"id": 1891,
	"parentId": "1877",
	"dateAddedLocal": "6/21/2021, 2:12:25 PM",
	"dateAddedUTC": "2021-06-21T18:12:25.000Z"
},{
	"index": 14,
	"title": "Thunk middleware for Redux",
	"url": "https://github.com/gaearon/redux-thunk",
	"id": 1892,
	"parentId": "1877",
	"dateAddedLocal": "6/21/2021, 2:12:25 PM",
	"dateAddedUTC": "2021-06-21T18:12:25.000Z"
},{
	"index": 15,
	"title": "xgrommx/awesome-redux: Awesome list of Redux examples and middlewares",
	"url": "https://github.com/xgrommx/awesome-redux",
	"id": 1893,
	"parentId": "1877",
	"dateAddedLocal": "6/21/2021, 2:12:25 PM",
	"dateAddedUTC": "2021-06-21T18:12:25.000Z"
},{
	"index": 16,
	"title": "Using Object Spread Operator Â· Redux",
	"url": "https://redux.js.org/docs/recipes/UsingObjectSpreadOperator.html",
	"id": 1894,
	"parentId": "1877",
	"dateAddedLocal": "6/21/2021, 2:12:25 PM",
	"dateAddedUTC": "2021-06-21T18:12:25.000Z"
},{
	"index": 17,
	"title": "The Definitive Guide to Redux Persist â€“ React Native Coach",
	"url": "https://blog.reactnativecoach.com/the-definitive-guide-to-redux-persist-84738167975",
	"id": 1895,
	"parentId": "1877",
	"dateAddedLocal": "6/21/2021, 2:12:25 PM",
	"dateAddedUTC": "2021-06-21T18:12:25.000Z"
},{
	"index": 145,
	"title": "react-testing-library",
	"id": 2219,
	"parentId": "871",
	"dateAddedLocal": "2/5/2022, 7:51:03 PM",
	"dateAddedUTC": "2022-02-06T00:51:03.563Z"
},{
	"index": 0,
	"title": "Accessible Rich Internet Applications (WAI-ARIA) 1.1",
	"url": "https://www.w3.org/TR/wai-aria/#role_definitions",
	"id": 2220,
	"parentId": "2219",
	"dateAddedLocal": "2/5/2022, 7:50:24 PM",
	"dateAddedUTC": "2022-02-06T00:50:24.891Z"
},{
	"index": 146,
	"title": "readme",
	"id": 1896,
	"parentId": "871",
	"dateAddedLocal": "6/21/2021, 2:28:37 PM",
	"dateAddedUTC": "2021-06-21T18:28:37.143Z"
},{
	"index": 0,
	"title": "About READMEs - User Documentation",
	"url": "https://help.github.com/articles/about-readmes/",
	"id": 1897,
	"parentId": "1896",
	"dateAddedLocal": "6/21/2021, 2:12:25 PM",
	"dateAddedUTC": "2021-06-21T18:12:25.000Z"
},{
	"index": 147,
	"title": "recursion",
	"id": 1898,
	"parentId": "871",
	"dateAddedLocal": "6/21/2021, 2:28:37 PM",
	"dateAddedUTC": "2021-06-21T18:28:37.144Z"
},{
	"index": 0,
	"title": "JS-Challenges/recursion-prompts: Repository of prompts to be solved using recursion",
	"url": "https://github.com/JS-Challenges/recursion-prompts",
	"id": 1899,
	"parentId": "1898",
	"dateAddedLocal": "6/21/2021, 2:12:25 PM",
	"dateAddedUTC": "2021-06-21T18:12:25.000Z"
},{
	"index": 148,
	"title": "refs",
	"id": 1900,
	"parentId": "871",
	"dateAddedLocal": "6/21/2021, 2:28:37 PM",
	"dateAddedUTC": "2021-06-21T18:28:37.144Z"
},{
	"index": 0,
	"title": "25Useful Keybd Shortcuts",
	"url": "https://blog.hubspot.com/sales/chrome-keyboard-shortcuts#sm.0001ltmxn310hseduuyr7pg3zq12t",
	"id": 1901,
	"parentId": "1900",
	"dateAddedLocal": "6/21/2021, 2:12:25 PM",
	"dateAddedUTC": "2021-06-21T18:12:25.000Z"
},{
	"index": 1,
	"title": "6 Simple Tools to Increase Your Coding Productivity Â« Flatiron School",
	"url": "http://blog.flatironschool.com/6-simple-tools-to-increase-your-coding-productivity/?utm_campaign=Alumni%20Engagement%20&utm_content=31428254&utm_medium=social&utm_source=twitter",
	"id": 1902,
	"parentId": "1900",
	"dateAddedLocal": "6/21/2021, 2:12:25 PM",
	"dateAddedUTC": "2021-06-21T18:12:25.000Z"
},{
	"index": 2,
	"title": "Class: Time (Ruby 2.3.0)",
	"url": "https://ruby-doc.org/stdlib-2.3.0/libdoc/time/rdoc/Time.html#method-c-strptime",
	"id": 1903,
	"parentId": "1900",
	"dateAddedLocal": "6/21/2021, 2:12:25 PM",
	"dateAddedUTC": "2021-06-21T18:12:25.000Z"
},{
	"index": 3,
	"title": "Cooperpress",
	"url": "https://cooperpress.com/publications/",
	"id": 1904,
	"parentId": "1900",
	"dateAddedLocal": "6/21/2021, 2:12:25 PM",
	"dateAddedUTC": "2021-06-21T18:12:25.000Z"
},{
	"index": 4,
	"title": "Date & Time in Ruby",
	"url": "https://www.tutorialspoint.com/ruby/ruby_date_time.htm",
	"id": 1905,
	"parentId": "1900",
	"dateAddedLocal": "6/21/2021, 2:12:25 PM",
	"dateAddedUTC": "2021-06-21T18:12:25.000Z"
},{
	"index": 5,
	"title": "Design Patterns | Object Oriented Design",
	"url": "http://www.oodesign.com/",
	"id": 1906,
	"parentId": "1900",
	"dateAddedLocal": "6/21/2021, 2:12:25 PM",
	"dateAddedUTC": "2021-06-21T18:12:25.000Z"
},{
	"index": 6,
	"title": "HappenApps",
	"url": "http://happenapps.com/#quiver",
	"id": 1907,
	"parentId": "1900",
	"dateAddedLocal": "6/21/2021, 2:12:25 PM",
	"dateAddedUTC": "2021-06-21T18:12:25.000Z"
},{
	"index": 7,
	"title": "Internet: Lots More Information - HowStuffWorks",
	"url": "http://computer.howstuffworks.com/internet/basics/internet3.htm",
	"id": 1908,
	"parentId": "1900",
	"dateAddedLocal": "6/21/2021, 2:12:25 PM",
	"dateAddedUTC": "2021-06-21T18:12:25.000Z"
},{
	"index": 8,
	"title": "JSONPlaceholder - Fake online REST API for developers",
	"url": "http://jsonplaceholder.typicode.com/",
	"id": 1909,
	"parentId": "1900",
	"dateAddedLocal": "6/21/2021, 2:12:25 PM",
	"dateAddedUTC": "2021-06-21T18:12:25.000Z"
},{
	"index": 9,
	"title": "Learn - Set Up",
	"url": "https://learn.co/manual_setup",
	"id": 1910,
	"parentId": "1900",
	"dateAddedLocal": "6/21/2021, 2:12:25 PM",
	"dateAddedUTC": "2021-06-21T18:12:25.000Z"
},{
	"index": 10,
	"title": "OneTab extension for Google Chrome and Firefox - save up to 95% memory and reduce tab clutter",
	"url": "https://www.one-tab.com/",
	"id": 1912,
	"parentId": "1900",
	"dateAddedLocal": "6/21/2021, 2:12:25 PM",
	"dateAddedUTC": "2021-06-21T18:12:25.000Z"
},{
	"index": 11,
	"title": "PDF to WORD",
	"url": "http://www.pdfonline.com/",
	"id": 1913,
	"parentId": "1900",
	"dateAddedLocal": "6/21/2021, 2:12:25 PM",
	"dateAddedUTC": "2021-06-21T18:12:25.000Z"
},{
	"index": 12,
	"title": "ScreenCap",
	"url": "http://www.imore.com/screenshot-mac",
	"id": 1914,
	"parentId": "1900",
	"dateAddedLocal": "6/21/2021, 2:12:25 PM",
	"dateAddedUTC": "2021-06-21T18:12:25.000Z"
},{
	"index": 13,
	"title": "URL Encoded Characters",
	"url": "http://www.degraeve.com/reference/urlencoding.php",
	"id": 1915,
	"parentId": "1900",
	"dateAddedLocal": "6/21/2021, 2:12:25 PM",
	"dateAddedUTC": "2021-06-21T18:12:25.000Z"
},{
	"index": 14,
	"title": "Curated list of awesome lists",
	"url": "https://github.com/sindresorhus/awesome",
	"id": 1916,
	"parentId": "1900",
	"dateAddedLocal": "6/21/2021, 2:12:25 PM",
	"dateAddedUTC": "2021-06-21T18:12:25.000Z"
},{
	"index": 15,
	"title": "Software development: Glossary - Reference from WhatIs.com",
	"url": "http://whatis.techtarget.com/reference/Software-development-Glossary",
	"id": 1917,
	"parentId": "1900",
	"dateAddedLocal": "6/21/2021, 2:12:25 PM",
	"dateAddedUTC": "2021-06-21T18:12:25.000Z"
},{
	"index": 149,
	"title": "regex",
	"id": 1918,
	"parentId": "871",
	"dateAddedLocal": "6/21/2021, 2:28:37 PM",
	"dateAddedUTC": "2021-06-21T18:28:37.146Z"
},{
	"index": 0,
	"title": "Become a regular with regular expressions",
	"url": "https://www.tableau.com/about/blog/2015/6/become-regular-regular-expressions-39802",
	"id": 1919,
	"parentId": "1918",
	"dateAddedLocal": "6/21/2021, 2:12:25 PM",
	"dateAddedUTC": "2021-06-21T18:12:25.000Z"
},{
	"index": 1,
	"title": "EditPad - Text Editor for Windows",
	"url": "https://www.editpadpro.com/",
	"id": 1920,
	"parentId": "1918",
	"dateAddedLocal": "6/21/2021, 2:12:25 PM",
	"dateAddedUTC": "2021-06-21T18:12:25.000Z"
},{
	"index": 2,
	"title": "Online regex tester and debugger: JavaScript, Python, PHP, and PCRE",
	"url": "https://regex101.com/r/nW9iC5/3",
	"id": 1921,
	"parentId": "1918",
	"dateAddedLocal": "6/21/2021, 2:12:25 PM",
	"dateAddedUTC": "2021-06-21T18:12:25.000Z"
},{
	"index": 3,
	"title": "PowerGREP: Windows grep Software to Search (and Replace) through Files and Folders on Your PC and Network",
	"url": "https://www.powergrep.com/",
	"id": 1922,
	"parentId": "1918",
	"dateAddedLocal": "6/21/2021, 2:12:25 PM",
	"dateAddedUTC": "2021-06-21T18:12:25.000Z"
},{
	"index": 4,
	"title": "REGEX: How to Become a Regular Expression Power User",
	"url": "https://www.memberpress.com/how-to-become-a-regular-expression-power-user/",
	"id": 1923,
	"parentId": "1918",
	"dateAddedLocal": "6/21/2021, 2:12:25 PM",
	"dateAddedUTC": "2021-06-21T18:12:25.000Z"
},{
	"index": 5,
	"title": "REGEX: RegexOne - Learn Regular Expressions - Lesson 1: An Introduction, and the ABCs",
	"url": "http://regexone.com/",
	"id": 1924,
	"parentId": "1918",
	"dateAddedLocal": "6/21/2021, 2:12:25 PM",
	"dateAddedUTC": "2021-06-21T18:12:25.000Z"
},{
	"index": 6,
	"title": "REGEX: Rubular: Ruby regular expression editor and tester",
	"url": "http://rubular.com/",
	"id": 1925,
	"parentId": "1918",
	"dateAddedLocal": "6/21/2021, 2:12:25 PM",
	"dateAddedUTC": "2021-06-21T18:12:25.000Z"
},{
	"index": 7,
	"title": "RegexOne - Learn Regular Expressions - Lesson 1: An Introduction, and the ABCs",
	"url": "https://www.regexone.com/",
	"id": 1926,
	"parentId": "1918",
	"dateAddedLocal": "6/21/2021, 2:12:25 PM",
	"dateAddedUTC": "2021-06-21T18:12:25.000Z"
},{
	"index": 8,
	"title": "RegexOne - Learn Regular Expressions - Problem 1: Matching a decimal numbers",
	"url": "https://regexone.com/problem/matching_decimal_numbers",
	"id": 1927,
	"parentId": "1918",
	"dateAddedLocal": "6/21/2021, 2:12:25 PM",
	"dateAddedUTC": "2021-06-21T18:12:25.000Z"
},{
	"index": 9,
	"title": "RegExr: Learn, Build, & Test RegEx",
	"url": "http://regexr.com/",
	"id": 1928,
	"parentId": "1918",
	"dateAddedLocal": "6/21/2021, 2:12:25 PM",
	"dateAddedUTC": "2021-06-21T18:12:25.000Z"
},{
	"index": 10,
	"title": "Regular-Expressions.pdf",
	"url": "https://www.princeton.edu/~mlovett/reference/Regular-Expressions.pdf",
	"id": 1929,
	"parentId": "1918",
	"dateAddedLocal": "6/21/2021, 2:12:25 PM",
	"dateAddedUTC": "2021-06-21T18:12:25.000Z"
},{
	"index": 11,
	"title": "Online regex tester and debugger: PHP, PCRE, Python, Golang and JavaScript",
	"url": "https://regex101.com/account/all",
	"id": 1930,
	"parentId": "1918",
	"dateAddedLocal": "6/21/2021, 2:12:25 PM",
	"dateAddedUTC": "2021-06-21T18:12:25.000Z"
},{
	"index": 12,
	"title": "RegExLib.com Regular Expression Cheat Sheet (.NET Framework)",
	"url": "http://regexlib.com/CheatSheet.aspx",
	"id": 1931,
	"parentId": "1918",
	"dateAddedLocal": "6/21/2021, 2:12:25 PM",
	"dateAddedUTC": "2021-06-21T18:12:25.000Z"
},{
	"index": 13,
	"title": "REGEX",
	"url": "http://rubular.com/",
	"id": 1932,
	"parentId": "1918",
	"dateAddedLocal": "6/21/2021, 2:12:25 PM",
	"dateAddedUTC": "2021-06-21T18:12:25.000Z"
},{
	"index": 14,
	"title": "REGEX intro Regular Expressions - YouTube",
	"url": "https://www.youtube.com/watch?v=-Yy2agBN8EA",
	"id": 1933,
	"parentId": "1918",
	"dateAddedLocal": "6/21/2021, 2:12:25 PM",
	"dateAddedUTC": "2021-06-21T18:12:25.000Z"
},{
	"index": 15,
	"title": "Online regex tester and debugger: PHP, PCRE, Python, Golang and JavaScript",
	"url": "https://regex101.com/",
	"id": 1934,
	"parentId": "1918",
	"dateAddedLocal": "6/21/2021, 2:12:25 PM",
	"dateAddedUTC": "2021-06-21T18:12:25.000Z"
},{
	"index": 150,
	"title": "resp mock",
	"id": 2202,
	"parentId": "871",
	"dateAddedLocal": "6/21/2021, 2:28:37 PM",
	"dateAddedUTC": "2021-06-21T18:28:37.171Z"
},{
	"index": 0,
	"title": "Method stubs - RSpec Mocks - RSpec - Relish",
	"url": "https://relishapp.com/rspec/rspec-mocks/v/2-99/docs/method-stubs",
	"id": 2203,
	"parentId": "2202",
	"dateAddedLocal": "6/21/2021, 2:12:25 PM",
	"dateAddedUTC": "2021-06-21T18:12:25.000Z"
},{
	"index": 1,
	"title": "using expect to stub a call rspec - Google Search",
	"url": "https://www.google.com/search?q=using+expect+to+stub+a+call+rspec&rlz=1C5CHFA_enUS885US885&oq=using+expect+to+stub+a+call+rspec&aqs=chrome..69i57j33i22i29i30.8224j1j15&sourceid=chrome&ie=UTF-8",
	"id": 2204,
	"parentId": "2202",
	"dateAddedLocal": "6/21/2021, 2:12:25 PM",
	"dateAddedUTC": "2021-06-21T18:12:25.000Z"
},{
	"index": 2,
	"title": "ruby on rails - Rspec mocks, can 'expect' also stub a method as a side effect? - Stack Overflow",
	"url": "https://stackoverflow.com/questions/22671719/rspec-mocks-can-expect-also-stub-a-method-as-a-side-effect",
	"id": 2205,
	"parentId": "2202",
	"dateAddedLocal": "6/21/2021, 2:12:25 PM",
	"dateAddedUTC": "2021-06-21T18:12:25.000Z"
},{
	"index": 3,
	"title": "File: README â€” Documentation for rspec-mocks (3.10.2)",
	"url": "https://www.rubydoc.info/gems/rspec-mocks/frames",
	"id": 2206,
	"parentId": "2202",
	"dateAddedLocal": "6/21/2021, 2:12:25 PM",
	"dateAddedUTC": "2021-06-21T18:12:25.000Z"
},{
	"index": 4,
	"title": "How to Use RSpec Mocks (Step-By-Step Tutorial) - RubyGuides",
	"url": "https://www.rubyguides.com/2018/10/rspec-mocks/",
	"id": 2207,
	"parentId": "2202",
	"dateAddedLocal": "6/21/2021, 2:12:25 PM",
	"dateAddedUTC": "2021-06-21T18:12:25.000Z"
},{
	"index": 5,
	"title": "RSpec - Stubs - Tutorialspoint",
	"url": "https://www.tutorialspoint.com/rspec/rspec_stubs.htm",
	"id": 2208,
	"parentId": "2202",
	"dateAddedLocal": "6/21/2021, 2:12:25 PM",
	"dateAddedUTC": "2021-06-21T18:12:25.000Z"
},{
	"index": 6,
	"title": "RSpec: difference between mocks and stubs - Ruby Blog",
	"url": "http://rubyblog.pro/2017/10/rspec-difference-between-mocks-and-stubs",
	"id": 2209,
	"parentId": "2202",
	"dateAddedLocal": "6/21/2021, 2:12:25 PM",
	"dateAddedUTC": "2021-06-21T18:12:25.000Z"
},{
	"index": 7,
	"title": "chrome save all tabs as bookmark folder - Google Search",
	"url": "https://www.google.com/search?q=chrome+save+all+tabs+as+bookmark+folder&rlz=1C5CHFA_enUS885US885&oq=chrome+save+all+tabs+as+bookmark+folder&aqs=chrome..69i57j0i22i30.12152j1j15&sourceid=chrome&ie=UTF-8",
	"id": 2210,
	"parentId": "2202",
	"dateAddedLocal": "6/21/2021, 2:12:25 PM",
	"dateAddedUTC": "2021-06-21T18:12:25.000Z"
},{
	"index": 8,
	"title": "Rails Testing Antipatterns: Fixtures and Factories - Semaphore",
	"url": "https://semaphoreci.com/blog/2014/01/14/rails-testing-antipatterns-fixtures-and-factories.html",
	"id": 2211,
	"parentId": "2202",
	"dateAddedLocal": "6/21/2021, 2:12:25 PM",
	"dateAddedUTC": "2021-06-21T18:12:25.000Z"
},{
	"index": 151,
	"title": "responsive web design",
	"id": 1935,
	"parentId": "871",
	"dateAddedLocal": "6/21/2021, 2:28:37 PM",
	"dateAddedUTC": "2021-06-21T18:28:37.147Z"
},{
	"index": 0,
	"title": "Responsive web design - Wikipedia",
	"url": "https://en.wikipedia.org/wiki/Responsive_web_design",
	"id": 1936,
	"parentId": "1935",
	"dateAddedLocal": "6/21/2021, 2:12:25 PM",
	"dateAddedUTC": "2021-06-21T18:12:25.000Z"
},{
	"index": 152,
	"title": "rspec",
	"id": 1937,
	"parentId": "871",
	"dateAddedLocal": "6/21/2021, 2:28:37 PM",
	"dateAddedUTC": "2021-06-21T18:28:37.147Z"
},{
	"index": 0,
	"title": "Better Specs { rspec guidelines with ruby }",
	"url": "http://betterspecs.org/",
	"id": 1938,
	"parentId": "1937",
	"dateAddedLocal": "6/21/2021, 2:12:25 PM",
	"dateAddedUTC": "2021-06-21T18:12:25.000Z"
},{
	"index": 1,
	"title": "Rails testing on Learn",
	"url": "https://learn.co/tracks/full-stack-web-dev-with-react/rails/validations-and-forms/rails-testing",
	"id": 1939,
	"parentId": "1937",
	"dateAddedLocal": "6/21/2021, 2:12:25 PM",
	"dateAddedUTC": "2021-06-21T18:12:25.000Z"
},{
	"index": 2,
	"title": "RSpec documentation",
	"url": "http://rspec.info/documentation/",
	"id": 1940,
	"parentId": "1937",
	"dateAddedLocal": "6/21/2021, 2:12:25 PM",
	"dateAddedUTC": "2021-06-21T18:12:25.000Z"
},{
	"index": 3,
	"title": "rspec INTRO",
	"url": "http://blog.teamtreehouse.com/an-introduction-to-rspec",
	"id": 1941,
	"parentId": "1937",
	"dateAddedLocal": "6/21/2021, 2:12:25 PM",
	"dateAddedUTC": "2021-06-21T18:12:25.000Z"
},{
	"index": 4,
	"title": "RSpec Testing for Beginners, Part 1",
	"url": "https://code.tutsplus.com/articles/rspec-testing-for-beginners-part-1--cms-26716",
	"id": 1942,
	"parentId": "1937",
	"dateAddedLocal": "6/21/2021, 2:12:25 PM",
	"dateAddedUTC": "2021-06-21T18:12:25.000Z"
},{
	"index": 5,
	"title": "RSPEC-RAILS",
	"url": "http://rspec.info/documentation/3.6/rspec-rails/",
	"id": 1943,
	"parentId": "1937",
	"dateAddedLocal": "6/21/2021, 2:12:25 PM",
	"dateAddedUTC": "2021-06-21T18:12:25.000Z"
},{
	"index": 6,
	"title": "Crash Course Intro to RSpec Â· GitBook",
	"url": "https://www.gitbook.com/book/bintlopez/rspec-wrangling/details",
	"id": 1944,
	"parentId": "1937",
	"dateAddedLocal": "6/21/2021, 2:12:25 PM",
	"dateAddedUTC": "2021-06-21T18:12:25.000Z"
},{
	"index": 7,
	"title": "rspec_cheatsheet_attributed.pdf",
	"url": "https://www.anchor.com.au/wp-content/uploads/rspec_cheatsheet_attributed.pdf",
	"id": 1945,
	"parentId": "1937",
	"dateAddedLocal": "6/21/2021, 2:12:25 PM",
	"dateAddedUTC": "2021-06-21T18:12:25.000Z"
},{
	"index": 8,
	"title": "How to Properly Test a Rails API with Rspec - Sandy Edwards - Medium",
	"url": "https://medium.com/@sedwardscode/how-to-properly-test-a-rails-api-with-rspec-f15cbe1dfd11",
	"id": 1946,
	"parentId": "1937",
	"dateAddedLocal": "6/21/2021, 2:12:25 PM",
	"dateAddedUTC": "2021-06-21T18:12:25.000Z"
},{
	"index": 153,
	"title": "ruby",
	"id": 1947,
	"parentId": "871",
	"dateAddedLocal": "6/21/2021, 2:28:37 PM",
	"dateAddedUTC": "2021-06-21T18:28:37.148Z"
},{
	"index": 0,
	"title": "A Quick (and Hopefully Painless) Ride Through Ruby (with Cartoon Foxes) :: Why's (Poignant) Guide to Ruby",
	"url": "http://poignant.guide/book/chapter-3.html",
	"id": 1948,
	"parentId": "1947",
	"dateAddedLocal": "6/21/2021, 2:12:25 PM",
	"dateAddedUTC": "2021-06-21T18:12:25.000Z"
},{
	"index": 1,
	"title": "A Ruby HOWTO: Writing A Method That Uses Code Blocks | Archives | codablog | Coda Hale",
	"url": "http://blog.codahale.com/2005/11/24/a-ruby-howto-writing-a-method-that-uses-code-blocks/",
	"id": 1949,
	"parentId": "1947",
	"dateAddedLocal": "6/21/2021, 2:12:25 PM",
	"dateAddedUTC": "2021-06-21T18:12:25.000Z"
},{
	"index": 2,
	"title": "A Wealth Of Ruby Loops And Iterators",
	"url": "http://www.skorks.com/2009/09/a-wealth-of-ruby-loops-and-iterators/",
	"id": 1950,
	"parentId": "1947",
	"dateAddedLocal": "6/21/2021, 2:12:25 PM",
	"dateAddedUTC": "2021-06-21T18:12:25.000Z"
},{
	"index": 3,
	"title": "All About Ruby | Ruby newbie view on the web development using Ruby on Rails",
	"url": "https://allaboutruby.wordpress.com/",
	"id": 1951,
	"parentId": "1947",
	"dateAddedLocal": "6/21/2021, 2:12:25 PM",
	"dateAddedUTC": "2021-06-21T18:12:25.000Z"
},{
	"index": 4,
	"title": "Block Parameters and Yielding",
	"url": "http://ruby.about.com/od/beginningruby/a/Block-Parameters-And-Yielding.htm",
	"id": 1952,
	"parentId": "1947",
	"dateAddedLocal": "6/21/2021, 2:12:25 PM",
	"dateAddedUTC": "2021-06-21T18:12:25.000Z"
},{
	"index": 5,
	"title": "Class and Instance Methods in Ruby // RailsTips by John Nunemaker",
	"url": "http://www.railstips.org/blog/archives/2009/05/11/class-and-instance-methods-in-ruby/",
	"id": 1953,
	"parentId": "1947",
	"dateAddedLocal": "6/21/2021, 2:12:25 PM",
	"dateAddedUTC": "2021-06-21T18:12:25.000Z"
},{
	"index": 6,
	"title": "Class: String (Ruby 2.2.0)",
	"url": "http://ruby-doc.org/core-2.2.0/String.html",
	"id": 1954,
	"parentId": "1947",
	"dateAddedLocal": "6/21/2021, 2:12:25 PM",
	"dateAddedUTC": "2021-06-21T18:12:25.000Z"
},{
	"index": 7,
	"title": "How to Create and Use Hashes in Ruby",
	"url": "http://ruby.about.com/od/rubyfeatures/a/hashes.htm",
	"id": 1955,
	"parentId": "1947",
	"dateAddedLocal": "6/21/2021, 2:12:25 PM",
	"dateAddedUTC": "2021-06-21T18:12:25.000Z"
},{
	"index": 8,
	"title": "Learn the Ruby Programming Language",
	"url": "http://ruby.about.com/",
	"id": 1956,
	"parentId": "1947",
	"dateAddedLocal": "6/21/2021, 2:12:25 PM",
	"dateAddedUTC": "2021-06-21T18:12:25.000Z"
},{
	"index": 9,
	"title": "Loops & Iterators | Codecademy",
	"url": "https://www.codecademy.com/en/courses/ruby-beginner-en-XYcN1/2/4?curriculum_id=5059f8619189a5000201fbcb",
	"id": 1957,
	"parentId": "1947",
	"dateAddedLocal": "6/21/2021, 2:12:25 PM",
	"dateAddedUTC": "2021-06-21T18:12:25.000Z"
},{
	"index": 10,
	"title": "Recent Tips - Reactive.TIPS - The Official Blog of Reactive.IO",
	"url": "http://www.reactive.io/tips/",
	"id": 1958,
	"parentId": "1947",
	"dateAddedLocal": "6/21/2021, 2:12:25 PM",
	"dateAddedUTC": "2021-06-21T18:12:25.000Z"
},{
	"index": 11,
	"title": "Ruby arrays - Zet Code",
	"url": "http://zetcode.com/lang/rubytutorial/arrays/",
	"id": 1959,
	"parentId": "1947",
	"dateAddedLocal": "6/21/2021, 2:12:25 PM",
	"dateAddedUTC": "2021-06-21T18:12:25.000Z"
},{
	"index": 12,
	"title": "Ruby Blocks 101 | All About Ruby",
	"url": "https://allaboutruby.wordpress.com/2006/01/20/ruby-blocks-101/",
	"id": 1960,
	"parentId": "1947",
	"dateAddedLocal": "6/21/2021, 2:12:25 PM",
	"dateAddedUTC": "2021-06-21T18:12:25.000Z"
},{
	"index": 13,
	"title": "Ruby Errors",
	"url": "http://ruby-doc.org/core-2.2.0/Exception.html",
	"id": 1961,
	"parentId": "1947",
	"dateAddedLocal": "6/21/2021, 2:12:25 PM",
	"dateAddedUTC": "2021-06-21T18:12:25.000Z"
},{
	"index": 14,
	"title": "Ruby Global variables",
	"url": "http://www.rubyist.net/~slagell/ruby/globalvars.html",
	"id": 1962,
	"parentId": "1947",
	"dateAddedLocal": "6/21/2021, 2:12:25 PM",
	"dateAddedUTC": "2021-06-21T18:12:25.000Z"
},{
	"index": 15,
	"title": "Ruby Programming/Syntax/Variables and Constants - Wikibooks, open books for an open world",
	"url": "https://en.wikibooks.org/wiki/Ruby_Programming/Syntax/Variables_and_Constants",
	"id": 1963,
	"parentId": "1947",
	"dateAddedLocal": "6/21/2021, 2:12:25 PM",
	"dateAddedUTC": "2021-06-21T18:12:25.000Z"
},{
	"index": 16,
	"title": "Ruby Syntax",
	"url": "http://ruby-doc.org/docs/ruby-doc-bundle/Manual/man-1.4/syntax.html",
	"id": 1964,
	"parentId": "1947",
	"dateAddedLocal": "6/21/2021, 2:12:25 PM",
	"dateAddedUTC": "2021-06-21T18:12:25.000Z"
},{
	"index": 17,
	"title": "Ruby variables",
	"url": "http://zetcode.com/lang/rubytutorial/variables/",
	"id": 1965,
	"parentId": "1947",
	"dateAddedLocal": "6/21/2021, 2:12:25 PM",
	"dateAddedUTC": "2021-06-21T18:12:25.000Z"
},{
	"index": 18,
	"title": "Ruby-doc.org",
	"url": "http://ruby-doc.org/",
	"id": 1966,
	"parentId": "1947",
	"dateAddedLocal": "6/21/2021, 2:12:25 PM",
	"dateAddedUTC": "2021-06-21T18:12:25.000Z"
},{
	"index": 19,
	"title": "RubyDoc",
	"url": "http://docs.ruby-lang.org/en/2.0.0/index.html",
	"id": 1967,
	"parentId": "1947",
	"dateAddedLocal": "6/21/2021, 2:12:25 PM",
	"dateAddedUTC": "2021-06-21T18:12:25.000Z"
},{
	"index": 20,
	"title": "RubyMonk - Ruby Primer - String Basics",
	"url": "https://rubymonk.com/learning/books/1-ruby-primer/chapters/5-strings/lessons/31-string-basics",
	"id": 1968,
	"parentId": "1947",
	"dateAddedLocal": "6/21/2021, 2:12:25 PM",
	"dateAddedUTC": "2021-06-21T18:12:25.000Z"
},{
	"index": 21,
	"title": "Understanding Ruby Blocks, Procs and Lambdas - Reactive.TIPS - The Official Blog of Reactive.IO",
	"url": "http://www.reactive.io/tips/2008/12/21/understanding-ruby-blocks-procs-and-lambdas/",
	"id": 1969,
	"parentId": "1947",
	"dateAddedLocal": "6/21/2021, 2:12:25 PM",
	"dateAddedUTC": "2021-06-21T18:12:25.000Z"
},{
	"index": 22,
	"title": "Variables and Assignment - Learn to Program",
	"url": "https://pine.fm/LearnToProgram/chap_03.html",
	"id": 1970,
	"parentId": "1947",
	"dateAddedLocal": "6/21/2021, 2:12:25 PM",
	"dateAddedUTC": "2021-06-21T18:12:25.000Z"
},{
	"index": 23,
	"title": "Tender Lovemaking | tenderlovemaking.com",
	"url": "http://tenderlovemaking.com/",
	"id": 1971,
	"parentId": "1947",
	"dateAddedLocal": "6/21/2021, 2:12:25 PM",
	"dateAddedUTC": "2021-06-21T18:12:25.000Z"
},{
	"index": 24,
	"title": "RVM: Ruby Version Manager - RVM Ruby Version Manager - Documentation",
	"url": "https://rvm.io/",
	"id": 1972,
	"parentId": "1947",
	"dateAddedLocal": "6/21/2021, 2:12:25 PM",
	"dateAddedUTC": "2021-06-21T18:12:25.000Z"
},{
	"index": 25,
	"title": "File input/output | The Bastards Book of Ruby",
	"url": "http://ruby.bastardsbook.com/chapters/io/",
	"id": 1973,
	"parentId": "1947",
	"dateAddedLocal": "6/21/2021, 2:12:25 PM",
	"dateAddedUTC": "2021-06-21T18:12:25.000Z"
},{
	"index": 26,
	"title": "strftime (DateTime) - APIdock",
	"url": "https://apidock.com/ruby/DateTime/strftime",
	"id": 1974,
	"parentId": "1947",
	"dateAddedLocal": "6/21/2021, 2:12:25 PM",
	"dateAddedUTC": "2021-06-21T18:12:25.000Z"
},{
	"index": 27,
	"title": "Ruby Blocks, Procs & Lambdas - The Ultimate Guide!",
	"url": "https://www.rubyguides.com/2016/02/ruby-procs-and-lambdas/",
	"id": 1975,
	"parentId": "1947",
	"dateAddedLocal": "6/21/2021, 2:12:25 PM",
	"dateAddedUTC": "2021-06-21T18:12:25.000Z"
},{
	"index": 154,
	"title": "sandbox",
	"id": 1976,
	"parentId": "871",
	"dateAddedLocal": "6/21/2021, 2:28:37 PM",
	"dateAddedUTC": "2021-06-21T18:28:37.150Z"
},{
	"index": 0,
	"title": "Plunker",
	"url": "http://plnkr.co/",
	"id": 1977,
	"parentId": "1976",
	"dateAddedLocal": "6/21/2021, 2:12:25 PM",
	"dateAddedUTC": "2021-06-21T18:12:25.000Z"
},{
	"index": 1,
	"title": "JS Bin",
	"url": "https://jsbin.com/?html,js,output",
	"id": 1978,
	"parentId": "1976",
	"dateAddedLocal": "6/21/2021, 2:12:25 PM",
	"dateAddedUTC": "2021-06-21T18:12:25.000Z"
},{
	"index": 155,
	"title": "scraping",
	"id": 1979,
	"parentId": "871",
	"dateAddedLocal": "6/21/2021, 2:28:37 PM",
	"dateAddedUTC": "2021-06-21T18:28:37.150Z"
},{
	"index": 0,
	"title": "Examples | Watir.com",
	"url": "https://watir.com/examples/",
	"id": 1980,
	"parentId": "1979",
	"dateAddedLocal": "6/21/2021, 2:12:25 PM",
	"dateAddedUTC": "2021-06-21T18:12:25.000Z"
},{
	"index": 1,
	"title": "Installing Nokogiri - Nokogiri é‹¸",
	"url": "http://www.nokogiri.org/tutorials/installing_nokogiri.html",
	"id": 1981,
	"parentId": "1979",
	"dateAddedLocal": "6/21/2021, 2:12:25 PM",
	"dateAddedUTC": "2021-06-21T18:12:25.000Z"
},{
	"index": 2,
	"title": "Nokogiri",
	"url": "http://ruby.bastardsbook.com/chapters/html-parsing/",
	"id": 1982,
	"parentId": "1979",
	"dateAddedLocal": "6/21/2021, 2:12:25 PM",
	"dateAddedUTC": "2021-06-21T18:12:25.000Z"
},{
	"index": 3,
	"title": "Sparkle Motion",
	"url": "https://github.com/sparklemotion",
	"id": 1983,
	"parentId": "1979",
	"dateAddedLocal": "6/21/2021, 2:12:25 PM",
	"dateAddedUTC": "2021-06-21T18:12:25.000Z"
},{
	"index": 4,
	"title": "The Ultimate Introduction to Web Scraping and Browser Automation - YouTube",
	"url": "https://www.youtube.com/watch?v=1UYBAn69Qrk&t=314s",
	"id": 1984,
	"parentId": "1979",
	"dateAddedLocal": "6/21/2021, 2:12:25 PM",
	"dateAddedUTC": "2021-06-21T18:12:25.000Z"
},{
	"index": 156,
	"title": "scribd",
	"id": 1985,
	"parentId": "871",
	"dateAddedLocal": "6/21/2021, 2:28:37 PM",
	"dateAddedUTC": "2021-06-21T18:28:37.151Z"
},{
	"index": 0,
	"title": "d1.scribdassets.com/ScribdViewer.swf?document_id=*********&access_key=key-*********",
	"url": "http://d1.scribdassets.com/ScribdViewer.swf?document_id=*********&access_key=key-*********",
	"id": 1986,
	"parentId": "1985",
	"dateAddedLocal": "6/21/2021, 2:12:25 PM",
	"dateAddedUTC": "2021-06-21T18:12:25.000Z"
},{
	"index": 157,
	"title": "search",
	"id": 1987,
	"parentId": "871",
	"dateAddedLocal": "6/21/2021, 2:28:37 PM",
	"dateAddedUTC": "2021-06-21T18:28:37.151Z"
},{
	"index": 0,
	"title": "Ryan McMahonâ€™s Blog Posts about rails",
	"url": "http://www.rymcmahon.com/categories/1",
	"id": 1988,
	"parentId": "1987",
	"dateAddedLocal": "6/21/2021, 2:12:25 PM",
	"dateAddedUTC": "2021-06-21T18:12:25.000Z"
},{
	"index": 1,
	"title": "Tutorial - Creating a Custom Google In-site Search for Rails - Ruby Forum",
	"url": "https://www.ruby-forum.com/topic/201324",
	"id": 1989,
	"parentId": "1987",
	"dateAddedLocal": "6/21/2021, 2:12:25 PM",
	"dateAddedUTC": "2021-06-21T18:12:25.000Z"
},{
	"index": 158,
	"title": "seed",
	"id": 1990,
	"parentId": "871",
	"dateAddedLocal": "6/21/2021, 2:28:37 PM",
	"dateAddedUTC": "2021-06-21T18:28:37.151Z"
},{
	"index": 0,
	"title": "Seeding a Rails database with a CSV file",
	"url": "https://gist.github.com/arjunvenkat/1115bc41bf395a162084",
	"id": 1991,
	"parentId": "1990",
	"dateAddedLocal": "6/21/2021, 2:12:25 PM",
	"dateAddedUTC": "2021-06-21T18:12:25.000Z"
},{
	"index": 159,
	"title": "seo",
	"id": 1992,
	"parentId": "871",
	"dateAddedLocal": "6/21/2021, 2:28:37 PM",
	"dateAddedUTC": "2021-06-21T18:28:37.152Z"
},{
	"index": 0,
	"title": "My (Insanely Large) List of SEO Tools & Other Useful Resources - Portent",
	"url": "https://www.portent.com/blog/seo/insanely-large-list-seo-tools-useful-resources.htm",
	"id": 1993,
	"parentId": "1992",
	"dateAddedLocal": "6/21/2021, 2:12:25 PM",
	"dateAddedUTC": "2021-06-21T18:12:25.000Z"
},{
	"index": 1,
	"title": "SEO Audit",
	"url": "https://www.youtube.com/watch?v=4EcSaLWeDBo&t=2025s",
	"id": 1994,
	"parentId": "1992",
	"dateAddedLocal": "6/21/2021, 2:12:25 PM",
	"dateAddedUTC": "2021-06-21T18:12:25.000Z"
},{
	"index": 160,
	"title": "sequelize",
	"id": 1995,
	"parentId": "871",
	"dateAddedLocal": "6/21/2021, 2:28:37 PM",
	"dateAddedUTC": "2021-06-21T18:28:37.152Z"
},{
	"index": 0,
	"title": "Reference | Sequelize",
	"url": "https://sequelize.org/master/identifiers",
	"id": 1996,
	"parentId": "1995",
	"dateAddedLocal": "6/21/2021, 2:12:25 PM",
	"dateAddedUTC": "2021-06-21T18:12:25.000Z"
},{
	"index": 161,
	"title": "shell",
	"id": 1997,
	"parentId": "871",
	"dateAddedLocal": "6/21/2021, 2:28:37 PM",
	"dateAddedUTC": "2021-06-21T18:28:37.153Z"
},{
	"index": 0,
	"title": "Moving to zsh â€“ Scripting OS X",
	"url": "https://scriptingosx.com/2019/06/moving-to-zsh/",
	"id": 1998,
	"parentId": "1997",
	"dateAddedLocal": "6/21/2021, 2:12:25 PM",
	"dateAddedUTC": "2021-06-21T18:12:25.000Z"
},{
	"index": 162,
	"title": "sidekiq",
	"id": 1999,
	"parentId": "871",
	"dateAddedLocal": "6/21/2021, 2:28:37 PM",
	"dateAddedUTC": "2021-06-21T18:28:37.153Z"
},{
	"index": 0,
	"title": "Learn - Paperclip",
	"url": "https://learn.co/tracks/full-stack-web-development-v3/rails-and-javascript/workers/sidekiq",
	"id": 2000,
	"parentId": "1999",
	"dateAddedLocal": "6/21/2021, 2:12:25 PM",
	"dateAddedUTC": "2021-06-21T18:12:25.000Z"
},{
	"index": 163,
	"title": "sinatra",
	"id": 2001,
	"parentId": "871",
	"dateAddedLocal": "6/21/2021, 2:28:37 PM",
	"dateAddedUTC": "2021-06-21T18:28:37.153Z"
},{
	"index": 0,
	"title": "Active Record Associations â€” Ruby on Rails Guides",
	"url": "http://guides.rubyonrails.org/association_basics.html",
	"id": 2002,
	"parentId": "2001",
	"dateAddedLocal": "6/21/2021, 2:12:25 PM",
	"dateAddedUTC": "2021-06-21T18:12:25.000Z"
},{
	"index": 1,
	"title": "ActiveModel::SecurePassword::ClassMethods",
	"url": "http://api.rubyonrails.org/classes/ActiveModel/SecurePassword/ClassMethods.html#method-i-has_secure_password",
	"id": 2003,
	"parentId": "2001",
	"dateAddedLocal": "6/21/2021, 2:12:25 PM",
	"dateAddedUTC": "2021-06-21T18:12:25.000Z"
},{
	"index": 2,
	"title": "BCRYPT",
	"url": "https://github.com/codahale/bcrypt-ruby",
	"id": 2004,
	"parentId": "2001",
	"dateAddedLocal": "6/21/2021, 2:12:25 PM",
	"dateAddedUTC": "2021-06-21T18:12:25.000Z"
},{
	"index": 3,
	"title": "Blake Mizerany: How do I learn and master Sinatra? // RubyLearning Blog",
	"url": "http://rubylearning.com/blog/2009/08/11/blake-mizerany-how-do-i-learn-and-master-sinatra/",
	"id": 2005,
	"parentId": "2001",
	"dateAddedLocal": "6/21/2021, 2:12:25 PM",
	"dateAddedUTC": "2021-06-21T18:12:25.000Z"
},{
	"index": 4,
	"title": "ERB: An Introduction to ERB Templating | StuartEllis.eu",
	"url": "http://www.stuartellis.eu/articles/erb/",
	"id": 2006,
	"parentId": "2001",
	"dateAddedLocal": "6/21/2021, 2:12:25 PM",
	"dateAddedUTC": "2021-06-21T18:12:25.000Z"
},{
	"index": 5,
	"title": "has_secure_password",
	"url": "http://api.rubyonrails.org/classes/ActiveModel/SecurePassword/ClassMethods.html",
	"id": 2007,
	"parentId": "2001",
	"dateAddedLocal": "6/21/2021, 2:12:25 PM",
	"dateAddedUTC": "2021-06-21T18:12:25.000Z"
},{
	"index": 6,
	"title": "rtomayko/sinatra-sequel: Sinatra extension that adds Sequel ORM features, database config, and database migrations",
	"url": "https://github.com/rtomayko/sinatra-sequel/tree/master",
	"id": 2008,
	"parentId": "2001",
	"dateAddedLocal": "6/21/2021, 2:12:25 PM",
	"dateAddedUTC": "2021-06-21T18:12:25.000Z"
},{
	"index": 7,
	"title": "Sinatra Book",
	"url": "http://sinatra-org-book.herokuapp.com/",
	"id": 2009,
	"parentId": "2001",
	"dateAddedLocal": "6/21/2021, 2:12:25 PM",
	"dateAddedUTC": "2021-06-21T18:12:25.000Z"
},{
	"index": 8,
	"title": "Sinatra Flash",
	"url": "http://www.sitepoint.com/sinatra-flash/",
	"id": 2010,
	"parentId": "2001",
	"dateAddedLocal": "6/21/2021, 2:12:25 PM",
	"dateAddedUTC": "2021-06-21T18:12:25.000Z"
},{
	"index": 9,
	"title": "Sinatra: README",
	"url": "http://www.sinatrarb.com/intro.html",
	"id": 2011,
	"parentId": "2001",
	"dateAddedLocal": "6/21/2021, 2:12:25 PM",
	"dateAddedUTC": "2021-06-21T18:12:25.000Z"
},{
	"index": 164,
	"title": "sinon",
	"id": 2012,
	"parentId": "871",
	"dateAddedLocal": "6/21/2021, 2:28:37 PM",
	"dateAddedUTC": "2021-06-21T18:28:37.154Z"
},{
	"index": 0,
	"title": "Best Practices for Spies, Stubs and Mocks in Sinon.js - Semaphore",
	"url": "https://semaphoreci.com/community/tutorials/best-practices-for-spies-stubs-and-mocks-in-sinon-js",
	"id": 2013,
	"parentId": "2012",
	"dateAddedLocal": "6/21/2021, 2:12:25 PM",
	"dateAddedUTC": "2021-06-21T18:12:25.000Z"
},{
	"index": 1,
	"title": "Sinon Tutorial: JavaScript Testing with Mocks, Spies & Stubs â€” SitePoint",
	"url": "https://www.sitepoint.com/sinon-tutorial-javascript-testing-mocks-spies-stubs/",
	"id": 2014,
	"parentId": "2012",
	"dateAddedLocal": "6/21/2021, 2:12:25 PM",
	"dateAddedUTC": "2021-06-21T18:12:25.000Z"
},{
	"index": 2,
	"title": "Sinon.JS",
	"url": "http://sinonjs.org/releases/index.html",
	"id": 2015,
	"parentId": "2012",
	"dateAddedLocal": "6/21/2021, 2:12:25 PM",
	"dateAddedUTC": "2021-06-21T18:12:25.000Z"
},{
	"index": 165,
	"title": "sql-ms_sqlserver",
	"id": 2016,
	"parentId": "871",
	"dateAddedLocal": "6/21/2021, 2:28:37 PM",
	"dateAddedUTC": "2021-06-21T18:28:37.154Z"
},{
	"index": 0,
	"title": "Configure the Windows Firewall to Allow SQL Server Access | Microsoft Docs",
	"url": "https://docs.microsoft.com/en-us/sql/sql-server/install/configure-the-windows-firewall-to-allow-sql-server-access",
	"id": 2017,
	"parentId": "2016",
	"dateAddedLocal": "6/21/2021, 2:12:25 PM",
	"dateAddedUTC": "2021-06-21T18:12:25.000Z"
},{
	"index": 166,
	"title": "sql-server",
	"id": 2018,
	"parentId": "871",
	"dateAddedLocal": "6/21/2021, 2:28:37 PM",
	"dateAddedUTC": "2021-06-21T18:28:37.154Z"
},{
	"index": 0,
	"title": "Notes on Setting Up PostgreSQL Â· codeforboston/cambridge_energy_app Wiki",
	"url": "https://github.com/codeforboston/cambridge_energy_app/wiki/Notes-on-Setting-Up-PostgreSQL",
	"id": 2019,
	"parentId": "2018",
	"dateAddedLocal": "6/21/2021, 2:12:25 PM",
	"dateAddedUTC": "2021-06-21T18:12:25.000Z"
},{
	"index": 167,
	"title": "sql-sqllite3",
	"id": 2020,
	"parentId": "871",
	"dateAddedLocal": "6/21/2021, 2:28:37 PM",
	"dateAddedUTC": "2021-06-21T18:28:37.154Z"
},{
	"index": 0,
	"title": "Datatypes In SQLite Version 3",
	"url": "http://www.sqlite.org/datatype3.html",
	"id": 2021,
	"parentId": "2020",
	"dateAddedLocal": "6/21/2021, 2:12:25 PM",
	"dateAddedUTC": "2021-06-21T18:12:25.000Z"
},{
	"index": 1,
	"title": "Homebrew â€” The missing package manager for OS X",
	"url": "http://brew.sh/",
	"id": 2022,
	"parentId": "2020",
	"dateAddedLocal": "6/21/2021, 2:12:25 PM",
	"dateAddedUTC": "2021-06-21T18:12:25.000Z"
},{
	"index": 2,
	"title": "In-Memory Databases",
	"url": "https://www.sqlite.org/inmemorydb.html",
	"id": 2023,
	"parentId": "2020",
	"dateAddedLocal": "6/21/2021, 2:12:25 PM",
	"dateAddedUTC": "2021-06-21T18:12:25.000Z"
},{
	"index": 3,
	"title": "Justified Nav Template for Bootstrap",
	"url": "file:///Users/BradSmith/Development/dev/smithpiano/index.html#",
	"id": 2024,
	"parentId": "2020",
	"dateAddedLocal": "6/21/2021, 2:12:25 PM",
	"dateAddedUTC": "2021-06-21T18:12:25.000Z"
},{
	"index": 4,
	"title": "Settings",
	"url": "chrome://settings/",
	"id": 2025,
	"parentId": "2020",
	"dateAddedLocal": "6/21/2021, 2:12:25 PM",
	"dateAddedUTC": "2021-06-21T18:12:25.000Z"
},{
	"index": 5,
	"title": "SQL Aggregate Functions",
	"url": "http://www.sqlclauses.com/sql+aggregate+functions",
	"id": 2026,
	"parentId": "2020",
	"dateAddedLocal": "6/21/2021, 2:12:25 PM",
	"dateAddedUTC": "2021-06-21T18:12:25.000Z"
},{
	"index": 6,
	"title": "SQL Joins - visual",
	"url": "http://blog.codinghorror.com/a-visual-explanation-of-sql-joins/",
	"id": 2027,
	"parentId": "2020",
	"dateAddedLocal": "6/21/2021, 2:12:25 PM",
	"dateAddedUTC": "2021-06-21T18:12:25.000Z"
},{
	"index": 7,
	"title": "SQLite Documentation",
	"url": "http://www.sqlite.org/docs.html",
	"id": 2028,
	"parentId": "2020",
	"dateAddedLocal": "6/21/2021, 2:12:25 PM",
	"dateAddedUTC": "2021-06-21T18:12:25.000Z"
},{
	"index": 8,
	"title": "SQLite Query Language: ALTER TABLE",
	"url": "https://www.sqlite.org/lang_altertable.html",
	"id": 2029,
	"parentId": "2020",
	"dateAddedLocal": "6/21/2021, 2:12:25 PM",
	"dateAddedUTC": "2021-06-21T18:12:25.000Z"
},{
	"index": 9,
	"title": "SQLite Query Language: SELECT",
	"url": "https://www.sqlite.org/lang_select.html#resultset",
	"id": 2030,
	"parentId": "2020",
	"dateAddedLocal": "6/21/2021, 2:12:25 PM",
	"dateAddedUTC": "2021-06-21T18:12:25.000Z"
},{
	"index": 10,
	"title": "SQLite tutorial",
	"url": "http://zetcode.com/db/sqlite/",
	"id": 2031,
	"parentId": "2020",
	"dateAddedLocal": "6/21/2021, 2:12:25 PM",
	"dateAddedUTC": "2021-06-21T18:12:25.000Z"
},{
	"index": 11,
	"title": "sqlite3 doc on github",
	"url": "https://github.com/sparklemotion/sqlite3-ruby",
	"id": 2032,
	"parentId": "2020",
	"dateAddedLocal": "6/21/2021, 2:12:25 PM",
	"dateAddedUTC": "2021-06-21T18:12:25.000Z"
},{
	"index": 12,
	"title": "The SELECT statement in SQLite",
	"url": "http://zetcode.com/db/sqlite/select/",
	"id": 2033,
	"parentId": "2020",
	"dateAddedLocal": "6/21/2021, 2:12:25 PM",
	"dateAddedUTC": "2021-06-21T18:12:25.000Z"
},{
	"index": 13,
	"title": "Docstring multi-line",
	"url": "https://www.commandercoriander.net/blog/2014/11/09/a-multiline-string-cheatsheet-for-ruby/",
	"id": 2034,
	"parentId": "2020",
	"dateAddedLocal": "6/21/2021, 2:12:25 PM",
	"dateAddedUTC": "2021-06-21T18:12:25.000Z"
},{
	"index": 168,
	"title": "style",
	"id": 2035,
	"parentId": "871",
	"dateAddedLocal": "6/21/2021, 2:28:37 PM",
	"dateAddedUTC": "2021-06-21T18:28:37.155Z"
},{
	"index": 0,
	"title": "Popper.js",
	"url": "https://popper.js.org/",
	"id": 2036,
	"parentId": "2035",
	"dateAddedLocal": "6/21/2021, 2:12:25 PM",
	"dateAddedUTC": "2021-06-21T18:12:25.000Z"
},{
	"index": 169,
	"title": "surge",
	"id": 2037,
	"parentId": "871",
	"dateAddedLocal": "6/21/2021, 2:28:37 PM",
	"dateAddedUTC": "2021-06-21T18:28:37.155Z"
},{
	"index": 0,
	"title": "Surge VS GitHub Pages: How to deploy a create-react-app project",
	"url": "https://medium.freecodecamp.org/surge-vs-github-pages-deploying-a-create-react-app-project-c0ecbf317089",
	"id": 2038,
	"parentId": "2037",
	"dateAddedLocal": "6/21/2021, 2:12:25 PM",
	"dateAddedUTC": "2021-06-21T18:12:25.000Z"
},{
	"index": 1,
	"title": "Surge",
	"url": "https://surge.sh/",
	"id": 2039,
	"parentId": "2037",
	"dateAddedLocal": "6/21/2021, 2:12:25 PM",
	"dateAddedUTC": "2021-06-21T18:12:25.000Z"
},{
	"index": 170,
	"title": "swagger",
	"id": 2040,
	"parentId": "871",
	"dateAddedLocal": "6/21/2021, 2:28:37 PM",
	"dateAddedUTC": "2021-06-21T18:28:37.156Z"
},{
	"index": 0,
	"title": "Build, Collaborate & Integrate APIs | SwaggerHub",
	"url": "https://app.swaggerhub.com/home",
	"id": 2041,
	"parentId": "2040",
	"dateAddedLocal": "6/21/2021, 2:12:25 PM",
	"dateAddedUTC": "2021-06-21T18:12:25.000Z"
},{
	"index": 171,
	"title": "tags",
	"id": 2042,
	"parentId": "871",
	"dateAddedLocal": "6/21/2021, 2:28:37 PM",
	"dateAddedUTC": "2021-06-21T18:28:37.156Z"
},{
	"index": 0,
	"title": "#382 Tagging - RailsCasts",
	"url": "http://railscasts.com/episodes/382-tagging?autoplay=true",
	"id": 2043,
	"parentId": "2042",
	"dateAddedLocal": "6/21/2021, 2:12:25 PM",
	"dateAddedUTC": "2021-06-21T18:12:25.000Z"
},{
	"index": 1,
	"title": "mbleigh/acts-as-taggable-on: A tagging plugin for Rails applications that allows for custom tagging along dynamic contexts.",
	"url": "https://github.com/mbleigh/acts-as-taggable-on",
	"id": 2044,
	"parentId": "2042",
	"dateAddedLocal": "6/21/2021, 2:12:25 PM",
	"dateAddedUTC": "2021-06-21T18:12:25.000Z"
},{
	"index": 2,
	"title": "mbleigh/acts-as-taggable-on: A tagging plugin for Rails applications that allows for custom tagging along dynamic contexts.",
	"url": "https://github.com/mbleigh/acts-as-taggable-on/",
	"id": 2045,
	"parentId": "2042",
	"dateAddedLocal": "6/21/2021, 2:12:25 PM",
	"dateAddedUTC": "2021-06-21T18:12:25.000Z"
},{
	"index": 172,
	"title": "task managers",
	"id": 2046,
	"parentId": "871",
	"dateAddedLocal": "6/21/2021, 2:28:37 PM",
	"dateAddedUTC": "2021-06-21T18:28:37.156Z"
},{
	"index": 0,
	"title": "Trello",
	"url": "https://trello.com/?aceid=&adposition=1t1&adgroup=45883604321&campaign=817711909&creative=230348617886&device=c&keyword=trello&matchtype=e&network=g&placement=&ds_kids=p20478354863&gclid=EAIaIQobChMIhouOnbbN2AIVCbnACh3imwSYEAAYASAAEgJwVPD_BwE&gclsrc=aw.ds",
	"id": 2047,
	"parentId": "2046",
	"dateAddedLocal": "6/21/2021, 2:12:25 PM",
	"dateAddedUTC": "2021-06-21T18:12:25.000Z"
},{
	"index": 1,
	"title": "Wunderlist | To-do list, Reminders, Errands - App of the Year!",
	"url": "https://www.wunderlist.com/",
	"id": 2048,
	"parentId": "2046",
	"dateAddedLocal": "6/21/2021, 2:12:25 PM",
	"dateAddedUTC": "2021-06-21T18:12:25.000Z"
},{
	"index": 2,
	"title": "Bear - Notes for iPhone, iPad and Mac",
	"url": "http://www.bear-writer.com/",
	"id": 2049,
	"parentId": "2046",
	"dateAddedLocal": "6/21/2021, 2:12:25 PM",
	"dateAddedUTC": "2021-06-21T18:12:25.000Z"
},{
	"index": 3,
	"title": "Â· Asana",
	"url": "https://asana.com/uses/task-management?pkw=%2Btask%20%2Bmanager&pmt=b&pdv=c&utm_campaign=usa-task&utm_source=google&utm_medium=pd_cpc_nb&utm_term=%2Btask%20%2Bmanager&gclid=EAIaIQobChMIl8CIpLbN2AIVEJ7ACh0Q7QO2EAAYASAAEgJrE_D_BwE",
	"id": 2050,
	"parentId": "2046",
	"dateAddedLocal": "6/21/2021, 2:12:25 PM",
	"dateAddedUTC": "2021-06-21T18:12:25.000Z"
},{
	"index": 173,
	"title": "testing",
	"id": 2590,
	"parentId": "871",
	"dateAddedLocal": "10/28/2023, 9:33:49 AM",
	"dateAddedUTC": "2023-10-28T13:33:49.220Z"
},{
	"index": 0,
	"title": "What Is the Difference Between Jest and Enzyme?",
	"url": "https://www.testim.io/blog/what-is-the-difference-between-jest-and-enzyme/",
	"id": 2589,
	"parentId": "2590",
	"dateAddedLocal": "10/28/2023, 9:33:12 AM",
	"dateAddedUTC": "2023-10-28T13:33:12.015Z"
},{
	"index": 1,
	"title": "Testing React with Jest and Enzyme I | by Dominic Fraser | CodeClan | Medium",
	"url": "https://medium.com/codeclan/testing-react-with-jest-and-enzyme-20505fec4675",
	"id": 2591,
	"parentId": "2590",
	"dateAddedLocal": "10/28/2023, 9:34:28 AM",
	"dateAddedUTC": "2023-10-28T13:34:28.974Z"
},{
	"index": 2,
	"title": "How to Update Node and NPM to the Latest Version",
	"url": "https://www.freecodecamp.org/news/how-to-update-node-and-npm-to-the-latest-version/",
	"id": 2592,
	"parentId": "2590",
	"dateAddedLocal": "10/28/2023, 9:40:00 AM",
	"dateAddedUTC": "2023-10-28T13:40:00.048Z"
},{
	"index": 3,
	"title": "reactjs - Does Enzyme support React version 18? - Stack Overflow",
	"url": "https://stackoverflow.com/questions/72029189/does-enzyme-support-react-version-18",
	"id": 2593,
	"parentId": "2590",
	"dateAddedLocal": "10/28/2023, 9:59:35 AM",
	"dateAddedUTC": "2023-10-28T13:59:35.686Z"
},{
	"index": 4,
	"title": "Vitejs - Vite (forked) - StackBlitz",
	"url": "https://stackblitz.com/edit/vitejs-vite-z1zavz?file=index.html&terminal=dev",
	"id": 2594,
	"parentId": "2590",
	"dateAddedLocal": "10/28/2023, 10:44:06 AM",
	"dateAddedUTC": "2023-10-28T14:44:06.570Z"
},{
	"index": 5,
	"title": "Test API Reference | Vitest",
	"url": "https://vitest.dev/api/",
	"id": 2596,
	"parentId": "2590",
	"dateAddedLocal": "10/29/2023, 10:02:39 AM",
	"dateAddedUTC": "2023-10-29T14:02:39.307Z"
},{
	"index": 174,
	"title": "testing",
	"id": 2051,
	"parentId": "871",
	"dateAddedLocal": "6/21/2021, 2:28:37 PM",
	"dateAddedUTC": "2021-06-21T18:28:37.156Z"
},{
	"index": 0,
	"title": "academind/js-testing-practical-guide-code: Course code & materials for our \"JavaScript Unit Testing - The Practical Guide\" course (https://acad.link/testing)",
	"url": "https://github.com/academind/js-testing-practical-guide-code",
	"id": 2611,
	"parentId": "2051",
	"dateAddedLocal": "11/22/2023, 1:22:26 PM",
	"dateAddedUTC": "2023-11-22T18:22:26.715Z"
},{
	"index": 1,
	"title": "Unit Testing and Coding Best Practices for Unit Tests: A Test-Driven Perspective | Toptal",
	"url": "https://www.toptal.com/qa/how-to-write-testable-code-and-why-it-matters",
	"id": 2052,
	"parentId": "2051",
	"dateAddedLocal": "6/21/2021, 2:12:25 PM",
	"dateAddedUTC": "2021-06-21T18:12:25.000Z"
},{
	"index": 2,
	"title": "Rails 4 Test Prescriptions: Build a Healthy Codebase by Noel Rappin | The Pragmatic Bookshelf",
	"url": "https://pragprog.com/book/nrtest2/rails-4-test-prescriptions",
	"id": 2053,
	"parentId": "2051",
	"dateAddedLocal": "6/21/2021, 2:12:25 PM",
	"dateAddedUTC": "2021-06-21T18:12:25.000Z"
},{
	"index": 3,
	"title": "Form Helpers â€” Ruby on Rails Guides",
	"url": "http://edgeguides.rubyonrails.org/form_helpers.html",
	"id": 2054,
	"parentId": "2051",
	"dateAddedLocal": "6/21/2021, 2:12:25 PM",
	"dateAddedUTC": "2021-06-21T18:12:25.000Z"
},{
	"index": 4,
	"title": "Everyday Rails Testing withâ€¦ by Aaron Sumner [PDF/iPad/Kindle]",
	"url": "https://leanpub.com/everydayrailsrspec",
	"id": 2055,
	"parentId": "2051",
	"dateAddedLocal": "6/21/2021, 2:12:25 PM",
	"dateAddedUTC": "2021-06-21T18:12:25.000Z"
},{
	"index": 5,
	"title": "Capybara Intro",
	"url": "https://learn.co/tracks/full-stack-web-dev-with-react/sinatra/forms/intro-to-capybara-tests",
	"id": 2056,
	"parentId": "2051",
	"dateAddedLocal": "6/21/2021, 2:12:25 PM",
	"dateAddedUTC": "2021-06-21T18:12:25.000Z"
},{
	"index": 6,
	"title": "factory_girl/GETTING_STARTED.md at master Â· thoughtbot/factory_girl",
	"url": "https://github.com/thoughtbot/factory_girl/blob/master/GETTING_STARTED.md",
	"id": 2057,
	"parentId": "2051",
	"dateAddedLocal": "6/21/2021, 2:12:25 PM",
	"dateAddedUTC": "2021-06-21T18:12:25.000Z"
},{
	"index": 7,
	"title": "How I learned to test my Rails applications, Part 4: Controller specs | Everyday Rails",
	"url": "https://everydayrails.com/2012/04/07/testing-series-rspec-controllers.html",
	"id": 2058,
	"parentId": "2051",
	"dateAddedLocal": "6/21/2021, 2:12:25 PM",
	"dateAddedUTC": "2021-06-21T18:12:25.000Z"
},{
	"index": 8,
	"title": "VIM regex commands for modifying ruby/rails/rspec syntax - DFCI Informatics Software Engineering - DFCI Wiki Server",
	"url": "https://wiki.dfci.harvard.edu:8443/pages/viewpage.action?pageId=169607284",
	"id": 2059,
	"parentId": "2051",
	"dateAddedLocal": "6/21/2021, 2:12:25 PM",
	"dateAddedUTC": "2021-06-21T18:12:25.000Z"
},{
	"index": 9,
	"title": "Better Specs. Testing Guidelines for Developers.",
	"url": "https://www.betterspecs.org/",
	"id": 2060,
	"parentId": "2051",
	"dateAddedLocal": "6/21/2021, 2:12:25 PM",
	"dateAddedUTC": "2021-06-21T18:12:25.000Z"
},{
	"index": 10,
	"title": "Testing Rails Applications â€” Ruby on Rails Guides",
	"url": "https://guides.rubyonrails.org/testing.html",
	"id": 2061,
	"parentId": "2051",
	"dateAddedLocal": "6/21/2021, 2:12:25 PM",
	"dateAddedUTC": "2021-06-21T18:12:25.000Z"
},{
	"index": 175,
	"title": "thoughtbot",
	"id": 2062,
	"parentId": "871",
	"dateAddedLocal": "6/21/2021, 2:28:37 PM",
	"dateAddedUTC": "2021-06-21T18:28:37.157Z"
},{
	"index": 0,
	"title": "Ruby Science",
	"url": "https://gumroad.com/l/ruby-science/?utm_campaign=remarket&utm_medium=blog&utm_source=giantrobots&utm_term=testing",
	"id": 2063,
	"parentId": "2062",
	"dateAddedLocal": "6/21/2021, 2:12:25 PM",
	"dateAddedUTC": "2021-06-21T18:12:25.000Z"
},{
	"index": 176,
	"title": "three-d",
	"id": 872,
	"parentId": "871",
	"dateAddedLocal": "6/21/2021, 2:28:37 PM",
	"dateAddedUTC": "2021-06-21T18:28:37.056Z"
},{
	"index": 0,
	"title": "Create digital context for digital twins with ContextCapture",
	"url": "https://www.bentley.com/en/campaigns/digital-cities/digital-context-for-digital-twins?skid=CT_PPC_GO_CCOP_W_GE_GS_P&mkwid=sZCLC8cxi_pcrid_356406976286_pkw_%2Bcontext%20%2Bcapture_pmt_b_pdv_c_slid__pgrid_74859889911_ptaid_kwd-317565514953_&intent=&gclid=Cj0KCQiAw4jvBRCJARIsAHYewPP5rSXxlVh1YZNImOtyeyOpzZq_AvH2mq_jo-vNET3gFZbYiidYRLEaAkIkEALw_wcB",
	"id": 873,
	"parentId": "872",
	"dateAddedLocal": "6/21/2021, 2:12:25 PM",
	"dateAddedUTC": "2021-06-21T18:12:25.000Z"
},{
	"index": 1,
	"title": "How to Make a 3D Model from any Youtube Video - Photogrammetry - YouTube",
	"url": "https://www.youtube.com/watch?v=FhKIXItWmQ4",
	"id": 874,
	"parentId": "872",
	"dateAddedLocal": "6/21/2021, 2:12:25 PM",
	"dateAddedUTC": "2021-06-21T18:12:25.000Z"
},{
	"index": 2,
	"title": "Create Three.js from SketchUp - FME Community",
	"url": "https://knowledge.safe.com/articles/648/create-threejs-from-sketchup.html",
	"id": 875,
	"parentId": "872",
	"dateAddedLocal": "6/21/2021, 2:12:25 PM",
	"dateAddedUTC": "2021-06-21T18:12:25.000Z"
},{
	"index": 177,
	"title": "tools",
	"id": 2064,
	"parentId": "871",
	"dateAddedLocal": "6/21/2021, 2:28:37 PM",
	"dateAddedUTC": "2021-06-21T18:28:37.157Z"
},{
	"index": 0,
	"title": "Uses | Wes Bos",
	"url": "https://wesbos.com/uses/",
	"id": 2065,
	"parentId": "2064",
	"dateAddedLocal": "6/21/2021, 2:12:25 PM",
	"dateAddedUTC": "2021-06-21T18:12:25.000Z"
},{
	"index": 1,
	"title": "Pricing | TextExpander",
	"url": "https://textexpander.com/pricing/",
	"id": 2066,
	"parentId": "2064",
	"dateAddedLocal": "6/21/2021, 2:12:25 PM",
	"dateAddedUTC": "2021-06-21T18:12:25.000Z"
},{
	"index": 178,
	"title": "ui",
	"id": 2067,
	"parentId": "871",
	"dateAddedLocal": "6/21/2021, 2:28:37 PM",
	"dateAddedUTC": "2021-06-21T18:28:37.157Z"
},{
	"index": 0,
	"title": "Bootstrap Â· The world's most popular mobile-first and responsive front-end framework.",
	"url": "http://getbootstrap.com/",
	"id": 2068,
	"parentId": "2067",
	"dateAddedLocal": "6/21/2021, 2:12:25 PM",
	"dateAddedUTC": "2021-06-21T18:12:25.000Z"
},{
	"index": 1,
	"title": "Foundation | The most advanced responsive front-end framework in the world.",
	"url": "http://foundation.zurb.com/",
	"id": 2069,
	"parentId": "2067",
	"dateAddedLocal": "6/21/2021, 2:12:25 PM",
	"dateAddedUTC": "2021-06-21T18:12:25.000Z"
},{
	"index": 2,
	"title": "Getting Started | Semantic UI",
	"url": "https://semantic-ui.com/introduction/getting-started.html",
	"id": 2070,
	"parentId": "2067",
	"dateAddedLocal": "6/21/2021, 2:12:25 PM",
	"dateAddedUTC": "2021-06-21T18:12:25.000Z"
},{
	"index": 3,
	"title": "Kendo UI - Telerik",
	"url": "http://www.telerik.com/kendo-ui",
	"id": 2071,
	"parentId": "2067",
	"dateAddedLocal": "6/21/2021, 2:12:25 PM",
	"dateAddedUTC": "2021-06-21T18:12:25.000Z"
},{
	"index": 4,
	"title": "Paperclip: add photos/docs to site",
	"url": "https://github.com/thoughtbot/paperclip",
	"id": 2072,
	"parentId": "2067",
	"dateAddedLocal": "6/21/2021, 2:12:25 PM",
	"dateAddedUTC": "2021-06-21T18:12:25.000Z"
},{
	"index": 5,
	"title": "Semantic UI",
	"url": "https://semantic-ui.com/",
	"id": 2073,
	"parentId": "2067",
	"dateAddedLocal": "6/21/2021, 2:12:25 PM",
	"dateAddedUTC": "2021-06-21T18:12:25.000Z"
},{
	"index": 6,
	"title": "Topcoat",
	"url": "http://topcoat.io/",
	"id": 2074,
	"parentId": "2067",
	"dateAddedLocal": "6/21/2021, 2:12:25 PM",
	"dateAddedUTC": "2021-06-21T18:12:25.000Z"
},{
	"index": 7,
	"title": "three.js - Javascript 3D library",
	"url": "https://threejs.org/",
	"id": 2075,
	"parentId": "2067",
	"dateAddedLocal": "6/21/2021, 2:12:25 PM",
	"dateAddedUTC": "2021-06-21T18:12:25.000Z"
},{
	"index": 179,
	"title": "user-agent",
	"id": 2076,
	"parentId": "871",
	"dateAddedLocal": "6/21/2021, 2:28:37 PM",
	"dateAddedUTC": "2021-06-21T18:28:37.158Z"
},{
	"index": 0,
	"title": "User Agent: Find Out Your Web Browser's UA Here",
	"url": "https://www.whoishostingthis.com/tools/user-agent/",
	"id": 2077,
	"parentId": "2076",
	"dateAddedLocal": "6/21/2021, 2:12:25 PM",
	"dateAddedUTC": "2021-06-21T18:12:25.000Z"
},{
	"index": 180,
	"title": "ux",
	"id": 2078,
	"parentId": "871",
	"dateAddedLocal": "6/21/2021, 2:28:37 PM",
	"dateAddedUTC": "2021-06-21T18:28:37.158Z"
},{
	"index": 0,
	"title": "InVision | Digital Product Design, Workflow & Collaboration",
	"url": "https://www.invisionapp.com/",
	"id": 2079,
	"parentId": "2078",
	"dateAddedLocal": "6/21/2021, 2:12:25 PM",
	"dateAddedUTC": "2021-06-21T18:12:25.000Z"
},{
	"index": 1,
	"title": "Jetstrap - The Bootstrap Interface Builder",
	"url": "https://jetstrap.com/",
	"id": 2080,
	"parentId": "2078",
	"dateAddedLocal": "6/21/2021, 2:12:25 PM",
	"dateAddedUTC": "2021-06-21T18:12:25.000Z"
},{
	"index": 2,
	"title": "Proto.io - Prototypes that feel real",
	"url": "https://proto.io/",
	"id": 2081,
	"parentId": "2078",
	"dateAddedLocal": "6/21/2021, 2:12:25 PM",
	"dateAddedUTC": "2021-06-21T18:12:25.000Z"
},{
	"index": 3,
	"title": "Scalable Enterprise Ecommerce Platform | Shopify Plus",
	"url": "https://www.shopify.com/plus/enterprise-ecommerce",
	"id": 2082,
	"parentId": "2078",
	"dateAddedLocal": "6/21/2021, 2:12:25 PM",
	"dateAddedUTC": "2021-06-21T18:12:25.000Z"
},{
	"index": 4,
	"title": "Sketch - The digital design toolkit",
	"url": "https://www.sketchapp.com/",
	"id": 2083,
	"parentId": "2078",
	"dateAddedLocal": "6/21/2021, 2:12:25 PM",
	"dateAddedUTC": "2021-06-21T18:12:25.000Z"
},{
	"index": 5,
	"title": "WordPress Themes Loved By Over 430k Customers",
	"url": "https://www.elegantthemes.com/",
	"id": 2084,
	"parentId": "2078",
	"dateAddedLocal": "6/21/2021, 2:12:25 PM",
	"dateAddedUTC": "2021-06-21T18:12:25.000Z"
},{
	"index": 181,
	"title": "virtual box",
	"id": 2085,
	"parentId": "871",
	"dateAddedLocal": "6/21/2021, 2:28:37 PM",
	"dateAddedUTC": "2021-06-21T18:28:37.159Z"
},{
	"index": 0,
	"title": "20 Things I Love About Code - YouTube",
	"url": "https://www.youtube.com/watch?v=_gl6uRWnu6s&feature=youtu.be",
	"id": 2086,
	"parentId": "2085",
	"dateAddedLocal": "6/21/2021, 2:12:25 PM",
	"dateAddedUTC": "2021-06-21T18:12:25.000Z"
},{
	"index": 1,
	"title": "How to Resize a Windows VirtualBox VM hosted on Mac OS X - YouTube",
	"url": "https://www.youtube.com/watch?v=2iAbwdaXXeA",
	"id": 2087,
	"parentId": "2085",
	"dateAddedLocal": "6/21/2021, 2:12:25 PM",
	"dateAddedUTC": "2021-06-21T18:12:25.000Z"
},{
	"index": 182,
	"title": "visualization",
	"id": 2088,
	"parentId": "871",
	"dateAddedLocal": "6/21/2021, 2:28:37 PM",
	"dateAddedUTC": "2021-06-21T18:28:37.159Z"
},{
	"index": 0,
	"title": "RAWGraphs",
	"url": "https://rawgraphs.io/",
	"id": 2089,
	"parentId": "2088",
	"dateAddedLocal": "6/21/2021, 2:12:25 PM",
	"dateAddedUTC": "2021-06-21T18:12:25.000Z"
},{
	"index": 1,
	"title": "Pageflow. Digital Storytelling Tool & Publishing Platform",
	"url": "https://pageflow.io/en/",
	"id": 2090,
	"parentId": "2088",
	"dateAddedLocal": "6/21/2021, 2:12:25 PM",
	"dateAddedUTC": "2021-06-21T18:12:25.000Z"
},{
	"index": 2,
	"title": "Colaboratory â€“ Google",
	"url": "https://research.google.com/colaboratory/faq.html",
	"id": 2091,
	"parentId": "2088",
	"dateAddedLocal": "6/21/2021, 2:12:25 PM",
	"dateAddedUTC": "2021-06-21T18:12:25.000Z"
},{
	"index": 3,
	"title": "IPython notebooks now available for everybody | Kaggle",
	"url": "https://www.kaggle.com/general/16970",
	"id": 2092,
	"parentId": "2088",
	"dateAddedLocal": "6/21/2021, 2:12:25 PM",
	"dateAddedUTC": "2021-06-21T18:12:25.000Z"
},{
	"index": 183,
	"title": "vscode-snippets",
	"id": 2093,
	"parentId": "871",
	"dateAddedLocal": "6/21/2021, 2:28:37 PM",
	"dateAddedUTC": "2021-06-21T18:28:37.159Z"
},{
	"index": 0,
	"title": "xabikos/vscode-react: Contains the code snippets for Reactjs development in VS Code editor",
	"url": "https://github.com/xabikos/vscode-react",
	"id": 2094,
	"parentId": "2093",
	"dateAddedLocal": "6/21/2021, 2:12:25 PM",
	"dateAddedUTC": "2021-06-21T18:12:25.000Z"
},{
	"index": 1,
	"title": "Live Server Extension in Visual Studio Code - YouTube",
	"url": "https://www.youtube.com/watch?v=WzE0yqwbdgU",
	"id": 2095,
	"parentId": "2093",
	"dateAddedLocal": "6/21/2021, 2:12:25 PM",
	"dateAddedUTC": "2021-06-21T18:12:25.000Z"
},{
	"index": 184,
	"title": "vue",
	"id": 1526,
	"parentId": "871",
	"dateAddedLocal": "6/21/2021, 2:28:37 PM",
	"dateAddedUTC": "2021-06-21T18:28:37.110Z"
},{
	"index": 0,
	"title": "Introduction â€” Vue.js",
	"url": "https://vuejs.org/v2/guide/",
	"id": 1527,
	"parentId": "1526",
	"dateAddedLocal": "6/21/2021, 2:12:25 PM",
	"dateAddedUTC": "2021-06-21T18:12:25.000Z"
},{
	"index": 185,
	"title": "vue",
	"id": 2096,
	"parentId": "871",
	"dateAddedLocal": "6/21/2021, 2:28:37 PM",
	"dateAddedUTC": "2021-06-21T18:28:37.159Z"
},{
	"index": 0,
	"title": "Introduction â€” Vue.js",
	"url": "https://vuejs.org/v2/guide/",
	"id": 2097,
	"parentId": "2096",
	"dateAddedLocal": "6/21/2021, 2:12:25 PM",
	"dateAddedUTC": "2021-06-21T18:12:25.000Z"
},{
	"index": 1,
	"title": "Creating a simple reusable Vue.js tooltip component",
	"url": "https://www.vuejsradar.com/creating-reusable-vuejs-tooltip-component-with-transitions/",
	"id": 2098,
	"parentId": "2096",
	"dateAddedLocal": "6/21/2021, 2:12:25 PM",
	"dateAddedUTC": "2021-06-21T18:12:25.000Z"
},{
	"index": 2,
	"title": "vue - program with erik",
	"url": "https://school.programwitherik.com/",
	"id": 2099,
	"parentId": "2096",
	"dateAddedLocal": "6/21/2021, 2:12:25 PM",
	"dateAddedUTC": "2021-06-21T18:12:25.000Z"
},{
	"index": 186,
	"title": "web packer",
	"id": 2100,
	"parentId": "871",
	"dateAddedLocal": "6/21/2021, 2:28:37 PM",
	"dateAddedUTC": "2021-06-21T18:28:37.160Z"
},{
	"index": 187,
	"title": "web packer",
	"id": 2212,
	"parentId": "871",
	"dateAddedLocal": "6/21/2021, 2:28:37 PM",
	"dateAddedUTC": "2021-06-21T18:28:37.172Z"
},{
	"index": 188,
	"title": "webgl-workers",
	"id": 2101,
	"parentId": "871",
	"dateAddedLocal": "6/21/2021, 2:28:37 PM",
	"dateAddedUTC": "2021-06-21T18:28:37.160Z"
},{
	"index": 0,
	"title": "WebGL in Web Workers, Today - and Faster than Expected! - Mozilla Research",
	"url": "https://research.mozilla.org/2014/07/22/webgl-in-web-workers-today-and-faster-than-expected/",
	"id": 2102,
	"parentId": "2101",
	"dateAddedLocal": "6/21/2021, 2:12:25 PM",
	"dateAddedUTC": "2021-06-21T18:12:25.000Z"
},{
	"index": 1,
	"title": "kripken/webgl-worker",
	"url": "https://github.com/kripken/webgl-worker",
	"id": 2103,
	"parentId": "2101",
	"dateAddedLocal": "6/21/2021, 2:12:25 PM",
	"dateAddedUTC": "2021-06-21T18:12:25.000Z"
},{
	"index": 2,
	"title": "WebGL compatibility check â€“ three.js docs",
	"url": "https://threejs.org/docs/#manual/en/introduction/WebGL-compatibility-check",
	"id": 2104,
	"parentId": "2101",
	"dateAddedLocal": "6/21/2021, 2:12:25 PM",
	"dateAddedUTC": "2021-06-21T18:12:25.000Z"
},{
	"index": 189,
	"title": "window_manager",
	"id": 2105,
	"parentId": "871",
	"dateAddedLocal": "6/21/2021, 2:28:37 PM",
	"dateAddedUTC": "2021-06-21T18:28:37.160Z"
},{
	"index": 0,
	"title": "xmonad | the tiling window manager that rocks",
	"url": "https://xmonad.org/",
	"id": 2106,
	"parentId": "2105",
	"dateAddedLocal": "6/21/2021, 2:12:25 PM",
	"dateAddedUTC": "2021-06-21T18:12:25.000Z"
},{
	"index": 1,
	"title": "amethyst window manager - Google Search",
	"url": "https://www.google.com/search?q=amethyst+window+manager&rlz=1C5CHFA_enUS783US783&oq=Amethyst+windows+mana&aqs=chrome.1.69i57j0l2.8060j0j8&sourceid=chrome&ie=UTF-8",
	"id": 2107,
	"parentId": "2105",
	"dateAddedLocal": "6/21/2021, 2:12:25 PM",
	"dateAddedUTC": "2021-06-21T18:12:25.000Z"
},{
	"index": 190,
	"title": "windows programming",
	"id": 2108,
	"parentId": "871",
	"dateAddedLocal": "6/21/2021, 2:28:37 PM",
	"dateAddedUTC": "2021-06-21T18:28:37.160Z"
},{
	"index": 0,
	"title": "configurationmanager - Where is SQL Server Configuration Manager in SQL Server 2016 - Stack Overflow",
	"url": "https://stackoverflow.com/questions/38824654/where-is-sql-server-configuration-manager-in-sql-server-2016",
	"id": 2109,
	"parentId": "2108",
	"dateAddedLocal": "6/21/2021, 2:12:25 PM",
	"dateAddedUTC": "2021-06-21T18:12:25.000Z"
},{
	"index": 1,
	"title": "Connection libraries for SQL Database | Microsoft Docs",
	"url": "https://docs.microsoft.com/en-us/azure/sql-database/sql-database-libraries",
	"id": 2110,
	"parentId": "2108",
	"dateAddedLocal": "6/21/2021, 2:12:25 PM",
	"dateAddedUTC": "2021-06-21T18:12:25.000Z"
},{
	"index": 2,
	"title": "Download LINQPad",
	"url": "https://www.linqpad.net/Download.aspx",
	"id": 2111,
	"parentId": "2108",
	"dateAddedLocal": "6/21/2021, 2:12:25 PM",
	"dateAddedUTC": "2021-06-21T18:12:25.000Z"
},{
	"index": 3,
	"title": "Rails and MSSQL Server",
	"url": "https://gist.github.com/basiszwo/6434984",
	"id": 2112,
	"parentId": "2108",
	"dateAddedLocal": "6/21/2021, 2:12:25 PM",
	"dateAddedUTC": "2021-06-21T18:12:25.000Z"
},{
	"index": 4,
	"title": "rails-sqlserver/tiny_tds: TinyTDS - Simple and fast FreeTDS bindings for Ruby using DB-Library.",
	"url": "https://github.com/rails-sqlserver/tiny_tds",
	"id": 2113,
	"parentId": "2108",
	"dateAddedLocal": "6/21/2021, 2:12:25 PM",
	"dateAddedUTC": "2021-06-21T18:12:25.000Z"
},{
	"index": 5,
	"title": "Ruby macOS",
	"url": "https://www.microsoft.com/en-us/sql-server/developer-get-started/ruby/mac/",
	"id": 2114,
	"parentId": "2108",
	"dateAddedLocal": "6/21/2021, 2:12:25 PM",
	"dateAddedUTC": "2021-06-21T18:12:25.000Z"
},{
	"index": 6,
	"title": "SQL Database Application Development Overview | Microsoft Docs",
	"url": "https://docs.microsoft.com/en-us/azure/sql-database/sql-database-develop-overview",
	"id": 2115,
	"parentId": "2108",
	"dateAddedLocal": "6/21/2021, 2:12:25 PM",
	"dateAddedUTC": "2021-06-21T18:12:25.000Z"
},{
	"index": 7,
	"title": "SQL Server quickstart - Microsoft Azure",
	"url": "https://portal.azure.com/#resource/subscriptions/408ed3a1-9797-4110-a51a-298c9612ac80/resourceGroups/swtResourceGroup1/providers/Microsoft.Sql/servers/swt1/quickStart",
	"id": 2116,
	"parentId": "2108",
	"dateAddedLocal": "6/21/2021, 2:12:25 PM",
	"dateAddedUTC": "2021-06-21T18:12:25.000Z"
},{
	"index": 191,
	"title": "wireframe",
	"id": 2117,
	"parentId": "871",
	"dateAddedLocal": "6/21/2021, 2:28:37 PM",
	"dateAddedUTC": "2021-06-21T18:28:37.161Z"
},{
	"index": 0,
	"title": "Balsamiq. Rapid, effective and fun wireframing software. | Balsamiq",
	"url": "https://balsamiq.com/index.html",
	"id": 2118,
	"parentId": "2117",
	"dateAddedLocal": "6/21/2021, 2:12:25 PM",
	"dateAddedUTC": "2021-06-21T18:12:25.000Z"
},{
	"index": 1,
	"title": "Bootstrap Studio",
	"url": "https://bootstrapstudio.io/",
	"id": 2119,
	"parentId": "2117",
	"dateAddedLocal": "6/21/2021, 2:12:25 PM",
	"dateAddedUTC": "2021-06-21T18:12:25.000Z"
},{
	"index": 2,
	"title": "cjdsie/pattern-portfolio: Inspired by the recent movement of creating systems, not pages. This is a living library of deliverables that can be stylized to fit your next project. Each pattern is included within the pattern directory and can be optionally i",
	"url": "https://github.com/cjdsie/pattern-portfolio",
	"id": 2120,
	"parentId": "2117",
	"dateAddedLocal": "6/21/2021, 2:12:25 PM",
	"dateAddedUTC": "2021-06-21T18:12:25.000Z"
},{
	"index": 3,
	"title": "Designing responsive web layouts in React Studio â€“ Hacker Noon",
	"url": "https://hackernoon.com/designing-responsive-web-layouts-in-react-studio-2e1d796704d5",
	"id": 2121,
	"parentId": "2117",
	"dateAddedLocal": "6/21/2021, 2:12:25 PM",
	"dateAddedUTC": "2021-06-21T18:12:25.000Z"
},{
	"index": 4,
	"title": "Jetstrap - The Easiest Twitter Bootstrap Builder!",
	"url": "https://jetstrap.com/demo",
	"id": 2122,
	"parentId": "2117",
	"dateAddedLocal": "6/21/2021, 2:12:25 PM",
	"dateAddedUTC": "2021-06-21T18:12:25.000Z"
},{
	"index": 5,
	"title": "LayoutIt! - Interface Builder for Bootstrap",
	"url": "http://www.layoutit.com/",
	"id": 2123,
	"parentId": "2117",
	"dateAddedLocal": "6/21/2021, 2:12:25 PM",
	"dateAddedUTC": "2021-06-21T18:12:25.000Z"
},{
	"index": 6,
	"title": "Online Mockup, Wireframe & UI Prototyping Tool Â· Moqups",
	"url": "https://moqups.com/#tour",
	"id": 2124,
	"parentId": "2117",
	"dateAddedLocal": "6/21/2021, 2:12:25 PM",
	"dateAddedUTC": "2021-06-21T18:12:25.000Z"
},{
	"index": 7,
	"title": "React Studio",
	"url": "https://reactstudio.com/",
	"id": 2125,
	"parentId": "2117",
	"dateAddedLocal": "6/21/2021, 2:12:25 PM",
	"dateAddedUTC": "2021-06-21T18:12:25.000Z"
},{
	"index": 8,
	"title": "Website wireframes: Mockingbird",
	"url": "https://gomockingbird.com/home",
	"id": 2126,
	"parentId": "2117",
	"dateAddedLocal": "6/21/2021, 2:12:25 PM",
	"dateAddedUTC": "2021-06-21T18:12:25.000Z"
},{
	"index": 9,
	"title": "Wirefy",
	"url": "http://getwirefy.com/",
	"id": 2127,
	"parentId": "2117",
	"dateAddedLocal": "6/21/2021, 2:12:25 PM",
	"dateAddedUTC": "2021-06-21T18:12:25.000Z"
},{
	"index": 192,
	"title": "xml",
	"id": 2128,
	"parentId": "871",
	"dateAddedLocal": "6/21/2021, 2:28:37 PM",
	"dateAddedUTC": "2021-06-21T18:28:37.162Z"
},{
	"index": 0,
	"title": "XPath - Wikipedia",
	"url": "https://en.wikipedia.org/wiki/XPath",
	"id": 2129,
	"parentId": "2128",
	"dateAddedLocal": "6/21/2021, 2:12:25 PM",
	"dateAddedUTC": "2021-06-21T18:12:25.000Z"
},{
	"index": 193,
	"title": "zipcodes",
	"id": 2130,
	"parentId": "871",
	"dateAddedLocal": "6/21/2021, 2:28:37 PM",
	"dateAddedUTC": "2021-06-21T18:28:37.162Z"
},{
	"index": 0,
	"title": "APIs & services - zip-appt1",
	"url": "https://console.developers.google.com/apis/api/distance-matrix-backend.googleapis.com/overview?project=zip-appt1&authuser=1&organizationId=431234920510&duration=PT1H",
	"id": 2131,
	"parentId": "2130",
	"dateAddedLocal": "6/21/2021, 2:12:25 PM",
	"dateAddedUTC": "2021-06-21T18:12:25.000Z"
},{
	"index": 1,
	"title": "Google Maps JavaScript API V3 Reference Â |Â  Google Maps JavaScript API Â |Â  Google Developers",
	"url": "https://developers.google.com/maps/documentation/javascript/reference",
	"id": 2132,
	"parentId": "2130",
	"dateAddedLocal": "6/21/2021, 2:12:25 PM",
	"dateAddedUTC": "2021-06-21T18:12:25.000Z"
},{
	"index": 2,
	"title": "Zip Code API - A RedLine13 Service",
	"url": "https://www.zipcodeapi.com/",
	"id": 2133,
	"parentId": "2130",
	"dateAddedLocal": "6/21/2021, 2:12:25 PM",
	"dateAddedUTC": "2021-06-21T18:12:25.000Z"
},{
	"index": 3,
	"title": "Zip Code API Documentation",
	"url": "https://www.zipcodeapi.com/API",
	"id": 2134,
	"parentId": "2130",
	"dateAddedLocal": "6/21/2021, 2:12:25 PM",
	"dateAddedUTC": "2021-06-21T18:12:25.000Z"
},{
	"index": 194,
	"title": "zsh",
	"id": 2848,
	"parentId": "871",
	"dateAddedLocal": "6/6/2024, 12:22:27 PM",
	"dateAddedUTC": "2024-06-06T16:22:27.625Z"
},{
	"index": 0,
	"title": "ohmyzsh/plugins/git at master Â· ohmyzsh/ohmyzsh Â· GitHub",
	"url": "https://github.com/ohmyzsh/ohmyzsh/tree/master/plugins/git",
	"id": 2847,
	"parentId": "2848",
	"dateAddedLocal": "6/6/2024, 12:21:53 PM",
	"dateAddedUTC": "2024-06-06T16:21:53.708Z"
},{
	"index": 195,
	"title": "chrome://net-internals/#hsts",
	"url": "chrome://net-internals/#hsts",
	"id": 2135,
	"parentId": "871",
	"dateAddedLocal": "6/21/2021, 2:12:25 PM",
	"dateAddedUTC": "2021-06-21T18:12:25.000Z"
},{
	"index": 7,
	"title": "",
	"url": "https://github.com/smithWEBtek",
	"id": 38,
	"parentId": "1",
	"dateAddedLocal": "6/21/2021, 2:12:25 PM",
	"dateAddedUTC": "2021-06-21T18:12:25.000Z"
},{
	"index": 8,
	"title": "cal",
	"url": "https://calendar.notion.so/",
	"id": 3004,
	"parentId": "1",
	"dateAddedLocal": "10/11/2024, 5:32:11 AM",
	"dateAddedUTC": "2024-10-11T09:32:11.961Z"
},{
	"index": 9,
	"title": "doc",
	"url": "https://devdocs.io/",
	"id": 2232,
	"parentId": "1",
	"dateAddedLocal": "6/21/2021, 2:12:25 PM",
	"dateAddedUTC": "2021-06-21T18:12:25.000Z"
},{
	"index": 10,
	"title": "React.dev",
	"url": "https://react.dev/",
	"id": 2485,
	"parentId": "1",
	"dateAddedLocal": "6/20/2023, 10:35:31 AM",
	"dateAddedUTC": "2023-06-20T14:35:31.519Z"
},{
	"index": 11,
	"title": "y",
	"url": "https://www.youtube.com/",
	"id": 2235,
	"parentId": "1",
	"dateAddedLocal": "3/29/2022, 7:30:38 PM",
	"dateAddedUTC": "2022-03-29T23:30:38.577Z"
},{
	"index": 12,
	"title": "ChatGPT",
	"url": "https://chatgpt.com/",
	"id": 2823,
	"parentId": "1",
	"dateAddedLocal": "5/14/2024, 6:07:56 PM",
	"dateAddedUTC": "2024-05-14T22:07:56.169Z"
}]